id_str,text,source,favorite_count,retweet_count,created_at,district,date_closed
441029850191507459,All schools in #Jefferson Co closed Wed 3/5/14,WVDE Twitbot,18,31,2014-03-05 01:58:04,Jefferson County School District,2014-03-05
176635172563849216,UPDATE: All schools in #Pocahontas Co now closed Mon 3/5/12,WVDE Twitbot,0,2,2012-03-05 11:48:01,Pocahontas County School District,2012-03-05
567729468312403968,All schools in #Cabell Co closed Wed 2/18/15 due to inclement weather code red,WVDE Twitbot,58,48,2015-02-17 16:57:07,Cabell County School District,2015-02-18
430278894202400768,All schools in #Marion Co closed Mon 2/3/14 due to Inclement Weather,WVDE Twitbot,14,53,2014-02-03 09:57:37,Marion County School District,2014-02-03
691296591169339398,All schools in #Putnam Co closed Mon 1/25/16 due to Weather conditions,WVDE Twitbot,154,336,2016-01-24 16:28:45,Putnam County School District,2016-01-25
316107186990354432,All schools in #Summers Co closed Mon 3/25/13,WVDE Twitbot,1,5,2013-03-25 08:40:01,Summers County School District,2013-03-25
691702285798346752,All schools in #Clay Co closed Tue 1/26/16 due to Weather conditions,WVDE Twitbot,22,27,2016-01-25 19:20:50,Clay County School District,2016-01-26
436115438053769217,UPDATE: All schools in #Grant Co now closed Wed 2/19/14 due to inclement wearer.  (freezing  rain),WVDE Twitbot,4,5,2014-02-19 12:29:57,Grant County School District,2014-02-19
294415644559032320,UPDATE: All schools in #Morgan Co now closed Thu 1/24/13 code A,WVDE Twitbot,31,14,2013-01-24 12:05:34,Morgan County School District,2013-01-24
425566938530471936,All schools in #Preston Co closed Tue 1/21/14,WVDE Twitbot,6,8,2014-01-21 09:53:59,Preston County School District,2014-01-21
171389829911814144,All schools in #Fayette Co closed Mon 2/20/12,WVDE Twitbot,0,18,2012-02-20 00:24:54,Fayette County School District,2012-02-20
691315227544154112,All schools in #Jackson Co closed Mon 1/25/16 code A,WVDE Twitbot,45,62,2016-01-24 17:42:48,Jackson County School District,2016-01-25
421447550613221376,All schools in #Putnam Co closed Fri 1/10/14 due to the emergency water advisory.  The central office will also be closed,WVDE Twitbot,33,147,2014-01-10 01:05:00,Putnam County School District,2014-01-10
420668020344619009,All schools in #Tucker Co closed Wed 1/8/14,WVDE Twitbot,18,14,2014-01-07 21:27:26,Tucker County School District,2014-01-08
568009454387658752,UPDATE: All schools in #Randolph Co now closed Wed 2/18/15,WVDE Twitbot,20,16,2015-02-18 11:29:41,Randolph County School District,2015-02-18
534672514778419201,UPDATE: All schools in #Barbour Co now closed Tue 11/18/14 due to Road Conditions,WVDE Twitbot,15,22,2014-11-18 11:40:35,Barbour County School District,2014-11-18
940920293484384261,UPDATE: All schools in #Wyoming Co now closed Wed 12/13/17 due to inclement weather,WVDE Twitbot,19,12,2017-12-13 12:24:14,Wyoming County School District,2017-12-13
948527075174076416,UPDATE: All schools in #Barbour Co now closed Wed 1/3/18 Staff will report on a two hour delay. Students should complete snow pack 2.,WVDE Twitbot,0,6,2018-01-03 12:10:52,Barbour County School District,2018-01-03
568539063428317184,All schools in #Marion Co closed Fri 2/20/15 due to Inclement Weather,WVDE Twitbot,39,77,2015-02-19 22:34:10,Marion County School District,2015-02-20
296953431829123072,UPDATE: All schools in #Mercer Co now closed Thu 1/31/13 due to inclement weather,WVDE Twitbot,0,6,2013-01-31 12:09:49,Mercer County School District,2013-01-31
948529621661777920,UPDATE: All schools in #Lewis Co now closed Wed 1/3/18 due to Inclement weather,WVDE Twitbot,6,9,2018-01-03 12:20:59,Lewis County School District,2018-01-03
566194339911835649,UPDATE: All schools in #Tucker Co now closed Fri 2/13/15,WVDE Twitbot,5,5,2015-02-13 11:17:04,Tucker County School District,2015-02-13
440652302722940928,All schools in #Monongalia Co closed Tue 3/4/14,WVDE Twitbot,56,94,2014-03-04 00:57:50,Monongalia County School District,2014-03-04
950330377935212546,UPDATE: All schools in #Tucker Co now closed Mon 1/8/18,WVDE Twitbot,3,0,2018-01-08 11:36:33,Tucker County School District,2018-01-08
950151310191493121,All schools in #Wetzel Co closed Mon 1/8/18 due to Inclement weather,WVDE Twitbot,22,21,2018-01-07 23:44:59,Wetzel County School District,2018-01-08
440558987025461248,All schools in #Mingo Co closed Tue 3/4/14 code H,WVDE Twitbot,16,23,2014-03-03 18:47:02,Mingo County School District,2014-03-04
573307930822500352,UPDATE: All schools in #Wayne Co now closed Thu 3/5/15 due to Inclement Weather,WVDE Twitbot,12,30,2015-03-05 02:23:56,Wayne County School District,2015-03-05
435613245072605184,All schools in #Brooke Co closed Tue 2/18/14,WVDE Twitbot,12,25,2014-02-18 03:14:25,Brooke County School District,2014-02-18
420352167174627328,All schools in #Mercer Co closed Tue 1/7/14 due to frigid temperatures,WVDE Twitbot,2,3,2014-01-07 00:32:21,Mercer County School District,2014-01-07
573307559605608448,All schools in #Wetzel Co closed Thu 3/5/15,WVDE Twitbot,25,45,2015-03-05 02:22:28,Wetzel County School District,2015-03-05
948156626313318405,UPDATE: All schools in #Webster Co now closed Tue 1/2/18 due to weather conditions,WVDE Twitbot,4,2,2018-01-02 11:38:50,Webster County School District,2018-01-02
440453029523775488,UPDATE: All schools in #Wyoming Co now closed Mon 3/3/14 due to inclement weather,WVDE Twitbot,2,7,2014-03-03 11:46:00,Wyoming County School District,2014-03-03
430316908856885248,UPDATE: All schools in #Tucker Co now closed Mon 2/3/14,WVDE Twitbot,5,5,2014-02-03 12:28:40,Tucker County School District,2014-02-03
440290152791818240,All schools in #Calhoun Co closed Mon 3/3/14 due to Inclement Weather and Hazardous Road Conditions,WVDE Twitbot,11,13,2014-03-03 00:58:47,Calhoun County School District,2014-03-03
826398153062678528,1/2 UPDATE: All schools in #Preston Co now closed Tue 1/31/17 due to winter weather conditions,WVDE Twitbot,3,2,2017-01-31 11:54:08,Preston County School District,2017-01-31
445512032272404480,UPDATE: All schools in #Greenbrier Co now closed Mon 3/17/14,WVDE Twitbot,14,22,2014-03-17 10:48:40,Greenbrier County School District,2014-03-17
316095565274427392,All schools in #Preston Co closed Mon 3/25/13,WVDE Twitbot,4,3,2013-03-25 07:53:50,Preston County School District,2013-03-25
950310413639528448,All schools in #Morgan Co closed Mon 1/8/18 due to the prediction of icy road conditions this afternoon code A,WVDE Twitbot,15,10,2018-01-08 10:17:13,Morgan County School District,2018-01-08
696990568166117376,All schools in #Nicholas Co closed Tue 2/9/16 due to weather condirions,WVDE Twitbot,16,20,2016-02-09 09:34:35,Nicholas County School District,2016-02-09
690143960749187073,UPDATE: All schools in #Wetzel Co now closed Thu 1/21/16 due to Snowy &amp; Icy Roads,WVDE Twitbot,23,37,2016-01-21 12:08:37,Wetzel County School District,2016-01-21
699017630418649088,All schools in #Greenbrier Co closed Mon 2/15/16 due to Weather conditions,WVDE Twitbot,33,43,2016-02-14 23:49:24,Greenbrier County School District,2016-02-15
567088099407433728,All schools in #McDowell Co closed Mon 2/16/15,WVDE Twitbot,7,8,2015-02-15 22:28:33,McDowell County School District,2015-02-16
294398213056778240,UPDATE: All schools in #Tucker Co now closed Thu 1/24/13,WVDE Twitbot,2,5,2013-01-24 10:56:18,Tucker County School District,2013-01-24
427959627569831937,All schools in #Logan Co closed Tue 1/28/14,WVDE Twitbot,27,57,2014-01-28 00:21:40,Logan County School District,2014-01-28
553360272925405188,All schools in #Taylor Co closed Fri 1/9/15,WVDE Twitbot,9,16,2015-01-09 01:19:04,Taylor County School District,2015-01-09
561103842344189953,All schools in #Greenbrier Co closed Fri 1/30/15 due to Weather conditions,WVDE Twitbot,6,10,2015-01-30 10:09:15,Greenbrier County School District,2015-01-30
699047302200225792,"All schools in #Wirt Co closed Mon 2/15/16 due to the winter weather advisory until 3:00pm Monday, 2/15",WVDE Twitbot,20,17,2016-02-15 01:47:19,Wirt County School District,2016-02-15
953585787907575813,1/2 UPDATE: All schools in #Tucker Co now closed Wed 1/17/18,WVDE Twitbot,3,1,2018-01-17 11:12:23,Tucker County School District,2018-01-17
420284204555841536,All schools in #Harrison Co closed Tue 1/7/14,WVDE Twitbot,32,154,2014-01-06 20:02:17,Harrison County School District,2014-01-07
699172126432043008,All schools in #Berkeley Co closed Mon 2/15/16 due to inclement weather All evening activities are canceled.,WVDE Twitbot,71,79,2016-02-15 10:03:19,Berkeley County School District,2016-02-15
568553253555851264,UPDATE: All schools in #Nicholas Co now closed Fri 2/20/15 due to weather conditions,WVDE Twitbot,12,10,2015-02-19 23:30:33,Nicholas County School District,2015-02-20
727951470038028289,"All schools in #Clay Co closed Thu 5/5/16 due to a school threat All Clay County Schools will open again on Monday, May 9, 2016",WVDE Twitbot,24,12,2016-05-04 20:02:09,Clay County School District,2016-05-05
963015171890401282,UPDATE: All schools in #Pleasants Co now closed Mon 2/12/18,WVDE Twitbot,16,2,2018-02-12 11:41:23,Pleasants County School District,2018-02-12
959193379367194631,All schools in #Mingo Co closed Fri 2/2/18,WVDE Twitbot,43,16,2018-02-01 22:34:57,Mingo County School District,2018-02-02
950310637493719040,UPDATE: All schools in #Upshur Co now closed Mon 1/8/18,WVDE Twitbot,11,1,2018-01-08 10:18:06,Upshur County School District,2018-01-08
568530775047409665,All schools in #McDowell Co closed Fri 2/20/15,WVDE Twitbot,2,6,2015-02-19 22:01:14,McDowell County School District,2015-02-20
691404167349452803,All schools in #Pocahontas Co closed Mon 1/25/16,WVDE Twitbot,13,6,2016-01-24 23:36:13,Pocahontas County School District,2016-01-25
418951818362638336,All schools in #Lewis Co closed Fri 1/3/14,WVDE Twitbot,18,23,2014-01-03 03:47:51,Lewis County School District,2014-01-03
426080370384441344,All schools in #Raleigh Co closed Thu 1/23/14 due to weather conditions,WVDE Twitbot,11,25,2014-01-22 19:54:11,Raleigh County School District,2014-01-23
697016429586079744,UPDATE: All schools in #Wyoming Co now closed Tue 2/9/16 due to Weather,WVDE Twitbot,15,22,2016-02-09 11:17:21,Wyoming County School District,2016-02-09
949055274970701829,All schools in #Hardy Co closed Fri 1/5/18,WVDE Twitbot,15,10,2018-01-04 23:09:44,Hardy County School District,2018-01-05
552431341770661888,UPDATE: All schools in #Pendleton Co now closed Tue 1/6/15,WVDE Twitbot,7,5,2015-01-06 11:47:50,Pendleton County School District,2015-01-06
426157986533224450,All schools in #Wyoming Co closed Thu 1/23/14 due to inclement weather,WVDE Twitbot,3,9,2014-01-23 01:02:36,Wyoming County School District,2014-01-23
294755485473705984,"UPDATE: All schools in #Wirt Co now closed Fri 1/25/13 Wirt County schools will be closed today Friday, January 25, 2013",WVDE Twitbot,2,7,2013-01-25 10:35:58,Wirt County School District,2013-01-25
295865848646742016,UPDATE: All schools in #Hampshire Co now closed Mon 1/28/13 due to Inclement Weather,WVDE Twitbot,0,7,2013-01-28 12:08:09,Hampshire County School District,2013-01-28
554592118577315842,UPDATE: All schools in #Pocahontas Co now closed Mon 1/12/15,WVDE Twitbot,5,5,2015-01-12 10:53:59,Pocahontas County School District,2015-01-12
426309490456014849,UPDATE: All schools in #Roane Co now closed Thu 1/23/14 due to snow + wind chill issues,WVDE Twitbot,5,9,2014-01-23 11:04:37,Roane County School District,2014-01-23
316112733596696576,All schools in #Mineral Co closed Mon 3/25/13 due to the weather code A,WVDE Twitbot,1,17,2013-03-25 09:02:03,Mineral County School District,2013-03-25
427575896258535424,All schools in #Harrison Co closed Mon 1/27/14,WVDE Twitbot,35,157,2014-01-26 22:56:52,Harrison County School District,2014-01-27
552962016462516225,All schools in #Lewis Co closed Thu 1/8/15,WVDE Twitbot,7,24,2015-01-07 22:56:32,Lewis County School District,2015-01-08
953205067582230529,All schools in #Lincoln Co closed Tue 1/16/18,WVDE Twitbot,10,8,2018-01-16 09:59:32,Lincoln County School District,2018-01-16
430317742647181313,UPDATE: All schools in #Brooke Co now closed Mon 2/3/14,WVDE Twitbot,2,9,2014-02-03 12:31:59,Brooke County School District,2014-02-03
697027285006811136,UPDATE: All schools in #Marshall Co now closed Tue 2/9/16,WVDE Twitbot,14,30,2016-02-09 12:00:29,Marshall County School District,2016-02-09
157793145638236161,UPDATE: All schools in #Lincoln Co now closed Fri 1/13/12,WVDE Twitbot,0,1,2012-01-13 11:56:32,Lincoln County School District,2012-01-13
560015912691335169,All schools in #Hancock Co closed Tue 1/27/15,WVDE Twitbot,6,6,2015-01-27 10:06:12,Hancock County School District,2015-01-27
427960429596258305,All schools in #Wyoming Co closed Tue 1/28/14 due to inclement weather,WVDE Twitbot,11,13,2014-01-28 00:24:52,Wyoming County School District,2014-01-28
567287995515289600,UPDATE: All schools in #Hampshire Co now closed Mon 2/16/15,WVDE Twitbot,9,14,2015-02-16 11:42:52,Hampshire County School District,2015-02-16
294411944243376128,UPDATE: All schools in #Preston Co now closed Thu 1/24/13,WVDE Twitbot,1,3,2013-01-24 11:50:52,Preston County School District,2013-01-24
421628625444937728,All schools in #McDowell Co closed Fri 1/10/14 due to inclement weather,WVDE Twitbot,1,1,2014-01-10 13:04:32,McDowell County School District,2014-01-10
157789966603268096,UPDATE: All schools in #Doddridge Co now closed Fri 1/13/12 due to snowy conditions and slick roads,WVDE Twitbot,0,0,2012-01-13 11:43:54,Doddridge County School District,2012-01-13
826050748383449088,UPDATE: All schools in #Barbour Co now closed Mon 1/30/17 due to slick secondary road conditions,WVDE Twitbot,21,15,2017-01-30 12:53:40,Barbour County School District,2017-01-30
699534354322714624,All schools in #Morgan Co closed Tue 2/16/16 code A,WVDE Twitbot,18,8,2016-02-16 10:02:41,Morgan County School District,2016-02-16
699171935981330432,All schools in #Preston Co closed Mon 2/15/16 due to winter weather conditions,WVDE Twitbot,10,2,2016-02-15 10:02:34,Preston County School District,2016-02-15
440632763952013312,All schools in #Taylor Co closed Tue 3/4/14,WVDE Twitbot,10,11,2014-03-03 23:40:12,Taylor County School District,2014-03-04
826012760420921344,UPDATE: All schools in #Roane Co now closed Mon 1/30/17 due to secondary road conditions,WVDE Twitbot,3,5,2017-01-30 10:22:43,Roane County School District,2017-01-30
263318214333833216,All schools in #Raleigh Co closed Wed 10/31/12 due to weather conditions  #WVSandy,WVDE Twitbot,1,21,2012-10-30 16:35:29,Raleigh County School District,2012-10-31
949042103107104768,All schools in #Nicholas Co closed Fri 1/5/18,WVDE Twitbot,20,19,2018-01-04 22:17:24,Nicholas County School District,2018-01-05
573592001892974592,All schools in #Mason Co closed Fri 3/6/15 due to Inclement Weather code red,WVDE Twitbot,25,28,2015-03-05 21:12:44,Mason County School District,2015-03-06
434094596998430720,All schools in #Greenbrier Co closed Fri 2/14/14 due to Weather and road conditions,WVDE Twitbot,12,31,2014-02-13 22:39:51,Greenbrier County School District,2014-02-14
568149191274471424,All schools in #Upshur Co closed Thu 2/19/15,WVDE Twitbot,24,25,2015-02-18 20:44:57,Upshur County School District,2015-02-19
567417733919551489,All schools in #Monroe Co closed Tue 2/17/15,WVDE Twitbot,10,20,2015-02-16 20:18:24,Monroe County School District,2015-02-17
427922508143030272,All schools in #Calhoun Co closed Tue 1/28/14 due to Dangerously Low Temperatures,WVDE Twitbot,10,5,2014-01-27 21:54:11,Calhoun County School District,2014-01-28
309241183715069954,All schools in #Harrison Co closed Wed 3/6/13,WVDE Twitbot,7,21,2013-03-06 09:56:58,Harrison County School District,2013-03-06
552418954736848896,UPDATE: All schools in #Upshur Co now closed Tue 1/6/15,WVDE Twitbot,12,11,2015-01-06 10:58:36,Upshur County School District,2015-01-06
699026279228706817,All schools in #Nicholas Co closed Mon 2/15/16 due to weather conditions,WVDE Twitbot,84,44,2016-02-15 00:23:46,Nicholas County School District,2016-02-15
444072411982360576,UPDATE: All schools in #Greenbrier Co now closed Thu 3/13/14,WVDE Twitbot,18,24,2014-03-13 11:28:08,Greenbrier County School District,2014-03-13
692045308767944705,All schools in #Clay Co closed Wed 1/27/16 due to Weather conditions,WVDE Twitbot,28,28,2016-01-26 18:03:53,Clay County School District,2016-01-27
263361880251314176,All schools in #Taylor Co closed Wed 10/31/12  #WVSandy,WVDE Twitbot,0,6,2012-10-30 19:28:59,Taylor County School District,2012-10-31
419043370791481344,UPDATE: All schools in #Wood Co now closed Fri 1/3/14 due to inclement weather code A,WVDE Twitbot,57,99,2014-01-03 09:51:39,Wood County School District,2014-01-03
568163310207684608,"All schools in #Boone Co closed Thu 2/19/15 The county math field day competition has been rescheduled for Friday, February 27th.",WVDE Twitbot,32,26,2015-02-18 21:41:03,Boone County School District,2015-02-19
309239469817610240,All schools in #Webster Co closed Wed 3/6/13 due to Weather Conditions All staff is to report on a 2 hr delay.,WVDE Twitbot,3,7,2013-03-06 09:50:09,Webster County School District,2013-03-06
425759694464892929,All schools in #McDowell Co closed Wed 1/22/14 due to inclement weather,WVDE Twitbot,7,5,2014-01-21 22:39:56,McDowell County School District,2014-01-22
157787244617408512,UPDATE: All schools in #Wayne Co now closed Fri 1/13/12 due to Inclement Weather,WVDE Twitbot,0,3,2012-01-13 11:33:05,Wayne County School District,2012-01-13
428313763750506496,All schools in #Summers Co closed Wed 1/29/14,WVDE Twitbot,2,9,2014-01-28 23:48:53,Summers County School District,2014-01-29
690125318930173952,UPDATE: All schools in #Lewis Co now closed Thu 1/21/16,WVDE Twitbot,13,14,2016-01-21 10:54:32,Lewis County School District,2016-01-21
697026759519313920,UPDATE: All schools in #Ohio Co now closed Tue 2/9/16,WVDE Twitbot,28,61,2016-02-09 11:58:24,Ohio County School District,2016-02-09
263047819668123650,All schools in #Mineral Co closed Tue 10/30/12 due to Inclement weather code A Employees are operating under code A #WVSandy,WVDE Twitbot,2,11,2012-10-29 22:41:02,Mineral County School District,2012-10-30
425754818712305665,All schools in #Logan Co closed Wed 1/22/14,WVDE Twitbot,18,38,2014-01-21 22:20:33,Logan County School District,2014-01-22
316135963124436993,UPDATE: All schools in #Greenbrier Co now closed Mon 3/25/13 due to Weather conditions,WVDE Twitbot,2,10,2013-03-25 10:34:21,Greenbrier County School District,2013-03-25
573421310275141633,All schools in #Morgan Co closed Thu 3/5/15 code A,WVDE Twitbot,10,14,2015-03-05 09:54:28,Morgan County School District,2015-03-05
690326652996448256,All schools in #Berkeley Co closed Fri 1/22/16 due to inclement weather,WVDE Twitbot,104,135,2016-01-22 00:14:34,Berkeley County School District,2016-01-22
433540964339052544,All schools in #Summers Co closed Wed 2/12/14,WVDE Twitbot,3,10,2014-02-12 09:59:55,Summers County School District,2014-02-12
703182720982081536,UPDATE: All schools in #Nicholas Co now closed Fri 2/26/16 due to weather conditions,WVDE Twitbot,18,7,2016-02-26 11:39:59,Nicholas County School District,2016-02-26
425558519559884800,All schools in #Nicholas Co closed Tue 1/21/14,WVDE Twitbot,3,14,2014-01-21 09:20:32,Nicholas County School District,2014-01-21
426485888265093120,All schools in #McDowell Co closed Fri 1/24/14 due to inclement weather,WVDE Twitbot,3,7,2014-01-23 22:45:34,McDowell County School District,2014-01-24
691316052886700032,All schools in #Monongalia Co closed Mon 1/25/16,WVDE Twitbot,101,140,2016-01-24 17:46:05,Monongalia County School District,2016-01-25
445514233157926914,UPDATE: All schools in #Wirt Co now closed Mon 3/17/14 Staff report at 10:00.,WVDE Twitbot,7,11,2014-03-17 10:57:25,Wirt County School District,2014-03-17
566193364211879936,UPDATE: All schools in #Nicholas Co now closed Fri 2/13/15 due to weather conditions,WVDE Twitbot,12,26,2015-02-13 11:13:12,Nicholas County School District,2015-02-13
420685576396734464,All schools in #Mercer Co closed Wed 1/8/14 due to frigid temperatures,WVDE Twitbot,6,5,2014-01-07 22:37:12,Mercer County School District,2014-01-08
552992625813618691,All schools in #Summers Co closed Thu 1/8/15,WVDE Twitbot,12,15,2015-01-08 00:58:10,Summers County School District,2015-01-08
440293193947418624,All schools in #Lincoln Co closed Mon 3/3/14,WVDE Twitbot,33,76,2014-03-03 01:10:52,Lincoln County School District,2014-03-03
567795984491900928,All schools in #Kanawha Co closed Wed 2/18/15 due to Inclement Weather code B,WVDE Twitbot,202,421,2015-02-17 21:21:26,Kanawha County School District,2015-02-18
428868375284953088,UPDATE: All schools in #Upshur Co now closed Thu 1/30/14 due to Bus issues,WVDE Twitbot,7,12,2014-01-30 12:32:43,Upshur County School District,2014-01-30
316101775235108865,All schools in #Barbour Co closed Mon 3/25/13 due to weather and road conditions,WVDE Twitbot,2,6,2013-03-25 08:18:30,Barbour County School District,2013-03-25
959395534464344069,UPDATE: All schools in #Doddridge Co now closed Fri 2/2/18 due to inclement weather &amp; icy road conditions code C,WVDE Twitbot,7,3,2018-02-02 11:58:14,Doddridge County School District,2018-02-02
573633718084104192,All schools in #Marshall Co closed Fri 3/6/15,WVDE Twitbot,17,22,2015-03-05 23:58:30,Marshall County School District,2015-03-06
573297455216926720,All schools in #Marion Co closed Thu 3/5/15 due to INCLEMENT WEATHER,WVDE Twitbot,41,90,2015-03-05 01:42:19,Marion County School District,2015-03-05
949052728176775168,All schools in #Fayette Co closed Fri 1/5/18,WVDE Twitbot,33,39,2018-01-04 22:59:37,Fayette County School District,2018-01-05
445482176088272896,All schools in #Morgan Co closed Mon 3/17/14 code A,WVDE Twitbot,7,22,2014-03-17 08:50:02,Morgan County School District,2014-03-17
568170727347757056,All schools in #Nicholas Co closed Thu 2/19/15,WVDE Twitbot,21,16,2015-02-18 22:10:32,Nicholas County School District,2015-02-19
425724315967840256,All schools in #Monongalia Co closed Wed 1/22/14,WVDE Twitbot,49,124,2014-01-21 20:19:21,Monongalia County School District,2014-01-22
953734230764392456,All schools in #Kanawha Co closed Thu 1/18/18 due to Poor Road Conditions code B,WVDE Twitbot,216,171,2018-01-17 21:02:14,Kanawha County School District,2018-01-18
157766467209789441,All schools in #Randolph Co closed Fri 1/13/12 due to Weather,WVDE Twitbot,1,3,2012-01-13 10:10:31,Randolph County School District,2012-01-13
690126084822732802,UPDATE: All schools in #Nicholas Co now closed Thu 1/21/16 due to weather conditions,WVDE Twitbot,19,29,2016-01-21 10:57:35,Nicholas County School District,2016-01-21
294424400751644672,UPDATE: All schools in #Jefferson Co now closed Thu 1/24/13 due to Weather,WVDE Twitbot,2,5,2013-01-24 12:40:21,Jefferson County School District,2013-01-24
433900888793817088,1/2 All schools in #Kanawha Co closed Thu 2/13/14 due to Inclement Weather Conditions code B,WVDE Twitbot,29,97,2014-02-13 09:50:08,Kanawha County School District,2014-02-13
428282966339760128,All schools in #Upshur Co closed Wed 1/29/14,WVDE Twitbot,10,22,2014-01-28 21:46:30,Upshur County School District,2014-01-29
409859805726003200,All schools in #Pendleton Co closed Mon 12/9/13 due to Inclement weather,WVDE Twitbot,5,16,2013-12-09 01:39:27,Pendleton County School District,2013-12-09
953408576894259200,UPDATE: All schools in #Kanawha Co now closed Wed 1/17/18 due to Inclement Weather code B All 261 Day Employees Report on a 2 Hour Delay.,WVDE Twitbot,37,27,2018-01-16 23:28:12,Kanawha County School District,2018-01-17
953237521776988160,1/2 UPDATE: All schools in #Barbour Co now closed Tue 1/16/18,WVDE Twitbot,8,2,2018-01-16 12:08:30,Barbour County School District,2018-01-16
307457027217715200,UPDATE: All schools in #Nicholas Co now closed Fri 3/1/13 due to Bad Weather,WVDE Twitbot,0,12,2013-03-01 11:47:22,Nicholas County School District,2013-03-01
958296501146484736,UPDATE: All schools in #Upshur Co now closed Tue 1/30/18,WVDE Twitbot,9,2,2018-01-30 11:11:04,Upshur County School District,2018-01-30
697335186116235264,UPDATE: All schools in #Upshur Co now closed Wed 2/10/16,WVDE Twitbot,9,9,2016-02-10 08:23:58,Upshur County School District,2016-02-10
154144945895251968,UPDATE: All schools in #McDowell Co now closed Tue 1/3/12 due to Weather conditions,WVDE Twitbot,0,0,2012-01-03 10:19:53,McDowell County School District,2012-01-03
697375956818927618,UPDATE: All schools in #Wyoming Co now closed Wed 2/10/16,WVDE Twitbot,13,16,2016-02-10 11:05:59,Wyoming County School District,2016-02-10
438643613073809408,UPDATE: All schools in #Randolph Co now closed Wed 2/26/14,WVDE Twitbot,12,16,2014-02-26 11:56:01,Randolph County School District,2014-02-26
263211087036575745,1/2 UPDATE: All schools in #Clay Co now closed Tue 10/30/12,WVDE Twitbot,0,1,2012-10-30 09:29:48,Clay County School District,2012-10-30
697019318438129665,UPDATE: All schools in #Roane Co now closed Tue 2/9/16 due to anticipated snow &amp; ice,WVDE Twitbot,8,8,2016-02-09 11:28:50,Roane County School District,2016-02-09
690252294609354753,All schools in #Barbour Co closed Fri 1/22/16 due to the County determined State of Emergency,WVDE Twitbot,15,22,2016-01-21 19:19:05,Barbour County School District,2016-01-22
296950659478081536,UPDATE: All schools in #Upshur Co now closed Thu 1/31/13 due to high water and inclement weather,WVDE Twitbot,1,13,2013-01-31 11:58:48,Upshur County School District,2013-01-31
552908549131894786,All schools in #Tucker Co closed Thu 1/8/15,WVDE Twitbot,19,16,2015-01-07 19:24:05,Tucker County School District,2015-01-08
559696376217763841,UPDATE: All schools in #Tucker Co now closed Mon 1/26/15,WVDE Twitbot,18,11,2015-01-26 12:56:29,Tucker County School District,2015-01-26
567826550504202240,All schools in #Wyoming Co closed Wed 2/18/15 due to inclement weather,WVDE Twitbot,15,36,2015-02-17 23:22:54,Wyoming County School District,2015-02-18
960501881503125508,UPDATE: All schools in #Webster Co now closed Mon 2/5/18 due to Road Conditions,WVDE Twitbot,13,5,2018-02-05 13:14:28,Webster County School District,2018-02-05
953391530315866112,All schools in #Putnam Co closed Wed 1/17/18,WVDE Twitbot,70,64,2018-01-16 22:20:28,Putnam County School District,2018-01-17
948529175912239104,UPDATE: All schools in #Pocahontas Co now closed Wed 1/3/18 due to frigid temperatures and water issues in some schools,WVDE Twitbot,3,2,2018-01-03 12:19:13,Pocahontas County School District,2018-01-03
697222777997230080,All schools in #Ritchie Co closed Wed 2/10/16,WVDE Twitbot,13,18,2016-02-10 00:57:18,Ritchie County School District,2016-02-10
691408774586851328,All schools in #Wetzel Co closed Mon 1/25/16 due to Road Conditions,WVDE Twitbot,27,32,2016-01-24 23:54:32,Wetzel County School District,2016-01-25
422825210107023361,All schools in #Putnam Co closed Tue 1/14/14 due to the water situation.  Central Office will report at the regular time,WVDE Twitbot,26,154,2014-01-13 20:19:20,Putnam County School District,2014-01-14
568182186832232448,All schools in #Harrison Co closed Thu 2/19/15,WVDE Twitbot,43,149,2015-02-18 22:56:04,Harrison County School District,2015-02-19
950325834673422336,1/2 UPDATE: All schools in #Fayette Co now closed Mon 1/8/18 due to incoming inclement weather,WVDE Twitbot,24,25,2018-01-08 11:18:29,Fayette County School District,2018-01-08
428496342499872768,UPDATE: All schools in #Hampshire Co now closed Wed 1/29/14,WVDE Twitbot,11,13,2014-01-29 11:54:23,Hampshire County School District,2014-01-29
568549278735568896,All schools in #Nicholas Co closed Fri 2/20/15,WVDE Twitbot,21,17,2015-02-19 23:14:45,Nicholas County School District,2015-02-20
445485481015255040,All schools in #Monongalia Co closed Mon 3/17/14,WVDE Twitbot,45,93,2014-03-17 09:03:10,Monongalia County School District,2014-03-17
553038454029049857,UPDATE: All schools in #Brooke Co now closed Thu 1/8/15,WVDE Twitbot,14,13,2015-01-08 04:00:17,Brooke County School District,2015-01-08
427947368399396864,All schools in #Kanawha Co closed Tue 1/28/14 due to wintery conditions code B,WVDE Twitbot,104,325,2014-01-27 23:32:58,Kanawha County School District,2014-01-28
263082439197458432,All schools in #Greenbrier Co closed Tue 10/30/12 due to weather  #WVSandy,WVDE Twitbot,4,18,2012-10-30 00:58:35,Greenbrier County School District,2012-10-30
573575195807641601,All schools in #Kanawha Co closed Fri 3/6/15 due to Inclement Weather code B,WVDE Twitbot,83,183,2015-03-05 20:05:57,Kanawha County School District,2015-03-06
298601520214192128,All schools in #Marshall Co closed Tue 2/5/13,WVDE Twitbot,2,17,2013-02-05 01:18:44,Marshall County School District,2013-02-05
431010544917561344,All schools in #Ohio Co closed Wed 2/5/14,WVDE Twitbot,13,32,2014-02-05 10:24:56,Ohio County School District,2014-02-05
963010351007662081,UPDATE: All schools in #Ohio Co now closed Mon 2/12/18,WVDE Twitbot,6,2,2018-02-12 11:22:14,Ohio County School District,2018-02-12
296953581356056577,UPDATE: All schools in #Summers Co now closed Thu 1/31/13 due to flooding,WVDE Twitbot,0,5,2013-01-31 12:10:25,Summers County School District,2013-01-31
426464530017710080,All schools in #Braxton Co closed Fri 1/24/14 Staff please report on a two-hour delay. Principals report to BOE at 9 am.,WVDE Twitbot,5,16,2014-01-23 21:20:41,Braxton County School District,2014-01-24
950695334971404288,UPDATE: All schools in #Pleasants Co now closed Tue 1/9/18,WVDE Twitbot,14,4,2018-01-09 11:46:45,Pleasants County School District,2018-01-09
427972595406102528,All schools in #Hardy Co closed Tue 1/28/14,WVDE Twitbot,8,31,2014-01-28 01:13:12,Hardy County School District,2014-01-28
691713832729853953,1/2 All schools in #WVSDB closed Tue 1/26/16,WVDE Twitbot,8,1,2016-01-25 20:06:43,,2016-01-26
420020238848393216,All schools in #Jackson Co closed Mon 1/6/14 code A,WVDE Twitbot,21,46,2014-01-06 02:33:23,Jackson County School District,2014-01-06
420727471273562112,UPDATE: All schools in #Wood Co now closed Wed 1/8/14 due to heating and weather related issues code A THIS IS A STATUS UPDATE.,WVDE Twitbot,6,13,2014-01-08 01:23:40,Wood County School District,2014-01-08
410391900462796800,UPDATE: All schools in #Cabell Co now closed Tue 12/10/13 due to Inclement Weather code red,WVDE Twitbot,28,42,2013-12-10 12:53:48,Cabell County School District,2013-12-10
430489890623483904,"All schools in #Tyler Co closed Tue 2/4/14 Employees, Code C.",WVDE Twitbot,6,11,2014-02-03 23:56:02,Tyler County School District,2014-02-04
573309653892927489,All schools in #Summers Co closed Thu 3/5/15,WVDE Twitbot,14,7,2015-03-05 02:30:47,Summers County School District,2015-03-05
562062542051504128,All schools in #Pocahontas Co closed Mon 2/2/15,WVDE Twitbot,16,21,2015-02-02 01:38:47,Pocahontas County School District,2015-02-02
691354221833228288,All schools in #Mineral Co closed Mon 1/25/16 due to inclement weather,WVDE Twitbot,29,67,2016-01-24 20:17:45,Mineral County School District,2016-01-25
426522269980950528,"All schools in #Tyler Co closed Fri 1/24/14 Employees, Code B.",WVDE Twitbot,8,10,2014-01-24 01:10:08,Tyler County School District,2014-01-24
696988579474624512,All schools in #Barbour Co closed Tue 2/9/16 due to road conditions The Philip Barbour FAFSA Night will be rescheduled.,WVDE Twitbot,7,14,2016-02-09 09:26:41,Barbour County School District,2016-02-09
440660039481573376,UPDATE: All schools in #Barbour Co now closed Tue 3/4/14,WVDE Twitbot,10,11,2014-03-04 01:28:35,Barbour County School District,2014-03-04
573275759873269760,All schools in #Lincoln Co closed Thu 3/5/15,WVDE Twitbot,21,43,2015-03-05 00:16:06,Lincoln County School District,2015-03-05
426499300475297793,All schools in #Monroe Co closed Fri 1/24/14,WVDE Twitbot,7,20,2014-01-23 23:38:51,Monroe County School District,2014-01-24
940902099818303488,UPDATE: All schools in #Monroe Co now closed Wed 12/13/17,WVDE Twitbot,3,13,2017-12-13 11:11:56,Monroe County School District,2017-12-13
568507677514600448,All schools in #Grant Co closed Fri 2/20/15,WVDE Twitbot,7,10,2015-02-19 20:29:27,Grant County School District,2015-02-20
423195146415403008,All schools in #Putnam Co closed Wed 1/15/14 due to the water situation.  Central Office will report at the regular time,WVDE Twitbot,39,130,2014-01-14 20:49:20,Putnam County School District,2014-01-15
420285983150444544,All schools in #Jefferson Co closed Tue 1/7/14 due to wind chill advisory,WVDE Twitbot,17,27,2014-01-06 20:09:21,Jefferson County School District,2014-01-07
304942587968634881,UPDATE: All schools in #Preston Co now closed Fri 2/22/13,WVDE Twitbot,2,4,2013-02-22 13:15:53,Preston County School District,2013-02-22
691713711346688000,All schools in #Lincoln Co closed Tue 1/26/16,WVDE Twitbot,22,30,2016-01-25 20:06:14,Lincoln County School District,2016-01-26
410400632579702784,UPDATE: All schools in #Taylor Co now closed Tue 12/10/13,WVDE Twitbot,4,12,2013-12-10 13:28:30,Taylor County School District,2013-12-10
430995736348475392,All schools in #Hancock Co closed Wed 2/5/14 due to weather,WVDE Twitbot,1,1,2014-02-05 09:26:05,Hancock County School District,2014-02-05
176639389705842688,UPDATE: All schools in #Boone Co now closed Mon 3/5/12,WVDE Twitbot,0,7,2012-03-05 12:04:46,Boone County School District,2012-03-05
568152877098770433,All schools in #Mercer Co closed Thu 2/19/15 due to inclement weather,WVDE Twitbot,19,10,2015-02-18 20:59:36,Mercer County School District,2015-02-19
309239310522146816,UPDATE: All schools in #Morgan Co now closed Wed 3/6/13 code H CORRECTION: EMPLOYEE CODE H,WVDE Twitbot,1,5,2013-03-06 09:49:31,Morgan County School District,2013-03-06
958276021081518080,All schools in #Summers Co closed Tue 1/30/18,WVDE Twitbot,6,5,2018-01-30 09:49:41,Summers County School District,2018-01-30
567103705569587200,All schools in #Webster Co closed Mon 2/16/15 due to Weather Conditions,WVDE Twitbot,17,15,2015-02-15 23:30:34,Webster County School District,2015-02-16
959387839032188928,UPDATE: All schools in #Randolph Co now closed Fri 2/2/18,WVDE Twitbot,5,8,2018-02-02 11:27:40,Randolph County School District,2018-02-02
690269867333804034,All schools in #Fayette Co closed Fri 1/22/16 due to incoming weather,WVDE Twitbot,28,84,2016-01-21 20:28:55,Fayette County School District,2016-01-22
567101334441459713,All schools in #Braxton Co closed Mon 2/16/15,WVDE Twitbot,13,26,2015-02-15 23:21:09,Braxton County School District,2015-02-16
427969242370039809,All schools in #Raleigh Co closed Tue 1/28/14 due to weather conditions code A Employees must report.,WVDE Twitbot,10,46,2014-01-28 00:59:53,Raleigh County School District,2014-01-28
304922782603542528,UPDATE: All schools in #Mercer Co now closed Fri 2/22/13 due to inclement weather,WVDE Twitbot,1,2,2013-02-22 11:57:11,Mercer County School District,2013-02-22
434084708800929792,All schools in #Morgan Co closed Fri 2/14/14,WVDE Twitbot,2,10,2014-02-13 22:00:34,Morgan County School District,2014-02-14
690280035379499015,All schools in #Mingo Co closed Fri 1/22/16 due to inclement weather code orange,WVDE Twitbot,27,69,2016-01-21 21:09:19,Mingo County School District,2016-01-22
697024637293744128,UPDATE: All schools in #Raleigh Co now closed Tue 2/9/16,WVDE Twitbot,36,52,2016-02-09 11:49:58,Raleigh County School District,2016-02-09
948538232790290432,UPDATE: All schools in #Tyler Co now closed Wed 1/3/18,WVDE Twitbot,4,12,2018-01-03 12:55:12,Tyler County School District,2018-01-03
837115967306104832,"All schools in #Braxton Co closed Thu 3/2/17 due to power outages All 261 and BOE employees, please report.",WVDE Twitbot,10,11,2017-03-02 01:42:54,Braxton County School District,2017-03-02
703196216549625856,UPDATE: All schools in #Summers Co now closed Fri 2/26/16,WVDE Twitbot,15,6,2016-02-26 12:33:37,Summers County School District,2016-02-26
552794416638078976,UPDATE: All schools in #McDowell Co now closed Wed 1/7/15,WVDE Twitbot,1,6,2015-01-07 11:50:34,McDowell County School District,2015-01-07
440423004070096896,UPDATE: All schools in #Wood Co now closed Mon 3/3/14 code C REPORT CODE UPDATE.,WVDE Twitbot,4,6,2014-03-03 09:46:41,Wood County School District,2014-03-03
426674033380184064,UPDATE: All schools in #Brooke Co now closed Fri 1/24/14,WVDE Twitbot,7,10,2014-01-24 11:13:11,Brooke County School District,2014-01-24
434123695829700608,All schools in #Roane Co closed Fri 2/14/14 due to icy roads,WVDE Twitbot,6,10,2014-02-14 00:35:29,Roane County School District,2014-02-14
426656549486862337,UPDATE: All schools in #Lincoln Co now closed Fri 1/24/14,WVDE Twitbot,10,34,2014-01-24 10:03:42,Lincoln County School District,2014-01-24
697742723118452736,UPDATE: All schools in #Fayette Co now closed Thu 2/11/16 due to inclement weather,WVDE Twitbot,25,37,2016-02-11 11:23:23,Fayette County School District,2016-02-11
691360960368525313,UPDATE: All schools in #Greenbrier Co now closed Mon 1/25/16 due to Weather conditions,WVDE Twitbot,17,12,2016-01-24 20:44:32,Greenbrier County School District,2016-01-25
433898458982780929,All schools in #Gilmer Co closed Thu 2/13/14,WVDE Twitbot,8,6,2014-02-13 09:40:28,Gilmer County School District,2014-02-13
568347973987508224,UPDATE: All schools in #Mineral Co now closed Thu 2/19/15 due to inclement weather,WVDE Twitbot,10,20,2015-02-19 09:54:51,Mineral County School District,2015-02-19
438650078689886208,UPDATE: All schools in #Wayne Co now closed Wed 2/26/14 due to Inclement Weather,WVDE Twitbot,7,21,2014-02-26 12:21:43,Wayne County School District,2014-02-26
960467742561329152,UPDATE: All schools in #Jefferson Co now closed Mon 2/5/18 due to Icy roads,WVDE Twitbot,29,23,2018-02-05 10:58:49,Jefferson County School District,2018-02-05
176611525656715264,All schools in #Wayne Co closed Mon 3/5/12 due to Inclement Weather,WVDE Twitbot,0,1,2012-03-05 10:14:03,Wayne County School District,2012-03-05
425768526171750400,All schools in #Hardy Co closed Wed 1/22/14,WVDE Twitbot,10,21,2014-01-21 23:15:01,Hardy County School District,2014-01-22
561125864579293184,UPDATE: All schools in #Raleigh Co now closed Fri 1/30/15 due to weather conditions,WVDE Twitbot,24,45,2015-01-30 11:36:45,Raleigh County School District,2015-01-30
573290212782153728,All schools in #Taylor Co closed Thu 3/5/15,WVDE Twitbot,19,15,2015-03-05 01:13:32,Taylor County School District,2015-03-05
691392062004994048,All schools in #Mingo Co closed Mon 1/25/16 due to inclement weather code orange,WVDE Twitbot,41,78,2016-01-24 22:48:07,Mingo County School District,2016-01-25
430303359468204033,UPDATE: All schools in #Upshur Co now closed Mon 2/3/14,WVDE Twitbot,4,15,2014-02-03 11:34:50,Upshur County School District,2014-02-03
567066588357357570,All schools in #Summers Co closed Mon 2/16/15,WVDE Twitbot,13,9,2015-02-15 21:03:04,Summers County School District,2015-02-16
690268033647038465,All schools in #Summers Co closed Fri 1/22/16,WVDE Twitbot,20,15,2016-01-21 20:21:38,Summers County School District,2016-01-22
298250289352433664,UPDATE: All schools in #Mingo Co now closed Mon 2/4/13 code A,WVDE Twitbot,3,8,2013-02-04 02:03:04,Mingo County School District,2013-02-04
440631754378842113,UPDATE: All schools in #Raleigh Co now closed Tue 3/4/14 due to weather conditions code B Essential personnel report.,WVDE Twitbot,7,14,2014-03-03 23:36:11,Raleigh County School District,2014-03-04
561089451531980800,All schools in #Randolph Co closed Fri 1/30/15,WVDE Twitbot,18,27,2015-01-30 09:12:04,Randolph County School District,2015-01-30
433937012458921985,UPDATE: All schools in #Wood Co now closed Thu 2/13/14 code B This is a status update.,WVDE Twitbot,57,111,2014-02-13 12:13:40,Wood County School District,2014-02-13
194403418620690432,UPDATE: All schools in #Preston Co now closed Mon 4/23/12 due to Weather conditions,WVDE Twitbot,1,1,2012-04-23 12:32:41,Preston County School District,2012-04-23
433740811218739200,All schools in #Greenbrier Co closed Thu 2/13/14 due to Weather and road conditions,WVDE Twitbot,22,39,2014-02-12 23:14:02,Greenbrier County School District,2014-02-13
949041417585819648,All schools in #Summers Co closed Fri 1/5/18,WVDE Twitbot,11,4,2018-01-04 22:14:40,Summers County School District,2018-01-05
552780640547250176,UPDATE: All schools in #Harrison Co now closed Wed 1/7/15,WVDE Twitbot,39,105,2015-01-07 10:55:49,Harrison County School District,2015-01-07
568195676829581314,All schools in #Webster Co closed Thu 2/19/15 due to Weather Conditions,WVDE Twitbot,11,14,2015-02-18 23:49:40,Webster County School District,2015-02-19
841442268833824769,All schools in #Hampshire Co closed Tue 3/14/17 due to Inclement Weather / Winter Storm Warning,WVDE Twitbot,14,18,2017-03-14 00:14:04,Hampshire County School District,2017-03-14
265896034453032960,All schools in #Webster Co closed Wed 11/7/12 due to Weather Conditions All staff report at regular time to their work place.,WVDE Twitbot,0,6,2012-11-06 19:18:49,Webster County School District,2012-11-07
699530751172280320,All schools in #Hampshire Co closed Tue 2/16/16 due to extreme icing,WVDE Twitbot,14,15,2016-02-16 09:48:22,Hampshire County School District,2016-02-16
294778638098890752,UPDATE: All schools in #Randolph Co now closed Fri 1/25/13,WVDE Twitbot,6,14,2013-01-25 12:07:58,Randolph County School District,2013-01-25
568550128807768065,All schools in #Brooke Co closed Fri 2/20/15,WVDE Twitbot,20,10,2015-02-19 23:18:08,Brooke County School District,2015-02-20
409815304257036289,All schools in #Berkeley Co closed Mon 12/9/13 due to inclement weather All evening activities are cancelled.,WVDE Twitbot,16,53,2013-12-08 22:42:37,Berkeley County School District,2013-12-09
691301413557780480,1/2 All schools in #Kanawha Co closed Mon 1/25/16 due to Inclement Weather Conditions code B,WVDE Twitbot,158,311,2016-01-24 16:47:55,Kanawha County School District,2016-01-25
958296425732952064,UPDATE: All schools in #Tucker Co now closed Tue 1/30/18,WVDE Twitbot,4,1,2018-01-30 11:10:46,Tucker County School District,2018-01-30
420338411657252864,All schools in #Monroe Co closed Tue 1/7/14,WVDE Twitbot,6,13,2014-01-06 23:37:41,Monroe County School District,2014-01-07
949021205142671360,All schools in #Mercer Co closed Fri 1/5/18 due to inclement weather conditions,WVDE Twitbot,26,20,2018-01-04 20:54:21,Mercer County School District,2018-01-05
697348584640012288,All schools in #Harrison Co closed Wed 2/10/16,WVDE Twitbot,33,78,2016-02-10 09:17:13,Harrison County School District,2016-02-10
426498258714644480,All schools in #Clay Co closed Fri 1/24/14 due to weather,WVDE Twitbot,11,29,2014-01-23 23:34:43,Clay County School District,2014-01-24
948726041748606976,UPDATE: All schools in #Wyoming Co now closed Thu 1/4/18 due to extremely low temperature and windchill throughout the day,WVDE Twitbot,29,12,2018-01-04 01:21:29,Wyoming County School District,2018-01-04
304921009423798274,UPDATE: All schools in #Summers Co now closed Fri 2/22/13,WVDE Twitbot,1,6,2013-02-22 11:50:08,Summers County School District,2013-02-22
448772425715843072,UPDATE: All schools in #Raleigh Co now closed Wed 3/26/14 due to road conditions,WVDE Twitbot,11,28,2014-03-26 10:44:18,Raleigh County School District,2014-03-26
426662325828210688,UPDATE: All schools in #Boone Co now closed Fri 1/24/14 due to inclement weather,WVDE Twitbot,11,36,2014-01-24 10:26:40,Boone County School District,2014-01-24
425416847710621696,UPDATE: All schools in #Clay Co now closed Tue 1/21/14 due to Winter Storm Warning,WVDE Twitbot,7,9,2014-01-20 23:57:35,Clay County School District,2014-01-21
571054845278490624,All schools in #Raleigh Co closed Fri 2/27/15,WVDE Twitbot,26,77,2015-02-26 21:10:59,Raleigh County School District,2015-02-27
567157090507300864,UPDATE: All schools in #Pleasants Co now closed Mon 2/16/15,WVDE Twitbot,26,22,2015-02-16 03:02:42,Pleasants County School District,2015-02-16
842132197528244226,All schools in #Preston Co closed Thu 3/16/17 due to winter weather conditions,WVDE Twitbot,17,7,2017-03-15 21:55:36,Preston County School District,2017-03-16
427948448541708288,All schools in #Putnam Co closed Tue 1/28/14 due to Weather conditions,WVDE Twitbot,56,209,2014-01-27 23:37:15,Putnam County School District,2014-01-28
426145726146441216,All schools in #Grant Co closed Thu 1/23/14 due to extreme cold temperatures. Staff are to report on a 2 hour delay,WVDE Twitbot,7,10,2014-01-23 00:13:53,Grant County School District,2014-01-23
950320471647621120,UPDATE: All schools in #Mercer Co now closed Mon 1/8/18 due to inclement weather conditions,WVDE Twitbot,9,9,2018-01-08 10:57:11,Mercer County School District,2018-01-08
427979850519810048,All schools in #Hampshire Co closed Tue 1/28/14,WVDE Twitbot,17,15,2014-01-28 01:42:02,Hampshire County School District,2014-01-28
955935563563110405,All schools in #Tucker Co closed Wed 1/24/18 due to a water main break at the City of Thomas,WVDE Twitbot,19,9,2018-01-23 22:49:33,Tucker County School District,2018-01-24
434053626386862080,All schools in #Barbour Co closed Fri 2/14/14,WVDE Twitbot,15,13,2014-02-13 19:57:03,Barbour County School District,2014-02-14
553144409668476928,UPDATE: All schools in #Wetzel Co now closed Thu 1/8/15,WVDE Twitbot,24,35,2015-01-08 11:01:18,Wetzel County School District,2015-01-08
219529602152935425,All schools in #Fayette Co closed Mon 7/2/12,WVDE Twitbot,0,2,2012-07-01 20:35:10,Fayette County School District,2012-07-02
922969757162360832,All schools in #Wood Co closed Wed 10/25/17 Employees will operate on a CODE C,WVDE Twitbot,46,27,2017-10-24 23:35:12,Wood County School District,2017-10-25
568532625339457536,All schools in #Preston Co closed Fri 2/20/15 due to frigid temperatures,WVDE Twitbot,9,8,2015-02-19 22:08:35,Preston County School District,2015-02-20
445491212913369088,All schools in #Jefferson Co closed Mon 3/17/14 due to snow,WVDE Twitbot,15,30,2014-03-17 09:25:56,Jefferson County School District,2014-03-17
697734195616096256,UPDATE: All schools in #Lewis Co now closed Thu 2/11/16,WVDE Twitbot,9,8,2016-02-11 10:49:30,Lewis County School District,2016-02-11
176628972031983616,1/2 UPDATE: All schools in #Pocahontas Co now closed Mon 3/5/12,WVDE Twitbot,0,1,2012-03-05 11:23:23,Pocahontas County School District,2012-03-05
842286094439878657,All schools in #Jefferson Co closed Thu 3/16/17 due to weather,WVDE Twitbot,46,37,2017-03-16 08:07:08,Jefferson County School District,2017-03-16
578846343734636544,All schools in #Jefferson Co closed Fri 3/20/15 due to weather All 261 Day employees are to report,WVDE Twitbot,23,40,2015-03-20 09:11:37,Jefferson County School District,2015-03-20
562180627425140736,All schools in #Preston Co closed Mon 2/2/15 due to anticipated icing conditions,WVDE Twitbot,6,9,2015-02-02 09:28:01,Preston County School District,2015-02-02
692008652107022337,All schools in #Kanawha Co closed Wed 1/27/16 due to Inclement Weather Conditions code B,WVDE Twitbot,184,365,2016-01-26 15:38:14,Kanawha County School District,2016-01-27
422486230756884480,All schools in #Lincoln Co closed Mon 1/13/14,WVDE Twitbot,8,39,2014-01-12 21:52:21,Lincoln County School District,2014-01-13
570736747522473984,UPDATE: All schools in #McDowell Co now closed Tue 2/24/15,WVDE Twitbot,4,0,2015-02-26 00:06:59,McDowell County School District,2015-02-24
175196679874678784,1/2 UPDATE: All schools in #Tyler Co now closed Thu 3/1/12 due to High water,WVDE Twitbot,0,0,2012-03-01 12:31:58,Tyler County School District,2012-03-01
959387127552372737,UPDATE: All schools in #Webster Co now closed Fri 2/2/18 due to Weather and Road Conditions,WVDE Twitbot,6,4,2018-02-02 11:24:50,Webster County School District,2018-02-02
699165306799919104,All schools in #Tucker Co closed Mon 2/15/16,WVDE Twitbot,13,10,2016-02-15 09:36:13,Tucker County School District,2016-02-15
433780242877272064,All schools in #Randolph Co closed Thu 2/13/14,WVDE Twitbot,14,40,2014-02-13 01:50:43,Randolph County School District,2014-02-13
950720215742078976,UPDATE: All schools in #Wyoming Co now closed Tue 1/9/18 due to inclement weather,WVDE Twitbot,18,15,2018-01-09 13:25:37,Wyoming County School District,2018-01-09
696844552682995713,All schools in #Kanawha Co closed Tue 2/9/16 due to Inclement Weather code B,WVDE Twitbot,210,360,2016-02-08 23:54:22,Kanawha County School District,2016-02-09
420284472777400321,All schools in #Hampshire Co closed Tue 1/7/14,WVDE Twitbot,8,19,2014-01-06 20:03:21,Hampshire County School District,2014-01-07
690276779660042240,All schools in #Gilmer Co closed Fri 1/22/16,WVDE Twitbot,15,13,2016-01-21 20:56:23,Gilmer County School District,2016-01-22
570360294012112899,All schools in #Monroe Co closed Wed 2/25/15,WVDE Twitbot,12,15,2015-02-24 23:11:05,Monroe County School District,2015-02-25
438632509035655168,UPDATE: All schools in #Kanawha Co now closed Wed 2/26/14 code B,WVDE Twitbot,73,164,2014-02-26 11:11:54,Kanawha County School District,2014-02-26
960487623339986945,UPDATE: All schools in #Barbour Co now closed Mon 2/5/18,WVDE Twitbot,6,5,2018-02-05 12:17:49,Barbour County School District,2018-02-05
433931570055892993,"All schools in #Tyler Co closed Thu 2/13/14 Employees, Code C.",WVDE Twitbot,3,9,2014-02-13 11:52:03,Tyler County School District,2014-02-13
563299545845866497,UPDATE: All schools in #Upshur Co now closed Thu 2/5/15,WVDE Twitbot,11,11,2015-02-05 11:34:11,Upshur County School District,2015-02-05
157794127675793410,UPDATE: All schools in #Monroe Co now closed Fri 1/13/12,WVDE Twitbot,0,1,2012-01-13 12:00:26,Monroe County School District,2012-01-13
262852649320321024,All schools in #Summers Co closed Mon 10/29/12,WVDE Twitbot,0,2,2012-10-29 09:45:29,Summers County School District,2012-10-29
697746815869972481,UPDATE: All schools in #Monroe Co now closed Thu 2/11/16,WVDE Twitbot,11,8,2016-02-11 11:39:39,Monroe County School District,2016-02-11
263069089960964097,"All schools in #Harrison Co closed Tue 10/30/12 Harrison County Schools are closed Tuesday, October 30, 2012. #WVSandy",WVDE Twitbot,0,28,2012-10-30 00:05:33,Harrison County School District,2012-10-30
578844700628619264,All schools in #Berkeley Co closed Fri 3/20/15 due to weather All evening activities cancelled.,WVDE Twitbot,31,79,2015-03-20 09:05:05,Berkeley County School District,2015-03-20
440654673498763264,All schools in #Doddridge Co closed Tue 3/4/14 due to inclement weather Staff is to report at 9:30 a.m.,WVDE Twitbot,10,9,2014-03-04 01:07:15,Doddridge County School District,2014-03-04
699185803348570112,UPDATE: All schools in #Lewis Co now closed Mon 2/15/16,WVDE Twitbot,13,7,2016-02-15 10:57:40,Lewis County School District,2016-02-15
699588472982650880,UPDATE: All schools in #Ritchie Co now closed Tue 2/16/16,WVDE Twitbot,14,11,2016-02-16 13:37:44,Ritchie County School District,2016-02-16
568528037240680449,All schools in #Webster Co closed Fri 2/20/15 due to Weather Conditions,WVDE Twitbot,17,19,2015-02-19 21:50:21,Webster County School District,2015-02-20
696997575841472512,All schools in #Monongalia Co closed Tue 2/9/16,WVDE Twitbot,46,67,2016-02-09 10:02:26,Monongalia County School District,2016-02-09
264111208578310144,1/2 All schools in #Boone Co closed Fri 11/2/12 due to continued widespread power outages,WVDE Twitbot,2,9,2012-11-01 21:06:33,Boone County School District,2012-11-02
433568808213553152,All schools in #Mercer Co closed Wed 2/12/14 due to impending storm,WVDE Twitbot,5,7,2014-02-12 11:50:33,Mercer County School District,2014-02-12
573059254116089856,All schools in #Calhoun Co closed Wed 3/4/15 due to Flooding code red,WVDE Twitbot,2,2,2015-03-04 09:55:47,Calhoun County School District,2015-03-04
691395749091872768,All schools in #Wood Co closed Mon 1/25/16 Only 261 day employees report for work.,WVDE Twitbot,185,328,2016-01-24 23:02:46,Wood County School District,2016-01-25
567447814314397696,All schools in #Clay Co closed Tue 2/17/15 due to weather conditions,WVDE Twitbot,15,10,2015-02-16 22:17:56,Clay County School District,2015-02-17
316115169677815808,All schools in #Nicholas Co closed Mon 3/25/13 due to Bad Weather,WVDE Twitbot,3,16,2013-03-25 09:11:44,Nicholas County School District,2013-03-25
425754458081853440,All schools in #Doddridge Co closed Wed 1/22/14 due to Inclement weather &amp; frigid temperatures,WVDE Twitbot,6,12,2014-01-21 22:19:07,Doddridge County School District,2014-01-22
570887429630124032,All schools in #Monroe Co closed Thu 2/26/15,WVDE Twitbot,3,11,2015-02-26 10:05:44,Monroe County School District,2015-02-26
568207874977103873,All schools in #Marion Co closed Thu 2/19/15 due to Inclement Weather,WVDE Twitbot,30,48,2015-02-19 00:38:08,Marion County School District,2015-02-19
567637251405135872,UPDATE: All schools in #Brooke Co now closed Tue 2/17/15,WVDE Twitbot,4,11,2015-02-17 10:50:41,Brooke County School District,2015-02-17
948658496739962887,All schools in #Mason Co closed Thu 1/4/18 due to No Heat code red,WVDE Twitbot,38,16,2018-01-03 20:53:05,Mason County School District,2018-01-04
689984615797374976,All schools in #Fayette Co closed Thu 1/21/16 due to inclement weather,WVDE Twitbot,38,101,2016-01-21 01:35:26,Fayette County School District,2016-01-21
552793094996111360,1/2 UPDATE: All schools in #Calhoun Co now closed Wed 1/7/15 due to Dangerous Weather Conditions code blue,WVDE Twitbot,3,4,2015-01-07 11:45:18,Calhoun County School District,2015-01-07
699021611672936450,All schools in #Wyoming Co closed Mon 2/15/16,WVDE Twitbot,27,30,2016-02-15 00:05:14,Wyoming County School District,2016-02-15
699033881337577472,UPDATE: All schools in #Greenbrier Co now closed Mon 2/15/16 due to Weather conditions,WVDE Twitbot,15,13,2016-02-15 00:53:59,Greenbrier County School District,2016-02-15
444073990462509056,UPDATE: All schools in #Logan Co now closed Thu 3/13/14,WVDE Twitbot,17,27,2014-03-13 11:34:24,Logan County School District,2014-03-13
567464425591160832,All schools in #Tyler Co closed Tue 2/17/15 All 240 and 261 day employees will get further instructions Tuesday morning.,WVDE Twitbot,15,18,2015-02-16 23:23:56,Tyler County School District,2015-02-17
440807569095811073,UPDATE: All schools in #Tucker Co now closed Tue 3/4/14,WVDE Twitbot,7,7,2014-03-04 11:14:48,Tucker County School District,2014-03-04
565804130560901120,All schools in #Nicholas Co closed Thu 2/12/15,WVDE Twitbot,3,4,2015-02-12 09:26:31,Nicholas County School District,2015-02-12
440420766908026880,All schools in #Gilmer Co closed Mon 3/3/14,WVDE Twitbot,4,6,2014-03-03 09:37:48,Gilmer County School District,2014-03-03
552799770155438080,UPDATE: All schools in #Morgan Co now closed Wed 1/7/15 code A,WVDE Twitbot,9,22,2015-01-07 12:11:50,Morgan County School District,2015-01-07
552436030251753472,UPDATE: All schools in #Jefferson Co now closed Tue 1/6/15 due to snow,WVDE Twitbot,22,40,2015-01-06 12:06:28,Jefferson County School District,2015-01-06
436113725246803968,UPDATE: All schools in #Preston Co now closed Wed 2/19/14,WVDE Twitbot,4,4,2014-02-19 12:23:09,Preston County School District,2014-02-19
561147571503390720,UPDATE: All schools in #Jackson Co now closed Fri 1/30/15 code A,WVDE Twitbot,6,8,2015-01-30 13:03:01,Jackson County School District,2015-01-30
552404553598238721,All schools in #Ohio Co closed Tue 1/6/15,WVDE Twitbot,31,76,2015-01-06 10:01:23,Ohio County School District,2015-01-06
420281618939801600,All schools in #Berkeley Co closed Tue 1/7/14 due to weather All Tuesday evening activities are cancelled as well.,WVDE Twitbot,42,101,2014-01-06 19:52:01,Berkeley County School District,2014-01-07
298743625716727811,UPDATE: All schools in #Taylor Co now closed Tue 2/5/13,WVDE Twitbot,2,3,2013-02-05 10:43:25,Taylor County School District,2013-02-05
263235205727416320,UPDATE: All schools in #Boone Co now closed Tue 10/30/12 due to inclement weather  #WVSandy,WVDE Twitbot,1,3,2012-10-30 11:05:38,Boone County School District,2012-10-30
265178986894741504,All schools in #Preston Co closed Mon 11/5/12,WVDE Twitbot,0,3,2012-11-04 19:49:31,Preston County School District,2012-11-05
561134895784013824,UPDATE: All schools in #Brooke Co now closed Fri 1/30/15,WVDE Twitbot,4,6,2015-01-30 12:12:39,Brooke County School District,2015-01-30
570916395434835969,UPDATE: All schools in #Jefferson Co now closed Thu 2/26/15 due to Inclement Weather,WVDE Twitbot,27,48,2015-02-26 12:00:50,Jefferson County School District,2015-02-26
699195784579969024,UPDATE: All schools in #Calhoun Co now closed Mon 2/15/16 due to Weather Conditions code blue,WVDE Twitbot,10,4,2016-02-15 11:37:20,Calhoun County School District,2016-02-15
420672899041615872,All schools in #Mingo Co closed Wed 1/8/14 code A,WVDE Twitbot,6,22,2014-01-07 21:46:49,Mingo County School District,2014-01-08
948691295752675328,All schools in #Monroe Co closed Thu 1/4/18,WVDE Twitbot,9,9,2018-01-03 23:03:25,Monroe County School District,2018-01-04
425742231400882176,All schools in #Lincoln Co closed Wed 1/22/14,WVDE Twitbot,14,54,2014-01-21 21:30:32,Lincoln County School District,2014-01-22
691350464869355521,All schools in #Fayette Co closed Mon 1/25/16,WVDE Twitbot,33,83,2016-01-24 20:02:50,Fayette County School District,2016-01-25
565838313953980416,UPDATE: All schools in #Clay Co now closed Thu 2/12/15 due to weather conditions,WVDE Twitbot,11,12,2015-02-12 11:42:21,Clay County School District,2015-02-12
703180712082436096,UPDATE: All schools in #Tucker Co now closed Fri 2/26/16,WVDE Twitbot,17,5,2016-02-26 11:32:00,Tucker County School District,2016-02-26
419039499704745984,UPDATE: All schools in #Harrison Co now closed Fri 1/3/14,WVDE Twitbot,15,49,2014-01-03 09:36:16,Harrison County School District,2014-01-03
306370324998533120,UPDATE: All schools in #Pendleton Co now closed Tue 2/26/13,WVDE Twitbot,2,3,2013-02-26 11:49:12,Pendleton County School District,2013-02-26
219528995979542528,"All schools in #Wood Co closed Mon 7/2/12 due to damges from recent storms,",WVDE Twitbot,0,0,2012-07-01 20:32:45,Wood County School District,2012-07-02
552628376113262592,All schools in #Pleasants Co closed Wed 1/7/15,WVDE Twitbot,31,41,2015-01-07 00:50:46,Pleasants County School District,2015-01-07
705572567793442818,All schools in #Greenbrier Co closed Fri 3/4/16 due to HAZARDOUS  CONDITIONS,WVDE Twitbot,23,25,2016-03-04 01:56:23,Greenbrier County School District,2016-03-04
950172450616115200,All schools in #Pocahontas Co closed Mon 1/8/18 due to impending inclement weather,WVDE Twitbot,6,3,2018-01-08 01:09:00,Pocahontas County School District,2018-01-08
277025274875506688,UPDATE: All schools in #Brooke Co now closed Fri 12/7/12 due to Power outages throughout the county,WVDE Twitbot,0,0,2012-12-07 12:22:27,Brooke County School District,2012-12-07
949029839301902338,All schools in #Barbour Co closed Fri 1/5/18 Additional information about staff reporting will be announced Friday morning.,WVDE Twitbot,8,11,2018-01-04 21:28:40,Barbour County School District,2018-01-05
956503817272614912,UPDATE: All schools in #Preston Co now closed Thu 1/25/18 due to winter weather conditions,WVDE Twitbot,18,2,2018-01-25 12:27:35,Preston County School District,2018-01-25
433760355546722304,All schools in #Raleigh Co closed Thu 2/13/14 due to weather conditions Board Offices will be closed.,WVDE Twitbot,24,50,2014-02-13 00:31:42,Raleigh County School District,2014-02-13
430183351774105600,All schools in #Wirt Co closed Mon 2/3/14 Staff report at 10:00.,WVDE Twitbot,10,25,2014-02-03 03:37:58,Wirt County School District,2014-02-03
219496283520507905,All schools in #Kanawha Co closed Mon 7/2/12 due to including Central Office &amp; Crede,WVDE Twitbot,0,5,2012-07-01 18:22:46,Kanawha County School District,2012-07-02
571280656971517952,UPDATE: All schools in #Barbour Co now closed Fri 2/27/15,WVDE Twitbot,6,5,2015-02-27 12:08:17,Barbour County School District,2015-02-27
431005594594455552,All schools in #Berkeley Co closed Wed 2/5/14 All evening activities are cancelled.,WVDE Twitbot,13,41,2014-02-05 10:05:16,Berkeley County School District,2014-02-05
423575968821702656,All schools in #Putnam Co closed Thu 1/16/14 due to the emergency water situation,WVDE Twitbot,40,159,2014-01-15 22:02:35,Putnam County School District,2014-01-16
689422303868780544,UPDATE: All schools in #Webster Co now closed Tue 1/19/16 due to Weather Conditions,WVDE Twitbot,18,13,2016-01-19 12:21:00,Webster County School District,2016-01-19
567465786592083969,All schools in #Grant Co closed Tue 2/17/15,WVDE Twitbot,13,15,2015-02-16 23:29:21,Grant County School District,2015-02-17
697383852378030080,UPDATE: All schools in #Mingo Co now closed Wed 2/10/16 due to inclement weather code orange,WVDE Twitbot,20,20,2016-02-10 11:37:21,Mingo County School District,2016-02-10
563298665440497664,UPDATE: All schools in #Barbour Co now closed Thu 2/5/15,WVDE Twitbot,9,6,2015-02-05 11:30:42,Barbour County School District,2015-02-05
294407295750766593,UPDATE: All schools in #Doddridge Co now closed Thu 1/24/13 due to Snow and Frigid Temperatures,WVDE Twitbot,2,1,2013-01-24 11:32:23,Doddridge County School District,2013-01-24
573288496993050624,All schools in #Roane Co closed Thu 3/5/15 due to snow,WVDE Twitbot,7,9,2015-03-05 01:06:43,Roane County School District,2015-03-05
699571150305816576,UPDATE: All schools in #Roane Co now closed Tue 2/16/16,WVDE Twitbot,15,12,2016-02-16 12:28:54,Roane County School District,2016-02-16
427753159507722240,UPDATE: All schools in #Randolph Co now closed Mon 1/27/14,WVDE Twitbot,6,25,2014-01-27 10:41:15,Randolph County School District,2014-01-27
262959096431538176,All schools in #Jefferson Co closed Tue 10/30/12,WVDE Twitbot,0,3,2012-10-29 16:48:28,Jefferson County School District,2012-10-30
573584681951715329,All schools in #Hampshire Co closed Fri 3/6/15 due to winter weather,WVDE Twitbot,22,25,2015-03-05 20:43:39,Hampshire County School District,2015-03-06
568157170379960320,All schools in #Raleigh Co closed Thu 2/19/15,WVDE Twitbot,45,83,2015-02-18 21:16:39,Raleigh County School District,2015-02-19
953414031272013826,All schools in #Fayette Co closed Wed 1/17/18 due to inclement weather,WVDE Twitbot,39,33,2018-01-16 23:49:53,Fayette County School District,2018-01-17
567144747106848768,UPDATE: All schools in #Lewis Co now closed Mon 2/16/15,WVDE Twitbot,11,30,2015-02-16 02:13:39,Lewis County School District,2015-02-16
445486081450844160,UPDATE: All schools in #Roane Co now closed Mon 3/17/14 due to snow,WVDE Twitbot,4,6,2014-03-17 09:05:33,Roane County School District,2014-03-17
309227880683020288,UPDATE: All schools in #Grant Co now closed Wed 3/6/13 due to inclement weather Staff are not to report.,WVDE Twitbot,2,2,2013-03-06 09:04:06,Grant County School District,2013-03-06
430277652465729537,All schools in #Monongalia Co closed Mon 2/3/14,WVDE Twitbot,26,70,2014-02-03 09:52:41,Monongalia County School District,2014-02-03
297278985509941248,All schools in #Raleigh Co closed Fri 2/1/13 due to weather conditions,WVDE Twitbot,3,22,2013-02-01 09:43:27,Raleigh County School District,2013-02-01
697376741233451009,UPDATE: All schools in #Randolph Co now closed Wed 2/10/16,WVDE Twitbot,15,15,2016-02-10 11:09:06,Randolph County School District,2016-02-10
690288275790155777,All schools in #Preston Co closed Fri 1/22/16 due to winter weather conditions,WVDE Twitbot,21,9,2016-01-21 21:42:04,Preston County School District,2016-01-22
697376754059632640,UPDATE: All schools in #Nicholas Co now closed Wed 2/10/16 due to weather conditions,WVDE Twitbot,16,16,2016-02-10 11:09:09,Nicholas County School District,2016-02-10
425571159589912576,All schools in #Braxton Co closed Tue 1/21/14,WVDE Twitbot,8,13,2014-01-21 10:10:45,Braxton County School District,2014-01-21
409814361109057536,All schools in #Morgan Co closed Mon 12/9/13 code A,WVDE Twitbot,4,17,2013-12-08 22:38:52,Morgan County School District,2013-12-09
297270317422874624,All schools in #Fayette Co closed Fri 2/1/13,WVDE Twitbot,7,22,2013-02-01 09:09:01,Fayette County School District,2013-02-01
567441288673628160,All schools in #McDowell Co closed Tue 2/17/15,WVDE Twitbot,7,6,2015-02-16 21:52:00,McDowell County School District,2015-02-17
950174935275790336,All schools in #Ritchie Co closed Mon 1/8/18,WVDE Twitbot,19,16,2018-01-08 01:18:52,Ritchie County School District,2018-01-08
438644987656273921,UPDATE: All schools in #Raleigh Co now closed Wed 2/26/14 due to weather conditions,WVDE Twitbot,9,27,2014-02-26 12:01:29,Raleigh County School District,2014-02-26
428334788647206912,1/2 All schools in #Pleasants Co closed Wed 1/29/14,WVDE Twitbot,9,18,2014-01-29 01:12:26,Pleasants County School District,2014-01-29
431037404988719104,UPDATE: All schools in #Roane Co now closed Wed 2/5/14 due to high water,WVDE Twitbot,10,7,2014-02-05 12:11:40,Roane County School District,2014-02-05
434077786722938880,All schools in #McDowell Co closed Fri 2/14/14 due to inclement weather,WVDE Twitbot,1,4,2014-02-13 21:33:03,McDowell County School District,2014-02-14
448775008802725889,UPDATE: All schools in #Summers Co now closed Wed 3/26/14,WVDE Twitbot,8,7,2014-03-26 10:54:34,Summers County School District,2014-03-26
316503971063808000,UPDATE: All schools in #Summers Co now closed Tue 3/26/13,WVDE Twitbot,3,6,2013-03-26 10:56:41,Summers County School District,2013-03-26
567263601673920512,UPDATE: All schools in #Harrison Co now closed Mon 2/16/15,WVDE Twitbot,32,73,2015-02-16 10:05:56,Harrison County School District,2015-02-16
567432357490458625,All schools in #Fayette Co closed Tue 2/17/15 due to Inclement weather,WVDE Twitbot,30,42,2015-02-16 21:16:31,Fayette County School District,2015-02-17
587919714032160768,All schools in #Lincoln Co closed Tue 4/14/15,WVDE Twitbot,15,28,2015-04-14 10:05:57,Lincoln County School District,2015-04-14
690134411640246273,UPDATE: All schools in #Calhoun Co now closed Thu 1/21/16 due to Weather Conditions code blue,WVDE Twitbot,9,8,2016-01-21 11:30:40,Calhoun County School District,2016-01-21
426669681504559104,UPDATE: All schools in #Wayne Co now closed Fri 1/24/14 due to Inclement Weather,WVDE Twitbot,7,8,2014-01-24 10:55:53,Wayne County School District,2014-01-24
425569407083900928,All schools in #Taylor Co closed Tue 1/21/14,WVDE Twitbot,7,18,2014-01-21 10:03:48,Taylor County School District,2014-01-21
433742598793347072,All schools in #McDowell Co closed Thu 2/13/14 due to inclement weather,WVDE Twitbot,3,6,2014-02-12 23:21:08,McDowell County School District,2014-02-13
826024784655958016,UPDATE: All schools in #Pocahontas Co now closed Mon 1/30/17,WVDE Twitbot,1,3,2017-01-30 11:10:30,Pocahontas County School District,2017-01-30
569622146567311360,All schools in #McDowell Co closed Mon 2/23/15,WVDE Twitbot,5,5,2015-02-22 22:17:57,McDowell County School District,2015-02-23
699560880309084160,UPDATE: All schools in #WVSDB now closed Tue 2/16/16,WVDE Twitbot,7,4,2016-02-16 11:48:05,,2016-02-16
219510384741203968,All schools in #Greenbrier Co closed Mon 7/2/12,WVDE Twitbot,0,3,2012-07-01 19:18:48,Greenbrier County School District,2012-07-02
294385461126893568,All schools in #Gilmer Co closed Thu 1/24/13,WVDE Twitbot,2,3,2013-01-24 10:05:38,Gilmer County School District,2013-01-24
263584558698614784,All schools in #Lincoln Co closed Wed 10/31/12  #WVSandy,WVDE Twitbot,2,10,2012-10-31 10:13:50,Lincoln County School District,2012-10-31
420128556102860800,All schools in #Braxton Co closed Mon 1/6/14,WVDE Twitbot,10,15,2014-01-06 09:43:48,Braxton County School District,2014-01-06
567497798464331776,UPDATE: All schools in #Harrison Co now closed Tue 2/17/15,WVDE Twitbot,54,161,2015-02-17 01:36:33,Harrison County School District,2015-02-17
425607663058038785,UPDATE: All schools in #Brooke Co now closed Tue 1/21/14,WVDE Twitbot,3,6,2014-01-21 12:35:48,Brooke County School District,2014-01-21
841590454416216064,1/2 UPDATE: All schools in #Preston Co now closed Tue 3/14/17 due to winter weather conditions,WVDE Twitbot,9,3,2017-03-14 10:02:54,Preston County School District,2017-03-14
433910631494737920,All schools in #Monongalia Co closed Thu 2/13/14,WVDE Twitbot,34,71,2014-02-13 10:28:50,Monongalia County School District,2014-02-13
568013151452704768,UPDATE: All schools in #Pleasants Co now closed Wed 2/18/15,WVDE Twitbot,16,18,2015-02-18 11:44:23,Pleasants County School District,2015-02-18
425566288132329472,All schools in #Jackson Co closed Tue 1/21/14 code A,WVDE Twitbot,9,26,2014-01-21 09:51:24,Jackson County School District,2014-01-21
420161503937843200,UPDATE: All schools in #Brooke Co now closed Mon 1/6/14,WVDE Twitbot,4,9,2014-01-06 11:54:43,Brooke County School District,2014-01-06
553024770145779712,All schools in #Marion Co closed Thu 1/8/15 due to INCLEMENT WEATHER,WVDE Twitbot,44,104,2015-01-08 03:05:54,Marion County School District,2015-01-08
263225661718663168,UPDATE: All schools in #Jackson Co now closed Tue 10/30/12 Code A #WVSandy,WVDE Twitbot,0,13,2012-10-30 10:27:42,Jackson County School District,2012-10-30
947928792697311234,1/2 All schools in #Barbour Co closed Tue 1/2/18,WVDE Twitbot,18,15,2018-01-01 20:33:30,Barbour County School District,2018-01-02
690305436302610434,All schools in #Webster Co closed Fri 1/22/16 due to Weather Conditions,WVDE Twitbot,29,28,2016-01-21 22:50:15,Webster County School District,2016-01-22
698127715501740032,UPDATE: All schools in #Barbour Co now closed Fri 2/12/16 due to frigid temperatures,WVDE Twitbot,17,6,2016-02-12 12:53:12,Barbour County School District,2016-02-12
410387441657196544,UPDATE: All schools in #Boone Co now closed Tue 12/10/13 due to the condition of the secondary roads,WVDE Twitbot,8,32,2013-12-10 12:36:05,Boone County School District,2013-12-10
410346959413989376,All schools in #Pendleton Co closed Tue 12/10/13 due to Inclement weather,WVDE Twitbot,8,18,2013-12-10 09:55:13,Pendleton County School District,2013-12-10
427970907156389889,All schools in #Morgan Co closed Tue 1/28/14 due to the Wind Chill Advisory code A,WVDE Twitbot,7,35,2014-01-28 01:06:30,Morgan County School District,2014-01-28
421452623258988544,All schools in #Boone Co closed Fri 1/10/14 due to the announced water emergency,WVDE Twitbot,16,51,2014-01-10 01:25:10,Boone County School District,2014-01-10
573617678860054529,All schools in #Greenbrier Co closed Fri 3/6/15,WVDE Twitbot,22,26,2015-03-05 22:54:46,Greenbrier County School District,2015-03-06
298606132681912321,All schools in #Tyler Co closed Tue 2/5/13,WVDE Twitbot,4,6,2013-02-05 01:37:04,Tyler County School District,2013-02-05
691378752828379136,All schools in #Marshall Co closed Mon 1/25/16,WVDE Twitbot,24,47,2016-01-24 21:55:14,Marshall County School District,2016-01-25
691357991027736576,All schools in #Clay Co closed Mon 1/25/16 due to Weather conditions,WVDE Twitbot,14,14,2016-01-24 20:32:44,Clay County School District,2016-01-25
316501171080667136,UPDATE: All schools in #Fayette Co now closed Tue 3/26/13 code B,WVDE Twitbot,2,24,2013-03-26 10:45:34,Fayette County School District,2013-03-26
958316296759803905,UPDATE: All schools in #Randolph Co now closed Tue 1/30/18 Students today will be Snow Packet day 2 with Staff reporting at 10:00 a.m.,WVDE Twitbot,13,7,2018-01-30 12:29:44,Randolph County School District,2018-01-30
552629926458064896,All schools in #Pocahontas Co closed Wed 1/7/15,WVDE Twitbot,12,8,2015-01-07 00:56:56,Pocahontas County School District,2015-01-07
948684380570087424,All schools in #Preston Co closed Thu 1/4/18 due to winter weather conditions,WVDE Twitbot,3,1,2018-01-03 22:35:56,Preston County School District,2018-01-04
699045519251869696,All schools in #Webster Co closed Mon 2/15/16 due to Weather Conditions,WVDE Twitbot,26,29,2016-02-15 01:40:14,Webster County School District,2016-02-15
444064097437368320,UPDATE: All schools in #Preston Co now closed Thu 3/13/14,WVDE Twitbot,11,12,2014-03-13 10:55:05,Preston County School District,2014-03-13
420358734632988672,All schools in #Lincoln Co closed Tue 1/7/14,WVDE Twitbot,18,74,2014-01-07 00:58:26,Lincoln County School District,2014-01-07
294381980349521920,UPDATE: All schools in #Calhoun Co now closed Thu 1/24/13 due to Inclement Weather/Snow Covered Roads,WVDE Twitbot,1,0,2013-01-24 09:51:48,Calhoun County School District,2013-01-24
561124449995735041,UPDATE: All schools in #Mercer Co now closed Fri 1/30/15 due to inclement weather,WVDE Twitbot,7,13,2015-01-30 11:31:08,Mercer County School District,2015-01-30
552406854874464257,All schools in #Taylor Co closed Tue 1/6/15,WVDE Twitbot,4,13,2015-01-06 10:10:32,Taylor County School District,2015-01-06
425562871829774336,All schools in #Summers Co closed Tue 1/21/14,WVDE Twitbot,3,6,2014-01-21 09:37:49,Summers County School District,2014-01-21
554614477581471744,UPDATE: All schools in #Mineral Co now closed Mon 1/12/15 due to icy secondary roads,WVDE Twitbot,15,27,2015-01-12 12:22:50,Mineral County School District,2015-01-12
309238854425133057,All schools in #Morgan Co closed Wed 3/6/13 code D,WVDE Twitbot,2,9,2013-03-06 09:47:42,Morgan County School District,2013-03-06
961175611678044160,All schools in #Hampshire Co closed Wed 2/7/18 due to accumulating ice,WVDE Twitbot,8,3,2018-02-07 09:51:38,Hampshire County School District,2018-02-07
432706746931347456,"All schools in #Tyler Co closed Mon 2/10/14 Employees, Code C.",WVDE Twitbot,9,8,2014-02-10 02:45:02,Tyler County School District,2014-02-10
567431812264513536,All schools in #Jackson Co closed Tue 2/17/15 code A,WVDE Twitbot,34,43,2015-02-16 21:14:21,Jackson County School District,2015-02-17
427967910271655936,UPDATE: All schools in #Lincoln Co now closed Tue 1/28/14,WVDE Twitbot,16,53,2014-01-28 00:54:35,Lincoln County School District,2014-01-28
568015062725726208,UPDATE: All schools in #Ritchie Co now closed Wed 2/18/15,WVDE Twitbot,9,8,2015-02-18 11:51:58,Ritchie County School District,2015-02-18
559676604415504385,UPDATE: All schools in #Brooke Co now closed Mon 1/26/15,WVDE Twitbot,10,11,2015-01-26 11:37:55,Brooke County School District,2015-01-26
295861458703634432,UPDATE: All schools in #Pendleton Co now closed Mon 1/28/13,WVDE Twitbot,0,2,2013-01-28 11:50:43,Pendleton County School District,2013-01-28
426095738825609216,All schools in #Summers Co closed Thu 1/23/14,WVDE Twitbot,9,18,2014-01-22 20:55:15,Summers County School District,2014-01-23
424989179131355136,All schools in #Doddridge Co closed Mon 1/20/14 due to Martin Luther King Holiday,WVDE Twitbot,7,5,2014-01-19 19:38:10,Doddridge County School District,2014-01-20
420283392475664384,All schools in #Wyoming Co closed Tue 1/7/14 due to inclement weather,WVDE Twitbot,14,22,2014-01-06 19:59:03,Wyoming County School District,2014-01-07
689419318866522112,UPDATE: All schools in #Pocahontas Co now closed Tue 1/19/16 due to sub zero temperatures,WVDE Twitbot,8,11,2016-01-19 12:09:09,Pocahontas County School District,2016-01-19
567429399956688896,All schools in #Ritchie Co closed Tue 2/17/15,WVDE Twitbot,14,14,2015-02-16 21:04:45,Ritchie County School District,2015-02-17
560029911952658432,UPDATE: All schools in #Marshall Co now closed Tue 1/27/15,WVDE Twitbot,16,28,2015-01-27 11:01:50,Marshall County School District,2015-01-27
428328252319338496,All schools in #Jackson Co closed Wed 1/29/14 code B,WVDE Twitbot,15,50,2014-01-29 00:46:27,Jackson County School District,2014-01-29
553124292100362240,UPDATE: All schools in #Braxton Co now closed Thu 1/8/15 due to inclement weather,WVDE Twitbot,9,9,2015-01-08 09:41:22,Braxton County School District,2015-01-08
434058769589235712,All schools in #Upshur Co closed Fri 2/14/14,WVDE Twitbot,17,31,2014-02-13 20:17:29,Upshur County School District,2014-02-14
826025663127814144,UPDATE: All schools in #Webster Co now closed Mon 1/30/17 due to Weather Conditions,WVDE Twitbot,7,5,2017-01-30 11:13:59,Webster County School District,2017-01-30
419055238939570176,UPDATE: All schools in #Summers Co now closed Fri 1/3/14,WVDE Twitbot,3,4,2014-01-03 10:38:49,Summers County School District,2014-01-03
428301661929754624,All schools in #Doddridge Co closed Wed 1/29/14 due to inclement weather and frigid temperatures,WVDE Twitbot,7,6,2014-01-28 23:00:48,Doddridge County School District,2014-01-29
298237023968428033,All schools in #Wyoming Co closed Mon 2/4/13 due to Inclement weather,WVDE Twitbot,2,11,2013-02-04 01:10:22,Wyoming County School District,2013-02-04
554610700434563072,UPDATE: All schools in #Calhoun Co now closed Mon 1/12/15 due to Freezing Rain code blue,WVDE Twitbot,2,5,2015-01-12 12:07:49,Calhoun County School District,2015-01-12
573613276292124673,All schools in #McDowell Co closed Fri 3/6/15,WVDE Twitbot,6,4,2015-03-05 22:37:16,McDowell County School District,2015-03-06
294749689289519104,UPDATE: All schools in #Raleigh Co now closed Fri 1/25/13 due to pending weather conditions,WVDE Twitbot,3,13,2013-01-25 10:12:56,Raleigh County School District,2013-01-25
950308346619482112,All schools in #Harrison Co closed Mon 1/8/18,WVDE Twitbot,65,47,2018-01-08 10:09:00,Harrison County School District,2018-01-08
418683370684809216,All schools in #Ohio Co closed Thu 1/2/14,WVDE Twitbot,14,35,2014-01-02 10:01:08,Ohio County School District,2014-01-02
563311952144105472,UPDATE: All schools in #Mingo Co now closed Thu 2/5/15 Code Orange.,WVDE Twitbot,11,20,2015-02-05 12:23:29,Mingo County School District,2015-02-05
420292161314095104,All schools in #Marion Co closed Tue 1/7/14 due to Inclement Weather,WVDE Twitbot,24,101,2014-01-06 20:33:54,Marion County School District,2014-01-07
440647843167363072,All schools in #Putnam Co closed Tue 3/4/14 due to the weather conditions,WVDE Twitbot,63,174,2014-03-04 00:40:07,Putnam County School District,2014-03-04
568015994632974336,UPDATE: All schools in #Wirt Co now closed Wed 2/18/15,WVDE Twitbot,9,10,2015-02-18 11:55:41,Wirt County School District,2015-02-18
316107944288743425,All schools in #Berkeley Co closed Mon 3/25/13 All evening activities cancelled.,WVDE Twitbot,8,34,2013-03-25 08:43:01,Berkeley County School District,2013-03-25
428883664559435776,UPDATE: All schools in #Braxton Co now closed Thu 1/30/14 due to weather and bus issues,WVDE Twitbot,6,9,2014-01-30 13:33:28,Braxton County School District,2014-01-30
961202037919756288,UPDATE: All schools in #Grant Co now closed Wed 2/7/18,WVDE Twitbot,9,4,2018-02-07 11:36:38,Grant County School District,2018-02-07
949008340507611136,All schools in #Marion Co closed Fri 1/5/18 due to Inclement Weather,WVDE Twitbot,66,45,2018-01-04 20:03:14,Marion County School District,2018-01-05
426120305741160448,All schools in #Mingo Co closed Thu 1/23/14 Code W.  School employees report on a 2 hour delay.,WVDE Twitbot,8,13,2014-01-22 22:32:52,Mingo County School District,2014-01-23
690293911345053697,All schools in #Lewis Co closed Fri 1/22/16,WVDE Twitbot,17,20,2016-01-21 22:04:28,Lewis County School District,2016-01-22
418925921199202304,All schools in #Taylor Co closed Fri 1/3/14,WVDE Twitbot,3,14,2014-01-03 02:04:57,Taylor County School District,2014-01-03
438641748139442178,UPDATE: All schools in #Boone Co now closed Wed 2/26/14 due to inclement weather,WVDE Twitbot,11,30,2014-02-26 11:48:36,Boone County School District,2014-02-26
566060408461852673,All schools in #Mercer Co closed Fri 2/13/15 due to inclement weather,WVDE Twitbot,12,6,2015-02-13 02:24:52,Mercer County School District,2015-02-13
298601438328811520,All schools in #Upshur Co closed Tue 2/5/13 due to inclement weather,WVDE Twitbot,8,28,2013-02-05 01:18:25,Upshur County School District,2013-02-05
430164428567240704,All schools in #Ritchie Co closed Mon 2/3/14,WVDE Twitbot,9,15,2014-02-03 02:22:46,Ritchie County School District,2014-02-03
154152143241220096,UPDATE: All schools in #Upshur Co now closed Tue 1/3/12,WVDE Twitbot,1,2,2012-01-03 10:48:29,Upshur County School District,2012-01-03
420762368784601088,UPDATE: All schools in #Monongalia Co now closed Wed 1/8/14,WVDE Twitbot,37,89,2014-01-08 03:42:20,Monongalia County School District,2014-01-08
294753083580379137,All schools in #Mingo Co closed Fri 1/25/13 code A,WVDE Twitbot,1,7,2013-01-25 10:26:26,Mingo County School District,2013-01-25
552798462874746880,UPDATE: All schools in #Hampshire Co now closed Wed 1/7/15 due to extremely icy secondary roads,WVDE Twitbot,16,23,2015-01-07 12:06:38,Hampshire County School District,2015-01-07
294425869332652032,UPDATE: All schools in #Pendleton Co now closed Thu 1/24/13,WVDE Twitbot,1,0,2013-01-24 12:46:12,Pendleton County School District,2013-01-24
157789068544065537,UPDATE: All schools in #Raleigh Co now closed Fri 1/13/12,WVDE Twitbot,0,11,2012-01-13 11:40:20,Raleigh County School District,2012-01-13
425806479208087552,UPDATE: All schools in #Wayne Co now closed Wed 1/22/14 due to Inclement Weather,WVDE Twitbot,6,12,2014-01-22 01:45:50,Wayne County School District,2014-01-22
950325592540569601,UPDATE: All schools in #Monroe Co now closed Mon 1/8/18,WVDE Twitbot,5,4,2018-01-08 11:17:32,Monroe County School District,2018-01-08
430494330336202752,All schools in #Monongalia Co closed Tue 2/4/14,WVDE Twitbot,42,103,2014-02-04 00:13:41,Monongalia County School District,2014-02-04
435384758583844864,"UPDATE: All schools in #Tyler Co now closed Mon 2/17/14 Employees, Code C.",WVDE Twitbot,9,9,2014-02-17 12:06:30,Tyler County School District,2014-02-17
573422379726192640,All schools in #Mineral Co closed Thu 3/5/15 due to inclement weather,WVDE Twitbot,7,15,2015-03-05 09:58:43,Mineral County School District,2015-03-05
430643587471003649,All schools in #Wood Co closed Tue 2/4/14 code B,WVDE Twitbot,31,93,2014-02-04 10:06:46,Wood County School District,2014-02-04
425829418607448064,UPDATE: All schools in #Brooke Co now closed Wed 1/22/14,WVDE Twitbot,4,5,2014-01-22 03:16:59,Brooke County School District,2014-01-22
959170969553207308,All schools in #Wyoming Co closed Fri 2/2/18 due to an impending work stoppage,WVDE Twitbot,98,63,2018-02-01 21:05:54,Wyoming County School District,2018-02-02
841798619741208576,UPDATE: All schools in #Preston Co now closed Wed 3/15/17 due to winter weather conditions,WVDE Twitbot,10,5,2017-03-14 23:50:05,Preston County School District,2017-03-15
940900087856803841,UPDATE: All schools in #Raleigh Co now closed Wed 12/13/17,WVDE Twitbot,77,44,2017-12-13 11:03:56,Raleigh County School District,2017-12-13
263085119282216960,All schools in #Lewis Co closed Tue 10/30/12  #WVSandy,WVDE Twitbot,2,4,2012-10-30 01:09:14,Lewis County School District,2012-10-30
440241996091768832,All schools in #Monongalia Co closed Mon 3/3/14,WVDE Twitbot,58,122,2014-03-02 21:47:25,Monongalia County School District,2014-03-03
567295030650736641,UPDATE: All schools in #Mingo Co now closed Mon 2/16/15 Code Blue.,WVDE Twitbot,0,0,2015-02-16 12:10:49,Mingo County School District,2015-02-16
410376498739023873,UPDATE: All schools in #Raleigh Co now closed Tue 12/10/13 due to road conditions,WVDE Twitbot,8,28,2013-12-10 11:52:36,Raleigh County School District,2013-12-10
426677394494074880,UPDATE: All schools in #Marshall Co now closed Fri 1/24/14,WVDE Twitbot,10,20,2014-01-24 11:26:32,Marshall County School District,2014-01-24
573576045372272640,All schools in #Logan Co closed Fri 3/6/15,WVDE Twitbot,16,36,2015-03-05 20:09:20,Logan County School District,2015-03-06
304940641224372224,UPDATE: All schools in #Tyler Co now closed Fri 2/22/13 due to weather conditions,WVDE Twitbot,1,0,2013-02-22 13:08:09,Tyler County School District,2013-02-22
426174468700905472,"UPDATE: All schools in #Tyler Co now closed Thu 1/23/14 Employees, Code C.",WVDE Twitbot,7,3,2014-01-23 02:08:05,Tyler County School District,2014-01-23
306364640256995328,UPDATE: All schools in #Pocahontas Co now closed Tue 2/26/13 due to freezing rain/snow,WVDE Twitbot,0,7,2013-02-26 11:26:36,Pocahontas County School District,2013-02-26
569661890512723968,All schools in #Gilmer Co closed Mon 2/23/15,WVDE Twitbot,10,8,2015-02-23 00:55:53,Gilmer County School District,2015-02-23
692082200943132672,All schools in #Taylor Co closed Wed 1/27/16,WVDE Twitbot,29,26,2016-01-26 20:30:29,Taylor County School District,2016-01-27
566019702460518400,All schools in #Summers Co closed Fri 2/13/15,WVDE Twitbot,13,22,2015-02-12 23:43:07,Summers County School District,2015-02-13
953214400130928640,UPDATE: All schools in #Jackson Co now closed Tue 1/16/18 code A,WVDE Twitbot,21,12,2018-01-16 10:36:37,Jackson County School District,2018-01-16
316131195844960256,UPDATE: All schools in #Raleigh Co now closed Mon 3/25/13 due to weather conditions code B Only essential employees need to report.,WVDE Twitbot,4,18,2013-03-25 10:15:25,Raleigh County School District,2013-03-25
568202584680476672,All schools in #Wood Co closed Thu 2/19/15 Only 261 day employees report to work.,WVDE Twitbot,111,164,2015-02-19 00:17:07,Wood County School District,2015-02-19
421625482887434241,UPDATE: All schools in #Jefferson Co now closed Fri 1/10/14 due to weather,WVDE Twitbot,8,20,2014-01-10 12:52:03,Jefferson County School District,2014-01-10
948903154523037697,UPDATE: All schools in #Clay Co now closed Thu 1/4/18,WVDE Twitbot,12,16,2018-01-04 13:05:16,Clay County School District,2018-01-04
568178220387987456,All schools in #Ritchie Co closed Thu 2/19/15,WVDE Twitbot,18,14,2015-02-18 22:40:18,Ritchie County School District,2015-02-19
699072516619444224,UPDATE: All schools in #Ritchie Co now closed Mon 2/15/16,WVDE Twitbot,24,10,2016-02-15 03:27:30,Ritchie County School District,2016-02-15
565852291937607680,UPDATE: All schools in #Tucker Co now closed Thu 2/12/15,WVDE Twitbot,5,6,2015-02-12 12:37:54,Tucker County School District,2015-02-12
427949577430241280,All schools in #Boone Co closed Tue 1/28/14 due to inclement winter weather,WVDE Twitbot,19,58,2014-01-27 23:41:44,Boone County School District,2014-01-28
434057562774720512,All schools in #Clay Co closed Fri 2/14/14 due to weather conditions,WVDE Twitbot,9,24,2014-02-13 20:12:42,Clay County School District,2014-02-14
433775238745051136,All schools in #Pendleton Co closed Thu 2/13/14,WVDE Twitbot,9,18,2014-02-13 01:30:50,Pendleton County School District,2014-02-13
316105953047105538,UPDATE: All schools in #Pocahontas Co now closed Mon 3/25/13,WVDE Twitbot,1,5,2013-03-25 08:35:06,Pocahontas County School District,2013-03-25
569827472214253569,UPDATE: All schools in #Doddridge Co now closed Mon 2/23/15,WVDE Twitbot,11,6,2015-02-23 11:53:50,Doddridge County School District,2015-02-23
570028521512439808,All schools in #Wyoming Co closed Tue 2/24/15 due to inclement weather,WVDE Twitbot,13,26,2015-02-24 01:12:44,Wyoming County School District,2015-02-24
434059569103261696,All schools in #Braxton Co closed Fri 2/14/14 Staff do not report.  Thank you!,WVDE Twitbot,11,16,2014-02-13 20:20:40,Braxton County School District,2014-02-14
552803705507311618,UPDATE: All schools in #Logan Co now closed Wed 1/7/15,WVDE Twitbot,22,27,2015-01-07 12:27:28,Logan County School District,2015-01-07
425746693049430016,All schools in #Clay Co closed Wed 1/22/14 due to weather conditions,WVDE Twitbot,6,18,2014-01-21 21:48:16,Clay County School District,2014-01-22
561135398471352320,UPDATE: All schools in #Pleasants Co now closed Fri 1/30/15,WVDE Twitbot,13,17,2015-01-30 12:14:39,Pleasants County School District,2015-01-30
689988137066610689,UPDATE: All schools in #Boone Co now closed Thu 1/21/16,WVDE Twitbot,32,36,2016-01-21 01:49:25,Boone County School District,2016-01-21
440298386827141121,All schools in #Tucker Co closed Mon 3/3/14,WVDE Twitbot,7,16,2014-03-03 01:31:30,Tucker County School District,2014-03-03
316509309209042944,All schools in #Mercer Co closed Tue 3/26/13 due to inclement weather,WVDE Twitbot,1,5,2013-03-26 11:17:54,Mercer County School District,2013-03-26
699167476182024193,All schools in #Grant Co closed Mon 2/15/16,WVDE Twitbot,14,8,2016-02-15 09:44:50,Grant County School District,2016-02-15
691316435310788608,All schools in #Marion Co closed Mon 1/25/16 due to Inclement Weather,WVDE Twitbot,58,143,2016-01-24 17:47:36,Marion County School District,2016-01-25
690111445435052032,All schools in #Monroe Co closed Thu 1/21/16,WVDE Twitbot,10,6,2016-01-21 09:59:24,Monroe County School District,2016-01-21
420158065137049600,UPDATE: All schools in #Mingo Co now closed Mon 1/6/14,WVDE Twitbot,6,15,2014-01-06 11:41:03,Mingo County School District,2014-01-06
418919404965855232,All schools in #McDowell Co closed Fri 1/3/14 due to inclement weather,WVDE Twitbot,2,5,2014-01-03 01:39:03,McDowell County School District,2014-01-03
219829668516339712,"All schools in #Wood Co closed Tue 7/3/12 due to issues resulting from recent storms,",WVDE Twitbot,0,0,2012-07-02 16:27:31,Wood County School District,2012-07-03
445481760470474752,1/2 All schools in #Preston Co closed Mon 3/17/14,WVDE Twitbot,7,6,2014-03-17 08:48:23,Preston County School District,2014-03-17
697033329372196864,UPDATE: All schools in #Mason Co now closed Tue 2/9/16 due to Inclement Weather code red,WVDE Twitbot,29,27,2016-02-09 12:24:30,Mason County School District,2016-02-09
219869601335476224,All schools in #Greenbrier Co closed Tue 7/3/12,WVDE Twitbot,0,1,2012-07-02 19:06:12,Greenbrier County School District,2012-07-03
426326580969750528,UPDATE: All schools in #Hardy Co now closed Thu 1/23/14,WVDE Twitbot,5,21,2014-01-23 12:12:32,Hardy County School District,2014-01-23
569652891218272257,All schools in #Wirt Co closed Mon 2/23/15,WVDE Twitbot,15,17,2015-02-23 00:20:07,Wirt County School District,2015-02-23
419074437376643072,UPDATE: All schools in #Hardy Co now closed Fri 1/3/14,WVDE Twitbot,9,19,2014-01-03 11:55:06,Hardy County School District,2014-01-03
697023747245678593,1/2 UPDATE: All schools in #Braxton Co now closed Tue 2/9/16,WVDE Twitbot,9,8,2016-02-09 11:46:26,Braxton County School District,2016-02-09
440300667656101888,1/2 All schools in #Boone Co closed Mon 3/3/14 due to pending inclement weather,WVDE Twitbot,19,39,2014-03-03 01:40:34,Boone County School District,2014-03-03
430482441032437760,All schools in #Marion Co closed Tue 2/4/14 due to Inclement Weather,WVDE Twitbot,17,50,2014-02-03 23:26:26,Marion County School District,2014-02-04
825885106879471617,All schools in #Kanawha Co closed Mon 1/30/17 due to Winter Weather Conditions code B,WVDE Twitbot,264,374,2017-01-30 01:55:28,Kanawha County School District,2017-01-30
552957790525087745,All schools in #Wirt Co closed Thu 1/8/15 Due to severe cold weather conditions.,WVDE Twitbot,14,23,2015-01-07 22:39:45,Wirt County School District,2015-01-08
420040943513784320,All schools in #Wyoming Co closed Mon 1/6/14 due to inclement weather,WVDE Twitbot,9,14,2014-01-06 03:55:39,Wyoming County School District,2014-01-06
951796968875020288,UPDATE: All schools in #Ritchie Co now closed Fri 1/12/18,WVDE Twitbot,11,5,2018-01-12 12:44:15,Ritchie County School District,2018-01-12
552432952119132161,UPDATE: All schools in #Morgan Co now closed Tue 1/6/15 code A,WVDE Twitbot,11,18,2015-01-06 11:54:14,Morgan County School District,2015-01-06
841448658721751040,All schools in #WVSDB closed Tue 3/14/17 due to Inclement weather,WVDE Twitbot,1,1,2017-03-14 00:39:28,,2017-03-14
316133567191212032,UPDATE: All schools in #Upshur Co now closed Mon 3/25/13 due to road conditions and inclement weather,WVDE Twitbot,2,9,2013-03-25 10:24:50,Upshur County School District,2013-03-25
420274332640636928,All schools in #Pleasants Co closed Tue 1/7/14,WVDE Twitbot,11,23,2014-01-06 19:23:03,Pleasants County School District,2014-01-07
948175610609831936,UPDATE: All schools in #Summers Co now closed Tue 1/2/18,WVDE Twitbot,10,2,2018-01-02 12:54:16,Summers County School District,2018-01-02
428308459314880512,All schools in #Ohio Co closed Wed 1/29/14,WVDE Twitbot,15,30,2014-01-28 23:27:48,Ohio County School District,2014-01-29
561136768624627712,UPDATE: All schools in #Wood Co now closed Fri 1/30/15 UPDATE - Only 261 day employees report.,WVDE Twitbot,79,127,2015-01-30 12:20:05,Wood County School District,2015-01-30
686876198761295872,UPDATE: All schools in #Ohio Co now closed Tue 1/12/16,WVDE Twitbot,27,69,2016-01-12 11:43:41,Ohio County School District,2016-01-12
434072016627302400,All schools in #Nicholas Co closed Fri 2/14/14,WVDE Twitbot,10,24,2014-02-13 21:10:08,Nicholas County School District,2014-02-14
569618572735070208,All schools in #Wyoming Co closed Mon 2/23/15 due to inclement weather,WVDE Twitbot,12,12,2015-02-22 22:03:45,Wyoming County School District,2015-02-23
428270400573681664,All schools in #Ritchie Co closed Wed 1/29/14 Staff is to report on a 2 hour delay schedule,WVDE Twitbot,5,12,2014-01-28 20:56:35,Ritchie County School District,2014-01-29
578844937615204352,All schools in #Morgan Co closed Fri 3/20/15 code A,WVDE Twitbot,7,12,2015-03-20 09:06:02,Morgan County School District,2015-03-20
570908999136223232,UPDATE: All schools in #Pendleton Co now closed Thu 2/26/15,WVDE Twitbot,5,3,2015-02-26 11:31:27,Pendleton County School District,2015-02-26
614379974284439552,All schools in #Putnam Co closed Fri 6/26/15 due to Water problems Central Office Closed and no summer classes,WVDE Twitbot,4,1,2015-06-26 10:29:35,Putnam County School District,2015-06-26
298384528140021760,UPDATE: All schools in #Taylor Co now closed Mon 2/4/13,WVDE Twitbot,1,6,2013-02-04 10:56:29,Taylor County School District,2013-02-04
316500944508555264,UPDATE: All schools in #Raleigh Co now closed Tue 3/26/13 due to poor road conditions code A Employees must report.,WVDE Twitbot,1,33,2013-03-26 10:44:40,Raleigh County School District,2013-03-26
573622911581421569,All schools in #Mineral Co closed Fri 3/6/15 due to inclement weather,WVDE Twitbot,22,59,2015-03-05 23:15:34,Mineral County School District,2015-03-06
440663208421253120,All schools in #Grant Co closed Tue 3/4/14 due to inclement weather,WVDE Twitbot,6,5,2014-03-04 01:41:10,Grant County School District,2014-03-04
692100873871294464,All schools in #Boone Co closed Wed 1/27/16 All 240 and 261 employees should report.,WVDE Twitbot,34,16,2016-01-26 21:44:41,Boone County School District,2016-01-27
559650861878902784,All schools in #Hampshire Co closed Mon 1/26/15,WVDE Twitbot,19,22,2015-01-26 09:55:37,Hampshire County School District,2015-01-26
430280567167275008,UPDATE: All schools in #Doddridge Co now closed Mon 2/3/14 due to snow and hazardous road condtions Staff is not required to report.,WVDE Twitbot,3,5,2014-02-03 10:04:16,Doddridge County School District,2014-02-03
691333216796594176,All schools in #Preston Co closed Mon 1/25/16 due to winter weather conditions All employees do not report.,WVDE Twitbot,22,20,2016-01-24 18:54:17,Preston County School District,2016-01-25
573295747396968448,All schools in #Calhoun Co closed Thu 3/5/15 code red,WVDE Twitbot,7,6,2015-03-05 01:35:32,Calhoun County School District,2015-03-05
565807482124390400,All schools in #Raleigh Co closed Thu 2/12/15 due to the threat of weather conditions,WVDE Twitbot,24,64,2015-02-12 09:39:50,Raleigh County School District,2015-02-12
426095766357020672,All schools in #Harrison Co closed Thu 1/23/14,WVDE Twitbot,23,103,2014-01-22 20:55:21,Harrison County School District,2014-01-23
567502527311400961,UPDATE: All schools in #Monongalia Co now closed Tue 2/17/15,WVDE Twitbot,57,107,2015-02-17 01:55:20,Monongalia County School District,2015-02-17
304925287630635008,UPDATE: All schools in #Pendleton Co now closed Fri 2/22/13,WVDE Twitbot,4,1,2013-02-22 12:07:08,Pendleton County School District,2013-02-22
264083121941647360,UPDATE: All schools in #Clay Co now closed Fri 11/2/12 due to Power Outage code A,WVDE Twitbot,0,8,2012-11-01 19:14:57,Clay County School District,2012-11-02
297287759821938688,1/2 UPDATE: All schools in #Boone Co now closed Fri 2/1/13 due to the condition of the roadways,WVDE Twitbot,2,8,2013-02-01 10:18:19,Boone County School District,2013-02-01
950180180093521920,UPDATE: All schools in #Wood Co now closed Mon 1/8/18 due to inclement weather Employees will operate on a CODE A,WVDE Twitbot,178,121,2018-01-08 01:39:43,Wood County School District,2018-01-08
570914534300508160,UPDATE: All schools in #Pocahontas Co now closed Thu 2/26/15 due to Inclement weather,WVDE Twitbot,7,5,2015-02-26 11:53:26,Pocahontas County School District,2015-02-26
568170292352294912,All schools in #Roane Co closed Thu 2/19/15 due to extreme cold,WVDE Twitbot,36,10,2015-02-18 22:08:48,Roane County School District,2015-02-19
432848217458237440,UPDATE: All schools in #Pleasants Co now closed Mon 2/10/14,WVDE Twitbot,13,10,2014-02-10 12:07:11,Pleasants County School District,2014-02-10
567444527037030401,UPDATE: All schools in #Kanawha Co now closed Tue 2/17/15 due to Inclement Weather code B,WVDE Twitbot,64,104,2015-02-16 22:04:52,Kanawha County School District,2015-02-17
426091873711951872,All schools in #Marion Co closed Thu 1/23/14 due to Inclement Weather,WVDE Twitbot,22,90,2014-01-22 20:39:53,Marion County School District,2014-01-23
420285454559506432,1/2 All schools in #Clay Co closed Tue 1/7/14 due to current weather conditions,WVDE Twitbot,12,26,2014-01-06 20:07:15,Clay County School District,2014-01-07
697020455199383553,UPDATE: All schools in #Gilmer Co now closed Tue 2/9/16,WVDE Twitbot,5,2,2016-02-09 11:33:21,Gilmer County School District,2016-02-09
552650445790126080,All schools in #Wood Co closed Wed 1/7/15 Only 261 Day employees are to report for work.,WVDE Twitbot,123,207,2015-01-07 02:18:28,Wood County School District,2015-01-07
157760194401665024,All schools in #Upshur Co closed Fri 1/13/12,WVDE Twitbot,1,2,2012-01-13 09:45:36,Upshur County School District,2012-01-13
309237454479708160,All schools in #Monongalia Co closed Wed 3/6/13,WVDE Twitbot,9,56,2013-03-06 09:42:09,Monongalia County School District,2013-03-06
690270752281608196,All schools in #Taylor Co closed Fri 1/22/16,WVDE Twitbot,24,24,2016-01-21 20:32:26,Taylor County School District,2016-01-22
826036815312338944,UPDATE: All schools in #Wyoming Co now closed Mon 1/30/17 due to extreme weather,WVDE Twitbot,15,29,2017-01-30 11:58:18,Wyoming County School District,2017-01-30
568146998945320960,All schools in #Jackson Co closed Thu 2/19/15 code A,WVDE Twitbot,31,57,2015-02-18 20:36:14,Jackson County School District,2015-02-19
697022462253469696,UPDATE: All schools in #Summers Co now closed Tue 2/9/16,WVDE Twitbot,4,2,2016-02-09 11:41:19,Summers County School District,2016-02-09
316139038123905025,UPDATE: All schools in #McDowell Co now closed Mon 3/25/13,WVDE Twitbot,0,1,2013-03-25 10:46:34,McDowell County School District,2013-03-25
420159059304542208,UPDATE: All schools in #Gilmer Co now closed Mon 1/6/14,WVDE Twitbot,2,10,2014-01-06 11:45:00,Gilmer County School District,2014-01-06
953402901896056833,All schools in #Kanawha Co closed Wed 1/17/18 due to Inclement Weather code B All 261 Day Employees Report on time.,WVDE Twitbot,176,166,2018-01-16 23:05:39,Kanawha County School District,2018-01-17
409750330868391937,All schools in #Pocahontas Co closed Mon 12/9/13,WVDE Twitbot,9,20,2013-12-08 18:24:26,Pocahontas County School District,2013-12-09
949012632786399237,All schools in #Monongalia Co closed Fri 1/5/18 Arctic Academy Day!,WVDE Twitbot,13,7,2018-01-04 20:20:18,Monongalia County School District,2018-01-05
438646783695007744,UPDATE: All schools in #Webster Co now closed Wed 2/26/14 due to Staff report on a 2 hr delay,WVDE Twitbot,7,10,2014-02-26 12:08:37,Webster County School District,2014-02-26
297295468529086464,UPDATE: All schools in #Clay Co now closed Fri 2/1/13 due to weather conditions,WVDE Twitbot,4,1,2013-02-01 10:48:57,Clay County School District,2013-02-01
433903482425208832,All schools in #Harrison Co closed Thu 2/13/14,WVDE Twitbot,26,74,2014-02-13 10:00:26,Harrison County School District,2014-02-13
568528236205903872,All schools in #Boone Co closed Fri 2/20/15,WVDE Twitbot,18,19,2015-02-19 21:51:08,Boone County School District,2015-02-20
291848617306755072,All schools in #Raleigh Co closed Thu 1/17/13 due to the threat of bad weather,WVDE Twitbot,4,27,2013-01-17 10:05:07,Raleigh County School District,2013-01-17
291852522606444546,All schools in #McDowell Co closed Thu 1/17/13 due to inclement weather,WVDE Twitbot,0,3,2013-01-17 10:20:38,McDowell County School District,2013-01-17
428328919289171968,All schools in #Wayne Co closed Wed 1/29/14 due to Extreme Cold,WVDE Twitbot,13,19,2014-01-29 00:49:06,Wayne County School District,2014-01-29
420139076507811840,All schools in #Cabell Co closed Mon 1/6/14 due to inclement weather code orange,WVDE Twitbot,32,59,2014-01-06 10:25:36,Cabell County School District,2014-01-06
560006638955151360,All schools in #Jefferson Co closed Tue 1/27/15 due to snow,WVDE Twitbot,21,30,2015-01-27 09:29:21,Jefferson County School District,2015-01-27
425599477823442944,UPDATE: All schools in #Marshall Co now closed Tue 1/21/14,WVDE Twitbot,7,23,2014-01-21 12:03:17,Marshall County School District,2014-01-21
410348006739693568,All schools in #Greenbrier Co closed Tue 12/10/13 due to Weather conditions,WVDE Twitbot,8,26,2013-12-10 09:59:23,Greenbrier County School District,2013-12-10
697369434223222784,UPDATE: All schools in #Taylor Co now closed Wed 2/10/16,WVDE Twitbot,12,11,2016-02-10 10:40:04,Taylor County School District,2016-02-10
298238904757276672,UPDATE: All schools in #Barbour Co now closed Mon 2/4/13 due to inclement weather and road conditions,WVDE Twitbot,1,8,2013-02-04 01:17:50,Barbour County School District,2013-02-04
263756667097870337,"All schools in #Barbour Co closed Thu 11/1/12 Lack of Electricity, Water, &amp; Inclement Weather #WVSandy",WVDE Twitbot,0,10,2012-10-31 21:37:44,Barbour County School District,2012-11-01
409811762293137408,All schools in #Grant Co closed Mon 12/9/13 due to inclement weather,WVDE Twitbot,3,13,2013-12-08 22:28:32,Grant County School District,2013-12-09
309109829488746496,All schools in #Hampshire Co closed Wed 3/6/13 due to weather,WVDE Twitbot,0,18,2013-03-06 01:15:00,Hampshire County School District,2013-03-06
425757370589786112,All schools in #Grant Co closed Wed 1/22/14 due to inclement weather and extreme cold temperature,WVDE Twitbot,2,7,2014-01-21 22:30:41,Grant County School District,2014-01-22
950136430121988096,All schools in #Tyler Co closed Mon 1/8/18,WVDE Twitbot,16,22,2018-01-07 22:45:52,Tyler County School District,2018-01-08
570703649678217218,All schools in #Wyoming Co closed Thu 2/26/15 due to Inclement weather,WVDE Twitbot,17,22,2015-02-25 21:55:27,Wyoming County School District,2015-02-26
295870629037608961,UPDATE: All schools in #Hardy Co now closed Mon 1/28/13 Cental Office staff use non work day or arrive when roads are safe for travel.,WVDE Twitbot,0,13,2013-01-28 12:27:09,Hardy County School District,2013-01-28
559649152158932992,All schools in #Jefferson Co closed Mon 1/26/15 due to snow,WVDE Twitbot,26,33,2015-01-26 09:48:50,Jefferson County School District,2015-01-26
316503724346458112,UPDATE: All schools in #Greenbrier Co now closed Tue 3/26/13 due to Weather conditions,WVDE Twitbot,4,26,2013-03-26 10:55:42,Greenbrier County School District,2013-03-26
566208539279241216,UPDATE: All schools in #Monroe Co now closed Fri 2/13/15,WVDE Twitbot,4,13,2015-02-13 12:13:30,Monroe County School District,2015-02-13
309160939511500800,All schools in #Berkeley Co closed Wed 3/6/13 All evening activities cancelled.,WVDE Twitbot,9,51,2013-03-06 04:38:06,Berkeley County School District,2013-03-06
690118709491417088,UPDATE: All schools in #Clay Co now closed Thu 1/21/16 due to Weather conditions,WVDE Twitbot,11,18,2016-01-21 10:28:16,Clay County School District,2016-01-21
425377387455332352,All schools in #Boone Co closed Tue 1/21/14 due to finalizing preparations for the return of students,WVDE Twitbot,8,15,2014-01-20 21:20:46,Boone County School District,2014-01-21
573274027550224384,All schools in #Randolph Co closed Thu 3/5/15,WVDE Twitbot,35,27,2015-03-05 00:09:13,Randolph County School District,2015-03-05
570173352112992256,UPDATE: All schools in #Fayette Co now closed Tue 2/24/15 due to inclement weather,WVDE Twitbot,16,47,2015-02-24 10:48:15,Fayette County School District,2015-02-24
567451419121577984,All schools in #Pleasants Co closed Tue 2/17/15,WVDE Twitbot,21,23,2015-02-16 22:32:15,Pleasants County School District,2015-02-17
425749830468526080,All schools in #Braxton Co closed Wed 1/22/14,WVDE Twitbot,10,19,2014-01-21 22:00:44,Braxton County School District,2014-01-22
425563772166475776,All schools in #Raleigh Co closed Tue 1/21/14 due to weather conditions,WVDE Twitbot,20,46,2014-01-21 09:41:24,Raleigh County School District,2014-01-21
573585749938991104,All schools in #Lincoln Co closed Fri 3/6/15,WVDE Twitbot,15,18,2015-03-05 20:47:54,Lincoln County School District,2015-03-06
841565309890879488,All schools in #Randolph Co closed Tue 3/14/17,WVDE Twitbot,12,9,2017-03-14 08:23:00,Randolph County School District,2017-03-14
954182167747268608,UPDATE: All schools in #Mason Co now closed Fri 1/19/18 due to Inclement Weather code red,WVDE Twitbot,41,16,2018-01-19 02:42:11,Mason County School District,2018-01-19
826019839764471808,"UPDATE: All schools in #Braxton Co now closed Mon 1/30/17 BOE and 261-day employees, report on 2-hr delay.",WVDE Twitbot,6,8,2017-01-30 10:50:51,Braxton County School District,2017-01-30
567125003796500480,All schools in #Wyoming Co closed Mon 2/16/15 due to inclement weather,WVDE Twitbot,20,37,2015-02-16 00:55:12,Wyoming County School District,2015-02-16
561136416827400192,UPDATE: All schools in #Lincoln Co now closed Fri 1/30/15,WVDE Twitbot,15,41,2015-01-30 12:18:41,Lincoln County School District,2015-01-30
961206088543690753,UPDATE: All schools in #Pleasants Co now closed Wed 2/7/18,WVDE Twitbot,13,3,2018-02-07 11:52:44,Pleasants County School District,2018-02-07
699019386825342980,All schools in #McDowell Co closed Mon 2/15/16,WVDE Twitbot,16,5,2016-02-14 23:56:23,McDowell County School District,2016-02-15
573600737034395648,All schools in #Doddridge Co closed Fri 3/6/15 due to Inclement Weather,WVDE Twitbot,7,11,2015-03-05 21:47:27,Doddridge County School District,2015-03-06
699531347862360064,All schools in #Mineral Co closed Tue 2/16/16 due to icy conditions,WVDE Twitbot,28,37,2016-02-16 09:50:44,Mineral County School District,2016-02-16
567475835494752256,All schools in #Preston Co closed Tue 2/17/15 due to winter weather conditions,WVDE Twitbot,12,10,2015-02-17 00:09:17,Preston County School District,2015-02-17
420289607259807744,All schools in #Braxton Co closed Tue 1/7/14 All extracurricular games and practices are cancelled.,WVDE Twitbot,11,20,2014-01-06 20:23:45,Braxton County School District,2014-01-07
426673650909990912,All schools in #Hancock Co closed Fri 1/24/14 due to weather,WVDE Twitbot,2,2,2014-01-24 11:11:40,Hancock County School District,2014-01-24
687231054655188992,UPDATE: All schools in #Monongalia Co now closed Wed 1/13/16,WVDE Twitbot,73,95,2016-01-13 11:13:46,Monongalia County School District,2016-01-13
262718589864382465,All schools in #Grant Co closed Mon 10/29/12 due to inclement weather,WVDE Twitbot,0,2,2012-10-29 00:52:47,Grant County School District,2012-10-29
573286934388338688,All schools in #Webster Co closed Thu 3/5/15 due to Weather Conditions,WVDE Twitbot,8,9,2015-03-05 01:00:30,Webster County School District,2015-03-05
438617481046147072,All schools in #Upshur Co closed Wed 2/26/14,WVDE Twitbot,4,16,2014-02-26 10:12:11,Upshur County School District,2014-02-26
309254389556715520,UPDATE: All schools in #Pocahontas Co now closed Wed 3/6/13,WVDE Twitbot,0,3,2013-03-06 10:49:26,Pocahontas County School District,2013-03-06
427979203112222720,All schools in #Wayne Co closed Tue 1/28/14 due to Inclement Weather,WVDE Twitbot,12,25,2014-01-28 01:39:28,Wayne County School District,2014-01-28
961171901086425088,All schools in #Jefferson Co closed Wed 2/7/18 due to Snow,WVDE Twitbot,14,5,2018-02-07 09:36:53,Jefferson County School District,2018-02-07
263779312841404416,1/2 All schools in #Webster Co closed Thu 11/1/12 due to Weather Conditions,WVDE Twitbot,0,0,2012-10-31 23:07:43,Webster County School District,2012-11-01
559670425312313346,UPDATE: All schools in #Ohio Co now closed Mon 1/26/15,WVDE Twitbot,19,42,2015-01-26 11:13:22,Ohio County School District,2015-01-26
697379067482542080,UPDATE: All schools in #Calhoun Co now closed Wed 2/10/16 due to Weather Conditions code blue,WVDE Twitbot,8,4,2016-02-10 11:18:21,Calhoun County School District,2016-02-10
561134295851757568,UPDATE: All schools in #Doddridge Co now closed Fri 1/30/15 due to snow and slick road conditions,WVDE Twitbot,6,9,2015-01-30 12:10:16,Doddridge County School District,2015-01-30
690307168784900096,All schools in #Putnam Co closed Fri 1/22/16 due to Weather conditions,WVDE Twitbot,194,368,2016-01-21 22:57:08,Putnam County School District,2016-01-22
157800183072174080,1/2 UPDATE: All schools in #Tyler Co now closed Fri 1/13/12,WVDE Twitbot,0,0,2012-01-13 12:24:30,Tyler County School District,2012-01-13
297286501581066240,All schools in #Wayne Co closed Fri 2/1/13 due to Inclement Weather,WVDE Twitbot,1,9,2013-02-01 10:13:19,Wayne County School District,2013-02-01
425796106081931264,UPDATE: All schools in #Putnam Co now closed Wed 1/22/14 due to Weather conditions,WVDE Twitbot,40,112,2014-01-22 01:04:37,Putnam County School District,2014-01-22
433906349198417920,All schools in #Marion Co closed Thu 2/13/14 due to Inclement Weather,WVDE Twitbot,12,38,2014-02-13 10:11:49,Marion County School District,2014-02-13
298396546137997312,UPDATE: All schools in #Greenbrier Co now closed Mon 2/4/13 due to weather conditions,WVDE Twitbot,2,6,2013-02-04 11:44:15,Greenbrier County School District,2013-02-04
297282018046255104,All schools in #Marion Co closed Fri 2/1/13 due to INCLEMENT WEATHER,WVDE Twitbot,1,15,2013-02-01 09:55:30,Marion County School District,2013-02-01
553027365098749952,UPDATE: All schools in #Wayne Co now closed Thu 1/8/15 due to Inclement Weather,WVDE Twitbot,15,52,2015-01-08 03:16:13,Wayne County School District,2015-01-08
421467432297836544,All schools in #Jackson Co closed Fri 1/10/14 code A,WVDE Twitbot,11,22,2014-01-10 02:24:01,Jackson County School District,2014-01-10
950332052431306753,UPDATE: All schools in #Brooke Co now closed Mon 1/8/18 due to weather,WVDE Twitbot,7,3,2018-01-08 11:43:12,Brooke County School District,2018-01-08
154158386974437376,UPDATE: All schools in #Preston Co now closed Tue 1/3/12 due to Weather,WVDE Twitbot,0,2,2012-01-03 11:13:18,Preston County School District,2012-01-03
428320115726098432,All schools in #Wetzel Co closed Wed 1/29/14,WVDE Twitbot,17,33,2014-01-29 00:14:08,Wetzel County School District,2014-01-29
420668256827887616,All schools in #Nicholas Co closed Wed 1/8/14,WVDE Twitbot,15,33,2014-01-07 21:28:22,Nicholas County School District,2014-01-08
552407443716968449,UPDATE: All schools in #Wirt Co now closed Tue 1/6/15,WVDE Twitbot,4,12,2015-01-06 10:12:52,Wirt County School District,2015-01-06
430293619950362624,All schools in #Marshall Co closed Mon 2/3/14,WVDE Twitbot,2,17,2014-02-03 10:56:08,Marshall County School District,2014-02-03
309252401133674496,UPDATE: All schools in #Nicholas Co now closed Wed 3/6/13 due to Bad Weather,WVDE Twitbot,1,13,2013-03-06 10:41:32,Nicholas County School District,2013-03-06
568578120435040256,All schools in #Jefferson Co closed Fri 2/20/15 due to severe weather,WVDE Twitbot,50,78,2015-02-20 01:09:22,Jefferson County School District,2015-02-20
435201075793387520,UPDATE: All schools in #Upshur Co now closed Mon 2/17/14,WVDE Twitbot,18,33,2014-02-16 23:56:36,Upshur County School District,2014-02-17
297274475571998720,All schools in #Nicholas Co closed Fri 2/1/13 due to Bad Weather!,WVDE Twitbot,4,10,2013-02-01 09:25:32,Nicholas County School District,2013-02-01
426467943614910464,All schools in #Randolph Co closed Fri 1/24/14,WVDE Twitbot,12,30,2014-01-23 21:34:15,Randolph County School District,2014-01-24
430274110904893440,All schools in #Taylor Co closed Mon 2/3/14,WVDE Twitbot,7,10,2014-02-03 09:38:36,Taylor County School District,2014-02-03
560008611519557632,1/2 All schools in #Berkeley Co closed Tue 1/27/15 due to weather,WVDE Twitbot,30,70,2015-01-27 09:37:12,Berkeley County School District,2015-01-27
953234914916339712,UPDATE: All schools in #Ritchie Co now closed Tue 1/16/18,WVDE Twitbot,13,7,2018-01-16 11:58:08,Ritchie County School District,2018-01-16
690530536243204097,UPDATE: All schools in #Mingo Co now closed Fri 1/22/16 due to inclement weather code blue,WVDE Twitbot,18,2,2016-01-22 13:44:43,Mingo County School District,2016-01-22
953751908166053888,All schools in #Mason Co closed Thu 1/18/18 due to Inclement Weather code red,WVDE Twitbot,15,6,2018-01-17 22:12:29,Mason County School District,2018-01-18
569631058725117952,All schools in #Monroe Co closed Mon 2/23/15,WVDE Twitbot,14,16,2015-02-22 22:53:22,Monroe County School District,2015-02-23
430996547799502848,All schools in #Pocahontas Co closed Wed 2/5/14,WVDE Twitbot,2,7,2014-02-05 09:29:19,Pocahontas County School District,2014-02-05
436121368254353409,UPDATE: All schools in #Pocahontas Co now closed Wed 2/19/14,WVDE Twitbot,3,9,2014-02-19 12:53:31,Pocahontas County School District,2014-02-19
567623998650195968,All schools in #Mineral Co closed Tue 2/17/15 due to inclement weather,WVDE Twitbot,11,25,2015-02-17 09:58:01,Mineral County School District,2015-02-17
691377507120054272,All schools in #Tucker Co closed Mon 1/25/16,WVDE Twitbot,14,22,2016-01-24 21:50:17,Tucker County School District,2016-01-25
568509521699561472,All schools in #Mercer Co closed Fri 2/20/15 due to inclement weather,WVDE Twitbot,11,11,2015-02-19 20:36:47,Mercer County School District,2015-02-20
63564363121963008,UPDATE: All schools in #Pendleton Co now closed Thu 4/28/11 due to High Water,WVDE Twitbot,0,0,2011-04-28 11:24:59,Pendleton County School District,2011-04-28
410383345798103040,UPDATE: All schools in #Mineral Co now closed Tue 12/10/13 due to weather,WVDE Twitbot,11,15,2013-12-10 12:19:48,Mineral County School District,2013-12-10
434080295805935617,All schools in #Mingo Co closed Fri 2/14/14 code H,WVDE Twitbot,8,24,2014-02-13 21:43:02,Mingo County School District,2014-02-14
420291386370715650,All schools in #Taylor Co closed Tue 1/7/14,WVDE Twitbot,2,14,2014-01-06 20:30:49,Taylor County School District,2014-01-07
309242800828973056,All schools in #Tucker Co closed Wed 3/6/13,WVDE Twitbot,3,2,2013-03-06 10:03:23,Tucker County School District,2013-03-06
297282633665241088,All schools in #Calhoun Co closed Fri 2/1/13 due to Snow and road conditions,WVDE Twitbot,0,0,2013-02-01 09:57:57,Calhoun County School District,2013-02-01
568171712367476737,All schools in #McDowell Co closed Thu 2/19/15,WVDE Twitbot,7,5,2015-02-18 22:14:27,McDowell County School District,2015-02-19
573317004247076865,All schools in #Wyoming Co closed Thu 3/5/15 due to high water,WVDE Twitbot,17,13,2015-03-05 03:00:00,Wyoming County School District,2015-03-05
440300457068474368,All schools in #Webster Co closed Mon 3/3/14 due to Weather Conditions,WVDE Twitbot,13,25,2014-03-03 01:39:44,Webster County School District,2014-03-03
697735370969108480,UPDATE: All schools in #Randolph Co now closed Thu 2/11/16,WVDE Twitbot,17,18,2016-02-11 10:54:10,Randolph County School District,2016-02-11
440649160044576768,All schools in #Marion Co closed Tue 3/4/14 due to Inclement Weather,WVDE Twitbot,10,36,2014-03-04 00:45:21,Marion County School District,2014-03-04
953581486325854209,UPDATE: All schools in #Morgan Co now closed Wed 1/17/18 code H,WVDE Twitbot,14,9,2018-01-17 10:55:17,Morgan County School District,2018-01-17
425935219552563200,UPDATE: All schools in #Mason Co now closed Wed 1/22/14 due to Inclement Weather,WVDE Twitbot,5,11,2014-01-22 10:17:24,Mason County School District,2014-01-22
569664057130815489,All schools in #Pleasants Co closed Mon 2/23/15,WVDE Twitbot,29,24,2015-02-23 01:04:29,Pleasants County School District,2015-02-23
427936760417370112,All schools in #Jackson Co closed Tue 1/28/14 code B,WVDE Twitbot,15,39,2014-01-27 22:50:49,Jackson County School District,2014-01-28
294760849896243200,UPDATE: All schools in #Clay Co now closed Fri 1/25/13 due to Weather,WVDE Twitbot,6,8,2013-01-25 10:57:17,Clay County School District,2013-01-25
298611783646732288,UPDATE: All schools in #Tucker Co now closed Tue 2/5/13,WVDE Twitbot,5,7,2013-02-05 01:59:31,Tucker County School District,2013-02-05
697748373097603072,UPDATE: All schools in #Mercer Co now closed Thu 2/11/16 due to inclement weather conditions,WVDE Twitbot,19,12,2016-02-11 11:45:50,Mercer County School District,2016-02-11
569961815892996096,All schools in #Mercer Co closed Tue 2/24/15 due to inclement weather,WVDE Twitbot,17,18,2015-02-23 20:47:40,Mercer County School District,2015-02-24
567401017143463936,All schools in #Putnam Co closed Tue 2/17/15 due to Weather conditions,WVDE Twitbot,67,85,2015-02-16 19:11:58,Putnam County School District,2015-02-17
298612678765711360,All schools in #Lewis Co closed Tue 2/5/13,WVDE Twitbot,6,19,2013-02-05 02:03:05,Lewis County School District,2013-02-05
953407697269002240,All schools in #Barbour Co closed Wed 1/17/18 Snow Pack Day #4. Staff available to help beginning at 10 a.m. by phone or internet.,WVDE Twitbot,7,9,2018-01-16 23:24:43,Barbour County School District,2018-01-17
294748995627143169,All schools in #Fayette Co closed Fri 1/25/13,WVDE Twitbot,8,23,2013-01-25 10:10:11,Fayette County School District,2013-01-25
950723525052166144,UPDATE: All schools in #Monroe Co now closed Tue 1/9/18,WVDE Twitbot,7,5,2018-01-09 13:38:46,Monroe County School District,2018-01-09
440664167783993344,All schools in #Summers Co closed Tue 3/4/14,WVDE Twitbot,5,9,2014-03-04 01:44:59,Summers County School District,2014-03-04
427926923390357504,"All schools in #Tyler Co closed Tue 1/28/14 Employees, Code B.",WVDE Twitbot,7,7,2014-01-27 22:11:43,Tyler County School District,2014-01-28
689241121885650944,All schools in #Summers Co closed Tue 1/19/16,WVDE Twitbot,13,17,2016-01-19 00:21:03,Summers County School District,2016-01-19
420708512671338496,All schools in #Pocahontas Co closed Wed 1/8/14,WVDE Twitbot,4,6,2014-01-08 00:08:20,Pocahontas County School District,2014-01-08
949083347929714693,UPDATE: All schools in #Calhoun Co now closed Fri 1/5/18,WVDE Twitbot,3,2,2018-01-05 01:01:17,Calhoun County School District,2018-01-05
697359893108547584,All schools in #Monongalia Co closed Wed 2/10/16,WVDE Twitbot,44,53,2016-02-10 10:02:09,Monongalia County School District,2016-02-10
696997061082873857,All schools in #Monroe Co closed Tue 2/9/16,WVDE Twitbot,8,4,2016-02-09 10:00:23,Monroe County School District,2016-02-09
568535123475492864,All schools in #Lincoln Co closed Fri 2/20/15,WVDE Twitbot,10,12,2015-02-19 22:18:30,Lincoln County School District,2015-02-20
691380172554178561,All schools in #Doddridge Co closed Mon 1/25/16 due to Inclement Weather,WVDE Twitbot,14,11,2016-01-24 22:00:53,Doddridge County School District,2016-01-25
425569427434663936,All schools in #Wetzel Co closed Tue 1/21/14,WVDE Twitbot,12,28,2014-01-21 10:03:52,Wetzel County School District,2014-01-21
573299463692943361,All schools in #Fayette Co closed Thu 3/5/15 due to inclement weather,WVDE Twitbot,31,76,2015-03-05 01:50:18,Fayette County School District,2015-03-05
959241673808187392,All schools in #McDowell Co closed Fri 2/2/18,WVDE Twitbot,16,2,2018-02-02 01:46:51,McDowell County School District,2018-02-02
263397247935463424,All schools in #Boone Co closed Wed 10/31/12 due to inclement weather and widespread power outages  #WVSandy,WVDE Twitbot,1,16,2012-10-30 21:49:32,Boone County School District,2012-10-31
950141477602168832,All schools in #Mason Co closed Mon 1/8/18 due to Inclement Weather code red,WVDE Twitbot,31,13,2018-01-07 23:05:55,Mason County School District,2018-01-08
953232016736243712,UPDATE: All schools in #Marion Co now closed Tue 1/16/18 due to Inclement Weather,WVDE Twitbot,37,20,2018-01-16 11:46:37,Marion County School District,2018-01-16
425832216988381184,UPDATE: All schools in #Ohio Co now closed Wed 1/22/14,WVDE Twitbot,16,33,2014-01-22 03:28:06,Ohio County School District,2014-01-22
553000493384224771,All schools in #McDowell Co closed Thu 1/8/15,WVDE Twitbot,3,4,2015-01-08 01:29:26,McDowell County School District,2015-01-08
298388924110344192,UPDATE: All schools in #Clay Co now closed Mon 2/4/13 due to Weather conditions,WVDE Twitbot,2,12,2013-02-04 11:13:57,Clay County School District,2013-02-04
425771131363016704,All schools in #Wetzel Co closed Wed 1/22/14,WVDE Twitbot,21,54,2014-01-21 23:25:22,Wetzel County School District,2014-01-22
573588771196772353,All schools in #Fayette Co closed Fri 3/6/15 due to inclement weather,WVDE Twitbot,31,52,2015-03-05 20:59:54,Fayette County School District,2015-03-06
425566017516208129,All schools in #Greenbrier Co closed Tue 1/21/14 due to Winter Storm Warning and heavy snowfall forecast,WVDE Twitbot,10,18,2014-01-21 09:50:19,Greenbrier County School District,2014-01-21
295848597059170304,UPDATE: All schools in #Pocahontas Co now closed Mon 1/28/13 due to Ice,WVDE Twitbot,1,5,2013-01-28 10:59:36,Pocahontas County School District,2013-01-28
949050624477450240,All schools in #Pocahontas Co closed Fri 1/5/18 due to Inclement weather,WVDE Twitbot,7,4,2018-01-04 22:51:16,Pocahontas County School District,2018-01-05
419060190042791936,UPDATE: All schools in #Hampshire Co now closed Fri 1/3/14,WVDE Twitbot,4,10,2014-01-03 10:58:29,Hampshire County School District,2014-01-03
298786496708739073,All schools in #Marion Co closed Tue 2/5/13 due to INCLEMENT WEATHER,WVDE Twitbot,1,8,2013-02-05 13:33:46,Marion County School District,2013-02-05
427773262316068864,1/2 UPDATE: All schools in #Preston Co now closed Mon 1/27/14,WVDE Twitbot,3,7,2014-01-27 12:01:08,Preston County School District,2014-01-27
410366578031460352,UPDATE: All schools in #Jefferson Co now closed Tue 12/10/13 due to Snow,WVDE Twitbot,5,12,2013-12-10 11:13:11,Jefferson County School District,2013-12-10
699028457641091072,All schools in #Boone Co closed Mon 2/15/16,WVDE Twitbot,30,15,2016-02-15 00:32:26,Boone County School District,2016-02-15
427974687478403072,All schools in #Monroe Co closed Tue 1/28/14,WVDE Twitbot,10,24,2014-01-28 01:21:31,Monroe County School District,2014-01-28
431031427841261568,UPDATE: All schools in #Wetzel Co now closed Wed 2/5/14,WVDE Twitbot,14,21,2014-02-05 11:47:55,Wetzel County School District,2014-02-05
961179485990088710,All schools in #WVSDB closed Wed 2/7/18 due to icy conditions,WVDE Twitbot,4,4,2018-02-07 10:07:01,,2018-02-07
440990226215751680,All schools in #Raleigh Co closed Wed 3/5/14 due to the condition of secondary roads code A Employees must report.,WVDE Twitbot,12,46,2014-03-04 23:20:37,Raleigh County School District,2014-03-05
568168305875398657,All schools in #Mason Co closed Thu 2/19/15 due to Inclement Weather code red,WVDE Twitbot,31,44,2015-02-18 22:00:54,Mason County School District,2015-02-19
263235764287066112,UPDATE: All schools in #Cabell Co now closed Tue 10/30/12 due to some slick roads and power outages code red  #WVSandy,WVDE Twitbot,12,19,2012-10-30 11:07:51,Cabell County School District,2012-10-30
438641703272984576,1/2 UPDATE: All schools in #Fayette Co now closed Wed 2/26/14 due to inclement weather code A,WVDE Twitbot,10,24,2014-02-26 11:48:26,Fayette County School District,2014-02-26
905046491731034112,UPDATE: All schools in #Wirt Co now closed Tue 9/5/17,WVDE Twitbot,3,4,2017-09-05 12:34:33,Wirt County School District,2017-09-05
426308934102568960,UPDATE: All schools in #Jackson Co now closed Thu 1/23/14 code A,WVDE Twitbot,11,25,2014-01-23 11:02:24,Jackson County School District,2014-01-23
552972669197778944,All schools in #Gilmer Co closed Thu 1/8/15,WVDE Twitbot,13,19,2015-01-07 23:38:52,Gilmer County School District,2015-01-08
568140525141929984,All schools in #Tucker Co closed Thu 2/19/15 The Central Office will also be closed.,WVDE Twitbot,14,13,2015-02-18 20:10:31,Tucker County School District,2015-02-19
950530853188325381,All schools in #Wetzel Co closed Tue 1/9/18 due to Secondary road conditions,WVDE Twitbot,25,22,2018-01-09 00:53:10,Wetzel County School District,2018-01-09
419052988884217856,UPDATE: All schools in #Logan Co now closed Fri 1/3/14,WVDE Twitbot,4,15,2014-01-03 10:29:52,Logan County School District,2014-01-03
427571379077017600,All schools in #Wetzel Co closed Mon 1/27/14,WVDE Twitbot,22,48,2014-01-26 22:38:55,Wetzel County School District,2014-01-27
568123941207875584,UPDATE: All schools in #Logan Co now closed Wed 2/18/15,WVDE Twitbot,9,14,2015-02-18 19:04:37,Logan County School District,2015-02-18
691653608014749696,All schools in #Berkeley Co closed Tue 1/26/16 All evening activities for 1/26 are canceled as well.,WVDE Twitbot,78,118,2016-01-25 16:07:25,Berkeley County School District,2016-01-26
425573254028206080,All schools in #Lincoln Co closed Tue 1/21/14,WVDE Twitbot,16,50,2014-01-21 10:19:05,Lincoln County School District,2014-01-21
959360288729559040,All schools in #Mercer Co closed Fri 2/2/18 due to inclement weather conditions,WVDE Twitbot,7,7,2018-02-02 09:38:11,Mercer County School District,2018-02-02
950328348617605120,UPDATE: All schools in #Boone Co now closed Mon 1/8/18 due to continued forecast for sleet and freezing rain,WVDE Twitbot,9,3,2018-01-08 11:28:29,Boone County School District,2018-01-08
569651421454450688,All schools in #Boone Co closed Mon 2/23/15 Principals and assistant principals report on a two hour delay.,WVDE Twitbot,23,24,2015-02-23 00:14:17,Boone County School District,2015-02-23
294384482331529216,All schools in #Braxton Co closed Thu 1/24/13 due to inclement weather,WVDE Twitbot,5,6,2013-01-24 10:01:44,Braxton County School District,2013-01-24
263757468662898688,All schools in #Boone Co closed Thu 11/1/12 due to the continued widespread power outages  #WVSandy,WVDE Twitbot,2,25,2012-10-31 21:40:55,Boone County School District,2012-11-01
438654133835284480,UPDATE: All schools in #Greenbrier Co now closed Wed 2/26/14,WVDE Twitbot,14,30,2014-02-26 12:37:49,Greenbrier County School District,2014-02-26
568506817992642561,All schools in #Clay Co closed Fri 2/20/15 due to weather conditions,WVDE Twitbot,17,26,2015-02-19 20:26:02,Clay County School District,2015-02-20
950317664005771265,All schools in #WVSDB closed Mon 1/8/18 due to impending inclement weather,WVDE Twitbot,5,0,2018-01-08 10:46:01,,2018-01-08
298393941655560192,UPDATE: All schools in #Wetzel Co now closed Mon 2/4/13,WVDE Twitbot,3,9,2013-02-04 11:33:54,Wetzel County School District,2013-02-04
427971322115653632,All schools in #Summers Co closed Tue 1/28/14,WVDE Twitbot,2,8,2014-01-28 01:08:09,Summers County School District,2014-01-28
696994161015263232,All schools in #Marion Co closed Tue 2/9/16 due to Inclement Weather,WVDE Twitbot,33,64,2016-02-09 09:48:52,Marion County School District,2016-02-09
552926528867418112,All schools in #Nicholas Co closed Thu 1/8/15,WVDE Twitbot,18,29,2015-01-07 20:35:32,Nicholas County School District,2015-01-08
960483477262127109,UPDATE: All schools in #Tyler Co now closed Mon 2/5/18,WVDE Twitbot,10,8,2018-02-05 12:01:20,Tyler County School District,2018-02-05
689980231814402048,All schools in #Raleigh Co closed Thu 1/21/16 due to weather conditions,WVDE Twitbot,61,123,2016-01-21 01:18:01,Raleigh County School District,2016-01-21
426523794237169665,All schools in #Morgan Co closed Fri 1/24/14 code A,WVDE Twitbot,9,22,2014-01-24 01:16:11,Morgan County School District,2014-01-24
309240613319106560,All schools in #Randolph Co closed Wed 3/6/13,WVDE Twitbot,4,19,2013-03-06 09:54:42,Randolph County School District,2013-03-06
426326434043269120,UPDATE: All schools in #Pendleton Co now closed Thu 1/23/14,WVDE Twitbot,5,9,2014-01-23 12:11:57,Pendleton County School District,2014-01-23
309262867474038784,UPDATE: All schools in #Ritchie Co now closed Wed 3/6/13,WVDE Twitbot,2,8,2013-03-06 11:23:08,Ritchie County School District,2013-03-06
176637565175209985,UPDATE: All schools in #Summers Co now closed Mon 3/5/12,WVDE Twitbot,0,1,2012-03-05 11:57:31,Summers County School District,2012-03-05
176633070043152384,UPDATE: All schools in #Fayette Co now closed Mon 3/5/12,WVDE Twitbot,1,15,2012-03-05 11:39:40,Fayette County School District,2012-03-05
953408036093210624,All schools in #Upshur Co closed Wed 1/17/18,WVDE Twitbot,15,3,2018-01-16 23:26:03,Upshur County School District,2018-01-17
691677591242182658,All schools in #Jefferson Co closed Tue 1/26/16 due to road conditions,WVDE Twitbot,72,78,2016-01-25 17:42:43,Jefferson County School District,2016-01-26
409851442803904512,All schools in #Mineral Co closed Mon 12/9/13 due to weather conditions code A,WVDE Twitbot,10,26,2013-12-09 01:06:13,Mineral County School District,2013-12-09
298598591621128192,All schools in #Ohio Co closed Tue 2/5/13,WVDE Twitbot,4,23,2013-02-05 01:07:06,Ohio County School District,2013-02-05
573599127529000960,All schools in #Jefferson Co closed Fri 3/6/15 due to weather County office opening at 10:00 am,WVDE Twitbot,43,60,2015-03-05 21:41:03,Jefferson County School District,2015-03-06
154136745921875968,UPDATE: All schools in #Nicholas Co now closed Tue 1/3/12 due to Bad Weather!,WVDE Twitbot,0,0,2012-01-03 09:47:18,Nicholas County School District,2012-01-03
691705612137304065,All schools in #Wayne Co closed Tue 1/26/16 due to Inclement Weather,WVDE Twitbot,33,36,2016-01-25 19:34:03,Wayne County School District,2016-01-26
316161151958392832,UPDATE: All schools in #Marshall Co now closed Mon 3/25/13,WVDE Twitbot,1,1,2013-03-25 12:14:27,Marshall County School District,2013-03-25
567440634391580673,All schools in #Wayne Co closed Tue 2/17/15 due to Inclement Weather,WVDE Twitbot,20,24,2015-02-16 21:49:24,Wayne County School District,2015-02-17
697001944846635008,All schools in #Wetzel Co closed Tue 2/9/16 due to Road Conditions,WVDE Twitbot,16,25,2016-02-09 10:19:47,Wetzel County School District,2016-02-09
422822598343270400,UPDATE: All schools in #Boone Co now closed Tue 1/14/14 due to the continued do not use water order,WVDE Twitbot,9,25,2014-01-13 20:08:57,Boone County School District,2014-01-14
438658133935017984,UPDATE: All schools in #Raleigh Co now closed Wed 2/26/14 due to weather conditions code A Employees must report.,WVDE Twitbot,3,11,2014-02-26 12:53:43,Raleigh County School District,2014-02-26
697377937344094208,UPDATE: All schools in #Jackson Co now closed Wed 2/10/16,WVDE Twitbot,19,28,2016-02-10 11:13:51,Jackson County School District,2016-02-10
433772093251928064,All schools in #Nicholas Co closed Thu 2/13/14,WVDE Twitbot,11,33,2014-02-13 01:18:20,Nicholas County School District,2014-02-13
691380395737223168,All schools in #Ritchie Co closed Mon 1/25/16,WVDE Twitbot,16,18,2016-01-24 22:01:46,Ritchie County School District,2016-01-25
430312867280060416,UPDATE: All schools in #Putnam Co now closed Mon 2/3/14 due to Weather Conditions,WVDE Twitbot,32,104,2014-02-03 12:12:37,Putnam County School District,2014-02-03
440305721217798146,All schools in #Barbour Co closed Mon 3/3/14,WVDE Twitbot,13,19,2014-03-03 02:00:39,Barbour County School District,2014-03-03
573604619085021184,All schools in #Raleigh Co closed Fri 3/6/15,WVDE Twitbot,36,82,2015-03-05 22:02:52,Raleigh County School District,2015-03-06
948873384401752064,UPDATE: All schools in #Gilmer Co now closed Thu 1/4/18,WVDE Twitbot,0,2,2018-01-04 11:06:58,Gilmer County School District,2018-01-04
292090334823997440,All schools in #Summers Co closed Fri 1/18/13,WVDE Twitbot,1,7,2013-01-18 02:05:37,Summers County School District,2013-01-18
420681650146906112,All schools in #Wirt Co closed Wed 1/8/14 due to Frigid Temperatures,WVDE Twitbot,9,26,2014-01-07 22:21:35,Wirt County School District,2014-01-08
160292889560219648,UPDATE: All schools in #Monongalia Co now closed Fri 1/20/12 due to Inclement weather,WVDE Twitbot,3,10,2012-01-20 09:29:37,Monongalia County School District,2012-01-20
573592269460217858,"All schools in #Wood Co closed Fri 3/6/15 code C Only designated, essential employees report for work.",WVDE Twitbot,85,153,2015-03-05 21:13:48,Wood County School District,2015-03-06
841951528235732994,UPDATE: All schools in #Webster Co now closed Wed 3/15/17 due to Weather and road conditions,WVDE Twitbot,6,7,2017-03-15 09:57:41,Webster County School District,2017-03-15
697241477676724224,All schools in #Kanawha Co closed Wed 2/10/16 due to Inclement Weather code B,WVDE Twitbot,216,460,2016-02-10 02:11:37,Kanawha County School District,2016-02-10
444053553179402241,UPDATE: All schools in #Fayette Co now closed Thu 3/13/14 due to inclement weather code A,WVDE Twitbot,9,18,2014-03-13 10:13:11,Fayette County School District,2014-03-13
953082474665476096,All schools in #Brooke Co closed Tue 1/16/18 due to weather,WVDE Twitbot,14,4,2018-01-16 01:52:24,Brooke County School District,2018-01-16
433894557529292800,All schools in #Braxton Co closed Thu 2/13/14 Staff is NOT to report.,WVDE Twitbot,5,9,2014-02-13 09:24:58,Braxton County School District,2014-02-13
953770348138434560,All schools in #Fayette Co closed Thu 1/18/18 due to inclement weather and road conditions,WVDE Twitbot,34,34,2018-01-17 23:25:45,Fayette County School District,2018-01-18
554614033652125696,UPDATE: All schools in #Hardy Co now closed Mon 1/12/15,WVDE Twitbot,9,17,2015-01-12 12:21:04,Hardy County School District,2015-01-12
953569182850920448,All schools in #Mineral Co closed Wed 1/17/18 due to icy conditions,WVDE Twitbot,14,8,2018-01-17 10:06:24,Mineral County School District,2018-01-17
567093042935767040,All schools in #Cabell Co closed Mon 2/16/15 due to inclement weather code red,WVDE Twitbot,55,57,2015-02-15 22:48:12,Cabell County School District,2015-02-16
567417983434489856,All schools in #Logan Co closed Tue 2/17/15,WVDE Twitbot,24,24,2015-02-16 20:19:24,Logan County School District,2015-02-17
425731529952608256,All schools in #Morgan Co closed Wed 1/22/14 code A,WVDE Twitbot,10,29,2014-01-21 20:48:01,Morgan County School District,2014-01-22
419995764581228544,All schools in #Pleasants Co closed Mon 1/6/14,WVDE Twitbot,16,24,2014-01-06 00:56:08,Pleasants County School District,2014-01-06
297289580212801536,All schools in #Wyoming Co closed Fri 2/1/13 due to inclement weather,WVDE Twitbot,5,7,2013-02-01 10:25:33,Wyoming County School District,2013-02-01
297313923395366912,UPDATE: All schools in #Ohio Co now closed Fri 2/1/13,WVDE Twitbot,1,7,2013-02-01 12:02:17,Ohio County School District,2013-02-01
552956876770787329,All schools in #Preston Co closed Thu 1/8/15 due to winter weather conditions,WVDE Twitbot,22,16,2015-01-07 22:36:07,Preston County School District,2015-01-08
573084552308121601,UPDATE: All schools in #Mingo Co now closed Wed 3/4/15 Code Blue.,WVDE Twitbot,11,16,2015-03-04 11:36:19,Mingo County School District,2015-03-04
264080989628817408,All schools in #Clay Co closed Fri 11/2/12 due to Power Outage code A,WVDE Twitbot,0,4,2012-11-01 19:06:28,Clay County School District,2012-11-02
431400433144172544,UPDATE: All schools in #Ritchie Co now closed Thu 2/6/14,WVDE Twitbot,12,11,2014-02-06 12:14:12,Ritchie County School District,2014-02-06
826037437961007105,UPDATE: All schools in #Jackson Co now closed Mon 1/30/17 code A,WVDE Twitbot,23,21,2017-01-30 12:00:46,Jackson County School District,2017-01-30
567290235164585984,UPDATE: All schools in #Hardy Co now closed Mon 2/16/15,WVDE Twitbot,10,23,2015-02-16 11:51:46,Hardy County School District,2015-02-16
940912534642724864,UPDATE: All schools in #Pendleton Co now closed Wed 12/13/17 due to Icy road conditions,WVDE Twitbot,11,2,2017-12-13 11:53:24,Pendleton County School District,2017-12-13
427905279791861760,All schools in #Tucker Co closed Tue 1/28/14,WVDE Twitbot,8,7,2014-01-27 20:45:43,Tucker County School District,2014-01-28
434116661436637184,All schools in #Monongalia Co closed Fri 2/14/14 All staff is to report on a 2hr delay.,WVDE Twitbot,33,73,2014-02-14 00:07:32,Monongalia County School District,2014-02-14
949054163488591873,All schools in #Grant Co closed Fri 1/5/18 due to extreme cold temperatures,WVDE Twitbot,14,9,2018-01-04 23:05:19,Grant County School District,2018-01-05
425768309594664960,All schools in #Wirt Co closed Wed 1/22/14,WVDE Twitbot,8,19,2014-01-21 23:14:10,Wirt County School District,2014-01-22
157789757794025472,UPDATE: All schools in #Summers Co now closed Fri 1/13/12,WVDE Twitbot,0,1,2012-01-13 11:43:04,Summers County School District,2012-01-13
826034132341882880,1/2 UPDATE: All schools in #Preston Co now closed Mon 1/30/17 due to winter weather conditions,WVDE Twitbot,5,3,2017-01-30 11:47:38,Preston County School District,2017-01-30
568022014721699840,UPDATE: All schools in #Taylor Co now closed Wed 2/18/15,WVDE Twitbot,12,13,2015-02-18 12:19:36,Taylor County School District,2015-02-18
296963808986034177,UPDATE: All schools in #Tucker Co now closed Thu 1/31/13,WVDE Twitbot,0,4,2013-01-31 12:51:04,Tucker County School District,2013-01-31
552613006002356224,All schools in #Randolph Co closed Wed 1/7/15,WVDE Twitbot,26,43,2015-01-06 23:49:42,Randolph County School District,2015-01-07
568168625921765377,1/2 All schools in #Preston Co closed Thu 2/19/15 due to frigid temperatures,WVDE Twitbot,10,8,2015-02-18 22:02:11,Preston County School District,2015-02-19
727681569461288960,All schools in #Clay Co closed Wed 5/4/16 due to A school threat Schools will be closed May 5 and 6 also.,WVDE Twitbot,36,35,2016-05-04 02:09:40,Clay County School District,2016-05-04
841944454261026816,UPDATE: All schools in #Nicholas Co now closed Wed 3/15/17,WVDE Twitbot,24,16,2017-03-15 09:29:35,Nicholas County School District,2017-03-15
304923407898779648,UPDATE: All schools in #Wood Co now closed Fri 2/22/13 due to inclement weather code A STATUS UPDATE.,WVDE Twitbot,11,63,2013-02-22 11:59:40,Wood County School District,2013-02-22
948699018057736196,All schools in #Mercer Co closed Thu 1/4/18 due to inclement weather conditions,WVDE Twitbot,11,15,2018-01-03 23:34:06,Mercer County School District,2018-01-04
841599438212685824,UPDATE: All schools in #Pendleton Co now closed Tue 3/14/17 due to Snow,WVDE Twitbot,9,4,2017-03-14 10:38:36,Pendleton County School District,2017-03-14
561096535749189632,All schools in #Tucker Co closed Fri 1/30/15,WVDE Twitbot,4,7,2015-01-30 09:40:13,Tucker County School District,2015-01-30
691382202119102464,All schools in #Wirt Co closed Mon 1/25/16 due to Inclement weather and road conditions,WVDE Twitbot,20,19,2016-01-24 22:08:56,Wirt County School District,2016-01-25
958329108475318279,UPDATE: All schools in #Monroe Co now closed Tue 1/30/18 due to inclement weather. Reimagined Day 1 is used,WVDE Twitbot,13,9,2018-01-30 13:20:39,Monroe County School District,2018-01-30
263074096408043521,All schools in #Preston Co closed Tue 10/30/12 due to Inclement weather  #WVSandy,WVDE Twitbot,2,3,2012-10-30 00:25:26,Preston County School District,2012-10-30
445482376781516801,All schools in #Hampshire Co closed Mon 3/17/14 due to snow covered and slick roads,WVDE Twitbot,4,12,2014-03-17 08:50:49,Hampshire County School District,2014-03-17
297287124825280512,All schools in #Lincoln Co closed Fri 2/1/13,WVDE Twitbot,4,21,2013-02-01 10:15:48,Lincoln County School District,2013-02-01
420146622572425216,All schools in #Pocahontas Co closed Mon 1/6/14,WVDE Twitbot,2,10,2014-01-06 10:55:35,Pocahontas County School District,2014-01-06
425573246608474113,All schools in #Pleasants Co closed Tue 1/21/14,WVDE Twitbot,9,8,2014-01-21 10:19:03,Pleasants County School District,2014-01-21
566192052569116672,UPDATE: All schools in #Randolph Co now closed Fri 2/13/15,WVDE Twitbot,11,22,2015-02-13 11:07:59,Randolph County School District,2015-02-13
690249835853811713,1/2 All schools in #WVSDB closed Fri 1/22/16 due to Impending Weather,WVDE Twitbot,12,4,2016-01-21 19:09:19,,2016-01-22
445504471359954945,UPDATE: All schools in #Mason Co now closed Mon 3/17/14 due to Inclement Weather,WVDE Twitbot,16,20,2014-03-17 10:18:37,Mason County School District,2014-03-17
420687470242439168,All schools in #Greenbrier Co closed Wed 1/8/14 due to Weather conditions &amp; Temperatures,WVDE Twitbot,14,49,2014-01-07 22:44:43,Greenbrier County School District,2014-01-08
953741427502206976,All schools in #Logan Co closed Thu 1/18/18,WVDE Twitbot,41,18,2018-01-17 21:30:50,Logan County School District,2018-01-18
940555401090748416,UPDATE: All schools in #Greenbrier Co now closed Tue 12/12/17 due to Weather forecast,WVDE Twitbot,23,12,2017-12-12 12:14:16,Greenbrier County School District,2017-12-12
427603297034178560,All schools in #Doddridge Co closed Mon 1/27/14 due to lnclement weather,WVDE Twitbot,11,10,2014-01-27 00:45:45,Doddridge County School District,2014-01-27
420705165658714112,UPDATE: All schools in #Barbour Co now closed Wed 1/8/14 due to impending weather conditions,WVDE Twitbot,11,8,2014-01-07 23:55:02,Barbour County School District,2014-01-08
573283713682960384,All schools in #Upshur Co closed Thu 3/5/15,WVDE Twitbot,20,19,2015-03-05 00:47:43,Upshur County School District,2015-03-05
568142801784983553,All schools in #Randolph Co closed Thu 2/19/15,WVDE Twitbot,25,29,2015-02-18 20:19:34,Randolph County School District,2015-02-19
959236959301459968,All schools in #Logan Co closed Fri 2/2/18,WVDE Twitbot,30,0,2018-02-02 01:28:07,Logan County School District,2018-02-02
440437240422887424,1/2 UPDATE: All schools in #Preston Co now closed Mon 3/3/14,WVDE Twitbot,1,1,2014-03-03 10:43:15,Preston County School District,2014-03-03
316109792252944385,All schools in #Hampshire Co closed Mon 3/25/13,WVDE Twitbot,2,6,2013-03-25 08:50:22,Hampshire County School District,2013-03-25
420368316352319488,All schools in #Pendleton Co closed Tue 1/7/14 due to Severe weather conditions,WVDE Twitbot,9,9,2014-01-07 01:36:31,Pendleton County School District,2014-01-07
297281613354659840,All schools in #Taylor Co closed Fri 2/1/13,WVDE Twitbot,3,3,2013-02-01 09:53:54,Taylor County School District,2013-02-01
410365136877019136,UPDATE: All schools in #Hampshire Co now closed Tue 12/10/13,WVDE Twitbot,5,12,2013-12-10 11:07:27,Hampshire County School District,2013-12-10
410393132920889344,UPDATE: All schools in #Kanawha Co now closed Tue 12/10/13 due to Winter Road conditions code A,WVDE Twitbot,27,40,2013-12-10 12:58:42,Kanawha County School District,2013-12-10
262843719881981952,All schools in #McDowell Co closed Mon 10/29/12 due to incliment weather,WVDE Twitbot,1,5,2012-10-29 09:10:00,McDowell County School District,2012-10-29
570903127848824832,UPDATE: All schools in #Mingo Co now closed Thu 2/26/15 Code Orange.,WVDE Twitbot,13,17,2015-02-26 11:08:07,Mingo County School District,2015-02-26
426684434964701185,UPDATE: All schools in #Mineral Co now closed Fri 1/24/14,WVDE Twitbot,10,17,2014-01-24 11:54:31,Mineral County School District,2014-01-24
568225423257182208,All schools in #Pendleton Co closed Thu 2/19/15 due to Extreme Weather,WVDE Twitbot,8,8,2015-02-19 01:47:52,Pendleton County School District,2015-02-19
953435922871345152,All schools in #Clay Co closed Wed 1/17/18 Snow Packet Day,WVDE Twitbot,11,7,2018-01-17 01:16:52,Clay County School District,2018-01-17
689987662585970689,UPDATE: All schools in #Lincoln Co now closed Thu 1/21/16,WVDE Twitbot,28,56,2016-01-21 01:47:32,Lincoln County School District,2016-01-21
552403605089955840,All schools in #Pleasants Co closed Tue 1/6/15,WVDE Twitbot,12,12,2015-01-06 09:57:37,Pleasants County School District,2015-01-06
420767902300532736,All schools in #Wyoming Co closed Wed 1/8/14 due to inclement weather,WVDE Twitbot,2,3,2014-01-08 04:04:20,Wyoming County School District,2014-01-08
433903800471285760,All schools in #Lincoln Co closed Thu 2/13/14,WVDE Twitbot,14,31,2014-02-13 10:01:42,Lincoln County School District,2014-02-13
689400660979126272,UPDATE: All schools in #Raleigh Co now closed Tue 1/19/16 due to weather conditions,WVDE Twitbot,49,82,2016-01-19 10:55:00,Raleigh County School District,2016-01-19
440330868297441280,All schools in #Nicholas Co closed Mon 3/3/14,WVDE Twitbot,14,28,2014-03-03 03:40:34,Nicholas County School District,2014-03-03
444085122120179713,UPDATE: All schools in #Mercer Co now closed Thu 3/13/14 due to inclement weather,WVDE Twitbot,2,3,2014-03-13 12:18:38,Mercer County School District,2014-03-13
567433821122232320,All schools in #Lincoln Co closed Tue 2/17/15,WVDE Twitbot,24,33,2015-02-16 21:22:20,Lincoln County School District,2015-02-17
960479799411134464,UPDATE: All schools in #Pendleton Co now closed Mon 2/5/18,WVDE Twitbot,2,2,2018-02-05 11:46:43,Pendleton County School District,2018-02-05
425760169285255168,All schools in #Nicholas Co closed Wed 1/22/14,WVDE Twitbot,2,10,2014-01-21 22:41:49,Nicholas County School District,2014-01-22
571094317529489408,All schools in #Mercer Co closed Fri 2/27/15 due to inclement weather,WVDE Twitbot,22,32,2015-02-26 23:47:50,Mercer County School District,2015-02-27
570300748262744064,UPDATE: All schools in #Logan Co now closed Tue 2/24/15,WVDE Twitbot,8,2,2015-02-24 19:14:28,Logan County School District,2015-02-24
426126894367387648,All schools in #Wayne Co closed Thu 1/23/14 due to Inclement Weather,WVDE Twitbot,12,18,2014-01-22 22:59:03,Wayne County School District,2014-01-23
309241225775575040,All schools in #Taylor Co closed Wed 3/6/13,WVDE Twitbot,0,2,2013-03-06 09:57:08,Taylor County School District,2013-03-06
552930448717127682,All schools in #Fayette Co closed Thu 1/8/15 due to inclement weather,WVDE Twitbot,34,77,2015-01-07 20:51:06,Fayette County School District,2015-01-08
690130539777499136,UPDATE: All schools in #Marion Co now closed Thu 1/21/16 due to Inclement Weather,WVDE Twitbot,36,67,2016-01-21 11:15:17,Marion County School District,2016-01-21
950305921212796928,All schools in #Greenbrier Co closed Mon 1/8/18 due to Weather forecast,WVDE Twitbot,9,5,2018-01-08 09:59:22,Greenbrier County School District,2018-01-08
567843548550340608,All schools in #Harrison Co closed Wed 2/18/15,WVDE Twitbot,44,141,2015-02-18 00:30:26,Harrison County School District,2015-02-18
426501032311414784,All schools in #Doddridge Co closed Fri 1/24/14 due to inclement weather and frigid temperatures,WVDE Twitbot,7,5,2014-01-23 23:45:44,Doddridge County School District,2014-01-24
428345543543115776,UPDATE: All schools in #Webster Co now closed Wed 1/29/14 due to Weather Conditions,WVDE Twitbot,3,19,2014-01-29 01:55:10,Webster County School District,2014-01-29
426311546482876416,UPDATE: All schools in #Wirt Co now closed Thu 1/23/14,WVDE Twitbot,6,7,2014-01-23 11:12:47,Wirt County School District,2014-01-23
959396846945923072,UPDATE: All schools in #Pocahontas Co now closed Fri 2/2/18 due to inclement weather and snowy road conditions,WVDE Twitbot,4,2,2018-02-02 12:03:27,Pocahontas County School District,2018-02-02
430301962337136641,UPDATE: All schools in #Pendleton Co now closed Mon 2/3/14,WVDE Twitbot,4,6,2014-02-03 11:29:17,Pendleton County School District,2014-02-03
440995680619089920,1/2 All schools in #Boone Co closed Wed 3/5/14 due to the condition of some primary &amp; many secondary roads,WVDE Twitbot,16,26,2014-03-04 23:42:18,Boone County School District,2014-03-05
586122252976058368,UPDATE: All schools in #Ritchie Co now closed Thu 4/9/15,WVDE Twitbot,6,11,2015-04-09 11:03:29,Ritchie County School District,2015-04-09
440420751355551745,All schools in #McDowell Co closed Mon 3/3/14 due to inclement weather,WVDE Twitbot,3,5,2014-03-03 09:37:44,McDowell County School District,2014-03-03
699566023393955844,UPDATE: All schools in #Marshall Co now closed Tue 2/16/16,WVDE Twitbot,9,27,2016-02-16 12:08:31,Marshall County School District,2016-02-16
265931267969785856,All schools in #Preston Co closed Wed 11/7/12,WVDE Twitbot,1,1,2012-11-06 21:38:49,Preston County School District,2012-11-07
440304133795348481,All schools in #Jefferson Co closed Mon 3/3/14 due to snow,WVDE Twitbot,17,53,2014-03-03 01:54:20,Jefferson County School District,2014-03-03
691304380109320192,All schools in #Jefferson Co closed Mon 1/25/16,WVDE Twitbot,55,77,2016-01-24 16:59:42,Jefferson County School District,2016-01-25
434072352993718272,All schools in #Raleigh Co closed Fri 2/14/14 due to weather conditions code B Essential personnel report.,WVDE Twitbot,11,31,2014-02-13 21:11:28,Raleigh County School District,2014-02-14
697748064333914113,UPDATE: All schools in #Summers Co now closed Thu 2/11/16,WVDE Twitbot,8,2,2016-02-11 11:44:36,Summers County School District,2016-02-11
298734192144039936,"All schools in #Wirt Co closed Tue 2/5/13 Wirt County Schools will be closed today Tue. Feb. 5, 2013",WVDE Twitbot,2,9,2013-02-05 10:05:56,Wirt County School District,2013-02-05
426317853399056384,UPDATE: All schools in #Braxton Co now closed Thu 1/23/14,WVDE Twitbot,11,11,2014-01-23 11:37:51,Braxton County School District,2014-01-23
560018284326973440,All schools in #WVSDB closed Tue 1/27/15,WVDE Twitbot,0,0,2015-01-27 10:15:38,,2015-01-27
297288360001695744,UPDATE: All schools in #Pocahontas Co now closed Fri 2/1/13 due to snow,WVDE Twitbot,2,4,2013-02-01 10:20:43,Pocahontas County School District,2013-02-01
690327242862379008,All schools in #Mason Co closed Fri 1/22/16 due to Inclement weather code red,WVDE Twitbot,34,50,2016-01-22 00:16:55,Mason County School District,2016-01-22
953224029577662469,UPDATE: All schools in #Mason Co now closed Tue 1/16/18 due to Inclement Weather code red,WVDE Twitbot,14,5,2018-01-16 11:14:53,Mason County School District,2018-01-16
950149462466486272,All schools in #Logan Co closed Mon 1/8/18 All administrative offices of Logan County Schools will be closed 1/8/18,WVDE Twitbot,21,21,2018-01-07 23:37:39,Logan County School District,2018-01-08
423190304024309760,1/2 All schools in #Boone Co closed Wed 1/15/14 due to the water crisis,WVDE Twitbot,13,53,2014-01-14 20:30:05,Boone County School District,2014-01-15
953200910964088832,All schools in #Boone Co closed Tue 1/16/18 due to pending weather,WVDE Twitbot,13,11,2018-01-16 09:43:01,Boone County School District,2018-01-16
687249113193185288,UPDATE: All schools in #Tyler Co now closed Wed 1/13/16,WVDE Twitbot,22,18,2016-01-13 12:25:31,Tyler County School District,2016-01-13
427806448253300736,UPDATE: All schools in #Webster Co now closed Mon 1/27/14 due to Weather Conditions,WVDE Twitbot,7,8,2014-01-27 14:13:00,Webster County School District,2014-01-27
425571917026701314,All schools in #Ritchie Co closed Tue 1/21/14,WVDE Twitbot,5,11,2014-01-21 10:13:46,Ritchie County School District,2014-01-21
567451852468678656,All schools in #Braxton Co closed Tue 2/17/15,WVDE Twitbot,8,15,2015-02-16 22:33:59,Braxton County School District,2015-02-17
263061427705757696,All schools in #Hardy Co closed Tue 10/30/12  #WVSandy,WVDE Twitbot,0,1,2012-10-29 23:35:06,Hardy County School District,2012-10-30
960474720897523712,UPDATE: All schools in #Greenbrier Co now closed Mon 2/5/18 due to Weather conditions Reimagined day 2,WVDE Twitbot,5,6,2018-02-05 11:26:32,Greenbrier County School District,2018-02-05
440279914810335232,"All schools in #Tyler Co closed Mon 3/3/14 Employees, Code C.",WVDE Twitbot,17,12,2014-03-03 00:18:06,Tyler County School District,2014-03-03
949048817579642880,All schools in #Mason Co closed Fri 1/5/18 due to Inclement Weather code red Maintenance do not report,WVDE Twitbot,20,11,2018-01-04 22:44:05,Mason County School District,2018-01-05
222166277370814464,1/2 All schools in #Greenbrier Co closed Mon 7/9/12,WVDE Twitbot,0,0,2012-07-09 03:12:22,Greenbrier County School District,2012-07-09
263071117848223744,All schools in #Webster Co closed Tue 10/30/12 due to Weather Conditions  #WVSandy,WVDE Twitbot,1,6,2012-10-30 00:13:36,Webster County School District,2012-10-30
559887776104345600,All schools in #Ohio Co closed Tue 1/27/15,WVDE Twitbot,30,48,2015-01-27 01:37:02,Ohio County School District,2015-01-27
699387018166591488,All schools in #Pocahontas Co closed Tue 2/16/16,WVDE Twitbot,12,4,2016-02-16 00:17:13,Pocahontas County School District,2016-02-16
542285939864006656,UPDATE: All schools in #Hampshire Co now closed Tue 12/9/14 due to snow and freezing rain,WVDE Twitbot,16,15,2014-12-09 11:53:37,Hampshire County School District,2014-12-09
567984974806310912,UPDATE: All schools in #Wood Co now closed Wed 2/18/15 Only 261 day employees report for work.,WVDE Twitbot,74,143,2015-02-18 09:52:25,Wood County School District,2015-02-18
561129481193394176,UPDATE: All schools in #Hancock Co now closed Fri 1/30/15,WVDE Twitbot,8,7,2015-01-30 11:51:08,Hancock County School District,2015-01-30
568215283682418688,All schools in #Tyler Co closed Thu 2/19/15 Schools will be closed for all students and staff.,WVDE Twitbot,19,13,2015-02-19 01:07:35,Tyler County School District,2015-02-19
567101821416898560,All schools in #Greenbrier Co closed Mon 2/16/15,WVDE Twitbot,20,35,2015-02-15 23:23:05,Greenbrier County School District,2015-02-16
316462806281105408,All schools in #Barbour Co closed Tue 3/26/13 due to inclement weather and road conditions,WVDE Twitbot,3,4,2013-03-26 08:13:07,Barbour County School District,2013-03-26
949052602398007297,All schools in #Berkeley Co closed Fri 1/5/18 PreK is closed and all evening activities are cancelled 1/5/18.,WVDE Twitbot,65,64,2018-01-04 22:59:07,Berkeley County School District,2018-01-05
552793719070801921,UPDATE: All schools in #Nicholas Co now closed Wed 1/7/15,WVDE Twitbot,20,31,2015-01-07 11:47:47,Nicholas County School District,2015-01-07
699532449202761728,All schools in #Berkeley Co closed Tue 2/16/16 due to weather Evening activities cancelled.,WVDE Twitbot,41,75,2016-02-16 09:55:07,Berkeley County School District,2016-02-16
552423775455965186,UPDATE: All schools in #Gilmer Co now closed Tue 1/6/15,WVDE Twitbot,7,5,2015-01-06 11:17:46,Gilmer County School District,2015-01-06
567459925379805184,All schools in #Wood Co closed Tue 2/17/15 Only 261 day employees report for work.,WVDE Twitbot,115,187,2015-02-16 23:06:03,Wood County School District,2015-02-17
697742330414161920,UPDATE: All schools in #Tucker Co now closed Thu 2/11/16,WVDE Twitbot,8,8,2016-02-11 11:21:49,Tucker County School District,2016-02-11
422821983013707776,All schools in #Boone Co closed Tue 1/14/14 due to the continued do not use water order,WVDE Twitbot,14,31,2014-01-13 20:06:31,Boone County School District,2014-01-14
425739179897540609,All schools in #Taylor Co closed Wed 1/22/14,WVDE Twitbot,10,24,2014-01-21 21:18:25,Taylor County School District,2014-01-22
279235149076504576,All schools in #Pocahontas Co closed Thu 12/13/12 due to Flu,WVDE Twitbot,3,19,2012-12-13 14:43:42,Pocahontas County School District,2012-12-13
433774217817911296,All schools in #Pocahontas Co closed Thu 2/13/14,WVDE Twitbot,9,7,2014-02-13 01:26:47,Pocahontas County School District,2014-02-13
428317395254407168,All schools in #Greenbrier Co closed Wed 1/29/14,WVDE Twitbot,15,51,2014-01-29 00:03:19,Greenbrier County School District,2014-01-29
426490240212017152,All schools in #Lewis Co closed Fri 1/24/14,WVDE Twitbot,12,9,2014-01-23 23:02:51,Lewis County School District,2014-01-24
837090098713923584,All schools in #Fayette Co closed Thu 3/2/17 due to widespread power outages,WVDE Twitbot,36,48,2017-03-02 00:00:06,Fayette County School District,2017-03-02
410421090565885952,All schools in #Mercer Co closed Tue 12/10/13 due to Inclement weather,WVDE Twitbot,7,3,2013-12-10 14:49:47,Mercer County School District,2013-12-10
298607019735281665,All schools in #Ritchie Co closed Tue 2/5/13,WVDE Twitbot,3,22,2013-02-05 01:40:36,Ritchie County School District,2013-02-05
154150250116956161,UPDATE: All schools in #Pocahontas Co now closed Tue 1/3/12,WVDE Twitbot,0,0,2012-01-03 10:40:58,Pocahontas County School District,2012-01-03
573593501335732227,All schools in #Cabell Co closed Fri 3/6/15 due to inclement weather code blue,WVDE Twitbot,31,43,2015-03-05 21:18:42,Cabell County School District,2015-03-06
425803146095386625,All schools in #Pendleton Co closed Wed 1/22/14,WVDE Twitbot,15,15,2014-01-22 01:32:35,Pendleton County School District,2014-01-22
573593942941392896,All schools in #Morgan Co closed Fri 3/6/15 code A,WVDE Twitbot,6,15,2015-03-05 21:20:27,Morgan County School District,2015-03-06
445475281176768513,All schools in #Harrison Co closed Mon 3/17/14,WVDE Twitbot,21,81,2014-03-17 08:22:38,Harrison County School District,2014-03-17
425720897442295808,All schools in #Marion Co closed Wed 1/22/14 due to Inclement Weather,WVDE Twitbot,22,94,2014-01-21 20:05:46,Marion County School District,2014-01-22
298725683495043072,All schools in #Wood Co closed Tue 2/5/13 due to inclement weather code A,WVDE Twitbot,27,76,2013-02-05 09:32:07,Wood County School District,2013-02-05
426130692708114432,"All schools in #Berkeley Co closed Thu 1/23/14 All evening activities scheduled for Thursday, January 23rd are cancelled.",WVDE Twitbot,35,99,2014-01-22 23:14:08,Berkeley County School District,2014-01-23
559655469405704192,All schools in #WVSDB closed Mon 1/26/15,WVDE Twitbot,2,1,2015-01-26 10:13:56,,2015-01-26
567510075485745152,All schools in #Marion Co closed Tue 2/17/15 due to Inclement weather,WVDE Twitbot,29,59,2015-02-17 02:25:20,Marion County School District,2015-02-17
699370280725168128,All schools in #Mercer Co closed Tue 2/16/16 due to inclement weather conditions,WVDE Twitbot,11,9,2016-02-15 23:10:43,Mercer County School District,2016-02-16
959389892588527616,UPDATE: All schools in #Taylor Co now closed Fri 2/2/18,WVDE Twitbot,9,5,2018-02-02 11:35:49,Taylor County School District,2018-02-02
559690334100537344,UPDATE: All schools in #Pocahontas Co now closed Mon 1/26/15,WVDE Twitbot,8,3,2015-01-26 12:32:28,Pocahontas County School District,2015-01-26
692018543127314436,All schools in #Morgan Co closed Wed 1/27/16 code H,WVDE Twitbot,22,10,2016-01-26 16:17:32,Morgan County School District,2016-01-27
438653646520082432,UPDATE: All schools in #Doddridge Co now closed Wed 2/26/14 due to inclement weather,WVDE Twitbot,7,11,2014-02-26 12:35:53,Doddridge County School District,2014-02-26
959400259574169600,UPDATE: All schools in #Boone Co now closed Fri 2/2/18,WVDE Twitbot,9,3,2018-02-02 12:17:01,Boone County School District,2018-02-02
434040887383834624,All schools in #Tucker Co closed Fri 2/14/14,WVDE Twitbot,9,7,2014-02-13 19:06:26,Tucker County School District,2014-02-14
703219322219601921,UPDATE: All schools in #Webster Co now closed Fri 2/26/16 due to Weather Conditions,WVDE Twitbot,32,15,2016-02-26 14:05:26,Webster County School District,2016-02-26
568212940060532738,All schools in #Ohio Co closed Thu 2/19/15,WVDE Twitbot,34,60,2015-02-19 00:58:16,Ohio County School District,2015-02-19
410364763957256193,UPDATE: All schools in #Hardy Co now closed Tue 12/10/13,WVDE Twitbot,2,19,2013-12-10 11:05:58,Hardy County School District,2013-12-10
567625944245207040,UPDATE: All schools in #Ohio Co now closed Tue 2/17/15,WVDE Twitbot,16,39,2015-02-17 10:05:45,Ohio County School District,2015-02-17
425567345310826496,All schools in #Berkeley Co closed Tue 1/21/14 Evening activities are cancelled as well.,WVDE Twitbot,20,51,2014-01-21 09:55:36,Berkeley County School District,2014-01-21
690262832194125824,All schools in #Tucker Co closed Fri 1/22/16,WVDE Twitbot,26,18,2016-01-21 20:00:58,Tucker County School District,2016-01-22
420316196362149888,All schools in #Gilmer Co closed Tue 1/7/14,WVDE Twitbot,4,12,2014-01-06 22:09:24,Gilmer County School District,2014-01-07
950308138523250688,All schools in #Grant Co closed Mon 1/8/18,WVDE Twitbot,5,4,2018-01-08 10:08:10,Grant County School District,2018-01-08
420303176999260160,All schools in #Putnam Co closed Tue 1/7/14 due to The weather conditions. Also the central office will be closed do to power,WVDE Twitbot,67,214,2014-01-06 21:17:40,Putnam County School District,2014-01-07
433929353508827138,UPDATE: All schools in #Mason Co now closed Thu 2/13/14 due to inclement Weather,WVDE Twitbot,11,11,2014-02-13 11:43:14,Mason County School District,2014-02-13
943814507389964289,1/2 All schools in #Lewis Co closed Thu 12/21/17 due to Natural Gas Issues,WVDE Twitbot,11,4,2017-12-21 12:04:48,Lewis County School District,2017-12-21
690135446337253377,UPDATE: All schools in #Ritchie Co now closed Thu 1/21/16,WVDE Twitbot,9,15,2016-01-21 11:34:47,Ritchie County School District,2016-01-21
438641710919192576,UPDATE: All schools in #Calhoun Co now closed Wed 2/26/14 due to Inclement Weather,WVDE Twitbot,4,7,2014-02-26 11:48:28,Calhoun County School District,2014-02-26
560014771484123136,All schools in #Hampshire Co closed Tue 1/27/15 due to snow covered primary and secondary roads,WVDE Twitbot,6,15,2015-01-27 10:01:40,Hampshire County School District,2015-01-27
959390970252054533,UPDATE: All schools in #Pendleton Co now closed Fri 2/2/18,WVDE Twitbot,7,1,2018-02-02 11:40:06,Pendleton County School District,2018-02-02
950310895321780224,UPDATE: All schools in #Lewis Co now closed Mon 1/8/18 Students are to complete snow packet #1.,WVDE Twitbot,8,4,2018-01-08 10:19:08,Lewis County School District,2018-01-08
427800173125722112,UPDATE: All schools in #Nicholas Co now closed Mon 1/27/14,WVDE Twitbot,7,22,2014-01-27 13:48:04,Nicholas County School District,2014-01-27
430298693762183168,UPDATE: All schools in #Hardy Co now closed Mon 2/3/14,WVDE Twitbot,4,8,2014-02-03 11:16:17,Hardy County School District,2014-02-03
697364476492906500,UPDATE: All schools in #Pocahontas Co now closed Wed 2/10/16,WVDE Twitbot,5,1,2016-02-10 10:20:22,Pocahontas County School District,2016-02-10
440614277263548416,All schools in #Greenbrier Co closed Tue 3/4/14,WVDE Twitbot,19,45,2014-03-03 22:26:44,Greenbrier County School District,2014-03-04
841595298757648384,UPDATE: All schools in #Tucker Co now closed Tue 3/14/17,WVDE Twitbot,7,5,2017-03-14 10:22:09,Tucker County School District,2017-03-14
953441068758028289,All schools in #Marion Co closed Wed 1/17/18 due to Inclement Weather,WVDE Twitbot,63,40,2018-01-17 01:37:19,Marion County School District,2018-01-17
568525504933789698,All schools in #Wood Co closed Fri 2/20/15 Only 261 day employees report to work.,WVDE Twitbot,118,232,2015-02-19 21:40:17,Wood County School District,2015-02-20
691667584043843584,All schools in #Morgan Co closed Tue 1/26/16 code H,WVDE Twitbot,23,12,2016-01-25 17:02:57,Morgan County School District,2016-01-26
430277331257925632,All schools in #Harrison Co closed Mon 2/3/14,WVDE Twitbot,26,56,2014-02-03 09:51:24,Harrison County School District,2014-02-03
426509279130951680,All schools in #Grant Co closed Fri 1/24/14 due to extreme cold temperatures. Staff are to report on a two hour delay,WVDE Twitbot,6,12,2014-01-24 00:18:30,Grant County School District,2014-01-24
950328851984539648,UPDATE: All schools in #Preston Co now closed Mon 1/8/18 due to winter weather conditions,WVDE Twitbot,5,2,2018-01-08 11:30:29,Preston County School District,2018-01-08
440311550474461184,All schools in #Wayne Co closed Mon 3/3/14 due to Inclement Weather,WVDE Twitbot,14,16,2014-03-03 02:23:48,Wayne County School District,2014-03-03
219565380044210176,All schools in #Roane Co closed Mon 7/2/12 due to Governor\'s State of Emergency,WVDE Twitbot,0,2,2012-07-01 22:57:20,Roane County School District,2012-07-02
418935976182837249,UPDATE: All schools in #Ritchie Co now closed Fri 1/3/14,WVDE Twitbot,9,10,2014-01-03 02:44:54,Ritchie County School District,2014-01-03
573425336433655808,All schools in #Marshall Co closed Thu 3/5/15,WVDE Twitbot,14,22,2015-03-05 10:10:28,Marshall County School District,2015-03-05
440660394605297664,All schools in #Upshur Co closed Tue 3/4/14,WVDE Twitbot,16,21,2014-03-04 01:29:59,Upshur County School District,2014-03-04
691614098400940032,1/2 UPDATE: All schools in #WVSDB now closed Mon 1/25/16,WVDE Twitbot,5,4,2016-01-25 13:30:25,,2016-01-25
427894964056358912,All schools in #Barbour Co closed Tue 1/28/14,WVDE Twitbot,12,20,2014-01-27 20:04:43,Barbour County School District,2014-01-28
263074638102425601,All schools in #Mercer Co closed Tue 10/30/12 due to inclement weather  #WVSandy,WVDE Twitbot,0,6,2012-10-30 00:27:36,Mercer County School District,2012-10-30
263077643405119489,All schools in #Pocahontas Co closed Tue 10/30/12  #WVSandy,WVDE Twitbot,0,5,2012-10-30 00:39:32,Pocahontas County School District,2012-10-30
440284211744755712,All schools in #Wetzel Co closed Mon 3/3/14,WVDE Twitbot,21,42,2014-03-03 00:35:10,Wetzel County School District,2014-03-03
281919611186847744,All schools in #Nicholas Co closed Fri 12/21/12 due to Bad Weather,WVDE Twitbot,2,5,2012-12-21 00:30:47,Nicholas County School District,2012-12-21
559649609241620480,All schools in #Morgan Co closed Mon 1/26/15 code A,WVDE Twitbot,5,13,2015-01-26 09:50:39,Morgan County School District,2015-01-26
950695853894832128,UPDATE: All schools in #Tucker Co now closed Tue 1/9/18,WVDE Twitbot,3,3,2018-01-09 11:48:49,Tucker County School District,2018-01-09
263748979056062464,All schools in #Fayette Co closed Thu 11/1/12,WVDE Twitbot,3,30,2012-10-31 21:07:11,Fayette County School District,2012-11-01
427752434354503680,UPDATE: All schools in #Tucker Co now closed Mon 1/27/14,WVDE Twitbot,6,10,2014-01-27 10:38:22,Tucker County School District,2014-01-27
296968836748550144,UPDATE: All schools in #Tyler Co now closed Thu 1/31/13 due to flooding throughout the county,WVDE Twitbot,2,2,2013-01-31 13:11:02,Tyler County School District,2013-01-31
691759623339118594,All schools in #Grant Co closed Tue 1/26/16 due to Road conditions,WVDE Twitbot,22,13,2016-01-25 23:08:41,Grant County School District,2016-01-26
552793764348309505,UPDATE: All schools in #Doddridge Co now closed Wed 1/7/15 due to Inclement Weather,WVDE Twitbot,3,4,2015-01-07 11:47:58,Doddridge County School District,2015-01-07
573637552969748480,All schools in #Pocahontas Co closed Fri 3/6/15,WVDE Twitbot,6,7,2015-03-06 00:13:44,Pocahontas County School District,2015-03-06
297288284638425088,All schools in #Logan Co closed Fri 2/1/13,WVDE Twitbot,2,20,2013-02-01 10:20:25,Logan County School District,2013-02-01
568508415242145792,All schools in #Braxton Co closed Fri 2/20/15,WVDE Twitbot,16,23,2015-02-19 20:32:23,Braxton County School District,2015-02-20
689961075350044672,All schools in #McDowell Co closed Thu 1/21/16,WVDE Twitbot,6,6,2016-01-21 00:01:53,McDowell County School District,2016-01-21
310828818313134080,All schools in #Clay Co closed Mon 3/11/13 due to No Water,WVDE Twitbot,1,10,2013-03-10 19:05:39,Clay County School District,2013-03-11
426458392094183426,All schools in #Tucker Co closed Fri 1/24/14,WVDE Twitbot,8,14,2014-01-23 20:56:18,Tucker County School District,2014-01-24
570192796306571264,UPDATE: All schools in #Brooke Co now closed Tue 2/24/15,WVDE Twitbot,8,14,2015-02-24 12:05:30,Brooke County School District,2015-02-24
699571591919828992,UPDATE: All schools in #Mason Co now closed Tue 2/16/16 due to Inclement weather code red,WVDE Twitbot,35,31,2016-02-16 12:30:39,Mason County School District,2016-02-16
427777218891104256,UPDATE: All schools in #Braxton Co now closed Mon 1/27/14 Staff report on 2-hour delay.,WVDE Twitbot,6,8,2014-01-27 12:16:51,Braxton County School District,2014-01-27
948531337044086784,UPDATE: All schools in #Webster Co now closed Wed 1/3/18 due to weather conditions,WVDE Twitbot,10,6,2018-01-03 12:27:48,Webster County School District,2018-01-03
420724904980262912,UPDATE: All schools in #Ritchie Co now closed Wed 1/8/14,WVDE Twitbot,9,7,2014-01-08 01:13:28,Ritchie County School District,2014-01-08
298387951828758528,UPDATE: All schools in #McDowell Co now closed Mon 2/4/13,WVDE Twitbot,1,3,2013-02-04 11:10:06,McDowell County School District,2013-02-04
841952245075841025,UPDATE: All schools in #Greenbrier Co now closed Wed 3/15/17 due to Weather conditions,WVDE Twitbot,12,28,2017-03-15 10:00:32,Greenbrier County School District,2017-03-15
434121371090563072,All schools in #Mineral Co closed Fri 2/14/14,WVDE Twitbot,9,32,2014-02-14 00:26:15,Mineral County School District,2014-02-14
960498929212280833,UPDATE: All schools in #Pocahontas Co now closed Mon 2/5/18 due to inclement weather and snowy road conditions,WVDE Twitbot,4,1,2018-02-05 13:02:44,Pocahontas County School District,2018-02-05
418706026700242944,All schools in #Marshall Co closed Thu 1/2/14,WVDE Twitbot,9,16,2014-01-02 11:31:10,Marshall County School District,2014-01-02
426519338330226688,All schools in #Wyoming Co closed Fri 1/24/14 due to inclement weather,WVDE Twitbot,9,11,2014-01-24 00:58:29,Wyoming County School District,2014-01-24
445480032710832128,All schools in #Braxton Co closed Mon 3/17/14 Staff need not report.,WVDE Twitbot,5,11,2014-03-17 08:41:31,Braxton County School District,2014-03-17
950158474926845952,All schools in #Roane Co closed Mon 1/8/18 due to inclement weather,WVDE Twitbot,6,9,2018-01-08 00:13:28,Roane County School District,2018-01-08
433760508634599424,All schools in #Hampshire Co closed Thu 2/13/14,WVDE Twitbot,14,27,2014-02-13 00:32:18,Hampshire County School District,2014-02-13
958317511291875329,UPDATE: All schools in #Braxton Co now closed Tue 1/30/18 BOE office please report.,WVDE Twitbot,7,2,2018-01-30 12:34:34,Braxton County School District,2018-01-30
309485855242858496,All schools in #Pocahontas Co closed Thu 3/7/13,WVDE Twitbot,1,14,2013-03-07 02:09:12,Pocahontas County School District,2013-03-07
697024703236608000,UPDATE: All schools in #Mercer Co now closed Tue 2/9/16 due to inclement weather conditions,WVDE Twitbot,18,14,2016-02-09 11:50:14,Mercer County School District,2016-02-09
309231779083059200,1/2 All schools in #Barbour Co closed Wed 3/6/13 due to weather and road conditions,WVDE Twitbot,1,2,2013-03-06 09:19:36,Barbour County School District,2013-03-06
419062850167246848,UPDATE: All schools in #Monroe Co now closed Fri 1/3/14,WVDE Twitbot,2,9,2014-01-03 11:09:03,Monroe County School District,2014-01-03
440632117936914432,All schools in #Wirt Co closed Tue 3/4/14 Staff report at 10:00am,WVDE Twitbot,4,16,2014-03-03 23:37:38,Wirt County School District,2014-03-04
420150677264801793,UPDATE: All schools in #Mason Co now closed Mon 1/6/14 due to Inclement Weather,WVDE Twitbot,7,7,2014-01-06 11:11:42,Mason County School District,2014-01-06
554613756085673984,UPDATE: All schools in #Ritchie Co now closed Mon 1/12/15,WVDE Twitbot,7,11,2015-01-12 12:19:58,Ritchie County School District,2015-01-12
157789531461009408,1/2 UPDATE: All schools in #Barbour Co now closed Fri 1/13/12 due to inclement weather,WVDE Twitbot,0,0,2012-01-13 11:42:10,Barbour County School District,2012-01-13
428259252092665857,All schools in #Roane Co closed Wed 1/29/14 due to extreme cold,WVDE Twitbot,9,17,2014-01-28 20:12:17,Roane County School District,2014-01-29
691316581473845248,All schools in #Roane Co closed Mon 1/25/16,WVDE Twitbot,22,11,2016-01-24 17:48:11,Roane County School District,2016-01-25
433757509283635200,All schools in #Morgan Co closed Thu 2/13/14 code A,WVDE Twitbot,7,14,2014-02-13 00:20:23,Morgan County School District,2014-02-13
961199939937284096,UPDATE: All schools in #Mineral Co now closed Wed 2/7/18 due to inclement weather,WVDE Twitbot,19,15,2018-02-07 11:28:18,Mineral County School District,2018-02-07
440423903177875456,All schools in #Greenbrier Co closed Mon 3/3/14 due to Weather and road conditions,WVDE Twitbot,3,13,2014-03-03 09:50:15,Greenbrier County School District,2014-03-03
570367153347567618,All schools in #Raleigh Co closed Wed 2/25/15,WVDE Twitbot,21,40,2015-02-24 23:38:20,Raleigh County School District,2015-02-25
691707612581269509,UPDATE: All schools in #Webster Co now closed Mon 1/25/16,WVDE Twitbot,25,5,2016-01-25 19:42:00,Webster County School District,2016-01-25
949028968883195910,All schools in #Tyler Co closed Fri 1/5/18,WVDE Twitbot,12,11,2018-01-04 21:25:12,Tyler County School District,2018-01-05
294396791099633664,UPDATE: All schools in #Pocahontas Co now closed Thu 1/24/13 due to Inclement Weather,WVDE Twitbot,1,7,2013-01-24 10:50:39,Pocahontas County School District,2013-01-24
573415810548563968,All schools in #Grant Co closed Thu 3/5/15,WVDE Twitbot,6,2,2015-03-05 09:32:37,Grant County School District,2015-03-05
949053223515705344,All schools in #Pendleton Co closed Fri 1/5/18,WVDE Twitbot,7,8,2018-01-04 23:01:35,Pendleton County School District,2018-01-05
294399308273442816,UPDATE: All schools in #Taylor Co now closed Thu 1/24/13,WVDE Twitbot,2,3,2013-01-24 11:00:39,Taylor County School District,2013-01-24
697391400342650880,UPDATE: All schools in #Monroe Co now closed Wed 2/10/16,WVDE Twitbot,13,8,2016-02-10 12:07:21,Monroe County School District,2016-02-10
950691789178114050,UPDATE: All schools in #Preston Co now closed Tue 1/9/18 due to icy back roads,WVDE Twitbot,2,0,2018-01-09 11:32:40,Preston County School District,2018-01-09
951758911211757568,All schools in #Wetzel Co closed Fri 1/12/18 due to Inclement Weather,WVDE Twitbot,11,15,2018-01-12 10:13:01,Wetzel County School District,2018-01-12
534679409207574528,UPDATE: All schools in #Mingo Co now closed Tue 11/18/14 Code Orange.,WVDE Twitbot,10,11,2014-11-18 12:07:59,Mingo County School District,2014-11-18
552422762342809600,UPDATE: All schools in #Tucker Co now closed Tue 1/6/15,WVDE Twitbot,11,6,2015-01-06 11:13:44,Tucker County School District,2015-01-06
425566391803342848,UPDATE: All schools in #Upshur Co now closed Tue 1/21/14,WVDE Twitbot,5,17,2014-01-21 09:51:49,Upshur County School District,2014-01-21
573420743867932673,All schools in #Hancock Co closed Thu 3/5/15,WVDE Twitbot,6,4,2015-03-05 09:52:13,Hancock County School District,2015-03-05
841940620088365056,All schools in #Upshur Co closed Wed 3/15/17,WVDE Twitbot,28,13,2017-03-15 09:14:20,Upshur County School District,2017-03-15
552428803231076353,UPDATE: All schools in #Preston Co now closed Tue 1/6/15 due to winter weather conditions,WVDE Twitbot,10,4,2015-01-06 11:37:44,Preston County School District,2015-01-06
950172599023218689,All schools in #Nicholas Co closed Mon 1/8/18,WVDE Twitbot,17,13,2018-01-08 01:09:35,Nicholas County School District,2018-01-08
420317767770730496,1/2 All schools in #Kanawha Co closed Tue 1/7/14 due to inclement weather code B,WVDE Twitbot,93,312,2014-01-06 22:15:39,Kanawha County School District,2014-01-07
425805010572951552,All schools in #Mineral Co closed Wed 1/22/14 due to weather,WVDE Twitbot,7,34,2014-01-22 01:40:00,Mineral County School District,2014-01-22
949072585463095297,All schools in #Preston Co closed Fri 1/5/18 due to winter weather conditions,WVDE Twitbot,4,1,2018-01-05 00:18:31,Preston County School District,2018-01-05
841955575760052224,UPDATE: All schools in #Pocahontas Co now closed Wed 3/15/17 due to inclement weather,WVDE Twitbot,4,3,2017-03-15 10:13:46,Pocahontas County School District,2017-03-15
705725008841199618,UPDATE: All schools in #Monroe Co now closed Fri 3/4/16,WVDE Twitbot,10,8,2016-03-04 12:02:08,Monroe County School District,2016-03-04
294747814628564992,All schools in #Nicholas Co closed Fri 1/25/13 due to Bad Weather,WVDE Twitbot,7,24,2013-01-25 10:05:29,Nicholas County School District,2013-01-25
419044870829785088,All schools in #Morgan Co closed Fri 1/3/14 code A,WVDE Twitbot,12,15,2014-01-03 09:57:37,Morgan County School District,2014-01-03
262845053276405761,All schools in #Raleigh Co closed Mon 10/29/12 due to Weather Conditions,WVDE Twitbot,3,26,2012-10-29 09:15:18,Raleigh County School District,2012-10-29
420133937508151296,All schools in #Monongalia Co closed Mon 1/6/14,WVDE Twitbot,25,78,2014-01-06 10:05:11,Monongalia County School District,2014-01-06
428339839470039040,All schools in #Raleigh Co closed Wed 1/29/14 due to weather conditions code A Employees must report.,WVDE Twitbot,14,40,2014-01-29 01:32:30,Raleigh County School District,2014-01-29
567116510976806912,All schools in #Marshall Co closed Mon 2/16/15,WVDE Twitbot,20,35,2015-02-16 00:21:27,Marshall County School District,2015-02-16
552805029430951939,UPDATE: All schools in #Mingo Co now closed Wed 1/7/15 Employee Code Orange.,WVDE Twitbot,11,19,2015-01-07 12:32:44,Mingo County School District,2015-01-07
561094901082116096,All schools in #Pocahontas Co closed Fri 1/30/15,WVDE Twitbot,5,3,2015-01-30 09:33:43,Pocahontas County School District,2015-01-30
691355450919555072,All schools in #Upshur Co closed Mon 1/25/16,WVDE Twitbot,29,21,2016-01-24 20:22:38,Upshur County School District,2016-01-25
697017532780318720,UPDATE: All schools in #Webster Co now closed Tue 2/9/16 due to Weather Conditions,WVDE Twitbot,13,11,2016-02-09 11:21:44,Webster County School District,2016-02-09
953590531795415040,UPDATE: All schools in #Hardy Co now closed Wed 1/17/18,WVDE Twitbot,5,1,2018-01-17 11:31:14,Hardy County School District,2018-01-17
697019017664557057,UPDATE: All schools in #McDowell Co now closed Tue 2/9/16,WVDE Twitbot,5,1,2016-02-09 11:27:38,McDowell County School District,2016-02-09
948999503230701569,All schools in #Wetzel Co closed Fri 1/5/18,WVDE Twitbot,14,30,2018-01-04 19:28:07,Wetzel County School District,2018-01-05
420008438702174208,All schools in #Wood Co closed Mon 1/6/14 due to weather conditions code A,WVDE Twitbot,89,173,2014-01-06 01:46:29,Wood County School District,2014-01-06
950310133493530625,All schools in #Mineral Co closed Mon 1/8/18 due to pending inclement weather,WVDE Twitbot,30,20,2018-01-08 10:16:06,Mineral County School District,2018-01-08
309273941573251072,UPDATE: All schools in #McDowell Co now closed Wed 3/6/13,WVDE Twitbot,0,2,2013-03-06 12:07:08,McDowell County School District,2013-03-06
426460388201209856,UPDATE: All schools in #Barbour Co now closed Fri 1/24/14 due to temperature related concerns. Staff does not report.,WVDE Twitbot,2,5,2014-01-23 21:04:14,Barbour County School District,2014-01-24
430290699020681216,All schools in #Lewis Co closed Mon 2/3/14,WVDE Twitbot,4,15,2014-02-03 10:44:31,Lewis County School District,2014-02-03
697387162812043264,UPDATE: All schools in #Mercer Co now closed Wed 2/10/16 due to inclement weather conditions,WVDE Twitbot,15,15,2016-02-10 11:50:31,Mercer County School District,2016-02-10
425767988931747841,All schools in #Summers Co closed Wed 1/22/14,WVDE Twitbot,4,10,2014-01-21 23:12:53,Summers County School District,2014-01-22
425750392941461504,All schools in #Mingo Co closed Wed 1/22/14 code A,WVDE Twitbot,14,33,2014-01-21 22:02:58,Mingo County School District,2014-01-22
565836304102223872,UPDATE: All schools in #Preston Co now closed Thu 2/12/15 due to icing &amp; anticipated winter weather conditions,WVDE Twitbot,4,9,2015-02-12 11:34:22,Preston County School District,2015-02-12
573785730788540416,All schools in #Brooke Co closed Fri 3/6/15,WVDE Twitbot,12,14,2015-03-06 10:02:33,Brooke County School District,2015-03-06
436116246250016768,1/2 UPDATE: All schools in #Mineral Co now closed Wed 2/19/14,WVDE Twitbot,10,17,2014-02-19 12:33:10,Mineral County School District,2014-02-19
316113143568924672,All schools in #Monroe Co closed Mon 3/25/13,WVDE Twitbot,3,6,2013-03-25 09:03:41,Monroe County School District,2013-03-25
294746353240768512,UPDATE: All schools in #Greenbrier Co now closed Fri 1/25/13 due to Weather conditions,WVDE Twitbot,1,8,2013-01-25 09:59:41,Greenbrier County School District,2013-01-25
567823949237878785,All schools in #Jackson Co closed Wed 2/18/15 code A,WVDE Twitbot,32,42,2015-02-17 23:12:33,Jackson County School District,2015-02-18
953213058272329730,All schools in #Putnam Co closed Tue 1/16/18,WVDE Twitbot,54,44,2018-01-16 10:31:17,Putnam County School District,2018-01-16
697355214140080128,All schools in #Tucker Co closed Wed 2/10/16,WVDE Twitbot,15,7,2016-02-10 09:43:33,Tucker County School District,2016-02-10
953204697900478464,UPDATE: All schools in #Roane Co now closed Tue 1/16/18 due to inclement weather,WVDE Twitbot,7,4,2018-01-16 09:58:04,Roane County School District,2018-01-16
425563410063843328,All schools in #Webster Co closed Tue 1/21/14 due to Expected Weather Conditions,WVDE Twitbot,2,7,2014-01-21 09:39:58,Webster County School District,2014-01-21
372665893106765824,All schools in #Barbour Co closed Wed 8/28/13 due to Flash Flooding of Roads,WVDE Twitbot,4,5,2013-08-28 10:24:07,Barbour County School District,2013-08-28
425760548882743296,UPDATE: All schools in #Hancock Co now closed Wed 1/22/14 due to weather,WVDE Twitbot,4,9,2014-01-21 22:43:19,Hancock County School District,2014-01-22
298411741660975106,UPDATE: All schools in #Tyler Co now closed Mon 2/4/13,WVDE Twitbot,1,1,2013-02-04 12:44:38,Tyler County School District,2013-02-04
949018522834886657,All schools in #Hampshire Co closed Fri 1/5/18,WVDE Twitbot,13,10,2018-01-04 20:43:42,Hampshire County School District,2018-01-05
440970008496054272,All schools in #Mingo Co closed Wed 3/5/14 Employees Code W.,WVDE Twitbot,9,27,2014-03-04 22:00:17,Mingo County School District,2014-03-05
434087362587787264,All schools in #Preston Co closed Fri 2/14/14,WVDE Twitbot,11,17,2014-02-13 22:11:06,Preston County School District,2014-02-14
573283488998297600,All schools in #Mercer Co closed Thu 3/5/15 due to inclement weather,WVDE Twitbot,13,33,2015-03-05 00:46:49,Mercer County School District,2015-03-05
420868381903179776,UPDATE: All schools in #Wetzel Co now closed Wed 1/8/14,WVDE Twitbot,12,32,2014-01-08 10:43:36,Wetzel County School District,2014-01-08
410386516515356672,UPDATE: All schools in #Kanawha Co now closed Tue 12/10/13 due to Winter Road conditions,WVDE Twitbot,52,178,2013-12-10 12:32:24,Kanawha County School District,2013-12-10
940916580145418240,UPDATE: All schools in #McDowell Co now closed Wed 12/13/17,WVDE Twitbot,9,5,2017-12-13 12:09:28,McDowell County School District,2017-12-13
953422055134912512,All schools in #Randolph Co closed Wed 1/17/18,WVDE Twitbot,11,8,2018-01-17 00:21:46,Randolph County School District,2018-01-17
697590763107020800,All schools in #Greenbrier Co closed Thu 2/11/16 due to Weather Temp. conditions,WVDE Twitbot,23,39,2016-02-11 01:19:33,Greenbrier County School District,2016-02-11
433900264756482048,1/2 All schools in #Preston Co closed Thu 2/13/14,WVDE Twitbot,4,6,2014-02-13 09:47:39,Preston County School District,2014-02-13
277024829796917248,All schools in #Brooke Co closed Fri 12/7/12 due to Power outages throughout the county,WVDE Twitbot,0,1,2012-12-07 12:20:40,Brooke County School District,2012-12-07
573069807643459584,All schools in #Pleasants Co closed Wed 3/4/15,WVDE Twitbot,12,12,2015-03-04 10:37:43,Pleasants County School District,2015-03-04
691731484932214784,All schools in #Boone Co closed Tue 1/26/16 All 240 and 261 day employees should report.,WVDE Twitbot,25,10,2016-01-25 21:16:52,Boone County School District,2016-01-26
568518301141241857,All schools in #Gilmer Co closed Fri 2/20/15,WVDE Twitbot,9,11,2015-02-19 21:11:40,Gilmer County School District,2015-02-20
297298840149696513,UPDATE: All schools in #Mason Co now closed Fri 2/1/13 due to Inclement weather,WVDE Twitbot,0,2,2013-02-01 11:02:21,Mason County School District,2013-02-01
949050941042552838,All schools in #Wood Co closed Fri 1/5/18 due to inclement weather Employees will operate on a Code A.,WVDE Twitbot,196,116,2018-01-04 22:52:31,Wood County School District,2018-01-05
265181850849386496,All schools in #Webster Co closed Sun 11/4/12 due to Storm Conditions Staff is encouraged to be at their respective schools by 10:00am.,WVDE Twitbot,0,0,2012-11-04 20:00:54,Webster County School District,2012-11-04
427629898707255296,All schools in #Monongalia Co closed Mon 1/27/14,WVDE Twitbot,54,133,2014-01-27 02:31:27,Monongalia County School District,2014-01-27
426486033547423744,All schools in #Jefferson Co closed Fri 1/24/14 due to weather,WVDE Twitbot,11,16,2014-01-23 22:46:08,Jefferson County School District,2014-01-24
950329913856479232,UPDATE: All schools in #Wyoming Co now closed Mon 1/8/18 due to inclement weather,WVDE Twitbot,6,10,2018-01-08 11:34:42,Wyoming County School District,2018-01-08
410370818799988736,UPDATE: All schools in #Grant Co now closed Tue 12/10/13 due to inclement weather,WVDE Twitbot,7,13,2013-12-10 11:30:02,Grant County School District,2013-12-10
419063025732431872,All schools in #Mingo Co closed Fri 1/3/14 code A,WVDE Twitbot,5,7,2014-01-03 11:09:45,Mingo County School District,2014-01-03
568477531332083712,All schools in #Mingo Co closed Fri 2/20/15 Code Orange.,WVDE Twitbot,19,45,2015-02-19 18:29:39,Mingo County School District,2015-02-20
420296218539880448,All schools in #Cabell Co closed Tue 1/7/14 due to inclement weather code orange,WVDE Twitbot,34,62,2014-01-06 20:50:01,Cabell County School District,2014-01-07
433899547668930560,All schools in #Taylor Co closed Thu 2/13/14,WVDE Twitbot,6,4,2014-02-13 09:44:48,Taylor County School District,2014-02-13
841435445368127489,All schools in #Berkeley Co closed Tue 3/14/17 due to weather All evening activities for Mar. 14th are cancelled.,WVDE Twitbot,73,87,2017-03-13 23:46:57,Berkeley County School District,2017-03-14
440420893487923200,UPDATE: All schools in #Fayette Co now closed Mon 3/3/14 due to inclement weather code B,WVDE Twitbot,7,19,2014-03-03 09:38:18,Fayette County School District,2014-03-03
425600002618957824,UPDATE: All schools in #Gilmer Co now closed Tue 1/21/14,WVDE Twitbot,2,6,2014-01-21 12:05:22,Gilmer County School District,2014-01-21
425566314359312384,All schools in #Marion Co closed Tue 1/21/14 due to INCLEMENT WEATHER,WVDE Twitbot,15,41,2014-01-21 09:51:30,Marion County School District,2014-01-21
573093318571261952,UPDATE: All schools in #Hancock Co now closed Wed 3/4/15,WVDE Twitbot,8,5,2015-03-04 12:11:09,Hancock County School District,2015-03-04
309238707796455425,All schools in #Marion Co closed Wed 3/6/13 due to INCLEMENT WEATHER,WVDE Twitbot,6,27,2013-03-06 09:47:07,Marion County School District,2013-03-06
157620895966433280,UPDATE: All schools in #Marshall Co now closed Fri 1/13/12,WVDE Twitbot,0,0,2012-01-13 00:32:04,Marshall County School District,2012-01-13
552427864004755456,UPDATE: All schools in #Doddridge Co now closed Tue 1/6/15 due to Inclement Weather-Snow,WVDE Twitbot,3,5,2015-01-06 11:34:01,Doddridge County School District,2015-01-06
691660591681896448,All schools in #Marion Co closed Tue 1/26/16 due to Inclement Weather,WVDE Twitbot,59,115,2016-01-25 16:35:10,Marion County School District,2016-01-26
699172391700795393,All schools in #Jefferson Co closed Mon 2/15/16 due to inclement weather all after school and evening activities are cancelled.,WVDE Twitbot,41,43,2016-02-15 10:04:22,Jefferson County School District,2016-02-15
420294004358803458,All schools in #Brooke Co closed Tue 1/7/14,WVDE Twitbot,11,32,2014-01-06 20:41:13,Brooke County School District,2014-01-07
575611281044041728,UPDATE: All schools in #Calhoun Co now closed Wed 3/11/15 due to Road Closure due to High Water code blue,WVDE Twitbot,5,7,2015-03-11 10:56:38,Calhoun County School District,2015-03-11
425728204356452352,All schools in #Jefferson Co closed Wed 1/22/14 due to snow,WVDE Twitbot,13,28,2014-01-21 20:34:48,Jefferson County School District,2014-01-22
263396482554662912,UPDATE: All schools in #Fayette Co now closed Wed 10/31/12,WVDE Twitbot,2,7,2012-10-30 21:46:29,Fayette County School District,2012-10-31
426502664080199682,All schools in #Logan Co closed Fri 1/24/14,WVDE Twitbot,10,21,2014-01-23 23:52:13,Logan County School District,2014-01-24
841933008592609280,"All schools in #Braxton Co closed Wed 3/15/17 240-261 staff, please report on two-hour delay.",WVDE Twitbot,3,7,2017-03-15 08:44:06,Braxton County School District,2017-03-15
690304910194298880,"All schools in #Wirt Co closed Fri 1/22/16 due to Severe weather forecast, Winter Storm warning",WVDE Twitbot,22,11,2016-01-21 22:48:10,Wirt County School District,2016-01-22
809338756058775552,All schools in #Tucker Co closed Thu 12/15/16,WVDE Twitbot,16,9,2016-12-15 10:06:10,Tucker County School District,2016-12-15
427577741374791680,All schools in #Brooke Co closed Mon 1/27/14,WVDE Twitbot,9,11,2014-01-26 23:04:12,Brooke County School District,2014-01-27
419049462388883456,UPDATE: All schools in #Roane Co now closed Fri 1/3/14 due to snow &amp; ice,WVDE Twitbot,7,4,2014-01-03 10:15:52,Roane County School District,2014-01-03
425749420584361984,All schools in #Monroe Co closed Wed 1/22/14,WVDE Twitbot,7,23,2014-01-21 21:59:06,Monroe County School District,2014-01-22
950336809493520384,UPDATE: All schools in #Wayne Co now closed Mon 1/8/18 due to Icy Roads,WVDE Twitbot,8,6,2018-01-08 12:02:06,Wayne County School District,2018-01-08
425744093936115712,All schools in #Greenbrier Co closed Wed 1/22/14 due to Weather conditions &amp; Temperatures,WVDE Twitbot,14,43,2014-01-21 21:37:56,Greenbrier County School District,2014-01-22
953234986978742273,UPDATE: All schools in #Gilmer Co now closed Tue 1/16/18,WVDE Twitbot,6,2,2018-01-16 11:58:25,Gilmer County School District,2018-01-16
559652516133339136,All schools in #Hancock Co closed Mon 1/26/15,WVDE Twitbot,6,5,2015-01-26 10:02:12,Hancock County School District,2015-01-26
691698205692674053,All schools in #Logan Co closed Tue 1/26/16,WVDE Twitbot,28,31,2016-01-25 19:04:38,Logan County School District,2016-01-26
440819285460410368,UPDATE: All schools in #Monroe Co now closed Tue 3/4/14,WVDE Twitbot,8,19,2014-03-04 12:01:22,Monroe County School District,2014-03-04
419952743424327680,All schools in #Nicholas Co closed Mon 1/6/14,WVDE Twitbot,10,25,2014-01-05 22:05:11,Nicholas County School District,2014-01-06
420283820848320512,All schools in #Morgan Co closed Tue 1/7/14 code A,WVDE Twitbot,7,24,2014-01-06 20:00:46,Morgan County School District,2014-01-07
430479977935822848,All schools in #Harrison Co closed Tue 2/4/14,WVDE Twitbot,27,127,2014-02-03 23:16:39,Harrison County School District,2014-02-04
157083370675908610,UPDATE: All schools in #Pendleton Co now closed Wed 1/11/12,WVDE Twitbot,0,0,2012-01-11 12:56:08,Pendleton County School District,2012-01-11
568515896148254720,All schools in #Wayne Co closed Fri 2/20/15 due to Inclement Weather,WVDE Twitbot,16,21,2015-02-19 21:02:06,Wayne County School District,2015-02-20
569595075459727360,All schools in #Logan Co closed Mon 2/23/15,WVDE Twitbot,27,27,2015-02-22 20:30:23,Logan County School District,2015-02-23
568188720941297664,All schools in #Hancock Co closed Thu 2/19/15,WVDE Twitbot,8,7,2015-02-18 23:22:02,Hancock County School District,2015-02-19
426687463742902272,UPDATE: All schools in #Ohio Co now closed Fri 1/24/14,WVDE Twitbot,19,31,2014-01-24 12:06:33,Ohio County School District,2014-01-24
430278473337536512,All schools in #Ohio Co closed Mon 2/3/14,WVDE Twitbot,18,36,2014-02-03 09:55:56,Ohio County School District,2014-02-03
561131590110433282,UPDATE: All schools in #Tyler Co now closed Fri 1/30/15 All 240 and 261 days employees should report on a two-hour delay today.,WVDE Twitbot,11,9,2015-01-30 11:59:31,Tyler County School District,2015-01-30
171353579276353536,All schools in #Monroe Co closed Mon 2/20/12,WVDE Twitbot,0,1,2012-02-19 22:00:51,Monroe County School District,2012-02-20
428492650384084992,UPDATE: All schools in #Pendleton Co now closed Wed 1/29/14,WVDE Twitbot,2,8,2014-01-29 11:39:43,Pendleton County School District,2014-01-29
568175410279780352,All schools in #Wyoming Co closed Thu 2/19/15 due to inclement weather,WVDE Twitbot,16,15,2015-02-18 22:29:08,Wyoming County School District,2015-02-19
570350525331320833,All schools in #McDowell Co closed Wed 2/25/15,WVDE Twitbot,6,8,2015-02-24 22:32:16,McDowell County School District,2015-02-25
438643050944811008,UPDATE: All schools in #Cabell Co now closed Wed 2/26/14 due to inclement weather code red,WVDE Twitbot,29,40,2014-02-26 11:53:47,Cabell County School District,2014-02-26
438608950238248960,All schools in #Barbour Co closed Wed 2/26/14,WVDE Twitbot,10,5,2014-02-26 09:38:17,Barbour County School District,2014-02-26
430307636668399616,"UPDATE: All schools in #Clay Co now closed Mon 2/3/14 due to weather; ice, sleet",WVDE Twitbot,6,13,2014-02-03 11:51:49,Clay County School District,2014-02-03
953417777498546176,All schools in #Webster Co closed Wed 1/17/18 due to Weather and Road Conditions,WVDE Twitbot,19,9,2018-01-17 00:04:46,Webster County School District,2018-01-17
427746264046776320,UPDATE: All schools in #Upshur Co now closed Mon 1/27/14,WVDE Twitbot,8,16,2014-01-27 10:13:51,Upshur County School District,2014-01-27
420144280791838720,UPDATE: All schools in #Tucker Co now closed Mon 1/6/14,WVDE Twitbot,6,4,2014-01-06 10:46:17,Tucker County School District,2014-01-06
691370326786248704,All schools in #Randolph Co closed Mon 1/25/16,WVDE Twitbot,38,46,2016-01-24 21:21:45,Randolph County School District,2016-01-25
309244786181820416,All schools in #Jefferson Co closed Wed 3/6/13 due to Snow,WVDE Twitbot,3,13,2013-03-06 10:11:17,Jefferson County School District,2013-03-06
428320962937778176,All schools in #Lincoln Co closed Wed 1/29/14,WVDE Twitbot,16,68,2014-01-29 00:17:30,Lincoln County School District,2014-01-29
448768932032155648,UPDATE: All schools in #Nicholas Co now closed Wed 3/26/14,WVDE Twitbot,5,19,2014-03-26 10:30:25,Nicholas County School District,2014-03-26
568500454725967872,All schools in #Randolph Co closed Fri 2/20/15,WVDE Twitbot,25,32,2015-02-19 20:00:45,Randolph County School District,2015-02-20
420674106946637824,All schools in #Taylor Co closed Wed 1/8/14,WVDE Twitbot,8,25,2014-01-07 21:51:37,Taylor County School District,2014-01-08
440297702459330560,All schools in #Wood Co closed Mon 3/3/14 code B Staff should monitor for possible updates to Report Code.,WVDE Twitbot,62,183,2014-03-03 01:28:47,Wood County School District,2014-03-03
428333942156955648,All schools in #Cabell Co closed Wed 1/29/14 due to inclement weather code red,WVDE Twitbot,30,74,2014-01-29 01:09:04,Cabell County School District,2014-01-29
426496278181068800,All schools in #Pocahontas Co closed Fri 1/24/14,WVDE Twitbot,3,5,2014-01-23 23:26:51,Pocahontas County School District,2014-01-24
949060561261735936,UPDATE: All schools in #Roane Co now closed Fri 1/5/18 due to extreme wind chill,WVDE Twitbot,7,8,2018-01-04 23:30:45,Roane County School District,2018-01-05
426134929018068992,All schools in #Jefferson Co closed Thu 1/23/14 due to weather,WVDE Twitbot,18,28,2014-01-22 23:30:58,Jefferson County School District,2014-01-23
561126914996572160,UPDATE: All schools in #Ritchie Co now closed Fri 1/30/15,WVDE Twitbot,12,8,2015-01-30 11:40:56,Ritchie County School District,2015-01-30
433906883888295936,All schools in #Ritchie Co closed Thu 2/13/14,WVDE Twitbot,9,3,2014-02-13 10:13:57,Ritchie County School District,2014-02-13
953083853123543040,UPDATE: All schools in #Marshall Co now closed Tue 1/16/18,WVDE Twitbot,24,10,2018-01-16 01:57:52,Marshall County School District,2018-01-16
440660177940131840,All schools in #Pleasants Co closed Tue 3/4/14,WVDE Twitbot,18,31,2014-03-04 01:29:08,Pleasants County School District,2014-03-04
950703777899798528,UPDATE: All schools in #Marion Co now closed Tue 1/9/18 due to Inclement Weather,WVDE Twitbot,55,26,2018-01-09 12:20:18,Marion County School District,2018-01-09
699167134304358400,All schools in #Hampshire Co closed Mon 2/15/16 due to Inclement weather,WVDE Twitbot,14,17,2016-02-15 09:43:29,Hampshire County School District,2016-02-15
573099711713964032,All schools in #McDowell Co closed Wed 3/4/15 Staff does not have to report.,WVDE Twitbot,3,2,2015-03-04 12:36:33,McDowell County School District,2015-03-04
263230892783325184,1/2 UPDATE: All schools in #Putnam Co now closed Tue 10/30/12 due to the weather conditions.  Central Office staff report on a 2 hr. delay,WVDE Twitbot,3,31,2012-10-30 10:48:30,Putnam County School District,2012-10-30
699177239934537728,All schools in #WVSDB closed Mon 2/15/16,WVDE Twitbot,9,3,2016-02-15 10:23:38,,2016-02-15
440452195209601024,UPDATE: All schools in #Mercer Co now closed Mon 3/3/14 due to inclement weather,WVDE Twitbot,3,6,2014-03-03 11:42:41,Mercer County School District,2014-03-03
953437336150380544,All schools in #Mercer Co closed Wed 1/17/18 due to inclement weather,WVDE Twitbot,15,14,2018-01-17 01:22:29,Mercer County School District,2018-01-17
420689046063419392,All schools in #Lewis Co closed Wed 1/8/14,WVDE Twitbot,9,11,2014-01-07 22:50:59,Lewis County School District,2014-01-08
573283945695072256,All schools in #Putnam Co closed Thu 3/5/15 due to Weather conditions,WVDE Twitbot,62,115,2015-03-05 00:48:38,Putnam County School District,2015-03-05
951759079717748736,UPDATE: All schools in #Hancock Co now closed Fri 1/12/18 due to Flooding,WVDE Twitbot,4,7,2018-01-12 10:13:42,Hancock County School District,2018-01-12
438623952143781888,UPDATE: All schools in #Clay Co now closed Wed 2/26/14 due to Weather conditions,WVDE Twitbot,9,13,2014-02-26 10:37:54,Clay County School District,2014-02-26
554618218296643584,1/2 UPDATE: All schools in #Tyler Co now closed Mon 1/12/15 due to hazardous road conditions throughout the county,WVDE Twitbot,6,11,2015-01-12 12:37:42,Tyler County School District,2015-01-12
569646836719300609,All schools in #WVSDB closed Mon 2/23/15,WVDE Twitbot,3,1,2015-02-22 23:56:04,,2015-02-23
826035467086860288,UPDATE: All schools in #Pendleton Co now closed Mon 1/30/17 due to Inclement weather,WVDE Twitbot,16,10,2017-01-30 11:52:57,Pendleton County School District,2017-01-30
568519304984989696,All schools in #Taylor Co closed Fri 2/20/15,WVDE Twitbot,19,15,2015-02-19 21:15:39,Taylor County School District,2015-02-20
953230667512451077,UPDATE: All schools in #Harrison Co now closed Tue 1/16/18,WVDE Twitbot,47,33,2018-01-16 11:41:15,Harrison County School District,2018-01-16
431051069289144320,UPDATE: All schools in #Doddridge Co now closed Wed 2/5/14 due to weather conditions Staff is not to report.,WVDE Twitbot,3,8,2014-02-05 13:05:58,Doddridge County School District,2014-02-05
425780952233541633,All schools in #Marshall Co closed Wed 1/22/14,WVDE Twitbot,4,9,2014-01-22 00:04:24,Marshall County School District,2014-01-22
294417737827090432,UPDATE: All schools in #Wood Co now closed Thu 1/24/13 due to inclement weather code A OPERATING STATUS UPDATE,WVDE Twitbot,21,72,2013-01-24 12:13:53,Wood County School District,2013-01-24
697369205893632001,UPDATE: All schools in #Roane Co now closed Wed 2/10/16 due to snow,WVDE Twitbot,8,8,2016-02-10 10:39:09,Roane County School District,2016-02-10
430508156356399104,All schools in #Wetzel Co closed Tue 2/4/14,WVDE Twitbot,14,38,2014-02-04 01:08:37,Wetzel County School District,2014-02-04
263439157458776064,All schools in #Summers Co closed Wed 10/31/12  #WVSandy,WVDE Twitbot,0,7,2012-10-31 00:36:04,Summers County School District,2012-10-31
445486234861715456,All schools in #Marion Co closed Mon 3/17/14 due to Inclement Weather,WVDE Twitbot,20,68,2014-03-17 09:06:09,Marion County School District,2014-03-17
950328034107764736,UPDATE: All schools in #Ohio Co now closed Mon 1/8/18,WVDE Twitbot,13,11,2018-01-08 11:27:14,Ohio County School District,2018-01-08
552964441843974144,All schools in #Raleigh Co closed Thu 1/8/15 due to weather conditions,WVDE Twitbot,38,111,2015-01-07 23:06:11,Raleigh County School District,2015-01-08
953213104560726022,1/2 UPDATE: All schools in #Wirt Co now closed Tue 1/16/18 due to Winter storm,WVDE Twitbot,5,3,2018-01-16 10:31:28,Wirt County School District,2018-01-16
691324727932116992,All schools in #Logan Co closed Mon 1/25/16,WVDE Twitbot,38,51,2016-01-24 18:20:33,Logan County School District,2016-01-25
940908790727217157,UPDATE: All schools in #Fayette Co now closed Wed 12/13/17 due to inclement weather,WVDE Twitbot,23,33,2017-12-13 11:38:31,Fayette County School District,2017-12-13
427774994467155968,UPDATE: All schools in #Jackson Co now closed Mon 1/27/14 code B Employees report after the 2 hour delay.,WVDE Twitbot,13,35,2014-01-27 12:08:01,Jackson County School District,2014-01-27
573258170992332800,All schools in #Raleigh Co closed Thu 3/5/15,WVDE Twitbot,36,80,2015-03-04 23:06:13,Raleigh County School District,2015-03-05
573579281655283713,All schools in #Wirt Co closed Fri 3/6/15 Staff do not report.,WVDE Twitbot,5,6,2015-03-05 20:22:11,Wirt County School District,2015-03-06
440422436144545793,All schools in #Morgan Co closed Mon 3/3/14 code A,WVDE Twitbot,3,2,2014-03-03 09:44:26,Morgan County School District,2014-03-03
836918430750113792,All schools in #Tyler Co closed Wed 3/1/17 due to rising flood waters throughout the county,WVDE Twitbot,23,29,2017-03-01 12:37:57,Tyler County School District,2017-03-01
428876255140667393,UPDATE: All schools in #Nicholas Co now closed Thu 1/30/14,WVDE Twitbot,11,20,2014-01-30 13:04:02,Nicholas County School District,2014-01-30
433790171973038080,1/2 All schools in #Mineral Co closed Thu 2/13/14,WVDE Twitbot,10,35,2014-02-13 02:30:11,Mineral County School District,2014-02-13
949067856121122816,UPDATE: All schools in #Mingo Co now closed Fri 1/5/18 Employees Code Orange.,WVDE Twitbot,19,16,2018-01-04 23:59:44,Mingo County School District,2018-01-05
950310665964740608,All schools in #Monongalia Co closed Mon 1/8/18,WVDE Twitbot,68,28,2018-01-08 10:18:13,Monongalia County School District,2018-01-08
699029225974734849,All schools in #Putnam Co closed Mon 2/15/16 due to Weather conditions,WVDE Twitbot,168,257,2016-02-15 00:35:29,Putnam County School District,2016-02-15
434108006788132865,All schools in #Harrison Co closed Fri 2/14/14,WVDE Twitbot,30,135,2014-02-13 23:33:08,Harrison County School District,2014-02-14
427922563168088064,All schools in #Pocahontas Co closed Tue 1/28/14,WVDE Twitbot,5,9,2014-01-27 21:54:24,Pocahontas County School District,2014-01-28
425757037872427009,All schools in #Lewis Co closed Wed 1/22/14,WVDE Twitbot,7,12,2014-01-21 22:29:22,Lewis County School District,2014-01-22
567119604397670401,All schools in #Mason Co closed Mon 2/16/15 due to Inclement weather code red,WVDE Twitbot,40,42,2015-02-16 00:33:44,Mason County School District,2015-02-16
953388651257397248,All schools in #Wetzel Co closed Wed 1/17/18 due to The magnitude of ice crystals  that  have fallen from the clouds,WVDE Twitbot,155,42,2018-01-16 22:09:02,Wetzel County School District,2018-01-17
426301423110729728,1/2 UPDATE: All schools in #Wetzel Co now closed Thu 1/23/14 due to weather and road conditions,WVDE Twitbot,8,18,2014-01-23 10:32:34,Wetzel County School District,2014-01-23
428328877581021184,All schools in #Taylor Co closed Wed 1/29/14 All staff report at 10:00.,WVDE Twitbot,7,10,2014-01-29 00:48:57,Taylor County School District,2014-01-29
552657652753629184,All schools in #Tyler Co closed Wed 1/7/15 due to hazardous road conditions throughout the county,WVDE Twitbot,9,7,2015-01-07 02:47:06,Tyler County School District,2015-01-07
552797444803936256,UPDATE: All schools in #Boone Co now closed Wed 1/7/15,WVDE Twitbot,15,44,2015-01-07 12:02:35,Boone County School District,2015-01-07
297271712146391041,All schools in #Upshur Co closed Fri 2/1/13 due to inclement weather,WVDE Twitbot,4,8,2013-02-01 09:14:33,Upshur County School District,2013-02-01
690270180476370944,All schools in #Calhoun Co closed Fri 1/22/16 due to Winter Storm code red,WVDE Twitbot,14,10,2016-01-21 20:30:10,Calhoun County School District,2016-01-22
948157957224755200,UPDATE: All schools in #Nicholas Co now closed Tue 1/2/18,WVDE Twitbot,17,14,2018-01-02 11:44:07,Nicholas County School District,2018-01-02
425592484883095552,UPDATE: All schools in #Randolph Co now closed Tue 1/21/14,WVDE Twitbot,4,18,2014-01-21 11:35:30,Randolph County School District,2014-01-21
445527052394201088,UPDATE: All schools in #Nicholas Co now closed Mon 3/17/14,WVDE Twitbot,8,24,2014-03-17 11:48:21,Nicholas County School District,2014-03-17
420361504722935808,All schools in #Mingo Co closed Tue 1/7/14 code H,WVDE Twitbot,6,7,2014-01-07 01:09:27,Mingo County School District,2014-01-07
563312795241160704,UPDATE: All schools in #Monongalia Co now closed Thu 2/5/15,WVDE Twitbot,46,93,2015-02-05 12:26:50,Monongalia County School District,2015-02-05
569826943199289345,UPDATE: All schools in #Jackson Co now closed Mon 2/23/15 code A,WVDE Twitbot,21,26,2015-02-23 11:51:44,Jackson County School District,2015-02-23
697349841706475520,All schools in #Marion Co closed Wed 2/10/16 due to Inclement Weather,WVDE Twitbot,29,48,2016-02-10 09:22:13,Marion County School District,2016-02-10
297182542581362689,UPDATE: All schools in #Preston Co now closed Fri 2/1/13,WVDE Twitbot,4,11,2013-02-01 03:20:14,Preston County School District,2013-02-01
552921426907635714,All schools in #Randolph Co closed Thu 1/8/15,WVDE Twitbot,30,34,2015-01-07 20:15:15,Randolph County School District,2015-01-08
697545889456504832,All schools in #Preston Co closed Thu 2/11/16 due to winter weather conditions,WVDE Twitbot,20,10,2016-02-10 22:21:14,Preston County School District,2016-02-11
573571304412045312,All schools in #Monongalia Co closed Fri 3/6/15,WVDE Twitbot,51,93,2015-03-05 19:50:30,Monongalia County School District,2015-03-06
264073558030962689,All schools in #Randolph Co closed Fri 11/2/12 due to inclement weather and power outages  #WVSandy,WVDE Twitbot,1,6,2012-11-01 18:36:57,Randolph County School District,2012-11-02
689409694020993025,UPDATE: All schools in #Greenbrier Co now closed Tue 1/19/16 due to Weather Temp. conditions,WVDE Twitbot,12,29,2016-01-19 11:30:54,Greenbrier County School District,2016-01-19
568499425158553600,All schools in #Jackson Co closed Fri 2/20/15 code B,WVDE Twitbot,18,34,2015-02-19 19:56:39,Jackson County School District,2015-02-20
440622494220046336,All schools in #Logan Co closed Tue 3/4/14,WVDE Twitbot,14,30,2014-03-03 22:59:23,Logan County School District,2014-03-04
263057157036048384,All schools in #Marion Co closed Tue 10/30/12 due to INCLEMENT WEATHER  #WVSandy,WVDE Twitbot,1,29,2012-10-29 23:18:08,Marion County School District,2012-10-30
690302140082950144,UPDATE: All schools in #Greenbrier Co now closed Fri 1/22/16 due to Weather conditions,WVDE Twitbot,24,18,2016-01-21 22:37:10,Greenbrier County School District,2016-01-22
426305375219236864,UPDATE: All schools in #Lincoln Co now closed Thu 1/23/14,WVDE Twitbot,7,43,2014-01-23 10:48:16,Lincoln County School District,2014-01-23
418924343112900608,All schools in #Calhoun Co closed Fri 1/3/14 due to Slick Roads and Frigid Temperatures,WVDE Twitbot,5,6,2014-01-03 01:58:41,Calhoun County School District,2014-01-03
690133031244447745,UPDATE: All schools in #Randolph Co now closed Thu 1/21/16,WVDE Twitbot,21,34,2016-01-21 11:25:11,Randolph County School District,2016-01-21
420016921560367105,"All schools in #Roane Co closed Mon 1/6/14 due to anticipated ice, snow &amp; extreme cold",WVDE Twitbot,12,16,2014-01-06 02:20:12,Roane County School District,2014-01-06
434088090680827904,All schools in #Boone Co closed Fri 2/14/14 due to the inclement winter weather,WVDE Twitbot,17,45,2014-02-13 22:14:00,Boone County School District,2014-02-14
922273747234689024,All schools in #Wood Co closed Mon 10/23/17 All 261 employees will report to work.,WVDE Twitbot,49,36,2017-10-23 01:29:31,Wood County School District,2017-10-23
430891565297324032,All schools in #Pleasants Co closed Wed 2/5/14,WVDE Twitbot,12,15,2014-02-05 02:32:09,Pleasants County School District,2014-02-05
298222089540874240,UPDATE: All schools in #Fayette Co now closed Mon 2/4/13 code A,WVDE Twitbot,10,37,2013-02-04 00:11:01,Fayette County School District,2013-02-04
440287239013404672,All schools in #Pocahontas Co closed Mon 3/3/14,WVDE Twitbot,7,12,2014-03-03 00:47:12,Pocahontas County School District,2014-03-03
826029475011948544,UPDATE: All schools in #Monroe Co now closed Mon 1/30/17,WVDE Twitbot,16,12,2017-01-30 11:29:08,Monroe County School District,2017-01-30
553008546896678912,All schools in #Tyler Co closed Thu 1/8/15 due to frigid temperatures and hazardous roads throughout the county,WVDE Twitbot,21,12,2015-01-08 02:01:26,Tyler County School District,2015-01-08
448776906775617536,UPDATE: All schools in #Monroe Co now closed Wed 3/26/14,WVDE Twitbot,2,8,2014-03-26 11:02:07,Monroe County School District,2014-03-26
567492646319714307,All schools in #Marshall Co closed Tue 2/17/15,WVDE Twitbot,22,27,2015-02-17 01:16:05,Marshall County School District,2015-02-17
573603771806281728,All schools in #Pleasants Co closed Fri 3/6/15,WVDE Twitbot,14,13,2015-03-05 21:59:30,Pleasants County School District,2015-03-06
425586488420876288,UPDATE: All schools in #Pocahontas Co now closed Tue 1/21/14,WVDE Twitbot,3,7,2014-01-21 11:11:40,Pocahontas County School District,2014-01-21
440449055957590017,UPDATE: All schools in #Pendleton Co now closed Mon 3/3/14,WVDE Twitbot,9,10,2014-03-03 11:30:12,Pendleton County School District,2014-03-03
953589006960332801,UPDATE: All schools in #Pocahontas Co now closed Wed 1/17/18,WVDE Twitbot,6,1,2018-01-17 11:25:10,Pocahontas County School District,2018-01-17
620741502201950208,1/2 All schools in #Webster Co closed Tue 7/14/15 due to Weather Conditions,WVDE Twitbot,6,6,2015-07-13 23:48:01,Webster County School District,2015-07-14
950343335813804033,UPDATE: All schools in #Cabell Co now closed Mon 1/8/18 due to Inclement weather code red,WVDE Twitbot,26,11,2018-01-08 12:28:02,Cabell County School District,2018-01-08
690266223653818368,All schools in #Boone Co closed Fri 1/22/16 All facilities will be closed on Friday - 240 and 261 day employees will not report.,WVDE Twitbot,39,32,2016-01-21 20:14:26,Boone County School District,2016-01-22
699563929031213056,UPDATE: All schools in #Doddridge Co now closed Tue 2/16/16 due to High Water,WVDE Twitbot,8,4,2016-02-16 12:00:12,Doddridge County School District,2016-02-16
947923090826285057,All schools in #Upshur Co closed Tue 1/2/18,WVDE Twitbot,31,19,2018-01-01 20:10:51,Upshur County School District,2018-01-02
420014428168269824,All schools in #McDowell Co closed Mon 1/6/14 due to inclement weather,WVDE Twitbot,3,5,2014-01-06 02:10:17,McDowell County School District,2014-01-06
922594893951848448,All schools in #Wood Co closed Tue 10/24/17 EMPLOYEES WILL OPERATE ON A CODE C,WVDE Twitbot,66,24,2017-10-23 22:45:38,Wood County School District,2017-10-24
220611852177125376,"All schools in #Greenbrier Co closed Thu 7/5/12 Greenbrier County Schools closed on Thursday, July 5, the county office will be open.",WVDE Twitbot,0,2,2012-07-04 20:15:38,Greenbrier County School District,2012-07-05
567837061820055553,All schools in #Lewis Co closed Wed 2/18/15,WVDE Twitbot,10,20,2015-02-18 00:04:40,Lewis County School District,2015-02-18
703202859807068160,UPDATE: All schools in #Greenbrier Co now closed Fri 2/26/16 due to HAZARDOUS  CONDITIONS,WVDE Twitbot,18,21,2016-02-26 13:00:01,Greenbrier County School District,2016-02-26
943977529957912576,All schools in #Lewis Co closed Fri 12/22/17 due to Natural Gas Issues,WVDE Twitbot,13,0,2017-12-21 22:52:36,Lewis County School District,2017-12-22
953593141923319808,UPDATE: All schools in #Monroe Co now closed Wed 1/17/18,WVDE Twitbot,10,5,2018-01-17 11:41:36,Monroe County School District,2018-01-17
420733540272459776,UPDATE: All schools in #Clay Co now closed Wed 1/8/14 due to severe weather conditions,WVDE Twitbot,12,17,2014-01-08 01:47:47,Clay County School District,2014-01-08
425577491026432000,All schools in #Wyoming Co closed Tue 1/21/14 due to inclement weather,WVDE Twitbot,10,17,2014-01-21 10:35:55,Wyoming County School District,2014-01-21
691359833375797248,All schools in #Greenbrier Co closed Mon 1/25/16 due to Weather conditions,WVDE Twitbot,19,28,2016-01-24 20:40:03,Greenbrier County School District,2016-01-25
690320532689010688,All schools in #Morgan Co closed Fri 1/22/16 code A,WVDE Twitbot,21,21,2016-01-21 23:50:15,Morgan County School District,2016-01-22
430891360078426112,"All schools in #Tyler Co closed Wed 2/5/14 Employees, Code B.",WVDE Twitbot,15,6,2014-02-05 02:31:20,Tyler County School District,2014-02-05
565850845649313792,UPDATE: All schools in #Ritchie Co now closed Thu 2/12/15,WVDE Twitbot,20,13,2015-02-12 12:32:09,Ritchie County School District,2015-02-12
433782258156466176,All schools in #Barbour Co closed Thu 2/13/14,WVDE Twitbot,14,15,2014-02-13 01:58:44,Barbour County School District,2014-02-13
425950096681742338,UPDATE: All schools in #Gilmer Co now closed Wed 1/22/14,WVDE Twitbot,5,8,2014-01-22 11:16:31,Gilmer County School District,2014-01-22
569628248541401088,All schools in #Greenbrier Co closed Mon 2/23/15,WVDE Twitbot,17,29,2015-02-22 22:42:12,Greenbrier County School District,2015-02-23
690277725240758274,All schools in #Clay Co closed Fri 1/22/16 due to Weather conditions,WVDE Twitbot,22,22,2016-01-21 21:00:09,Clay County School District,2016-01-22
690088200832991232,UPDATE: All schools in #Upshur Co now closed Thu 1/21/16,WVDE Twitbot,14,17,2016-01-21 08:27:02,Upshur County School District,2016-01-21
690278799997550592,UPDATE: All schools in #Roane Co now closed Fri 1/22/16 due to anticipated snow,WVDE Twitbot,19,6,2016-01-21 21:04:25,Roane County School District,2016-01-22
297313809255780353,UPDATE: All schools in #Marshall Co now closed Fri 2/1/13,WVDE Twitbot,1,11,2013-02-01 12:01:50,Marshall County School District,2013-02-01
420134818685284352,All schools in #Grant Co closed Mon 1/6/14 due to inclement weather,WVDE Twitbot,8,10,2014-01-06 10:08:41,Grant County School District,2014-01-06
425588672419749888,All schools in #Mercer Co closed Tue 1/21/14 due to inclement weather,WVDE Twitbot,3,6,2014-01-21 11:20:21,Mercer County School District,2014-01-21
421613983121301504,UPDATE: All schools in #Grant Co now closed Fri 1/10/14 due to inclement weather and iced road conditions,WVDE Twitbot,4,5,2014-01-10 12:06:21,Grant County School District,2014-01-10
948542733815308288,UPDATE: All schools in #Jackson Co now closed Wed 1/3/18 due to a widespread power impacting multiple schools code A,WVDE Twitbot,18,9,2018-01-03 13:13:05,Jackson County School District,2018-01-03
691393844131319808,All schools in #Mercer Co closed Mon 1/25/16 due to inclement weather conditions,WVDE Twitbot,23,20,2016-01-24 22:55:12,Mercer County School District,2016-01-25
419059874895380480,UPDATE: All schools in #Raleigh Co now closed Fri 1/3/14 due to weather conditions,WVDE Twitbot,7,21,2014-01-03 10:57:14,Raleigh County School District,2014-01-03
552639631649685504,All schools in #Taylor Co closed Wed 1/7/15,WVDE Twitbot,7,17,2015-01-07 01:35:30,Taylor County School District,2015-01-07
263442139998998529,All schools in #Mercer Co closed Wed 10/31/12 due to inclement weather  #WVSandy,WVDE Twitbot,0,16,2012-10-31 00:47:55,Mercer County School District,2012-10-31
561092620043431936,All schools in #Preston Co closed Fri 1/30/15 due to winter weather conditions,WVDE Twitbot,8,6,2015-01-30 09:24:39,Preston County School District,2015-01-30
420146058602106880,UPDATE: All schools in #Boone Co now closed Mon 1/6/14 due to forecasted weather conditions,WVDE Twitbot,18,26,2014-01-06 10:53:20,Boone County School District,2014-01-06
294400972254507009,UPDATE: All schools in #Lewis Co now closed Thu 1/24/13,WVDE Twitbot,4,3,2013-01-24 11:07:16,Lewis County School District,2013-01-24
445485102705807360,All schools in #Taylor Co closed Mon 3/17/14,WVDE Twitbot,10,9,2014-03-17 09:01:39,Taylor County School District,2014-03-17
263094508915400705,All schools in #Doddridge Co closed Tue 10/30/12 due to inclement weather conditions  #WVSandy,WVDE Twitbot,1,2,2012-10-30 01:46:33,Doddridge County School District,2012-10-30
570189269555417090,UPDATE: All schools in #Tucker Co now closed Tue 2/24/15,WVDE Twitbot,10,6,2015-02-24 11:51:30,Tucker County School District,2015-02-24
438647990232682496,UPDATE: All schools in #Ritchie Co now closed Wed 2/26/14,WVDE Twitbot,3,7,2014-02-26 12:13:25,Ritchie County School District,2014-02-26
263224695745306624,UPDATE: All schools in #Kanawha Co now closed Tue 10/30/12 due to Winter weather conditions  #WVSandy,WVDE Twitbot,29,118,2012-10-30 10:23:52,Kanawha County School District,2012-10-30
425729427935227904,UPDATE: All schools in #Barbour Co now closed Wed 1/22/14 due to poor road conditions and frigid temperatures,WVDE Twitbot,10,22,2014-01-21 20:39:39,Barbour County School District,2014-01-22
431029899693129728,UPDATE: All schools in #Grant Co now closed Wed 2/5/14 due to inclement weather,WVDE Twitbot,3,1,2014-02-05 11:41:50,Grant County School District,2014-02-05
316139066334785536,UPDATE: All schools in #Ohio Co now closed Mon 3/25/13,WVDE Twitbot,3,15,2013-03-25 10:46:41,Ohio County School District,2013-03-25
440656204381958145,All schools in #Wood Co closed Tue 3/4/14 code B,WVDE Twitbot,79,189,2014-03-04 01:13:20,Wood County School District,2014-03-04
440483516539629568,UPDATE: All schools in #Jackson Co now closed Mon 3/3/14 code C,WVDE Twitbot,2,1,2014-03-03 13:47:08,Jackson County School District,2014-03-03
691968080415711232,UPDATE: All schools in #Tucker Co now closed Tue 1/26/16 due to road conditions,WVDE Twitbot,13,15,2016-01-26 12:57:01,Tucker County School District,2016-01-26
426450308932202496,All schools in #Barbour Co closed Fri 1/24/14 due to temperature related concerns.,WVDE Twitbot,7,12,2014-01-23 20:24:11,Barbour County School District,2014-01-24
568502040114143232,All schools in #Upshur Co closed Fri 2/20/15,WVDE Twitbot,17,16,2015-02-19 20:07:03,Upshur County School District,2015-02-20
953791074652352520,UPDATE: All schools in #Boone Co now closed Thu 1/18/18 due to the condition of many secondary roads,WVDE Twitbot,10,3,2018-01-18 00:48:07,Boone County School District,2018-01-18
420321340961595392,All schools in #Pocahontas Co closed Tue 1/7/14,WVDE Twitbot,3,13,2014-01-06 22:29:51,Pocahontas County School District,2014-01-07
573618738471256064,All schools in #Nicholas Co closed Fri 3/6/15,WVDE Twitbot,12,22,2015-03-05 22:58:59,Nicholas County School District,2015-03-06
687237756469309440,UPDATE: All schools in #Wetzel Co now closed Wed 1/13/16 due to Cold weather and road conditions,WVDE Twitbot,22,37,2016-01-13 11:40:24,Wetzel County School District,2016-01-13
568546709917343744,All schools in #Mineral Co closed Fri 2/20/15 due to cold temperatures,WVDE Twitbot,17,49,2015-02-19 23:04:33,Mineral County School District,2015-02-20
568178640749514752,All schools in #Calhoun Co closed Thu 2/19/15 due to Dangerous Temperatures code red,WVDE Twitbot,12,7,2015-02-18 22:41:58,Calhoun County School District,2015-02-19
433905684703637504,UPDATE: All schools in #Doddridge Co now closed Thu 2/13/14 due to inclement weather Staff does not have to report.,WVDE Twitbot,8,2,2014-02-13 10:09:11,Doddridge County School District,2014-02-13
419974542472146944,All schools in #Clay Co closed Mon 1/6/14 due to impending weather,WVDE Twitbot,16,34,2014-01-05 23:31:48,Clay County School District,2014-01-06
953774849226366977,All schools in #Wood Co closed Thu 1/18/18 due to inclement weather Employees will operate on a CODE A.,WVDE Twitbot,125,79,2018-01-17 23:43:38,Wood County School District,2018-01-18
432840918270345216,UPDATE: All schools in #Morgan Co now closed Mon 2/10/14 code A,WVDE Twitbot,5,13,2014-02-10 11:38:11,Morgan County School District,2014-02-10
690284421526786049,All schools in #Upshur Co closed Fri 1/22/16,WVDE Twitbot,25,26,2016-01-21 21:26:45,Upshur County School District,2016-01-22
561137375569805313,UPDATE: All schools in #Roane Co now closed Fri 1/30/15 due to snow &amp; ice,WVDE Twitbot,14,11,2015-01-30 12:22:30,Roane County School District,2015-01-30
690290101713240069,All schools in #Monongalia Co closed Fri 1/22/16,WVDE Twitbot,96,134,2016-01-21 21:49:19,Monongalia County School District,2016-01-22
264136537644621824,All schools in #Braxton Co closed Fri 11/2/12 due to electrical outages and road conditions  #WVSandy,WVDE Twitbot,1,12,2012-11-01 22:47:12,Braxton County School District,2012-11-02
948900771315310592,UPDATE: All schools in #Wirt Co now closed Thu 1/4/18 due to Extreme Cold and road conditions Use Snow Day Leaning Packets,WVDE Twitbot,6,1,2018-01-04 12:55:48,Wirt County School District,2018-01-04
430311262845538304,UPDATE: All schools in #Cabell Co now closed Mon 2/3/14 due to inclement weather code red,WVDE Twitbot,28,49,2014-02-03 12:06:14,Cabell County School District,2014-02-03
432845506981937152,UPDATE: All schools in #Fayette Co now closed Mon 2/10/14 due to inclement weather code A,WVDE Twitbot,16,31,2014-02-10 11:56:25,Fayette County School District,2014-02-10
554616566344863744,UPDATE: All schools in #Grant Co now closed Mon 1/12/15,WVDE Twitbot,5,5,2015-01-12 12:31:08,Grant County School District,2015-01-12
953208935829393408,UPDATE: All schools in #Mingo Co now closed Tue 1/16/18 Code Orange,WVDE Twitbot,27,19,2018-01-16 10:14:54,Mingo County School District,2018-01-16
428350794648129536,UPDATE: All schools in #Kanawha Co now closed Wed 1/29/14 due to wintery conditions code A,WVDE Twitbot,98,272,2014-01-29 02:16:02,Kanawha County School District,2014-01-29
567447040591167488,All schools in #Roane Co closed Tue 2/17/15 due to snow,WVDE Twitbot,11,15,2015-02-16 22:14:51,Roane County School District,2015-02-17
425736873604968448,All schools in #Upshur Co closed Wed 1/22/14,WVDE Twitbot,10,39,2014-01-21 21:09:15,Upshur County School District,2014-01-22
262711221252411392,All schools in #Hardy Co closed Mon 10/29/12 Liberal leave for central office staff.,WVDE Twitbot,0,3,2012-10-29 00:23:30,Hardy County School District,2012-10-29
425570915871498240,All schools in #Hancock Co closed Tue 1/21/14 due to weather,WVDE Twitbot,6,8,2014-01-21 10:09:47,Hancock County School District,2014-01-21
448759901188136960,UPDATE: All schools in #Pocahontas Co now closed Wed 3/26/14,WVDE Twitbot,6,7,2014-03-26 09:54:32,Pocahontas County School District,2014-03-26
445365678522900480,All schools in #Upshur Co closed Mon 3/17/14,WVDE Twitbot,19,31,2014-03-17 01:07:06,Upshur County School District,2014-03-17
263245997889708032,UPDATE: All schools in #Logan Co now closed Tue 10/30/12  #WVSandy,WVDE Twitbot,1,4,2012-10-30 11:48:31,Logan County School District,2012-10-30
568520736731631616,All schools in #Monroe Co closed Fri 2/20/15,WVDE Twitbot,10,15,2015-02-19 21:21:20,Monroe County School District,2015-02-20
264008052540313601,All schools in #Webster Co closed Fri 11/2/12 due to Weather Conditions  #WVSandy,WVDE Twitbot,0,4,2012-11-01 14:16:39,Webster County School District,2012-11-02
690328120168189956,All schools in #Logan Co closed Fri 1/22/16,WVDE Twitbot,22,17,2016-01-22 00:20:24,Logan County School District,2016-01-22
953725347278749698,All schools in #Lincoln Co closed Thu 1/18/18,WVDE Twitbot,28,15,2018-01-17 20:26:56,Lincoln County School District,2018-01-18
567110704717914112,All schools in #Boone Co closed Mon 2/16/15 No employees are to report - All facilities closed.,WVDE Twitbot,42,57,2015-02-15 23:58:23,Boone County School District,2015-02-16
697368705680994304,UPDATE: All schools in #Clay Co now closed Wed 2/10/16 due to Weather Conditions,WVDE Twitbot,13,11,2016-02-10 10:37:10,Clay County School District,2016-02-10
263381183293964288,All schools in #McDowell Co closed Wed 10/31/12 due to Inclement weather  #WVSandy,WVDE Twitbot,0,5,2012-10-30 20:45:42,McDowell County School District,2012-10-31
567432637720313862,All schools in #Summers Co closed Tue 2/17/15,WVDE Twitbot,13,5,2015-02-16 21:17:37,Summers County School District,2015-02-17
552428933556473857,All schools in #Barbour Co closed Tue 1/6/15 due to Road Conditions,WVDE Twitbot,14,5,2015-01-06 11:38:16,Barbour County School District,2015-01-06
689999473448239104,All schools in #Greenbrier Co closed Thu 1/21/16 due to HAZARDOUS  CONDITIONS,WVDE Twitbot,34,49,2016-01-21 02:34:28,Greenbrier County School District,2016-01-21
420148004998234112,UPDATE: All schools in #Marshall Co now closed Mon 1/6/14,WVDE Twitbot,8,29,2014-01-06 11:01:05,Marshall County School District,2014-01-06
569594306635407360,All schools in #Summers Co closed Mon 2/23/15,WVDE Twitbot,10,4,2015-02-22 20:27:19,Summers County School District,2015-02-23
426452841859805186,All schools in #Raleigh Co closed Fri 1/24/14 due to weather conditions,WVDE Twitbot,11,30,2014-01-23 20:34:15,Raleigh County School District,2014-01-24
963025304666234880,UPDATE: All schools in #Mingo Co now closed Mon 2/12/18 Employees Code Orange.,WVDE Twitbot,24,17,2018-02-12 12:21:39,Mingo County School District,2018-02-12
953731356256849922,All schools in #Putnam Co closed Thu 1/18/18,WVDE Twitbot,98,74,2018-01-17 20:50:49,Putnam County School District,2018-01-18
568513334481256449,All schools in #Wyoming Co closed Fri 2/20/15 due to inclement weather,WVDE Twitbot,14,22,2015-02-19 20:51:56,Wyoming County School District,2015-02-20
445478688126038017,All schools in #Doddridge Co closed Mon 3/17/14 due to in clement weather Staff does not have to report.,WVDE Twitbot,2,10,2014-03-17 08:36:10,Doddridge County School District,2014-03-17
438639920605700096,UPDATE: All schools in #Putnam Co now closed Wed 2/26/14 due to Weather Conditions,WVDE Twitbot,41,98,2014-02-26 11:41:21,Putnam County School District,2014-02-26
418926754447638528,All schools in #Upshur Co closed Fri 1/3/14,WVDE Twitbot,17,42,2014-01-03 02:08:16,Upshur County School District,2014-01-03
438642621552930817,UPDATE: All schools in #Braxton Co now closed Wed 2/26/14,WVDE Twitbot,2,8,2014-02-26 11:52:05,Braxton County School District,2014-02-26
433803490217832448,All schools in #Upshur Co closed Thu 2/13/14,WVDE Twitbot,18,27,2014-02-13 03:23:06,Upshur County School District,2014-02-13
949032888019881984,UPDATE: All schools in #Wayne Co now closed Fri 1/5/18 due to Sub-zero wind chill,WVDE Twitbot,17,14,2018-01-04 21:40:47,Wayne County School District,2018-01-05
953236488577306625,UPDATE: All schools in #Doddridge Co now closed Tue 1/16/18 due to inclement weather code C,WVDE Twitbot,6,7,2018-01-16 12:04:23,Doddridge County School District,2018-01-16
569625601067388928,All schools in #Raleigh Co closed Mon 2/23/15,WVDE Twitbot,30,62,2015-02-22 22:31:41,Raleigh County School District,2015-02-23
431009314036129792,All schools in #Brooke Co closed Wed 2/5/14,WVDE Twitbot,6,7,2014-02-05 10:20:02,Brooke County School District,2014-02-05
427951184746250240,UPDATE: All schools in #Cabell Co now closed Tue 1/28/14 due to inclement weather code red,WVDE Twitbot,37,66,2014-01-27 23:48:08,Cabell County School District,2014-01-28
427940751180595200,All schools in #Harrison Co closed Tue 1/28/14,WVDE Twitbot,33,122,2014-01-27 23:06:40,Harrison County School District,2014-01-28
950308854977482752,UPDATE: All schools in #Hardy Co now closed Mon 1/8/18,WVDE Twitbot,6,8,2018-01-08 10:11:01,Hardy County School District,2018-01-08
427934527919378432,All schools in #Marshall Co closed Tue 1/28/14,WVDE Twitbot,7,16,2014-01-27 22:41:56,Marshall County School District,2014-01-28
294398475867668481,UPDATE: All schools in #Pleasants Co now closed Thu 1/24/13,WVDE Twitbot,2,4,2013-01-24 10:57:20,Pleasants County School District,2013-01-24
569824933418651648,UPDATE: All schools in #Lewis Co now closed Mon 2/23/15,WVDE Twitbot,13,11,2015-02-23 11:43:45,Lewis County School District,2015-02-23
573098286288138240,All schools in #Boone Co closed Wed 3/4/15 due to several areas experiencing high water,WVDE Twitbot,21,16,2015-03-04 12:30:53,Boone County School District,2015-03-04
176634346919301120,UPDATE: All schools in #Raleigh Co now closed Mon 3/5/12 due to Inclement Weather,WVDE Twitbot,0,13,2012-03-05 11:44:44,Raleigh County School District,2012-03-05
445484615227027456,All schools in #Berkeley Co closed Mon 3/17/14 due to weather,WVDE Twitbot,23,59,2014-03-17 08:59:43,Berkeley County School District,2014-03-17
425572248699674624,All schools in #Mineral Co closed Tue 1/21/14 due to weather,WVDE Twitbot,3,14,2014-01-21 10:15:05,Mineral County School District,2014-01-21
263395703840202752,All schools in #Fayette Co closed Wed 10/31/12,WVDE Twitbot,2,14,2012-10-30 21:43:24,Fayette County School District,2012-10-31
263060875706003457,UPDATE: All schools in #Tucker Co now closed Tue 10/30/12  #WVSandy,WVDE Twitbot,0,0,2012-10-29 23:32:54,Tucker County School District,2012-10-30
425740942742544385,All schools in #Raleigh Co closed Wed 1/22/14 due to weather conditions,WVDE Twitbot,11,43,2014-01-21 21:25:25,Raleigh County School District,2014-01-22
427938849881202688,All schools in #Brooke Co closed Tue 1/28/14,WVDE Twitbot,3,3,2014-01-27 22:59:07,Brooke County School District,2014-01-28
426089795689779200,All schools in #Taylor Co closed Thu 1/23/14,WVDE Twitbot,6,9,2014-01-22 20:31:38,Taylor County School District,2014-01-23
573634420680323073,All schools in #Grant Co closed Fri 3/6/15,WVDE Twitbot,9,6,2015-03-06 00:01:18,Grant County School District,2015-03-06
958308595879342080,UPDATE: All schools in #Webster Co now closed Tue 1/30/18 due to Weather and Road Conditions,WVDE Twitbot,7,5,2018-01-30 11:59:08,Webster County School District,2018-01-30
559655901884596225,All schools in #Hardy Co closed Mon 1/26/15,WVDE Twitbot,15,27,2015-01-26 10:15:39,Hardy County School District,2015-01-26
419071848044052481,UPDATE: All schools in #Ohio Co now closed Fri 1/3/14,WVDE Twitbot,19,42,2014-01-03 11:44:49,Ohio County School District,2014-01-03
572355931117395968,UPDATE: All schools in #Preston Co now closed Mon 3/2/15 due to poor secondary road conditions,WVDE Twitbot,8,5,2015-03-02 11:21:02,Preston County School District,2015-03-02
435755478769872896,UPDATE: All schools in #Greenbrier Co now closed Tue 2/18/14,WVDE Twitbot,18,35,2014-02-18 12:39:36,Greenbrier County School District,2014-02-18
421448555480367104,"All schools in #Kanawha Co closed Fri 1/10/14 due to contaminated water situation Schools,facilities and Central Office.",WVDE Twitbot,90,277,2014-01-10 01:09:00,Kanawha County School District,2014-01-10
699034838620336128,All schools in #Jackson Co closed Mon 2/15/16 code A,WVDE Twitbot,32,43,2016-02-15 00:57:47,Jackson County School District,2016-02-15
425566119823679488,All schools in #Pendleton Co closed Tue 1/21/14,WVDE Twitbot,8,6,2014-01-21 09:50:44,Pendleton County School District,2014-01-21
433902337417957377,All schools in #Doddridge Co closed Thu 2/13/14 due to inclement weather,WVDE Twitbot,5,4,2014-02-13 09:55:53,Doddridge County School District,2014-02-13
433900308419194880,All schools in #Lewis Co closed Thu 2/13/14,WVDE Twitbot,6,10,2014-02-13 09:47:49,Lewis County School District,2014-02-13
435383216262766592,UPDATE: All schools in #Ritchie Co now closed Mon 2/17/14,WVDE Twitbot,6,8,2014-02-17 12:00:22,Ritchie County School District,2014-02-17
958298932643233792,UPDATE: All schools in #Fayette Co now closed Tue 1/30/18 due to inclement weather,WVDE Twitbot,22,21,2018-01-30 11:20:44,Fayette County School District,2018-01-30
298228511548796928,All schools in #Monongalia Co closed Mon 2/4/13 due to inclement weather,WVDE Twitbot,10,60,2013-02-04 00:36:32,Monongalia County School District,2013-02-04
841954011997700097,UPDATE: All schools in #Tucker Co now closed Wed 3/15/17,WVDE Twitbot,4,7,2017-03-15 10:07:33,Tucker County School District,2017-03-15
570883682497646593,UPDATE: All schools in #Raleigh Co now closed Thu 2/26/15,WVDE Twitbot,20,51,2015-02-26 09:50:51,Raleigh County School District,2015-02-26
418930636226039808,All schools in #Marion Co closed Fri 1/3/14 due to Inclement Weather,WVDE Twitbot,18,30,2014-01-03 02:23:41,Marion County School District,2014-01-03
586119859110596609,All schools in #Lewis Co closed Thu 4/9/15,WVDE Twitbot,7,12,2015-04-09 10:53:58,Lewis County School District,2015-04-09
552411446085443584,All schools in #Wood Co closed Tue 1/6/15 due to inclement weather Only 261 Day employees report for work.,WVDE Twitbot,121,168,2015-01-06 10:28:46,Wood County School District,2015-01-06
959363956694573058,All schools in #Greenbrier Co closed Fri 2/2/18 due to Weather conditions,WVDE Twitbot,7,4,2018-02-02 09:52:46,Greenbrier County School District,2018-02-02
950318556297728000,UPDATE: All schools in #Taylor Co now closed Mon 1/8/18,WVDE Twitbot,15,5,2018-01-08 10:49:34,Taylor County School District,2018-01-08
566185794839543808,UPDATE: All schools in #Upshur Co now closed Fri 2/13/15,WVDE Twitbot,3,11,2015-02-13 10:43:07,Upshur County School District,2015-02-13
567435741652086784,All schools in #Kanawha Co closed Tue 2/17/15 due to Inclement Weather code B,WVDE Twitbot,199,398,2015-02-16 21:29:57,Kanawha County School District,2015-02-17
176639612754722816,UPDATE: All schools in #Nicholas Co now closed Mon 3/5/12 due to Bad Weather,WVDE Twitbot,0,4,2012-03-05 12:05:40,Nicholas County School District,2012-03-05
573416440298131456,All schools in #Tucker Co closed Thu 3/5/15,WVDE Twitbot,5,2,2015-03-05 09:35:07,Tucker County School District,2015-03-05
294383348053315584,All schools in #Roane Co closed Thu 1/24/13 due to Snow,WVDE Twitbot,4,5,2013-01-24 09:57:14,Roane County School District,2013-01-24
440416997654798337,All schools in #Fayette Co closed Mon 3/3/14 due to inclement weather code B,WVDE Twitbot,4,11,2014-03-03 09:22:49,Fayette County School District,2014-03-03
440791424120803329,UPDATE: All schools in #Braxton Co now closed Tue 3/4/14 Staff please report on a two-hour delay.,WVDE Twitbot,6,12,2014-03-04 10:10:39,Braxton County School District,2014-03-04
428317672867000320,All schools in #Preston Co closed Wed 1/29/14,WVDE Twitbot,2,10,2014-01-29 00:04:25,Preston County School District,2014-01-29
438296101285011456,UPDATE: All schools in #Upshur Co now closed Tue 2/25/14,WVDE Twitbot,6,12,2014-02-25 12:55:08,Upshur County School District,2014-02-25
428500959040262144,UPDATE: All schools in #Pocahontas Co now closed Wed 1/29/14,WVDE Twitbot,5,6,2014-01-29 12:12:44,Pocahontas County School District,2014-01-29
426144108261154817,All schools in #Webster Co closed Thu 1/23/14 due to Weather Conditions,WVDE Twitbot,6,9,2014-01-23 00:07:27,Webster County School District,2014-01-23
568170357548556288,All schools in #Taylor Co closed Thu 2/19/15,WVDE Twitbot,18,17,2015-02-18 22:09:03,Taylor County School District,2015-02-19
294749969032822784,All schools in #Taylor Co closed Fri 1/25/13,WVDE Twitbot,1,5,2013-01-25 10:14:03,Taylor County School District,2013-01-25
418943602924847104,UPDATE: All schools in #Wirt Co now closed Fri 1/3/14 Due to inclement weather.,WVDE Twitbot,14,22,2014-01-03 03:15:13,Wirt County School District,2014-01-03
949046352981495808,All schools in #Pleasants Co closed Fri 1/5/18,WVDE Twitbot,16,12,2018-01-04 22:34:17,Pleasants County School District,2018-01-05
568199640073564160,All schools in #Pleasants Co closed Thu 2/19/15,WVDE Twitbot,26,18,2015-02-19 00:05:25,Pleasants County School District,2015-02-19
953403792908840961,All schools in #Boone Co closed Wed 1/17/18,WVDE Twitbot,27,13,2018-01-16 23:09:12,Boone County School District,2018-01-17
573299959484841984,All schools in #Harrison Co closed Thu 3/5/15,WVDE Twitbot,57,166,2015-03-05 01:52:16,Harrison County School District,2015-03-05
950144421663735808,All schools in #Calhoun Co closed Mon 1/8/18 code red,WVDE Twitbot,9,3,2018-01-07 23:17:37,Calhoun County School District,2018-01-08
438297226440241153,"UPDATE: All schools in #Tyler Co now closed Tue 2/25/14 All evening events are cancelled.  Employees, Code C.",WVDE Twitbot,8,7,2014-02-25 12:59:36,Tyler County School District,2014-02-25
445516634665414656,UPDATE: All schools in #Putnam Co now closed Mon 3/17/14 due to Weather conditions,WVDE Twitbot,52,110,2014-03-17 11:06:57,Putnam County School District,2014-03-17
309238907420147713,UPDATE: All schools in #Fayette Co now closed Wed 3/6/13 code B,WVDE Twitbot,2,14,2013-03-06 09:47:55,Fayette County School District,2013-03-06
297276820921929728,All schools in #Webster Co closed Fri 2/1/13 due to Weather Conditions,WVDE Twitbot,1,8,2013-02-01 09:34:51,Webster County School District,2013-02-01
949019944875937794,All schools in #Harrison Co closed Fri 1/5/18,WVDE Twitbot,40,51,2018-01-04 20:49:21,Harrison County School District,2018-01-05
298399804340445184,UPDATE: All schools in #Ohio Co now closed Mon 2/4/13,WVDE Twitbot,4,17,2013-02-04 11:57:12,Ohio County School District,2013-02-04
154136556779732993,UPDATE: All schools in #Fayette Co now closed Tue 1/3/12 due to inclement weather,WVDE Twitbot,1,2,2012-01-03 09:46:33,Fayette County School District,2012-01-03
949092061604712448,UPDATE: All schools in #Jackson Co now closed Fri 1/5/18 code A,WVDE Twitbot,40,32,2018-01-05 01:35:55,Jackson County School District,2018-01-05
297286731894509568,All schools in #Boone Co closed Fri 2/1/13 due to the condition of the roadways,WVDE Twitbot,4,9,2013-02-01 10:14:14,Boone County School District,2013-02-01
826038795090919425,UPDATE: All schools in #Mason Co now closed Mon 1/30/17 due to Inclement weather code red,WVDE Twitbot,20,25,2017-01-30 12:06:10,Mason County School District,2017-01-30
689413551799164931,UPDATE: All schools in #Pendleton Co now closed Tue 1/19/16,WVDE Twitbot,12,7,2016-01-19 11:46:14,Pendleton County School District,2016-01-19
702823642648944640,All schools in #Lewis Co closed Thu 2/25/16 due to power outages in the area,WVDE Twitbot,28,11,2016-02-25 11:53:08,Lewis County School District,2016-02-25
291849194782724097,All schools in #Fayette Co closed Thu 1/17/13 due to incoming inclement weather,WVDE Twitbot,4,25,2013-01-17 10:07:24,Fayette County School District,2013-01-17
428331228433879040,"All schools in #Braxton Co closed Wed 1/29/14 Staff, please report on a two-hour delay.",WVDE Twitbot,5,13,2014-01-29 00:58:17,Braxton County School District,2014-01-29
953238664334757888,UPDATE: All schools in #Upshur Co now closed Tue 1/16/18,WVDE Twitbot,14,5,2018-01-16 12:13:02,Upshur County School District,2018-01-16
559682354680451073,UPDATE: All schools in #Pendleton Co now closed Mon 1/26/15,WVDE Twitbot,4,2,2015-01-26 12:00:46,Pendleton County School District,2015-01-26
690271573304086528,All schools in #Harrison Co closed Fri 1/22/16,WVDE Twitbot,70,163,2016-01-21 20:35:42,Harrison County School District,2016-01-22
440278514701316096,All schools in #Brooke Co closed Mon 3/3/14,WVDE Twitbot,9,12,2014-03-03 00:12:32,Brooke County School District,2014-03-03
691332604314947585,1/2 All schools in #Braxton Co closed Mon 1/25/16,WVDE Twitbot,19,15,2016-01-24 18:51:51,Braxton County School District,2016-01-25
703191979585314816,UPDATE: All schools in #Mercer Co now closed Fri 2/26/16 due to Inclement weather conditions,WVDE Twitbot,8,9,2016-02-26 12:16:47,Mercer County School District,2016-02-26
690136037356638209,UPDATE: All schools in #Harrison Co now closed Thu 1/21/16,WVDE Twitbot,59,108,2016-01-21 11:37:08,Harrison County School District,2016-01-21
410370075649003520,UPDATE: All schools in #Fayette Co now closed Tue 12/10/13 due to inclement weather,WVDE Twitbot,19,39,2013-12-10 11:27:05,Fayette County School District,2013-12-10
691694208785240066,All schools in #Putnam Co closed Tue 1/26/16 due to Weather conditions,WVDE Twitbot,132,265,2016-01-25 18:48:45,Putnam County School District,2016-01-26
296958313038479360,UPDATE: All schools in #Nicholas Co now closed Thu 1/31/13 due to Bad Weather!,WVDE Twitbot,0,15,2013-01-31 12:29:13,Nicholas County School District,2013-01-31
699168763573374976,All schools in #Randolph Co closed Mon 2/15/16,WVDE Twitbot,17,22,2016-02-15 09:49:57,Randolph County School District,2016-02-15
573570396848529410,All schools in #Jackson Co closed Fri 3/6/15 code A,WVDE Twitbot,21,23,2015-03-05 19:46:53,Jackson County School District,2015-03-06
418940693675913216,UPDATE: All schools in #Pleasants Co now closed Fri 1/3/14,WVDE Twitbot,11,18,2014-01-03 03:03:39,Pleasants County School District,2014-01-03
426155027715989505,All schools in #Mercer Co closed Thu 1/23/14 due to inclement weather,WVDE Twitbot,2,9,2014-01-23 00:50:50,Mercer County School District,2014-01-23
434051554568462336,All schools in #Jefferson Co closed Fri 2/14/14 due to snow,WVDE Twitbot,12,30,2014-02-13 19:48:49,Jefferson County School District,2014-02-14
294386293578809344,All schools in #Randolph Co closed Thu 1/24/13 due to snow,WVDE Twitbot,4,21,2013-01-24 10:08:56,Randolph County School District,2013-01-24
159224290057781248,All schools in #Barbour Co closed Tue 1/17/12 due to Water outages at multiple schools,WVDE Twitbot,1,2,2012-01-17 10:43:23,Barbour County School District,2012-01-17
553155089666695169,UPDATE: All schools in #Pendleton Co now closed Thu 1/8/15,WVDE Twitbot,4,4,2015-01-08 11:43:45,Pendleton County School District,2015-01-08
420129485644521472,All schools in #Fayette Co closed Mon 1/6/14 due to inclement weather,WVDE Twitbot,13,42,2014-01-06 09:47:29,Fayette County School District,2014-01-06
440307552375808000,All schools in #Randolph Co closed Mon 3/3/14,WVDE Twitbot,21,40,2014-03-03 02:07:55,Randolph County School District,2014-03-03
445375165799481345,All schools in #Clay Co closed Mon 3/17/14 due to weather conditions,WVDE Twitbot,15,27,2014-03-17 01:44:48,Clay County School District,2014-03-17
953233525981007872,UPDATE: All schools in #Taylor Co now closed Tue 1/16/18,WVDE Twitbot,12,14,2018-01-16 11:52:37,Taylor County School District,2018-01-16
687068793672187905,All schools in #Ohio Co closed Wed 1/13/16,WVDE Twitbot,42,105,2016-01-13 00:29:00,Ohio County School District,2016-01-13
405306247986954240,All schools in #Marshall Co closed Tue 11/26/13,WVDE Twitbot,2,18,2013-11-26 12:05:14,Marshall County School District,2013-11-26
263731692622209025,All schools in #Preston Co closed Thu 11/1/12 Emergency personel should report. #WVSandy,WVDE Twitbot,0,8,2012-10-31 19:58:30,Preston County School District,2012-11-01
426164248252002304,All schools in #Pleasants Co closed Thu 1/23/14,WVDE Twitbot,8,22,2014-01-23 01:27:29,Pleasants County School District,2014-01-23
154169604791480320,UPDATE: All schools in #Pendleton Co now closed Tue 1/3/12 due to wind chill/snow,WVDE Twitbot,0,0,2012-01-03 11:57:52,Pendleton County School District,2012-01-03
294745963254403072,All schools in #Greenbrier Co closed Fri 1/25/13 due to Weather conditions,WVDE Twitbot,4,10,2013-01-25 09:58:08,Greenbrier County School District,2013-01-25
448759432172691456,All schools in #Mercer Co closed Wed 3/26/14 due to inclement weather,WVDE Twitbot,7,5,2014-03-26 09:52:40,Mercer County School District,2014-03-26
841958685060562947,UPDATE: All schools in #McDowell Co now closed Wed 3/15/17,WVDE Twitbot,5,2,2017-03-15 10:26:08,McDowell County School District,2017-03-15
292014038081228801,All schools in #Monroe Co closed Fri 1/18/13,WVDE Twitbot,1,5,2013-01-17 21:02:26,Monroe County School District,2013-01-18
697374929977786369,UPDATE: All schools in #Preston Co now closed Wed 2/10/16 due to winter weather conditions,WVDE Twitbot,8,3,2016-02-10 11:01:54,Preston County School District,2016-02-10
309469622300721154,All schools in #Pendleton Co closed Thu 3/7/13,WVDE Twitbot,1,6,2013-03-07 01:04:42,Pendleton County School District,2013-03-07
841807418912780288,All schools in #Randolph Co closed Wed 3/15/17,WVDE Twitbot,29,21,2017-03-15 00:25:03,Randolph County School District,2017-03-15
412563503803682818,UPDATE: All schools in #Marion Co now closed Mon 12/16/13 due to BLACK ICE ON THE ROADS,WVDE Twitbot,13,27,2013-12-16 12:42:59,Marion County School District,2013-12-16
697220000613060608,All schools in #Wetzel Co closed Wed 2/10/16 due to Road Conditions,WVDE Twitbot,15,39,2016-02-10 00:46:16,Wetzel County School District,2016-02-10
425812705996324865,All schools in #Wyoming Co closed Wed 1/22/14 due to inclement weather,WVDE Twitbot,8,3,2014-01-22 02:10:34,Wyoming County School District,2014-01-22
419057763419840512,UPDATE: All schools in #Randolph Co now closed Fri 1/3/14,WVDE Twitbot,12,8,2014-01-03 10:48:51,Randolph County School District,2014-01-03
428280894726496256,All schools in #Wirt Co closed Wed 1/29/14 Staff will report at 9:30.,WVDE Twitbot,9,20,2014-01-28 21:38:17,Wirt County School District,2014-01-29
573301599881302016,"All schools in #Wood Co closed Thu 3/5/15 code C Only designated, essential staff report to work.",WVDE Twitbot,101,176,2015-03-05 01:58:47,Wood County School District,2015-03-05
440626919004839936,All schools in #Nicholas Co closed Tue 3/4/14,WVDE Twitbot,17,35,2014-03-03 23:16:58,Nicholas County School District,2014-03-04
426142988679786496,All schools in #Calhoun Co closed Thu 1/23/14 due to Frigid Wind Chill Temperatures,WVDE Twitbot,8,7,2014-01-23 00:03:00,Calhoun County School District,2014-01-23
949054702330793984,All schools in #Boone Co closed Fri 1/5/18 due to predicted wind chill values,WVDE Twitbot,19,16,2018-01-04 23:07:28,Boone County School District,2018-01-05
561093357129465857,All schools in #Fayette Co closed Fri 1/30/15 due to inclement weather,WVDE Twitbot,32,50,2015-01-30 09:27:35,Fayette County School District,2015-01-30
410386423460540416,UPDATE: All schools in #Putnam Co now closed Tue 12/10/13 due to the weather conditions,WVDE Twitbot,38,101,2013-12-10 12:32:02,Putnam County School District,2013-12-10
440629880838180865,All schools in #Cabell Co closed Tue 3/4/14 due to inclement weather code red,WVDE Twitbot,43,83,2014-03-03 23:28:44,Cabell County School District,2014-03-04
303834132159557632,UPDATE: All schools in #Pocahontas Co now closed Tue 2/19/13 due to snow,WVDE Twitbot,0,10,2013-02-19 11:51:16,Pocahontas County School District,2013-02-19
552430171333341184,UPDATE: All schools in #Monongalia Co now closed Tue 1/6/15,WVDE Twitbot,35,69,2015-01-06 11:43:11,Monongalia County School District,2015-01-06
573085393375125504,All schools in #Wyoming Co closed Wed 3/4/15 due to high water,WVDE Twitbot,8,26,2015-03-04 11:39:39,Wyoming County School District,2015-03-04
692754029328404480,All schools in #Berkeley Co closed Fri 1/29/16 Evening activities are canceled as well.,WVDE Twitbot,41,69,2016-01-28 17:00:05,Berkeley County School District,2016-01-29
566200567182413825,UPDATE: All schools in #Pendleton Co now closed Fri 2/13/15,WVDE Twitbot,7,8,2015-02-13 11:41:49,Pendleton County School District,2015-02-13
298397208028512256,UPDATE: All schools in #Marshall Co now closed Mon 2/4/13,WVDE Twitbot,2,11,2013-02-04 11:46:53,Marshall County School District,2013-02-04
433769015115124736,All schools in #Hardy Co closed Thu 2/13/14,WVDE Twitbot,14,33,2014-02-13 01:06:06,Hardy County School District,2014-02-13
949025815018266624,All schools in #Ritchie Co closed Fri 1/5/18,WVDE Twitbot,17,22,2018-01-04 21:12:41,Ritchie County School District,2018-01-05
959385522794885120,UPDATE: All schools in #Preston Co now closed Fri 2/2/18 due to winter weather conditions,WVDE Twitbot,4,0,2018-02-02 11:18:27,Preston County School District,2018-02-02
691733437892395014,All schools in #Gilmer Co closed Tue 1/26/16,WVDE Twitbot,13,12,2016-01-25 21:24:38,Gilmer County School District,2016-01-26
826015068559200256,UPDATE: All schools in #Fayette Co now closed Mon 1/30/17 due to inclement weather,WVDE Twitbot,24,45,2017-01-30 10:31:53,Fayette County School District,2017-01-30
157787849696100353,UPDATE: All schools in #Nicholas Co now closed Fri 1/13/12 due to Bad Weather!,WVDE Twitbot,0,2,2012-01-13 11:35:29,Nicholas County School District,2012-01-13
567988261458722816,UPDATE: All schools in #Nicholas Co now closed Wed 2/18/15 due to weather conditions,WVDE Twitbot,6,21,2015-02-18 10:05:28,Nicholas County School District,2015-02-18
697390519966638080,UPDATE: All schools in #Boone Co now closed Wed 2/10/16,WVDE Twitbot,14,14,2016-02-10 12:03:51,Boone County School District,2016-02-10
552787231673704448,UPDATE: All schools in #Monongalia Co now closed Wed 1/7/15,WVDE Twitbot,57,93,2015-01-07 11:22:00,Monongalia County School District,2015-01-07
826048005853822976,UPDATE: All schools in #Doddridge Co now closed Mon 1/30/17 due to inclement weather,WVDE Twitbot,10,9,2017-01-30 12:42:46,Doddridge County School District,2017-01-30
568555584712249344,All schools in #Logan Co closed Fri 2/20/15,WVDE Twitbot,8,11,2015-02-19 23:39:49,Logan County School District,2015-02-20
570890792472076288,All schools in #Greenbrier Co closed Thu 2/26/15,WVDE Twitbot,18,24,2015-02-26 10:19:06,Greenbrier County School District,2015-02-26
427610097137643520,All schools in #Calhoun Co closed Mon 1/27/14 due to Inclement Weather and Secondary Road Conditions,WVDE Twitbot,8,11,2014-01-27 01:12:46,Calhoun County School District,2014-01-27
420136889052430336,All schools in #Kanawha Co closed Mon 1/6/14 due to inclement weather code B,WVDE Twitbot,81,215,2014-01-06 10:16:54,Kanawha County School District,2014-01-06
568187235004231680,All schools in #Gilmer Co closed Thu 2/19/15,WVDE Twitbot,10,7,2015-02-18 23:16:07,Gilmer County School District,2015-02-19
291850986723606528,All schools in #Greenbrier Co closed Thu 1/17/13 All schools closed,WVDE Twitbot,0,14,2013-01-17 10:14:32,Greenbrier County School District,2013-01-17
262691318801764352,All schools in #Berkeley Co closed Mon 10/29/12 All evening activities are cancelled.,WVDE Twitbot,0,13,2012-10-28 23:04:25,Berkeley County School District,2012-10-29
294749097389342720,All schools in #Raleigh Co closed Fri 1/25/13 due to pending weather conditions,WVDE Twitbot,3,14,2013-01-25 10:10:35,Raleigh County School District,2013-01-25
434109766801977344,All schools in #Lincoln Co closed Fri 2/14/14,WVDE Twitbot,25,70,2014-02-13 23:40:08,Lincoln County School District,2014-02-14
567292837868617728,UPDATE: All schools in #Tyler Co now closed Mon 2/16/15 This closing notice is for all employees.,WVDE Twitbot,10,10,2015-02-16 12:02:06,Tyler County School District,2015-02-16
264099149618757634,All schools in #Barbour Co closed Fri 11/2/12 Lack of electric and road conditions. #WVSandy,WVDE Twitbot,0,2,2012-11-01 20:18:38,Barbour County School District,2012-11-02
423203276788490240,All schools in #Lincoln Co closed Wed 1/15/14,WVDE Twitbot,24,60,2014-01-14 21:21:38,Lincoln County School District,2014-01-15
699178068355710976,All schools in #Mineral Co closed Mon 2/15/16 due to inclement weather,WVDE Twitbot,35,39,2016-02-15 10:26:56,Mineral County School District,2016-02-15
552793983249027072,UPDATE: All schools in #Wetzel Co now closed Wed 1/7/15,WVDE Twitbot,17,37,2015-01-07 11:48:50,Wetzel County School District,2015-01-07
690269492971192320,All schools in #Braxton Co closed Fri 1/22/16,WVDE Twitbot,13,17,2016-01-21 20:27:26,Braxton County School District,2016-01-22
948185729800261633,"1/2 UPDATE: All schools in #Wirt Co now closed Tue 1/2/18 due to Severe cold, water main break",WVDE Twitbot,11,2,2018-01-02 13:34:29,Wirt County School District,2018-01-02
953436713283674112,All schools in #Harrison Co closed Wed 1/17/18,WVDE Twitbot,71,66,2018-01-17 01:20:01,Harrison County School District,2018-01-17
573650549305909249,All schools in #Pendleton Co closed Fri 3/6/15,WVDE Twitbot,7,4,2015-03-06 01:05:23,Pendleton County School District,2015-03-06
316134558644969472,UPDATE: All schools in #Fayette Co now closed Mon 3/25/13 code B,WVDE Twitbot,3,17,2013-03-25 10:28:46,Fayette County School District,2013-03-25
948542020687101952,UPDATE: All schools in #Tucker Co now closed Wed 1/3/18,WVDE Twitbot,2,1,2018-01-03 13:10:15,Tucker County School District,2018-01-03
316157164794290177,1/2 UPDATE: All schools in #Tyler Co now closed Mon 3/25/13 due to dangerous road conditions,WVDE Twitbot,1,1,2013-03-25 11:58:36,Tyler County School District,2013-03-25
948698147009724418,All schools in #McDowell Co closed Thu 1/4/18,WVDE Twitbot,3,3,2018-01-03 23:30:38,McDowell County School District,2018-01-04
425579831678341120,1/2 UPDATE: All schools in #Boone Co now closed Tue 1/21/14 due to the pending winter storm,WVDE Twitbot,3,3,2014-01-21 10:45:13,Boone County School District,2014-01-21
841570712947171328,All schools in #Webster Co closed Tue 3/14/17 due to Weather and road  conditions,WVDE Twitbot,10,7,2017-03-14 08:44:28,Webster County School District,2017-03-14
440286756588355584,All schools in #Roane Co closed Mon 3/3/14 due to ice &amp; snow,WVDE Twitbot,13,13,2014-03-03 00:45:17,Roane County School District,2014-03-03
561118233034756097,UPDATE: All schools in #Webster Co now closed Fri 1/30/15 due to Weather Conditions,WVDE Twitbot,5,9,2015-01-30 11:06:26,Webster County School District,2015-01-30
223234068286930944,All schools in #Greenbrier Co closed Thu 7/12/12,WVDE Twitbot,0,3,2012-07-12 01:55:24,Greenbrier County School District,2012-07-12
297286447722012672,All schools in #Monroe Co closed Fri 2/1/13,WVDE Twitbot,3,3,2013-02-01 10:13:07,Monroe County School District,2013-02-01
432848428004278272,UPDATE: All schools in #Mingo Co now closed Mon 2/10/14 Employees Code W.,WVDE Twitbot,11,19,2014-02-10 12:08:01,Mingo County School District,2014-02-10
425729049969700865,All schools in #Harrison Co closed Wed 1/22/14,WVDE Twitbot,23,109,2014-01-21 20:38:09,Harrison County School District,2014-01-22
297300440176005120,UPDATE: All schools in #Mingo Co now closed Fri 2/1/13 code A,WVDE Twitbot,1,4,2013-02-01 11:08:43,Mingo County School District,2013-02-01
567819521857314816,"All schools in #Calhoun Co closed Wed 2/18/15 due to Road Conditions, Impending Weather code blue",WVDE Twitbot,15,3,2015-02-17 22:54:58,Calhoun County School District,2015-02-18
426109330493292545,All schools in #Upshur Co closed Thu 1/23/14,WVDE Twitbot,20,44,2014-01-22 21:49:15,Upshur County School District,2014-01-23
573594648209408000,All schools in #Barbour Co closed Fri 3/6/15,WVDE Twitbot,12,9,2015-03-05 21:23:15,Barbour County School District,2015-03-06
948892443252002817,UPDATE: All schools in #Hancock Co now closed Thu 1/4/18 due to Windchills and  slick roads,WVDE Twitbot,9,6,2018-01-04 12:22:42,Hancock County School District,2018-01-04
699169869833617408,All schools in #Morgan Co closed Mon 2/15/16 code A,WVDE Twitbot,18,15,2016-02-15 09:54:21,Morgan County School District,2016-02-15
958299070883385344,"UPDATE: All schools in #Raleigh Co now closed Tue 1/30/18 Reimagined Day 4, staff report at 10:00 am.",WVDE Twitbot,16,17,2018-01-30 11:21:17,Raleigh County School District,2018-01-30
420144060834123776,UPDATE: All schools in #Randolph Co now closed Mon 1/6/14,WVDE Twitbot,6,26,2014-01-06 10:45:24,Randolph County School District,2014-01-06
692749505431740417,All schools in #Morgan Co closed Fri 1/29/16 code A,WVDE Twitbot,11,3,2016-01-28 16:42:07,Morgan County School District,2016-01-29
691356656333099008,All schools in #Webster Co closed Mon 1/25/16,WVDE Twitbot,25,23,2016-01-24 20:27:26,Webster County School District,2016-01-25
950326183970967552,1/2 UPDATE: All schools in #Hancock Co now closed Mon 1/8/18 due to Ice and snow conditions code A,WVDE Twitbot,10,2,2018-01-08 11:19:53,Hancock County School District,2018-01-08
553012225783644160,UPDATE: All schools in #Wood Co now closed Thu 1/8/15 STATUS UPDATE - Only 261 Day employees report to work.,WVDE Twitbot,87,120,2015-01-08 02:16:03,Wood County School District,2015-01-08
427800400792530944,UPDATE: All schools in #Preston Co now closed Mon 1/27/14,WVDE Twitbot,3,4,2014-01-27 13:48:58,Preston County School District,2014-01-27
440649603038203904,All schools in #Kanawha Co closed Tue 3/4/14 due to winter weather conditions code B Central Office on a two hour delay.,WVDE Twitbot,105,321,2014-03-04 00:47:06,Kanawha County School District,2014-03-04
690298588186972163,All schools in #Cabell Co closed Fri 1/22/16 due to inclement weather code blue,WVDE Twitbot,110,151,2016-01-21 22:23:03,Cabell County School District,2016-01-22
569587771951734784,All schools in #Mercer Co closed Mon 2/23/15 due to inclement weather,WVDE Twitbot,17,24,2015-02-22 20:01:21,Mercer County School District,2015-02-23
696993446133919744,All schools in #Taylor Co closed Tue 2/9/16,WVDE Twitbot,15,13,2016-02-09 09:46:01,Taylor County School District,2016-02-09
440655901070880769,All schools in #Hampshire Co closed Tue 3/4/14 due to hazardous road conditions and forecasted below 0 temps,WVDE Twitbot,21,33,2014-03-04 01:12:08,Hampshire County School District,2014-03-04
841945423942168576,UPDATE: All schools in #Fayette Co now closed Wed 3/15/17 due to inclement weather,WVDE Twitbot,15,26,2017-03-15 09:33:26,Fayette County School District,2017-03-15
448768877820788736,UPDATE: All schools in #Greenbrier Co now closed Wed 3/26/14,WVDE Twitbot,7,14,2014-03-26 10:30:12,Greenbrier County School District,2014-03-26
312123515572744192,All schools in #Greenbrier Co closed Thu 3/14/13 due to weather conditions,WVDE Twitbot,2,14,2013-03-14 08:50:19,Greenbrier County School District,2013-03-14
552414366239555584,All schools in #WVSDB closed Tue 1/6/15,WVDE Twitbot,6,2,2015-01-06 10:40:22,,2015-01-06
950158722596311040,All schools in #Mingo Co closed Mon 1/8/18 Employees Code Orange.,WVDE Twitbot,47,34,2018-01-08 00:14:27,Mingo County School District,2018-01-08
264083327265431552,All schools in #Nicholas Co closed Fri 11/2/12  #WVSandy,WVDE Twitbot,0,4,2012-11-01 19:15:46,Nicholas County School District,2012-11-02
440426993897578496,All schools in #Raleigh Co closed Mon 3/3/14 due to weather conditions code B Essential Personnel report.,WVDE Twitbot,10,29,2014-03-03 10:02:32,Raleigh County School District,2014-03-03
433909341800787968,UPDATE: All schools in #Boone Co now closed Thu 2/13/14 due to the inclement winter weather,WVDE Twitbot,7,20,2014-02-13 10:23:43,Boone County School District,2014-02-13
425571938153414656,All schools in #Doddridge Co closed Tue 1/21/14 due to Inclement Weather,WVDE Twitbot,6,8,2014-01-21 10:13:51,Doddridge County School District,2014-01-21
219936392023769088,"All schools in #Fayette Co closed Tue 7/3/12 All Fayette County Board of Education functions are cancelled for Tuesday, July 3, 2012.",WVDE Twitbot,0,3,2012-07-02 23:31:36,Fayette County School District,2012-07-03
690300498453368832,All schools in #Greenbrier Co closed Fri 1/22/16 due to Weather conditions,WVDE Twitbot,28,28,2016-01-21 22:30:38,Greenbrier County School District,2016-01-22
552974028512960512,All schools in #Marshall Co closed Thu 1/8/15,WVDE Twitbot,18,32,2015-01-07 23:44:16,Marshall County School District,2015-01-08
561133512783585280,UPDATE: All schools in #Wirt Co now closed Fri 1/30/15,WVDE Twitbot,8,11,2015-01-30 12:07:09,Wirt County School District,2015-01-30
552790559702913025,UPDATE: All schools in #Fayette Co now closed Wed 1/7/15 due to inclement weather,WVDE Twitbot,20,39,2015-01-07 11:35:14,Fayette County School District,2015-01-07
960482334570176512,UPDATE: All schools in #Roane Co now closed Mon 2/5/18 due to road conditions,WVDE Twitbot,5,2,2018-02-05 11:56:48,Roane County School District,2018-02-05
425732973946609664,All schools in #Randolph Co closed Wed 1/22/14,WVDE Twitbot,17,41,2014-01-21 20:53:45,Randolph County School District,2014-01-22
440272891179843584,All schools in #Clay Co closed Mon 3/3/14 due to Winter Storm Warning,WVDE Twitbot,14,30,2014-03-02 23:50:11,Clay County School District,2014-03-03
427937581137793024,All schools in #Grant Co closed Tue 1/28/14 due to extreme cold temperatures. All staff are to report on a 2 hour delay,WVDE Twitbot,3,15,2014-01-27 22:54:04,Grant County School District,2014-01-28
953211967367467008,All schools in #Wayne Co closed Tue 1/16/18 due to Inclement weather,WVDE Twitbot,11,10,2018-01-16 10:26:57,Wayne County School District,2018-01-16
691369138359517184,All schools in #Monroe Co closed Mon 1/25/16,WVDE Twitbot,14,16,2016-01-24 21:17:02,Monroe County School District,2016-01-25
426509120368148480,All schools in #Ritchie Co closed Fri 1/24/14 Staff is to report according to supervisor instruction,WVDE Twitbot,7,8,2014-01-24 00:17:53,Ritchie County School District,2014-01-24
316110878875471873,All schools in #Webster Co closed Mon 3/25/13 due to Weather Conditions Staff report on a 2 hr delay.,WVDE Twitbot,1,14,2013-03-25 08:54:41,Webster County School District,2013-03-25
427937931391557632,All schools in #Wetzel Co closed Tue 1/28/14,WVDE Twitbot,18,38,2014-01-27 22:55:28,Wetzel County School District,2014-01-28
953402985803141126,All schools in #Ohio Co closed Wed 1/17/18,WVDE Twitbot,20,12,2018-01-16 23:05:59,Ohio County School District,2018-01-17
690126366092693505,UPDATE: All schools in #Gilmer Co now closed Thu 1/21/16,WVDE Twitbot,10,8,2016-01-21 10:58:42,Gilmer County School District,2016-01-21
431025332578033664,UPDATE: All schools in #Hardy Co now closed Wed 2/5/14,WVDE Twitbot,5,8,2014-02-05 11:23:42,Hardy County School District,2014-02-05
699553425340690432,UPDATE: All schools in #Lincoln Co now closed Tue 2/16/16,WVDE Twitbot,15,25,2016-02-16 11:18:28,Lincoln County School District,2016-02-16
420138510373232641,All schools in #Putnam Co closed Mon 1/6/14 due to Weather conditions. Also the central office is closed due to power outage,WVDE Twitbot,36,98,2014-01-06 10:23:21,Putnam County School District,2014-01-06
262981007588868096,All schools in #Morgan Co closed Tue 10/30/12 code H,WVDE Twitbot,0,1,2012-10-29 18:15:32,Morgan County School District,2012-10-30
440617877545033728,All schools in #Harrison Co closed Tue 3/4/14,WVDE Twitbot,46,140,2014-03-03 22:41:02,Harrison County School District,2014-03-04
948526925970051079,UPDATE: All schools in #Harrison Co now closed Wed 1/3/18,WVDE Twitbot,47,42,2018-01-03 12:10:16,Harrison County School District,2018-01-03
263061380721156098,All schools in #Pendleton Co closed Tue 10/30/12  #WVSandy,WVDE Twitbot,1,3,2012-10-29 23:34:55,Pendleton County School District,2012-10-30
154153533212598273,UPDATE: All schools in #Greenbrier Co now closed Tue 1/3/12 All Schools Closed,WVDE Twitbot,0,6,2012-01-03 10:54:01,Greenbrier County School District,2012-01-03
569987505317122051,All schools in #Pocahontas Co closed Tue 2/24/15,WVDE Twitbot,7,4,2015-02-23 22:29:45,Pocahontas County School District,2015-02-24
573424785717370881,UPDATE: All schools in #Ohio Co now closed Thu 3/5/15,WVDE Twitbot,6,33,2015-03-05 10:08:17,Ohio County School District,2015-03-05
697387771175006208,UPDATE: All schools in #Webster Co now closed Wed 2/10/16 due to Weather and road conditions,WVDE Twitbot,11,9,2016-02-10 11:52:56,Webster County School District,2016-02-10
689236971479240708,All schools in #Randolph Co closed Tue 1/19/16 due to cold temperatures,WVDE Twitbot,44,49,2016-01-19 00:04:34,Randolph County School District,2016-01-19
573422346024955904,All schools in #Pendleton Co closed Thu 3/5/15,WVDE Twitbot,6,5,2015-03-05 09:58:35,Pendleton County School District,2015-03-05
568180753793736704,All schools in #Doddridge Co closed Thu 2/19/15 due to frigid temperatures,WVDE Twitbot,10,13,2015-02-18 22:50:22,Doddridge County School District,2015-02-19
263690526019162112,All schools in #Clay Co closed Thu 11/1/12 due to weather,WVDE Twitbot,1,12,2012-10-31 17:14:55,Clay County School District,2012-11-01
265186024962015233,All schools in #Webster Co closed Mon 11/5/12 due to Storm Conditions Staff is encouraged to at their respectively schools by 10:00am.,WVDE Twitbot,0,1,2012-11-04 20:17:29,Webster County School District,2012-11-05
573281742720782337,All schools in #Logan Co closed Thu 3/5/15,WVDE Twitbot,38,45,2015-03-05 00:39:53,Logan County School District,2015-03-05
553150450095366145,UPDATE: All schools in #Harrison Co now closed Thu 1/8/15,WVDE Twitbot,41,91,2015-01-08 11:25:18,Harrison County School District,2015-01-08
263727068301365249,All schools in #Nicholas Co closed Thu 11/1/12 due to Bad Weather,WVDE Twitbot,1,13,2012-10-31 19:40:07,Nicholas County School District,2012-11-01
691708418579664897,1/2 All schools in #Preston Co closed Tue 1/26/16 due to winter weather conditions,WVDE Twitbot,11,7,2016-01-25 19:45:12,Preston County School District,2016-01-26
294741935472660480,All schools in #Calhoun Co closed Fri 1/25/13 due to NWS Predicted Winter Storm,WVDE Twitbot,1,1,2013-01-25 09:42:08,Calhoun County School District,2013-01-25
559649967556788224,All schools in #Mineral Co closed Mon 1/26/15 due to inclement weather,WVDE Twitbot,23,31,2015-01-26 09:52:04,Mineral County School District,2015-01-26
958273395753353219,All schools in #Wyoming Co closed Tue 1/30/18 due to inclement weather,WVDE Twitbot,10,5,2018-01-30 09:39:16,Wyoming County School District,2018-01-30
699043756746485761,All schools in #Pocahontas Co closed Mon 2/15/16,WVDE Twitbot,9,4,2016-02-15 01:33:13,Pocahontas County School District,2016-02-15
436118264553275394,UPDATE: All schools in #Tucker Co now closed Wed 2/19/14,WVDE Twitbot,5,5,2014-02-19 12:41:11,Tucker County School District,2014-02-19
691719887241265152,All schools in #Lewis Co closed Tue 1/26/16,WVDE Twitbot,24,19,2016-01-25 20:30:47,Lewis County School District,2016-01-26
426131034153820160,All schools in #Logan Co closed Thu 1/23/14,WVDE Twitbot,27,37,2014-01-22 23:15:30,Logan County School District,2014-01-23
948989754078646274,All schools in #Wyoming Co closed Fri 1/5/18 due to extremely cold temperatures and windchills,WVDE Twitbot,32,13,2018-01-04 18:49:23,Wyoming County School District,2018-01-05
697764827582881792,UPDATE: All schools in #Tyler Co now closed Thu 2/11/16,WVDE Twitbot,18,19,2016-02-11 12:51:13,Tyler County School District,2016-02-11
950138034711859203,All schools in #Lincoln Co closed Mon 1/8/18,WVDE Twitbot,11,15,2018-01-07 22:52:14,Lincoln County School District,2018-01-08
419998748475809792,All schools in #Calhoun Co closed Mon 1/6/14 due to Snow and Dangerously Cold Wind Chill Temperatures,WVDE Twitbot,4,13,2014-01-06 01:07:59,Calhoun County School District,2014-01-06
314716731316776960,All schools in #McDowell Co closed Thu 3/21/13 Students at schools will be sent home as soon as the buses get back to the schools.,WVDE Twitbot,0,4,2013-03-21 12:34:50,McDowell County School District,2013-03-21
154028805344858112,UPDATE: All schools in #Clay Co now closed Tue 1/3/12,WVDE Twitbot,0,2,2012-01-03 02:38:23,Clay County School District,2012-01-03
573295728451301377,All schools in #Greenbrier Co closed Thu 3/5/15,WVDE Twitbot,34,47,2015-03-05 01:35:27,Greenbrier County School District,2015-03-05
428355047936622592,All schools in #Mercer Co closed Wed 1/29/14 due to inclement weather,WVDE Twitbot,6,4,2014-01-29 02:32:56,Mercer County School District,2014-01-29
553509732670246912,UPDATE: All schools in #Preston Co now closed Fri 1/9/15 due to winter weather conditions,WVDE Twitbot,10,10,2015-01-09 11:12:58,Preston County School District,2015-01-09
295860767700430848,UPDATE: All schools in #Grant Co now closed Mon 1/28/13 due to inclement weather,WVDE Twitbot,1,5,2013-01-28 11:47:58,Grant County School District,2013-01-28
430273308961947649,All schools in #Wetzel Co closed Mon 2/3/14,WVDE Twitbot,12,22,2014-02-03 09:35:25,Wetzel County School District,2014-02-03
573093551866847232,UPDATE: All schools in #Doddridge Co now closed Wed 3/4/15 due to High Waters,WVDE Twitbot,8,7,2015-03-04 12:12:04,Doddridge County School District,2015-03-04
425767550236913664,All schools in #Kanawha Co closed Wed 1/22/14 due to wintery conditions code B,WVDE Twitbot,88,293,2014-01-21 23:11:09,Kanawha County School District,2014-01-22
818232360135172096,All schools in #Raleigh Co closed Mon 1/9/17,WVDE Twitbot,83,112,2017-01-08 23:06:11,Raleigh County School District,2017-01-09
222531071558959104,1/2 All schools in #Greenbrier Co closed Tue 7/10/12,WVDE Twitbot,0,0,2012-07-10 03:21:56,Greenbrier County School District,2012-07-10
419069098241175552,UPDATE: All schools in #Greenbrier Co now closed Fri 1/3/14 due to Weather conditions,WVDE Twitbot,5,15,2014-01-03 11:33:53,Greenbrier County School District,2014-01-03
428282032213336064,All schools in #Barbour Co closed Wed 1/29/14,WVDE Twitbot,4,9,2014-01-28 21:42:48,Barbour County School District,2014-01-29
425562115542249472,All schools in #Kanawha Co closed Tue 1/21/14 due to wintery conditions code B,WVDE Twitbot,58,206,2014-01-21 09:34:49,Kanawha County School District,2014-01-21
440252248044478464,All schools in #Harrison Co closed Mon 3/3/14,WVDE Twitbot,38,169,2014-03-02 22:28:10,Harrison County School District,2014-03-03
412557087286124544,UPDATE: All schools in #Greenbrier Co now closed Mon 12/16/13 due to Weather and road conditions,WVDE Twitbot,12,23,2013-12-16 12:17:29,Greenbrier County School District,2013-12-16
699582067525419008,UPDATE: All schools in #Wirt Co now closed Tue 2/16/16 due to Icy road conditions and flooding,WVDE Twitbot,7,12,2016-02-16 13:12:17,Wirt County School District,2016-02-16
427959262942220288,All schools in #Greenbrier Co closed Tue 1/28/14,WVDE Twitbot,20,48,2014-01-28 00:20:14,Greenbrier County School District,2014-01-28
431395271671439360,UPDATE: All schools in #Pleasants Co now closed Thu 2/6/14,WVDE Twitbot,11,15,2014-02-06 11:53:42,Pleasants County School District,2014-02-06
692050284600770560,All schools in #Logan Co closed Wed 1/27/16,WVDE Twitbot,25,26,2016-01-26 18:23:40,Logan County School District,2016-01-27
426668872671170560,UPDATE: All schools in #Wood Co now closed Fri 1/24/14 code B THIS IS A STATUS UPDATE.,WVDE Twitbot,46,99,2014-01-24 10:52:41,Wood County School District,2014-01-24
420864195018518528,UPDATE: All schools in #Braxton Co now closed Wed 1/8/14 200-day staff do not report.  Thank you!,WVDE Twitbot,5,13,2014-01-08 10:26:58,Braxton County School District,2014-01-08
440429530222587905,All schools in #Hardy Co closed Mon 3/3/14,WVDE Twitbot,8,17,2014-03-03 10:12:37,Hardy County School District,2014-03-03
428337412217909248,All schools in #Monroe Co closed Wed 1/29/14,WVDE Twitbot,4,25,2014-01-29 01:22:51,Monroe County School District,2014-01-29
950330659188412416,UPDATE: All schools in #McDowell Co now closed Mon 1/8/18,WVDE Twitbot,4,0,2018-01-08 11:37:40,McDowell County School District,2018-01-08
568005519492943872,UPDATE: All schools in #Upshur Co now closed Wed 2/18/15,WVDE Twitbot,11,15,2015-02-18 11:14:03,Upshur County School District,2015-02-18
419065285149085696,UPDATE: All schools in #Lincoln Co now closed Fri 1/3/14,WVDE Twitbot,5,24,2014-01-03 11:18:44,Lincoln County School District,2014-01-03
691715425579724800,All schools in #Monongalia Co closed Tue 1/26/16,WVDE Twitbot,68,105,2016-01-25 20:13:03,Monongalia County School District,2016-01-26
427937764118515713,All schools in #Preston Co closed Tue 1/28/14,WVDE Twitbot,6,16,2014-01-27 22:54:48,Preston County School District,2014-01-28
433909454451392512,All schools in #Cabell Co closed Thu 2/13/14 due to inclement weather code red,WVDE Twitbot,44,51,2014-02-13 10:24:10,Cabell County School District,2014-02-13
950700347911299072,1/2 UPDATE: All schools in #Braxton Co now closed Tue 1/9/18 due to hazardous secondary roads being covered with ice,WVDE Twitbot,9,4,2018-01-09 12:06:40,Braxton County School District,2018-01-09
263760606430121985,1/2 All schools in #Randolph Co closed Thu 11/1/12 due to inclement weather and power outages,WVDE Twitbot,0,2,2012-10-31 21:53:23,Randolph County School District,2012-11-01
425593852209020928,UPDATE: All schools in #Ohio Co now closed Tue 1/21/14,WVDE Twitbot,9,43,2014-01-21 11:40:56,Ohio County School District,2014-01-21
219967116789555200,All schools in #Clay Co closed Tue 7/3/12,WVDE Twitbot,0,2,2012-07-03 01:33:42,Clay County School District,2012-07-03
433766840725430272,All schools in #Grant Co closed Thu 2/13/14 due to inclement weather,WVDE Twitbot,8,9,2014-02-13 00:57:28,Grant County School District,2014-02-13
427769946345861120,UPDATE: All schools in #Wirt Co now closed Mon 1/27/14,WVDE Twitbot,4,12,2014-01-27 11:47:57,Wirt County School District,2014-01-27
696996715652632577,All schools in #Jackson Co closed Tue 2/9/16 code B,WVDE Twitbot,18,34,2016-02-09 09:59:01,Jackson County School District,2016-02-09
567825332222451712,All schools in #Roane Co closed Wed 2/18/15 due to snow and ice,WVDE Twitbot,12,16,2015-02-17 23:18:03,Roane County School District,2015-02-18
157764344430600192,All schools in #Preston Co closed Fri 1/13/12 due to Weather,WVDE Twitbot,0,0,2012-01-13 10:02:05,Preston County School District,2012-01-13
953384167139610627,All schools in #Marshall Co closed Wed 1/17/18,WVDE Twitbot,11,6,2018-01-16 21:51:13,Marshall County School District,2018-01-17
947964819214254081,All schools in #Gilmer Co closed Tue 1/2/18,WVDE Twitbot,4,3,2018-01-01 22:56:39,Gilmer County School District,2018-01-02
691690901295493120,All schools in #Roane Co closed Tue 1/26/16 due to snow,WVDE Twitbot,26,15,2016-01-25 18:35:36,Roane County School District,2016-01-26
841948129993854976,UPDATE: All schools in #Raleigh Co now closed Wed 3/15/17,WVDE Twitbot,43,56,2017-03-15 09:44:11,Raleigh County School District,2017-03-15
829658636804722689,UPDATE: All schools in #Preston Co now closed Thu 2/9/17 due to winter weather conditions,WVDE Twitbot,8,7,2017-02-09 11:50:07,Preston County School District,2017-02-09
841793442791452672,All schools in #Hampshire Co closed Wed 3/15/17 due to snow covered and icy secondary roads,WVDE Twitbot,15,14,2017-03-14 23:29:31,Hampshire County School District,2017-03-15
948161199371440128,UPDATE: All schools in #Pocahontas Co now closed Tue 1/2/18 due to sub zero temperatures,WVDE Twitbot,13,4,2018-01-02 11:57:00,Pocahontas County School District,2018-01-02
949056141455167489,All schools in #Raleigh Co closed Fri 1/5/18 Operate on Reimagined Day 2.,WVDE Twitbot,33,26,2018-01-04 23:13:11,Raleigh County School District,2018-01-05
425410711360004096,All schools in #Clay Co closed Tue 1/21/14 due to Winter Storm Warning,WVDE Twitbot,9,22,2014-01-20 23:33:11,Clay County School District,2014-01-21
263067415141814272,All schools in #Grant Co closed Tue 10/30/12 due to inclement weather  #WVSandy,WVDE Twitbot,0,3,2012-10-29 23:58:53,Grant County School District,2012-10-30
418938783396941824,UPDATE: All schools in #Tyler Co now closed Fri 1/3/14 due to dangerous road conditions,WVDE Twitbot,6,12,2014-01-03 02:56:04,Tyler County School District,2014-01-03
689398965574328320,UPDATE: All schools in #Nicholas Co now closed Tue 1/19/16 due to Weather Conditions,WVDE Twitbot,19,22,2016-01-19 10:48:16,Nicholas County School District,2016-01-19
426474174232526849,All schools in #Harrison Co closed Fri 1/24/14,WVDE Twitbot,31,119,2014-01-23 21:59:01,Harrison County School District,2014-01-24
552615927326724097,All schools in #Ritchie Co closed Wed 1/7/15,WVDE Twitbot,16,24,2015-01-07 00:01:18,Ritchie County School District,2015-01-07
420133213952954368,All schools in #Harrison Co closed Mon 1/6/14,WVDE Twitbot,21,67,2014-01-06 10:02:18,Harrison County School District,2014-01-06
428279709772697600,All schools in #Clay Co closed Wed 1/29/14 due to weather Staff will be reporting on a two-hour delay schedule.,WVDE Twitbot,5,14,2014-01-28 21:33:34,Clay County School District,2014-01-29
263582268243722240,UPDATE: All schools in #Kanawha Co now closed Wed 10/31/12 due to Massive power outages  #WVSandy,WVDE Twitbot,26,118,2012-10-31 10:04:44,Kanawha County School District,2012-10-31
410041436441018369,UPDATE: All schools in #Summers Co now closed Mon 12/9/13 due to Most areas of county are without power,WVDE Twitbot,0,3,2013-12-09 13:41:11,Summers County School District,2013-12-09
948701763984592898,All schools in #Pocahontas Co closed Thu 1/4/18 due to inclement weather,WVDE Twitbot,5,2,2018-01-03 23:45:01,Pocahontas County School District,2018-01-04
157770843726954496,All schools in #Lewis Co closed Fri 1/13/12,WVDE Twitbot,0,0,2012-01-13 10:27:55,Lewis County School District,2012-01-13
567823247431041024,All schools in #Greenbrier Co closed Wed 2/18/15,WVDE Twitbot,17,34,2015-02-17 23:09:46,Greenbrier County School District,2015-02-18
445390378955325440,All schools in #Tucker Co closed Mon 3/17/14,WVDE Twitbot,7,13,2014-03-17 02:45:15,Tucker County School District,2014-03-17
445478226714828800,All schools in #Ritchie Co closed Mon 3/17/14,WVDE Twitbot,11,6,2014-03-17 08:34:20,Ritchie County School District,2014-03-17
441000301424685056,All schools in #Mason Co closed Wed 3/5/14 due to inclement Weather code A,WVDE Twitbot,13,18,2014-03-05 00:00:39,Mason County School District,2014-03-05
440643073568026624,All schools in #Morgan Co closed Tue 3/4/14 code A,WVDE Twitbot,6,23,2014-03-04 00:21:10,Morgan County School District,2014-03-04
438638528202022912,1/2 UPDATE: All schools in #Preston Co now closed Wed 2/26/14,WVDE Twitbot,2,3,2014-02-26 11:35:49,Preston County School District,2014-02-26
613659524189319168,"All schools in #Putnam Co closed Wed 6/24/15 due to No Water All Summer programs are closed today, all summer workers do not report",WVDE Twitbot,7,13,2015-06-24 10:46:46,Putnam County School District,2015-06-24
440982436369797120,All schools in #Lincoln Co closed Wed 3/5/14,WVDE Twitbot,23,57,2014-03-04 22:49:40,Lincoln County School District,2014-03-05
568198868271280128,All schools in #Monroe Co closed Thu 2/19/15,WVDE Twitbot,9,9,2015-02-19 00:02:21,Monroe County School District,2015-02-19
697383545438912512,UPDATE: All schools in #Raleigh Co now closed Wed 2/10/16,WVDE Twitbot,26,40,2016-02-10 11:36:08,Raleigh County School District,2016-02-10
445481299797479424,UPDATE: All schools in #Barbour Co now closed Mon 3/17/14,WVDE Twitbot,6,6,2014-03-17 08:46:33,Barbour County School District,2014-03-17
567100218211336192,All schools in #Nicholas Co closed Mon 2/16/15,WVDE Twitbot,18,27,2015-02-15 23:16:42,Nicholas County School District,2015-02-16
433740293838368768,All schools in #Summers Co closed Thu 2/13/14,WVDE Twitbot,6,10,2014-02-12 23:11:59,Summers County School District,2014-02-13
420286241947385857,All schools in #Upshur Co closed Tue 1/7/14 due to Extreme temperatures,WVDE Twitbot,27,49,2014-01-06 20:10:23,Upshur County School District,2014-01-07
961064490656780289,UPDATE: All schools in #Marshall Co now closed Wed 2/7/18 This is a one hour delay added to our regular Wednesday o https://t.co/gQPQpL3bOc,WVDE Twitbot,33,9,2018-02-07 02:30:04,Marshall County School District,2018-02-07
434062690617528320,All schools in #Logan Co closed Fri 2/14/14,WVDE Twitbot,23,39,2014-02-13 20:33:04,Logan County School District,2014-02-14
570187510892138496,UPDATE: All schools in #Gilmer Co now closed Tue 2/24/15,WVDE Twitbot,8,4,2015-02-24 11:44:30,Gilmer County School District,2015-02-24
434102492385669120,All schools in #Marion Co closed Fri 2/14/14 due to Inclement Weather,WVDE Twitbot,16,83,2014-02-13 23:11:14,Marion County School District,2014-02-14
561090455174393856,All schools in #Nicholas Co closed Fri 1/30/15,WVDE Twitbot,8,7,2015-01-30 09:16:03,Nicholas County School District,2015-01-30
552922002542321665,All schools in #Taylor Co closed Thu 1/8/15,WVDE Twitbot,8,20,2015-01-07 20:17:32,Taylor County School District,2015-01-08
440244800244047872,All schools in #Marshall Co closed Mon 3/3/14,WVDE Twitbot,9,25,2014-03-02 21:58:34,Marshall County School District,2014-03-03
696994202899582976,All schools in #Ritchie Co closed Tue 2/9/16,WVDE Twitbot,12,8,2016-02-09 09:49:02,Ritchie County School District,2016-02-09
440297226179313664,All schools in #Mason Co closed Mon 3/3/14 due to Inclement weather Closed for students and staff,WVDE Twitbot,29,39,2014-03-03 01:26:53,Mason County School District,2014-03-03
567482217602232320,"All schools in #Berkeley Co closed Tue 2/17/15 due to weather All evening activities are canceled for Tuesday, February 17, 2015.",WVDE Twitbot,70,152,2015-02-17 00:34:38,Berkeley County School District,2015-02-17
427560220772950016,All schools in #Hancock Co closed Mon 1/27/14 due to weather,WVDE Twitbot,3,13,2014-01-26 21:54:34,Hancock County School District,2014-01-27
427921413966528512,All schools in #Pleasants Co closed Tue 1/28/14,WVDE Twitbot,6,10,2014-01-27 21:49:50,Pleasants County School District,2014-01-28
292244405635661824,UPDATE: All schools in #Greenbrier Co now closed Fri 1/18/13,WVDE Twitbot,1,13,2013-01-18 12:17:50,Greenbrier County School District,2013-01-18
963010988852305922,UPDATE: All schools in #Marshall Co now closed Mon 2/12/18,WVDE Twitbot,11,8,2018-02-12 11:24:46,Marshall County School District,2018-02-12
552928712401092608,All schools in #Pocahontas Co closed Thu 1/8/15,WVDE Twitbot,5,4,2015-01-07 20:44:12,Pocahontas County School District,2015-01-08
573291383638896640,All schools in #Pleasants Co closed Thu 3/5/15,WVDE Twitbot,24,14,2015-03-05 01:18:11,Pleasants County School District,2015-03-05
566179184704495616,UPDATE: All schools in #McDowell Co now closed Fri 2/13/15,WVDE Twitbot,3,2,2015-02-13 10:16:51,McDowell County School District,2015-02-13
690322717208399872,All schools in #Wetzel Co closed Fri 1/22/16 due to Approaching Blizzard,WVDE Twitbot,32,37,2016-01-21 23:58:56,Wetzel County School District,2016-01-22
552810522069192705,UPDATE: All schools in #Lincoln Co now closed Wed 1/7/15,WVDE Twitbot,16,41,2015-01-07 12:54:33,Lincoln County School District,2015-01-07
297278380179611648,All schools in #Barbour Co closed Fri 2/1/13 due to weather and road conditions,WVDE Twitbot,0,1,2013-02-01 09:41:03,Barbour County School District,2013-02-01
427573448852787200,All schools in #Taylor Co closed Mon 1/27/14,WVDE Twitbot,10,15,2014-01-26 22:47:08,Taylor County School District,2014-01-27
841441868789514240,All schools in #Morgan Co closed Tue 3/14/17 code A,WVDE Twitbot,23,22,2017-03-14 00:12:29,Morgan County School District,2017-03-14
430489075896705025,All schools in #Doddridge Co closed Tue 2/4/14 due to snow and hazardous road conditions Staff is not required to report.,WVDE Twitbot,9,15,2014-02-03 23:52:48,Doddridge County School District,2014-02-04
573303080181211138,All schools in #Mingo Co closed Thu 3/5/15 Code Orange.,WVDE Twitbot,24,50,2015-03-05 02:04:40,Mingo County School District,2015-03-05
570316004942876672,All schools in #Summers Co closed Wed 2/25/15,WVDE Twitbot,11,4,2015-02-24 20:15:06,Summers County School District,2015-02-25
154156003267588096,UPDATE: All schools in #Monroe Co now closed Tue 1/3/12,WVDE Twitbot,0,0,2012-01-03 11:03:49,Monroe County School District,2012-01-03
298639921349005314,All schools in #Wetzel Co closed Tue 2/5/13,WVDE Twitbot,2,6,2013-02-05 03:51:20,Wetzel County School District,2013-02-05
428285094877335552,All schools in #Brooke Co closed Wed 1/29/14 due to Extreme cold and wind chills,WVDE Twitbot,8,30,2014-01-28 21:54:58,Brooke County School District,2014-01-29
418928229903118336,All schools in #Clay Co closed Fri 1/3/14 due to Snow,WVDE Twitbot,16,22,2014-01-03 02:14:07,Clay County School District,2014-01-03
304914828194099202,UPDATE: All schools in #Pocahontas Co now closed Fri 2/22/13 due to weather,WVDE Twitbot,1,11,2013-02-22 11:25:34,Pocahontas County School District,2013-02-22
426092885155401729,All schools in #Fayette Co closed Thu 1/23/14 due to inclement weather code B,WVDE Twitbot,27,68,2014-01-22 20:43:54,Fayette County School District,2014-01-23
568501747309780993,All schools in #Calhoun Co closed Fri 2/20/15 due to Dangerous Temperatures code red,WVDE Twitbot,6,5,2015-02-19 20:05:53,Calhoun County School District,2015-02-20
573554806440202241,All schools in #Harrison Co closed Fri 3/6/15,WVDE Twitbot,45,143,2015-03-05 18:44:56,Harrison County School District,2015-03-06
432844572369354752,UPDATE: All schools in #Nicholas Co now closed Mon 2/10/14,WVDE Twitbot,8,15,2014-02-10 11:52:42,Nicholas County School District,2014-02-10
440631302144798722,All schools in #Wayne Co closed Tue 3/4/14 due to Inclement Weather,WVDE Twitbot,10,23,2014-03-03 23:34:23,Wayne County School District,2014-03-04
571098623813009409,All schools in #Summers Co closed Fri 2/27/15,WVDE Twitbot,10,8,2015-02-27 00:04:57,Summers County School District,2015-02-27
951757700194594816,All schools in #Marshall Co closed Fri 1/12/18 due to flooding,WVDE Twitbot,15,14,2018-01-12 10:08:13,Marshall County School District,2018-01-12
425575363842809857,All schools in #Tyler Co closed Tue 1/21/14 code C,WVDE Twitbot,4,6,2014-01-21 10:27:28,Tyler County School District,2014-01-21
430530385911357440,All schools in #Calhoun Co closed Tue 2/4/14 due to Thawing and Refreezing on Secondary Roads,WVDE Twitbot,11,17,2014-02-04 02:36:57,Calhoun County School District,2014-02-04
566039299813277696,All schools in #Pocahontas Co closed Fri 2/13/15,WVDE Twitbot,8,4,2015-02-13 01:01:00,Pocahontas County School District,2015-02-13
699050692149956608,All schools in #Clay Co closed Mon 2/15/16 due to Weather conditions,WVDE Twitbot,21,22,2016-02-15 02:00:47,Clay County School District,2016-02-15
433909623758667776,All schools in #Wirt Co closed Thu 2/13/14,WVDE Twitbot,11,9,2014-02-13 10:24:50,Wirt County School District,2014-02-13
421574011198660608,All schools in #Pocahontas Co closed Fri 1/10/14,WVDE Twitbot,2,7,2014-01-10 09:27:31,Pocahontas County School District,2014-01-10
157799789461897217,All schools in #Mercer Co closed Fri 1/13/12 due to inclement weather,WVDE Twitbot,0,1,2012-01-13 12:22:56,Mercer County School District,2012-01-13
420302249412149248,All schools in #Doddridge Co closed Tue 1/7/14 due to Inclement Weather,WVDE Twitbot,6,14,2014-01-06 21:13:59,Doddridge County School District,2014-01-07
298247543521943553,UPDATE: All schools in #Nicholas Co now closed Mon 2/4/13 due to Bad Weather!,WVDE Twitbot,8,22,2013-02-04 01:52:10,Nicholas County School District,2013-02-04
567789298968449025,All schools in #Wayne Co closed Wed 2/18/15 due to Inclement Weather,WVDE Twitbot,31,42,2015-02-17 20:54:52,Wayne County School District,2015-02-18
691372157918666752,All schools in #Summers Co closed Mon 1/25/16,WVDE Twitbot,12,9,2016-01-24 21:29:02,Summers County School District,2016-01-25
690245558565494784,All schools in #Lincoln Co closed Fri 1/22/16,WVDE Twitbot,31,50,2016-01-21 18:52:19,Lincoln County School District,2016-01-22
426096690182238208,All schools in #Randolph Co closed Thu 1/23/14,WVDE Twitbot,14,44,2014-01-22 20:59:02,Randolph County School District,2014-01-23
438294217496862722,UPDATE: All schools in #Pleasants Co now closed Tue 2/25/14,WVDE Twitbot,11,12,2014-02-25 12:47:39,Pleasants County School District,2014-02-25
689961767703814149,All schools in #Mingo Co closed Thu 1/21/16 due to inclement weather code orange,WVDE Twitbot,46,92,2016-01-21 00:04:38,Mingo County School District,2016-01-21
438660068368601088,UPDATE: All schools in #Harrison Co now closed Wed 2/26/14,WVDE Twitbot,34,83,2014-02-26 13:01:24,Harrison County School District,2014-02-26
160292711738515456,All schools in #Monongalia Co closed Fri 1/20/12 due to Inclement weather,WVDE Twitbot,0,2,2012-01-20 09:28:55,Monongalia County School District,2012-01-20
433907703555956736,UPDATE: All schools in #Mingo Co now closed Thu 2/13/14 code H,WVDE Twitbot,3,4,2014-02-13 10:17:12,Mingo County School District,2014-02-13
426085858316263424,All schools in #Monongalia Co closed Thu 1/23/14,WVDE Twitbot,38,102,2014-01-22 20:15:59,Monongalia County School District,2014-01-23
425786174938955776,All schools in #Wood Co closed Wed 1/22/14 due to weather conditions code A,WVDE Twitbot,72,180,2014-01-22 00:25:09,Wood County School District,2014-01-22
553093890174357504,UPDATE: All schools in #Logan Co now closed Thu 1/8/15,WVDE Twitbot,6,8,2015-01-08 07:40:34,Logan County School District,2015-01-08
567104261293871104,All schools in #Pocahontas Co closed Mon 2/16/15,WVDE Twitbot,10,6,2015-02-15 23:32:46,Pocahontas County School District,2015-02-16
420250388991062017,All schools in #Logan Co closed Tue 1/7/14,WVDE Twitbot,34,69,2014-01-06 17:47:55,Logan County School District,2014-01-07
425740890900946944,All schools in #Roane Co closed Wed 1/22/14 due to snow,WVDE Twitbot,8,11,2014-01-21 21:25:12,Roane County School District,2014-01-22
563307419858919424,UPDATE: All schools in #Roane Co now closed Thu 2/5/15 due to snow,WVDE Twitbot,14,17,2015-02-05 12:05:29,Roane County School District,2015-02-05
566196380658839552,UPDATE: All schools in #Raleigh Co now closed Fri 2/13/15,WVDE Twitbot,13,40,2015-02-13 11:25:11,Raleigh County School District,2015-02-13
444065809732616193,UPDATE: All schools in #Wyoming Co now closed Thu 3/13/14 due to inclement weather,WVDE Twitbot,9,19,2014-03-13 11:01:54,Wyoming County School District,2014-03-13
573262388264370176,"All schools in #Boone Co closed Thu 3/5/15 The county math field day will be held on Monday, March 9th.",WVDE Twitbot,16,22,2015-03-04 23:22:58,Boone County School District,2015-03-05
445514767201886208,UPDATE: All schools in #Wayne Co now closed Mon 3/17/14 due to Inclement Weather,WVDE Twitbot,8,11,2014-03-17 10:59:32,Wayne County School District,2014-03-17
427969279166648320,All schools in #Mineral Co closed Tue 1/28/14,WVDE Twitbot,11,43,2014-01-28 01:00:02,Mineral County School District,2014-01-28
573260568393592832,All schools in #Clay Co closed Thu 3/5/15 due to inclement weather,WVDE Twitbot,12,20,2015-03-04 23:15:44,Clay County School District,2015-03-05
689973832862580737,All schools in #Kanawha Co closed Thu 1/21/16 due to Inclement Weather code B,WVDE Twitbot,320,624,2016-01-21 00:52:35,Kanawha County School District,2016-01-21
953380658348462080,All schools in #Wayne Co closed Wed 1/17/18 due to low temps and poor road conditions,WVDE Twitbot,21,13,2018-01-16 21:37:16,Wayne County School District,2018-01-17
567839356389564416,All schools in #McDowell Co closed Wed 2/18/15,WVDE Twitbot,7,4,2015-02-18 00:13:47,McDowell County School District,2015-02-18
430317627869646848,UPDATE: All schools in #Wayne Co now closed Mon 2/3/14 due to Inclement Weather,WVDE Twitbot,10,16,2014-02-03 12:31:32,Wayne County School District,2014-02-03
686878910135582720,UPDATE: All schools in #Hancock Co now closed Tue 1/12/16,WVDE Twitbot,17,18,2016-01-12 11:54:28,Hancock County School District,2016-01-12
440428792838774785,All schools in #Monroe Co closed Mon 3/3/14,WVDE Twitbot,8,11,2014-03-03 10:09:41,Monroe County School District,2014-03-03
826039355345076225,UPDATE: All schools in #Marion Co now closed Mon 1/30/17 due to Inclement Weather,WVDE Twitbot,53,78,2017-01-30 12:08:24,Marion County School District,2017-01-30
567096942925459456,All schools in #Randolph Co closed Mon 2/16/15,WVDE Twitbot,34,40,2015-02-15 23:03:42,Randolph County School District,2015-02-16
691364592212168704,All schools in #Boone Co closed Mon 1/25/16 All 240 and 261 employees report as well as custodians with a 210 or higher day contract.,WVDE Twitbot,31,17,2016-01-24 20:58:58,Boone County School District,2016-01-25
440420945556025344,All schools in #Berkeley Co closed Mon 3/3/14 due to weather All evening activities cancelled.,WVDE Twitbot,18,56,2014-03-03 09:38:30,Berkeley County School District,2014-03-03
565848935944978432,UPDATE: All schools in #Pleasants Co now closed Thu 2/12/15,WVDE Twitbot,13,15,2015-02-12 12:24:33,Pleasants County School District,2015-02-12
552405075113824260,All schools in #Roane Co closed Tue 1/6/15 due to snow,WVDE Twitbot,10,9,2015-01-06 10:03:27,Roane County School District,2015-01-06
444034878909468673,UPDATE: All schools in #Barbour Co now closed Thu 3/13/14,WVDE Twitbot,7,10,2014-03-13 08:58:59,Barbour County School District,2014-03-13
294395910220308481,UPDATE: All schools in #Barbour Co now closed Thu 1/24/13 due to weather &amp; road conditions,WVDE Twitbot,2,4,2013-01-24 10:47:09,Barbour County School District,2013-01-24
409813876230742016,All schools in #Hardy Co closed Mon 12/9/13,WVDE Twitbot,8,28,2013-12-08 22:36:56,Hardy County School District,2013-12-09
157794423374233600,UPDATE: All schools in #Calhoun Co now closed Fri 1/13/12 due to Icy road conditions,WVDE Twitbot,0,0,2012-01-13 12:01:36,Calhoun County School District,2012-01-13
573291143124938752,All schools in #Ritchie Co closed Thu 3/5/15,WVDE Twitbot,13,11,2015-03-05 01:17:14,Ritchie County School District,2015-03-05
947957985678159872,All schools in #Randolph Co closed Tue 1/2/18 Staff is to report on a 2-hour delay,WVDE Twitbot,21,11,2018-01-01 22:29:30,Randolph County School District,2018-01-02
428300323606634496,All schools in #Tyler Co closed Wed 1/29/14 Employees report per your supervisor's instructions.,WVDE Twitbot,10,2,2014-01-28 22:55:29,Tyler County School District,2014-01-29
263779567116877824,UPDATE: All schools in #Raleigh Co now closed Thu 11/1/12 due to weather conditions and power outages  #WVSandy,WVDE Twitbot,3,17,2012-10-31 23:08:44,Raleigh County School District,2012-11-01
961205140886839296,UPDATE: All schools in #Pendleton Co now closed Wed 2/7/18,WVDE Twitbot,5,2,2018-02-07 11:48:58,Pendleton County School District,2018-02-07
569961739619586048,All schools in #Lincoln Co closed Tue 2/24/15,WVDE Twitbot,9,15,2015-02-23 20:47:22,Lincoln County School District,2015-02-24
948188044133326848,UPDATE: All schools in #Mason Co now closed Tue 1/2/18 due to Inclement weather code red,WVDE Twitbot,38,21,2018-01-02 13:43:40,Mason County School District,2018-01-02
309252426630844416,UPDATE: All schools in #Preston Co now closed Wed 3/6/13,WVDE Twitbot,1,6,2013-03-06 10:41:38,Preston County School District,2013-03-06
419073561098469376,UPDATE: All schools in #Brooke Co now closed Fri 1/3/14,WVDE Twitbot,10,9,2014-01-03 11:51:37,Brooke County School District,2014-01-03
561102873950711808,All schools in #Calhoun Co closed Fri 1/30/15 due to Inclement Weather code red,WVDE Twitbot,3,4,2015-01-30 10:05:24,Calhoun County School District,2015-01-30
691305791006056448,All schools in #Taylor Co closed Mon 1/25/16,WVDE Twitbot,27,27,2016-01-24 17:05:19,Taylor County School District,2016-01-25
427739297580449792,UPDATE: All schools in #Lewis Co now closed Mon 1/27/14,WVDE Twitbot,7,8,2014-01-27 09:46:10,Lewis County School District,2014-01-27
294846934169038848,UPDATE: All schools in #Pocahontas Co now closed Fri 1/25/13 due to Weather,WVDE Twitbot,1,2,2013-01-25 16:39:21,Pocahontas County School District,2013-01-25
420142396295217152,All schools in #Doddridge Co closed Mon 1/6/14 due to Inclement Weather,WVDE Twitbot,5,6,2014-01-06 10:38:47,Doddridge County School District,2014-01-06
176635045568716801,All schools in #McDowell Co closed Mon 3/5/12 due to unsafe road conditions,WVDE Twitbot,0,0,2012-03-05 11:47:31,McDowell County School District,2012-03-05
263753540332302336,All schools in #Pendleton Co closed Thu 11/1/12 due to power outage  #WVSandy,WVDE Twitbot,0,2,2012-10-31 21:25:18,Pendleton County School District,2012-11-01
440661739294957568,All schools in #Wyoming Co closed Tue 3/4/14 due to inclement weather,WVDE Twitbot,5,15,2014-03-04 01:35:20,Wyoming County School District,2014-03-04
428307158086582272,UPDATE: All schools in #Lewis Co now closed Wed 1/29/14 All staff are to report at regular time.,WVDE Twitbot,2,1,2014-01-28 23:22:38,Lewis County School District,2014-01-29
420128906994122752,All schools in #Webster Co closed Mon 1/6/14 due to Weather Conditions,WVDE Twitbot,5,11,2014-01-06 09:45:11,Webster County School District,2014-01-06
697374059621937152,UPDATE: All schools in #Logan Co now closed Wed 2/10/16,WVDE Twitbot,11,19,2016-02-10 10:58:27,Logan County School District,2016-02-10
691344746523017216,All schools in #Hampshire Co closed Mon 1/25/16,WVDE Twitbot,39,28,2016-01-24 19:40:06,Hampshire County School District,2016-01-25
291858207230533632,All schools in #Mercer Co closed Thu 1/17/13,WVDE Twitbot,2,9,2013-01-17 10:43:13,Mercer County School District,2013-01-17
567261630011293696,All schools in #Clay Co closed Mon 2/16/15,WVDE Twitbot,7,8,2015-02-16 09:58:06,Clay County School District,2015-02-16
367256744776724480,UPDATE: All schools in #Tyler Co now closed Tue 8/13/13 due to High water and localized flooding,WVDE Twitbot,5,15,2013-08-13 12:10:05,Tyler County School District,2013-08-13
950343243836903424,UPDATE: All schools in #Putnam Co now closed Mon 1/8/18,WVDE Twitbot,48,37,2018-01-08 12:27:40,Putnam County School District,2018-01-08
420641721391661056,All schools in #McDowell Co closed Wed 1/8/14 due to inclement weather,WVDE Twitbot,3,9,2014-01-07 19:42:56,McDowell County School District,2014-01-08
950307717742321664,All schools in #Marion Co closed Mon 1/8/18 due to WINTER WEATHER ADVISORY,WVDE Twitbot,53,28,2018-01-08 10:06:30,Marion County School District,2018-01-08
296948197711048704,UPDATE: All schools in #Greenbrier Co now closed Thu 1/31/13 due to weather conditions and flooding,WVDE Twitbot,3,18,2013-01-31 11:49:02,Greenbrier County School District,2013-01-31
940733708738400256,All schools in #Mercer Co closed Wed 12/13/17 due to inclement weather conditions,WVDE Twitbot,48,30,2017-12-13 00:02:48,Mercer County School District,2017-12-13
431029559472185345,UPDATE: All schools in #Preston Co now closed Wed 2/5/14,WVDE Twitbot,6,8,2014-02-05 11:40:29,Preston County School District,2014-02-05
422829623349506048,All schools in #Lincoln Co closed Tue 1/14/14,WVDE Twitbot,19,60,2014-01-13 20:36:52,Lincoln County School District,2014-01-14
282086226926919680,All schools in #Calhoun Co closed Fri 12/21/12 due to inclement weather,WVDE Twitbot,1,0,2012-12-21 11:32:52,Calhoun County School District,2012-12-21
837274477130035200,UPDATE: All schools in #Mingo Co now closed Thu 3/2/17 due to power outages code orange,WVDE Twitbot,26,22,2017-03-02 12:12:45,Mingo County School District,2017-03-02
316135211123503104,All schools in #Mercer Co closed Mon 3/25/13 due to inclement weather,WVDE Twitbot,0,2,2013-03-25 10:31:22,Mercer County School District,2013-03-25
309227556098408448,All schools in #Grant Co closed Wed 3/6/13 due to inclement weather Staff are not to report,WVDE Twitbot,1,2,2013-03-06 09:02:49,Grant County School District,2013-03-06
438636542966239232,UPDATE: All schools in #Nicholas Co now closed Wed 2/26/14,WVDE Twitbot,6,13,2014-02-26 11:27:55,Nicholas County School District,2014-02-26
420016592756281344,All schools in #Greenbrier Co closed Mon 1/6/14 due to Weather conditions &amp; Temperatures,WVDE Twitbot,17,47,2014-01-06 02:18:53,Greenbrier County School District,2014-01-06
298593208861093888,All schools in #Monongalia Co closed Tue 2/5/13 due to inclement weather,WVDE Twitbot,16,84,2013-02-05 00:45:43,Monongalia County School District,2013-02-05
316528276376006657,UPDATE: All schools in #Webster Co now closed Tue 3/26/13 due to Weather Conditions Staff report on a 2 hour delay.,WVDE Twitbot,5,11,2013-03-26 12:33:16,Webster County School District,2013-03-26
425722353494945793,All schools in #Hampshire Co closed Wed 1/22/14,WVDE Twitbot,14,23,2014-01-21 20:11:33,Hampshire County School District,2014-01-22
262946756919181313,UPDATE: All schools in #Berkeley Co now closed Tue 10/30/12 All evening activities are cancelled.,WVDE Twitbot,0,3,2012-10-29 15:59:26,Berkeley County School District,2012-10-30
438613755400683520,All schools in #Taylor Co closed Wed 2/26/14,WVDE Twitbot,6,11,2014-02-26 09:57:22,Taylor County School District,2014-02-26
570011084284960768,All schools in #Monroe Co closed Tue 2/24/15,WVDE Twitbot,7,9,2015-02-24 00:03:27,Monroe County School District,2015-02-24
427979133398695937,All schools in #Pendleton Co closed Tue 1/28/14,WVDE Twitbot,12,8,2014-01-28 01:39:11,Pendleton County School District,2014-01-28
432836514678988800,UPDATE: All schools in #Lincoln Co now closed Mon 2/10/14,WVDE Twitbot,9,41,2014-02-10 11:20:41,Lincoln County School District,2014-02-10
552429541621497856,UPDATE: All schools in #Harrison Co now closed Tue 1/6/15,WVDE Twitbot,40,84,2015-01-06 11:40:41,Harrison County School District,2015-01-06
428290865493073920,All schools in #Randolph Co closed Wed 1/29/14,WVDE Twitbot,16,26,2014-01-28 22:17:54,Randolph County School District,2014-01-29
567483665819897856,UPDATE: All schools in #Doddridge Co now closed Tue 2/17/15 due to frigid temperatures and inclement weather,WVDE Twitbot,8,13,2015-02-17 00:40:23,Doddridge County School District,2015-02-17
434112447629099008,All schools in #Pocahontas Co closed Fri 2/14/14,WVDE Twitbot,10,5,2014-02-13 23:50:47,Pocahontas County School District,2014-02-14
552619115136180224,UPDATE: All schools in #Barbour Co now closed Wed 1/7/15 due to frigid temperatures,WVDE Twitbot,14,7,2015-01-07 00:13:58,Barbour County School District,2015-01-07
294768584087973888,UPDATE: All schools in #Braxton Co now closed Fri 1/25/13,WVDE Twitbot,2,7,2013-01-25 11:28:01,Braxton County School District,2013-01-25
573591992954937344,All schools in #Wetzel Co closed Fri 3/6/15 All 261 day employees will report to work.,WVDE Twitbot,22,32,2015-03-05 21:12:42,Wetzel County School District,2015-03-06
425773266297298944,All schools in #Calhoun Co closed Wed 1/22/14 due to Frigid Temperatures and Slick Secondary Roads,WVDE Twitbot,4,6,2014-01-21 23:33:51,Calhoun County School District,2014-01-22
697020843789045760,UPDATE: All schools in #Randolph Co now closed Tue 2/9/16,WVDE Twitbot,15,17,2016-02-09 11:34:53,Randolph County School District,2016-02-09
425575775970926592,All schools in #Hardy Co closed Tue 1/21/14,WVDE Twitbot,8,14,2014-01-21 10:29:06,Hardy County School District,2014-01-21
157799721057001472,UPDATE: All schools in #McDowell Co now closed Fri 1/13/12,WVDE Twitbot,0,1,2012-01-13 12:22:39,McDowell County School District,2012-01-13
953243072132997120,UPDATE: All schools in #Calhoun Co now closed Tue 1/16/18 code blue Code Blue with evening custodians reporting at their scheduled time.,WVDE Twitbot,8,2,2018-01-16 12:30:33,Calhoun County School District,2018-01-16
949021907566956545,All schools in #Brooke Co closed Fri 1/5/18 due to weather,WVDE Twitbot,2,8,2018-01-04 20:57:09,Brooke County School District,2018-01-05
436126158405386240,UPDATE: All schools in #Hardy Co now closed Wed 2/19/14,WVDE Twitbot,7,10,2014-02-19 13:12:33,Hardy County School District,2014-02-19
567094777653760000,All schools in #Lincoln Co closed Mon 2/16/15,WVDE Twitbot,21,71,2015-02-15 22:55:05,Lincoln County School District,2015-02-16
433763922437369857,All schools in #Fayette Co closed Thu 2/13/14 due to inclement weather code B,WVDE Twitbot,18,46,2014-02-13 00:45:52,Fayette County School District,2014-02-13
567830811265990657,All schools in #Monroe Co closed Wed 2/18/15,WVDE Twitbot,12,15,2015-02-17 23:39:49,Monroe County School District,2015-02-18
568538915923218432,All schools in #Wetzel Co closed Fri 2/20/15,WVDE Twitbot,25,38,2015-02-19 22:33:35,Wetzel County School District,2015-02-20
570322101858660353,All schools in #Mercer Co closed Wed 2/25/15 due to inclement weather,WVDE Twitbot,17,19,2015-02-24 20:39:19,Mercer County School District,2015-02-25
565803464371216384,All schools in #Fayette Co closed Thu 2/12/15 due to incoming weather,WVDE Twitbot,15,40,2015-02-12 09:23:52,Fayette County School District,2015-02-12
953567868817428480,All schools in #Berkeley Co closed Wed 1/17/18 due to weather All evening activties are cancelled.,WVDE Twitbot,83,38,2018-01-17 10:01:11,Berkeley County School District,2018-01-17
433904044264796160,All schools in #Jackson Co closed Thu 2/13/14 code B,WVDE Twitbot,15,25,2014-02-13 10:02:40,Jackson County School District,2014-02-13
554604761069391872,UPDATE: All schools in #Hampshire Co now closed Mon 1/12/15 due to extremely icy secondary roads,WVDE Twitbot,13,15,2015-01-12 11:44:13,Hampshire County School District,2015-01-12
265307304121995265,All schools in #Barbour Co closed Mon 11/5/12 Continued Power Outages and poor road conditions.,WVDE Twitbot,1,0,2012-11-05 04:19:25,Barbour County School District,2012-11-05
959359561697243136,All schools in #Upshur Co closed Fri 2/2/18,WVDE Twitbot,8,0,2018-02-02 09:35:18,Upshur County School District,2018-02-02
567489377207869440,All schools in #WVSDB closed Tue 2/17/15 due to inclement weather,WVDE Twitbot,10,8,2015-02-17 01:03:05,,2015-02-17
552421908126629888,All schools in #Brooke Co closed Tue 1/6/15,WVDE Twitbot,10,9,2015-01-06 11:10:21,Brooke County School District,2015-01-06
958313258993233920,UPDATE: All schools in #Pocahontas Co now closed Tue 1/30/18 due to inclement weather,WVDE Twitbot,5,0,2018-01-30 12:17:40,Pocahontas County School District,2018-01-30
561092757830524928,All schools in #Barbour Co closed Fri 1/30/15,WVDE Twitbot,6,8,2015-01-30 09:25:12,Barbour County School District,2015-01-30
690269615587467265,All schools in #Wyoming Co closed Fri 1/22/16 due to Severe Winter Weather,WVDE Twitbot,24,22,2016-01-21 20:27:55,Wyoming County School District,2016-01-22
959170041337008128,UPDATE: All schools in #Logan Co now closed Fri 2/2/18 All schools in Logan County closed on 2-2-18,WVDE Twitbot,61,25,2018-02-01 21:02:13,Logan County School District,2018-02-02
949036082137567232,All schools in #Randolph Co closed Fri 1/5/18,WVDE Twitbot,11,12,2018-01-04 21:53:28,Randolph County School District,2018-01-05
438288457920552961,UPDATE: All schools in #Ritchie Co now closed Tue 2/25/14,WVDE Twitbot,14,7,2014-02-25 12:24:46,Ritchie County School District,2014-02-25
573285894171594754,UPDATE: All schools in #Nicholas Co now closed Thu 3/5/15 due to weather conditions,WVDE Twitbot,8,16,2015-03-05 00:56:22,Nicholas County School District,2015-03-05
262689218214645761,All schools in #Morgan Co closed Mon 10/29/12 code A,WVDE Twitbot,0,6,2012-10-28 22:56:04,Morgan County School District,2012-10-29
953400249053270016,All schools in #Tyler Co closed Wed 1/17/18,WVDE Twitbot,17,10,2018-01-16 22:55:07,Tyler County School District,2018-01-17
961200920712372224,UPDATE: All schools in #Hardy Co now closed Wed 2/7/18,WVDE Twitbot,17,2,2018-02-07 11:32:12,Hardy County School District,2018-02-07
440625299416293377,All schools in #McDowell Co closed Tue 3/4/14 due to inclement weather,WVDE Twitbot,5,7,2014-03-03 23:10:32,McDowell County School District,2014-03-04
949039507831173122,All schools in #Ohio Co closed Fri 1/5/18,WVDE Twitbot,19,14,2018-01-04 22:07:05,Ohio County School District,2018-01-05
294387690445606912,All schools in #Nicholas Co closed Thu 1/24/13 due to Bad Weather,WVDE Twitbot,5,18,2013-01-24 10:14:29,Nicholas County School District,2013-01-24
697389009341911044,UPDATE: All schools in #Summers Co now closed Wed 2/10/16,WVDE Twitbot,6,4,2016-02-10 11:57:51,Summers County School District,2016-02-10
425565941930676224,All schools in #Calhoun Co closed Tue 1/21/14 due to Inclement Weather,WVDE Twitbot,4,4,2014-01-21 09:50:01,Calhoun County School District,2014-01-21
157762980946264066,All schools in #Taylor Co closed Fri 1/13/12,WVDE Twitbot,0,4,2012-01-13 09:56:40,Taylor County School District,2012-01-13
264087652628844544,All schools in #Taylor Co closed Fri 11/2/12  #WVSandy,WVDE Twitbot,1,11,2012-11-01 19:32:57,Taylor County School District,2012-11-02
154175478721294336,UPDATE: All schools in #Putnam Co now closed Tue 1/3/12 due to the weather conditions,WVDE Twitbot,0,12,2012-01-03 12:21:13,Putnam County School District,2012-01-03
841796815708139521,All schools in #Preston Co closed Wed 3/15/17 due to winter weather conditions,WVDE Twitbot,18,6,2017-03-14 23:42:55,Preston County School District,2017-03-15
553151149914996737,UPDATE: All schools in #Boone Co now closed Thu 1/8/15,WVDE Twitbot,21,32,2015-01-08 11:28:05,Boone County School District,2015-01-08
420350855628353536,All schools in #Hardy Co closed Tue 1/7/14,WVDE Twitbot,12,39,2014-01-07 00:27:08,Hardy County School District,2014-01-07
154158997954494464,All schools in #Mercer Co closed Tue 1/3/12 due to Inclement weather,WVDE Twitbot,0,0,2012-01-03 11:15:43,Mercer County School District,2012-01-03
702793984301789184,All schools in #Nicholas Co closed Thu 2/25/16 due to weather conditions,WVDE Twitbot,23,17,2016-02-25 09:55:17,Nicholas County School District,2016-02-25
262709207080525824,All schools in #Hampshire Co closed Mon 10/29/12 All evening activities are also cancelled.,WVDE Twitbot,2,12,2012-10-29 00:15:30,Hampshire County School District,2012-10-29
950723683571683330,UPDATE: All schools in #Pocahontas Co now closed Tue 1/9/18 due to icy road conditions,WVDE Twitbot,2,2,2018-01-09 13:39:24,Pocahontas County School District,2018-01-09
703184313240530944,UPDATE: All schools in #Fayette Co now closed Fri 2/26/16 due to inclement weather,WVDE Twitbot,24,35,2016-02-26 11:46:19,Fayette County School District,2016-02-26
420145980315402240,All schools in #Mercer Co closed Mon 1/6/14 due to inclement weather,WVDE Twitbot,2,4,2014-01-06 10:53:02,Mercer County School District,2014-01-06
691366917639110657,All schools in #Grant Co closed Mon 1/25/16 due to road conditions,WVDE Twitbot,20,22,2016-01-24 21:08:12,Grant County School District,2016-01-25
573422796711329792,All schools in #Jefferson Co closed Thu 3/5/15 due to Weather,WVDE Twitbot,32,34,2015-03-05 10:00:23,Jefferson County School District,2015-03-05
219530603987599360,UPDATE: All schools in #Fayette Co now closed Mon 7/2/12,WVDE Twitbot,0,3,2012-07-01 20:39:09,Fayette County School District,2012-07-02
567148785105903616,UPDATE: All schools in #Brooke Co now closed Mon 2/16/15,WVDE Twitbot,14,16,2015-02-16 02:29:42,Brooke County School District,2015-02-16
438642847168741376,UPDATE: All schools in #Braxton Co now closed Wed 2/26/14 Staff do NOT report.,WVDE Twitbot,2,7,2014-02-26 11:52:59,Braxton County School District,2014-02-26
445495253592596480,UPDATE: All schools in #Lewis Co now closed Mon 3/17/14,WVDE Twitbot,9,7,2014-03-17 09:42:00,Lewis County School District,2014-03-17
409810779991334913,All schools in #Hampshire Co closed Mon 12/9/13 due to snow and freezing rain,WVDE Twitbot,6,18,2013-12-08 22:24:38,Hampshire County School District,2013-12-09
420701282882813952,UPDATE: All schools in #Upshur Co now closed Wed 1/8/14,WVDE Twitbot,16,32,2014-01-07 23:39:36,Upshur County School District,2014-01-08
959222858600853511,All schools in #Raleigh Co closed Fri 2/2/18,WVDE Twitbot,71,49,2018-02-02 00:32:05,Raleigh County School District,2018-02-02
434083896590745600,All schools in #Monroe Co closed Fri 2/14/14,WVDE Twitbot,2,13,2014-02-13 21:57:20,Monroe County School District,2014-02-14
426476830804025344,All schools in #Taylor Co closed Fri 1/24/14,WVDE Twitbot,7,10,2014-01-23 22:09:34,Taylor County School District,2014-01-24
691345016497782785,All schools in #WVSDB closed Mon 1/25/16,WVDE Twitbot,20,8,2016-01-24 19:41:11,,2016-01-25
570319975044546560,All schools in #Wyoming Co closed Wed 2/25/15 due to inclement weather,WVDE Twitbot,14,30,2015-02-24 20:30:52,Wyoming County School District,2015-02-25
568186841658204160,All schools in #Lewis Co closed Thu 2/19/15,WVDE Twitbot,13,13,2015-02-18 23:14:34,Lewis County School District,2015-02-19
691384224402776064,All schools in #Pleasants Co closed Mon 1/25/16,WVDE Twitbot,25,37,2016-01-24 22:16:59,Pleasants County School District,2016-01-25
692026150231654401,1/2 All schools in #Berkeley Co closed Wed 1/27/16,WVDE Twitbot,58,93,2016-01-26 16:47:46,Berkeley County School District,2016-01-27
573598875354808320,All schools in #Tucker Co closed Fri 3/6/15,WVDE Twitbot,11,3,2015-03-05 21:40:03,Tucker County School District,2015-03-06
561127197713661952,UPDATE: All schools in #Summers Co now closed Fri 1/30/15,WVDE Twitbot,6,6,2015-01-30 11:42:03,Summers County School District,2015-01-30
561148628883218434,UPDATE: All schools in #Ohio Co now closed Fri 1/30/15,WVDE Twitbot,8,21,2015-01-30 13:07:13,Ohio County School District,2015-01-30
440602123919568896,All schools in #Fayette Co closed Tue 3/4/14 due to inclement weather code B,WVDE Twitbot,14,43,2014-03-03 21:38:26,Fayette County School District,2014-03-04
427935658477633536,All schools in #Wood Co closed Tue 1/28/14 due to frigid conditions code B,WVDE Twitbot,66,166,2014-01-27 22:46:26,Wood County School District,2014-01-28
421622360135831552,UPDATE: All schools in #Berkeley Co now closed Fri 1/10/14 due to weather,WVDE Twitbot,23,64,2014-01-10 12:39:38,Berkeley County School District,2014-01-10
953370798907121667,All schools in #Cabell Co closed Wed 1/17/18 due to inclement weather code red,WVDE Twitbot,34,21,2018-01-16 20:58:05,Cabell County School District,2018-01-17
552978262629314560,All schools in #Monroe Co closed Thu 1/8/15,WVDE Twitbot,14,26,2015-01-08 00:01:06,Monroe County School District,2015-01-08
961211524508540929,UPDATE: All schools in #Tyler Co now closed Wed 2/7/18,WVDE Twitbot,9,4,2018-02-07 12:14:20,Tyler County School District,2018-02-07
423882890091307008,All schools in #Boone Co closed Fri 1/17/14 due to the continued water crisis,WVDE Twitbot,5,18,2014-01-16 18:22:11,Boone County School District,2014-01-17
960486139898617857,UPDATE: All schools in #Mingo Co now closed Mon 2/5/18 Employees Code Orange.,WVDE Twitbot,11,17,2018-02-05 12:11:55,Mingo County School District,2018-02-05
420601758688100352,All schools in #Raleigh Co closed Wed 1/8/14 due to weather conditions,WVDE Twitbot,19,53,2014-01-07 17:04:08,Raleigh County School District,2014-01-08
297303122307596288,All schools in #Mercer Co closed Fri 2/1/13 due to inclement weather,WVDE Twitbot,1,6,2013-02-01 11:19:22,Mercer County School District,2013-02-01
690291745096110085,All schools in #Tyler Co closed Fri 1/22/16,WVDE Twitbot,19,19,2016-01-21 21:55:51,Tyler County School District,2016-01-22
573560654067548162,All schools in #Clay Co closed Fri 3/6/15 due to inclement weather,WVDE Twitbot,13,13,2015-03-05 19:08:10,Clay County School District,2015-03-06
691416049514840064,All schools in #Pendleton Co closed Mon 1/25/16,WVDE Twitbot,14,12,2016-01-25 00:23:26,Pendleton County School District,2016-01-25
262987177300987904,UPDATE: All schools in #Morgan Co now closed Tue 10/30/12 code H,WVDE Twitbot,1,2,2012-10-29 18:40:03,Morgan County School District,2012-10-30
948528418882236418,UPDATE: All schools in #Gilmer Co now closed Wed 1/3/18,WVDE Twitbot,2,1,2018-01-03 12:16:12,Gilmer County School District,2018-01-03
930028732206678016,All schools in #Braxton Co closed Mon 11/13/17 due to gas issues,WVDE Twitbot,3,3,2017-11-13 11:05:03,Braxton County School District,2017-11-13
412566955703300096,UPDATE: All schools in #Pleasants Co now closed Mon 12/16/13,WVDE Twitbot,7,11,2013-12-16 12:56:42,Pleasants County School District,2013-12-16
567492463544512512,All schools in #Pendleton Co closed Tue 2/17/15,WVDE Twitbot,8,8,2015-02-17 01:15:21,Pendleton County School District,2015-02-17
428323560609030144,All schools in #McDowell Co closed Wed 1/29/14 due to inclement weather,WVDE Twitbot,2,5,2014-01-29 00:27:49,McDowell County School District,2014-01-29
428346691494739969,UPDATE: All schools in #Putnam Co now closed Wed 1/29/14 due to Weather conditions,WVDE Twitbot,43,195,2014-01-29 01:59:44,Putnam County School District,2014-01-29
691662138746761216,All schools in #Kanawha Co closed Tue 1/26/16 due to Inclement Weather Conditions code B,WVDE Twitbot,195,392,2016-01-25 16:41:18,Kanawha County School District,2016-01-26
306380359698898944,UPDATE: All schools in #Greenbrier Co now closed Tue 2/26/13 due to Weather conditions,WVDE Twitbot,1,12,2013-02-26 12:29:04,Greenbrier County School District,2013-02-26
953773984704757761,All schools in #Clay Co closed Thu 1/18/18 Snow Packet - Day 2,WVDE Twitbot,7,7,2018-01-17 23:40:12,Clay County School District,2018-01-18
561091015327895552,All schools in #Upshur Co closed Fri 1/30/15 due to icybackroads,WVDE Twitbot,10,11,2015-01-30 09:18:17,Upshur County School District,2015-01-30
263052951281618946,All schools in #Randolph Co closed Tue 10/30/12 due to inclement weather  #WVSandy,WVDE Twitbot,2,17,2012-10-29 23:01:25,Randolph County School District,2012-10-30
954093961794252801,All schools in #Wayne Co closed Fri 1/19/18 due to poor road conditions,WVDE Twitbot,26,14,2018-01-18 20:51:41,Wayne County School District,2018-01-19
959389832798720000,UPDATE: All schools in #Nicholas Co now closed Fri 2/2/18,WVDE Twitbot,10,9,2018-02-02 11:35:35,Nicholas County School District,2018-02-02
567452868211662848,All schools in #Wyoming Co closed Tue 2/17/15 due to inclement weather,WVDE Twitbot,15,31,2015-02-16 22:38:01,Wyoming County School District,2015-02-17
691755692596793344,All schools in #Summers Co closed Tue 1/26/16,WVDE Twitbot,14,12,2016-01-25 22:53:03,Summers County School District,2016-01-26
440612827464601600,All schools in #Clay Co closed Tue 3/4/14 due to weather conditions,WVDE Twitbot,13,23,2014-03-03 22:20:58,Clay County School District,2014-03-04
444055193013854208,UPDATE: All schools in #Tucker Co now closed Thu 3/13/14,WVDE Twitbot,5,0,2014-03-13 10:19:42,Tucker County School District,2014-03-13
154176995662635009,1/2 UPDATE: All schools in #Barbour Co now closed Tue 1/3/12 due to inclement weather,WVDE Twitbot,0,0,2012-01-03 12:27:14,Barbour County School District,2012-01-03
565842670040666113,UPDATE: All schools in #Calhoun Co now closed Thu 2/12/15 due to Road Conditions code blue,WVDE Twitbot,6,3,2015-02-12 11:59:40,Calhoun County School District,2015-02-12
294402479863525376,UPDATE: All schools in #Upshur Co now closed Thu 1/24/13,WVDE Twitbot,3,12,2013-01-24 11:13:15,Upshur County School District,2013-01-24
699571584630177792,UPDATE: All schools in #Jackson Co now closed Tue 2/16/16 code A,WVDE Twitbot,34,30,2016-02-16 12:30:37,Jackson County School District,2016-02-16
697013509582880768,UPDATE: All schools in #Monroe Co now closed Tue 2/9/16,WVDE Twitbot,10,3,2016-02-09 11:05:45,Monroe County School District,2016-02-09
568187900984209408,All schools in #Fayette Co closed Thu 2/19/15 due to inclement weather,WVDE Twitbot,44,55,2015-02-18 23:18:46,Fayette County School District,2015-02-19
692082705564078084,All schools in #Marion Co closed Wed 1/27/16 due to Inclement weather,WVDE Twitbot,50,103,2016-01-26 20:32:29,Marion County School District,2016-01-27
692086410212433920,All schools in #Lincoln Co closed Wed 1/27/16,WVDE Twitbot,24,18,2016-01-26 20:47:13,Lincoln County School District,2016-01-27
953224189904908288,UPDATE: All schools in #Tyler Co now closed Tue 1/16/18,WVDE Twitbot,6,6,2018-01-16 11:15:31,Tyler County School District,2018-01-16
428309740343398400,All schools in #Tucker Co closed Wed 1/29/14,WVDE Twitbot,6,3,2014-01-28 23:32:54,Tucker County School District,2014-01-29
573602623468781568,All schools in #Mercer Co closed Fri 3/6/15 due to inclement weather,WVDE Twitbot,12,21,2015-03-05 21:54:57,Mercer County School District,2015-03-06
426146533361217536,All schools in #Monroe Co closed Thu 1/23/14,WVDE Twitbot,9,22,2014-01-23 00:17:05,Monroe County School District,2014-01-23
573442947032698881,UPDATE: All schools in #Boone Co now closed Thu 3/5/15 All facilities are closed for today. No employees are to report.,WVDE Twitbot,3,4,2015-03-05 11:20:27,Boone County School District,2015-03-05
426663347988492288,UPDATE: All schools in #Roane Co now closed Fri 1/24/14 due to extreme cold,WVDE Twitbot,3,8,2014-01-24 10:30:43,Roane County School District,2014-01-24
420284432067473408,"All schools in #Roane Co closed Tue 1/7/14 due to snow, ice &amp; extreme cold",WVDE Twitbot,11,19,2014-01-06 20:03:11,Roane County School District,2014-01-07
691711256017903616,All schools in #Upshur Co closed Tue 1/26/16 due to Road conditions on back roads,WVDE Twitbot,24,21,2016-01-25 19:56:29,Upshur County School District,2016-01-26
841953307430125568,UPDATE: All schools in #Morgan Co now closed Wed 3/15/17 code A,WVDE Twitbot,12,8,2017-03-15 10:04:45,Morgan County School District,2017-03-15
427944965470048256,All schools in #Ohio Co closed Tue 1/28/14,WVDE Twitbot,17,58,2014-01-27 23:23:25,Ohio County School District,2014-01-28
950702083380047874,UPDATE: All schools in #Doddridge Co now closed Tue 1/9/18 due to inclement weather code C,WVDE Twitbot,6,5,2018-01-09 12:13:34,Doddridge County School District,2018-01-09
419040239420600320,All schools in #Gilmer Co closed Fri 1/3/14,WVDE Twitbot,3,7,2014-01-03 09:39:13,Gilmer County School District,2014-01-03
818228544375586816,All schools in #Mercer Co closed Mon 1/9/17 due to inclement weather conditions,WVDE Twitbot,29,23,2017-01-08 22:51:01,Mercer County School District,2017-01-09
297280467030380544,All schools in #Braxton Co closed Fri 2/1/13 due to inclement weather,WVDE Twitbot,1,8,2013-02-01 09:49:21,Braxton County School District,2013-02-01
567146181894340608,UPDATE: All schools in #Ritchie Co now closed Mon 2/16/15,WVDE Twitbot,16,19,2015-02-16 02:19:21,Ritchie County School District,2015-02-16
690267387095023617,All schools in #Ritchie Co closed Fri 1/22/16,WVDE Twitbot,17,13,2016-01-21 20:19:04,Ritchie County School District,2016-01-22
263084079338102784,All schools in #Summers Co closed Tue 10/30/12  #WVSandy,WVDE Twitbot,0,5,2012-10-30 01:05:07,Summers County School District,2012-10-30
960472079115214849,UPDATE: All schools in #Morgan Co now closed Mon 2/5/18 code A,WVDE Twitbot,11,8,2018-02-05 11:16:03,Morgan County School District,2018-02-05
553199361975664640,All schools in #Mercer Co closed Thu 1/8/15 due to Inclement weather,WVDE Twitbot,5,1,2015-01-08 14:39:40,Mercer County School District,2015-01-08
266361383518629889,1/2 All schools in #Preston Co closed Thu 11/8/12,WVDE Twitbot,0,0,2012-11-08 02:07:57,Preston County School District,2012-11-08
699035303793848320,All schools in #Summers Co closed Mon 2/15/16,WVDE Twitbot,21,9,2016-02-15 00:59:38,Summers County School District,2016-02-15
573098734441123840,UPDATE: All schools in #Tyler Co now closed Wed 3/4/15 due to high water Schools are closed today for all students and staff.,WVDE Twitbot,7,8,2015-03-04 12:32:40,Tyler County School District,2015-03-04
691320549373509632,UPDATE: All schools in #Roane Co now closed Mon 1/25/16 due to snow,WVDE Twitbot,17,5,2016-01-24 18:03:57,Roane County School District,2016-01-25
826023980679184385,UPDATE: All schools in #Clay Co now closed Mon 1/30/17,WVDE Twitbot,5,9,2017-01-30 11:07:18,Clay County School District,2017-01-30
445521581448499202,UPDATE: All schools in #Summers Co now closed Mon 3/17/14,WVDE Twitbot,8,12,2014-03-17 11:26:37,Summers County School District,2014-03-17
959419550356983808,UPDATE: All schools in #Monroe Co now closed Fri 2/2/18 due to inclement weather. Reimagined Day 2  is used,WVDE Twitbot,12,6,2018-02-02 13:33:40,Monroe County School District,2018-02-02
448751699532861440,All schools in #Wyoming Co closed Wed 3/26/14 due to inclement weather,WVDE Twitbot,9,21,2014-03-26 09:21:57,Wyoming County School District,2014-03-26
697025970109288448,UPDATE: All schools in #Tucker Co now closed Tue 2/9/16,WVDE Twitbot,17,13,2016-02-09 11:55:16,Tucker County School District,2016-02-09
430161783651696640,All schools in #Pleasants Co closed Mon 2/3/14,WVDE Twitbot,18,20,2014-02-03 02:12:15,Pleasants County School District,2014-02-03
561128149975855105,UPDATE: All schools in #Gilmer Co now closed Fri 1/30/15,WVDE Twitbot,5,3,2015-01-30 11:45:50,Gilmer County School District,2015-01-30
691379874863407105,All schools in #McDowell Co closed Mon 1/25/16,WVDE Twitbot,10,7,2016-01-24 21:59:42,McDowell County School District,2016-01-25
432855054366670848,UPDATE: All schools in #Raleigh Co now closed Mon 2/10/14 due to road conditions code A Employees must report.,WVDE Twitbot,16,27,2014-02-10 12:34:21,Raleigh County School District,2014-02-10
427745558740992000,UPDATE: All schools in #Barbour Co now closed Mon 1/27/14,WVDE Twitbot,3,7,2014-01-27 10:11:02,Barbour County School District,2014-01-27
430279206401224704,1/2 All schools in #Preston Co closed Mon 2/3/14,WVDE Twitbot,2,11,2014-02-03 09:58:51,Preston County School District,2014-02-03
298747947535986688,UPDATE: All schools in #Doddridge Co now closed Tue 2/5/13 due to Snow &amp; Slick Roads,WVDE Twitbot,1,3,2013-02-05 11:00:35,Doddridge County School District,2013-02-05
444063372015718400,1/2 All schools in #Grant Co closed Thu 3/13/14 due to extreme cold temperatures,WVDE Twitbot,6,3,2014-03-13 10:52:12,Grant County School District,2014-03-13
294663369267478530,All schools in #Wetzel Co closed Fri 1/25/13,WVDE Twitbot,4,4,2013-01-25 04:29:56,Wetzel County School District,2013-01-25
958307871183327232,UPDATE: All schools in #Nicholas Co now closed Tue 1/30/18,WVDE Twitbot,8,8,2018-01-30 11:56:15,Nicholas County School District,2018-01-30
427522652412968960,All schools in #Marshall Co closed Mon 1/27/14,WVDE Twitbot,13,39,2014-01-26 19:25:17,Marshall County School District,2014-01-27
567291490335207424,UPDATE: All schools in #Morgan Co now closed Mon 2/16/15 code A,WVDE Twitbot,3,19,2015-02-16 11:56:45,Morgan County School District,2015-02-16
948549106980573185,UPDATE: All schools in #Ritchie Co now closed Wed 1/3/18,WVDE Twitbot,33,17,2018-01-03 13:38:24,Ritchie County School District,2018-01-03
567103372281794560,All schools in #Calhoun Co closed Mon 2/16/15 due to dangerous temperatures and impending storm warning code red,WVDE Twitbot,6,6,2015-02-15 23:29:14,Calhoun County School District,2015-02-16
953589362079432704,UPDATE: All schools in #Pendleton Co now closed Wed 1/17/18,WVDE Twitbot,5,4,2018-01-17 11:26:35,Pendleton County School District,2018-01-17
568522304000385025,All schools in #Hardy Co closed Fri 2/20/15,WVDE Twitbot,10,32,2015-02-19 21:27:34,Hardy County School District,2015-02-20
426466229524504576,All schools in #Webster Co closed Fri 1/24/14 due to Weather Conditions,WVDE Twitbot,7,11,2014-01-23 21:27:27,Webster County School District,2014-01-24
572369854038216704,UPDATE: All schools in #Ohio Co now closed Mon 3/2/15,WVDE Twitbot,18,61,2015-03-02 12:16:21,Ohio County School District,2015-03-02
691716669392166912,"All schools in #Braxton Co closed Tue 1/26/16 Board office employees,maintenance, principals, and custodians over 200 days please report.",WVDE Twitbot,15,13,2016-01-25 20:18:00,Braxton County School District,2016-01-26
426457651384315905,UPDATE: All schools in #Upshur Co now closed Fri 1/24/14,WVDE Twitbot,4,25,2014-01-23 20:53:21,Upshur County School District,2014-01-24
297293352578187264,UPDATE: All schools in #Ritchie Co now closed Fri 2/1/13,WVDE Twitbot,1,6,2013-02-01 10:40:33,Ritchie County School District,2013-02-01
958314372715171840,UPDATE: All schools in #Taylor Co now closed Tue 1/30/18,WVDE Twitbot,16,7,2018-01-30 12:22:05,Taylor County School District,2018-01-30
157760651287207936,All schools in #Marion Co closed Fri 1/13/12 due to ICEY ROAD CONDITIONS,WVDE Twitbot,0,4,2012-01-13 09:47:24,Marion County School District,2012-01-13
440278741600591872,All schools in #Pleasants Co closed Mon 3/3/14,WVDE Twitbot,14,25,2014-03-03 00:13:26,Pleasants County School District,2014-03-03
428888700139741185,UPDATE: All schools in #Wyoming Co now closed Thu 1/30/14 due to inclement weather,WVDE Twitbot,8,10,2014-01-30 13:53:29,Wyoming County School District,2014-01-30
430313211410120704,UPDATE: All schools in #Lincoln Co now closed Mon 2/3/14,WVDE Twitbot,10,41,2014-02-03 12:13:59,Lincoln County School District,2014-02-03
953425768926924805,All schools in #Calhoun Co closed Wed 1/17/18 code blue,WVDE Twitbot,6,0,2018-01-17 00:36:31,Calhoun County School District,2018-01-17
953753072832000000,All schools in #Mingo Co closed Thu 1/18/18 Employees Code Orange.,WVDE Twitbot,37,23,2018-01-17 22:17:07,Mingo County School District,2018-01-18
426133444649684992,All schools in #Nicholas Co closed Thu 1/23/14,WVDE Twitbot,5,16,2014-01-22 23:25:05,Nicholas County School District,2014-01-23
427869571324706816,All schools in #Fayette Co closed Tue 1/28/14 due to inclement weather code A,WVDE Twitbot,23,52,2014-01-27 18:23:49,Fayette County School District,2014-01-28
445498986997100544,UPDATE: All schools in #Gilmer Co now closed Mon 3/17/14,WVDE Twitbot,6,5,2014-03-17 09:56:50,Gilmer County School District,2014-03-17
573577900831670272,All schools in #Putnam Co closed Fri 3/6/15 due to weather conditions,WVDE Twitbot,43,95,2015-03-05 20:16:42,Putnam County School District,2015-03-06
691357569844121600,All schools in #Nicholas Co closed Mon 1/25/16 due to snow accumulations,WVDE Twitbot,24,32,2016-01-24 20:31:04,Nicholas County School District,2016-01-25
953409133667082240,All schools in #Gilmer Co closed Wed 1/17/18,WVDE Twitbot,11,5,2018-01-16 23:30:25,Gilmer County School District,2018-01-17
699178615318126593,UPDATE: All schools in #Barbour Co now closed Mon 2/15/16 due to weather conditions,WVDE Twitbot,12,8,2016-02-15 10:29:06,Barbour County School District,2016-02-15
705558469366124544,All schools in #Raleigh Co closed Fri 3/4/16,WVDE Twitbot,62,101,2016-03-04 01:00:22,Raleigh County School District,2016-03-04
949052320855347201,All schools in #Clay Co closed Fri 1/5/18,WVDE Twitbot,5,12,2018-01-04 22:58:00,Clay County School District,2018-01-05
263791485961519104,All schools in #Braxton Co closed Thu 11/1/12 due to electrical outages  #WVSandy,WVDE Twitbot,2,10,2012-10-31 23:56:05,Braxton County School District,2012-11-01
428310785316487168,All schools in #Logan Co closed Wed 1/29/14,WVDE Twitbot,34,53,2014-01-28 23:37:03,Logan County School District,2014-01-29
567810513519910912,All schools in #Boone Co closed Wed 2/18/15 The 240 and 261 day employees should report following their delay schedule.,WVDE Twitbot,19,31,2015-02-17 22:19:10,Boone County School District,2015-02-18
420672293652529152,All schools in #Roane Co closed Wed 1/8/14 due to secondary road conditions + frigid temperatures in the morning,WVDE Twitbot,6,19,2014-01-07 21:44:25,Roane County School District,2014-01-08
434079883396788225,All schools in #Summers Co closed Fri 2/14/14,WVDE Twitbot,3,13,2014-02-13 21:41:23,Summers County School District,2014-02-14
176635304856403968,UPDATE: All schools in #Mingo Co now closed Mon 3/5/12 code A,WVDE Twitbot,0,1,2012-03-05 11:48:33,Mingo County School District,2012-03-05
426682326832005120,UPDATE: All schools in #Wetzel Co now closed Fri 1/24/14,WVDE Twitbot,12,16,2014-01-24 11:46:08,Wetzel County School District,2014-01-24
419064998628192256,UPDATE: All schools in #Marshall Co now closed Fri 1/3/14,WVDE Twitbot,12,18,2014-01-03 11:17:36,Marshall County School District,2014-01-03
950310480970739712,1/2 UPDATE: All schools in #Braxton Co now closed Mon 1/8/18 due to possible hazardous driving conditions,WVDE Twitbot,8,3,2018-01-08 10:17:29,Braxton County School District,2018-01-08
431405746811465728,UPDATE: All schools in #Webster Co now closed Thu 2/6/14 due to Weather Conditions,WVDE Twitbot,6,11,2014-02-06 12:35:19,Webster County School District,2014-02-06
427933317023809536,All schools in #Monongalia Co closed Tue 1/28/14,WVDE Twitbot,39,120,2014-01-27 22:37:08,Monongalia County School District,2014-01-28
423573586884837376,All schools in #Kanawha Co closed Thu 1/16/14 due to water crisis code B,WVDE Twitbot,58,220,2014-01-15 21:53:07,Kanawha County School District,2014-01-16
567435857674924032,All schools in #Pocahontas Co closed Tue 2/17/15,WVDE Twitbot,5,8,2015-02-16 21:30:25,Pocahontas County School District,2015-02-17
567430757183127552,All schools in #Wirt Co closed Tue 2/17/15,WVDE Twitbot,9,16,2015-02-16 21:10:09,Wirt County School District,2015-02-17
297319603967766530,UPDATE: All schools in #Morgan Co now closed Fri 2/1/13 code A,WVDE Twitbot,1,16,2013-02-01 12:24:52,Morgan County School District,2013-02-01
553151045673963520,UPDATE: All schools in #Doddridge Co now closed Thu 1/8/15 due to Inclement Weather-Extreme Cold Temperatures,WVDE Twitbot,9,7,2015-01-08 11:27:40,Doddridge County School District,2015-01-08
950333585076211712,UPDATE: All schools in #Jackson Co now closed Mon 1/8/18 code B,WVDE Twitbot,21,7,2018-01-08 11:49:17,Jackson County School District,2018-01-08
826018919123136512,UPDATE: All schools in #Raleigh Co now closed Mon 1/30/17,WVDE Twitbot,40,46,2017-01-30 10:47:11,Raleigh County School District,2017-01-30
561140033252769792,UPDATE: All schools in #Mason Co now closed Fri 1/30/15 due to Inclement weather code red,WVDE Twitbot,28,32,2015-01-30 12:33:04,Mason County School District,2015-01-30
316109450412965888,All schools in #Morgan Co closed Mon 3/25/13 code A,WVDE Twitbot,2,11,2013-03-25 08:49:00,Morgan County School District,2013-03-25
690307712769486848,All schools in #Raleigh Co closed Fri 1/22/16 due to weather conditions,WVDE Twitbot,52,105,2016-01-21 22:59:18,Raleigh County School District,2016-01-22
440419440287838208,All schools in #Lewis Co closed Mon 3/3/14,WVDE Twitbot,4,8,2014-03-03 09:32:31,Lewis County School District,2014-03-03
702793123513114624,All schools in #Fayette Co closed Thu 2/25/16 due to inclement weather,WVDE Twitbot,27,35,2016-02-25 09:51:52,Fayette County School District,2016-02-25
298386405829246977,UPDATE: All schools in #Marion Co now closed Mon 2/4/13 due to INCLEMENT WEATHER,WVDE Twitbot,6,27,2013-02-04 11:03:57,Marion County School District,2013-02-04
953725765492924417,All schools in #Cabell Co closed Thu 1/18/18 due to inclement weather code red,WVDE Twitbot,24,20,2018-01-17 20:28:36,Cabell County School District,2018-01-18
687241160570630144,UPDATE: All schools in #Preston Co now closed Wed 1/13/16 due to winter weather conditions,WVDE Twitbot,17,13,2016-01-13 11:53:55,Preston County School District,2016-01-13
949038284197498880,All schools in #Lewis Co closed Fri 1/5/18 due to Poor weather conditions,WVDE Twitbot,7,4,2018-01-04 22:02:13,Lewis County School District,2018-01-05
420124732152086528,"All schools in #Barbour Co closed Mon 1/6/14 due to impending frigid temperatures, weather, and road conditions",WVDE Twitbot,3,5,2014-01-06 09:28:36,Barbour County School District,2014-01-06
440786209959583744,UPDATE: All schools in #Preston Co now closed Tue 3/4/14,WVDE Twitbot,7,7,2014-03-04 09:49:56,Preston County School District,2014-03-04
70817418074783745,UPDATE: All schools in #Hardy Co now closed Wed 5/18/11,WVDE Twitbot,0,0,2011-05-18 11:46:02,Hardy County School District,2011-05-18
568120462812831744,All schools in #Cabell Co closed Thu 2/19/15 due to inclement weather code red,WVDE Twitbot,51,56,2015-02-18 18:50:48,Cabell County School District,2015-02-19
567281129460604928,UPDATE: All schools in #Preston Co now closed Mon 2/16/15 due to frigid temperatures &amp; winter weather conditions,WVDE Twitbot,2,2,2015-02-16 11:15:35,Preston County School District,2015-02-16
573420900470665216,All schools in #Brooke Co closed Thu 3/5/15,WVDE Twitbot,10,5,2015-03-05 09:52:50,Brooke County School District,2015-03-05
425567190599745537,All schools in #Hampshire Co closed Tue 1/21/14,WVDE Twitbot,9,8,2014-01-21 09:54:59,Hampshire County School District,2014-01-21
953423420632465414,All schools in #McDowell Co closed Wed 1/17/18,WVDE Twitbot,9,4,2018-01-17 00:27:11,McDowell County School District,2018-01-17
421609769523511297,UPDATE: All schools in #Pendleton Co now closed Fri 1/10/14 due to Inclement weather,WVDE Twitbot,2,12,2014-01-10 11:49:36,Pendleton County School District,2014-01-10
154152622134263810,UPDATE: All schools in #Raleigh Co now closed Tue 1/3/12,WVDE Twitbot,0,7,2012-01-03 10:50:23,Raleigh County School District,2012-01-03
294748466020757508,All schools in #Monroe Co closed Fri 1/25/13,WVDE Twitbot,2,6,2013-01-25 10:08:05,Monroe County School District,2013-01-25
309238499985457152,All schools in #Greenbrier Co closed Wed 3/6/13 due to Weather conditions,WVDE Twitbot,1,10,2013-03-06 09:46:18,Greenbrier County School District,2013-03-06
696997481314435072,All schools in #Lewis Co closed Tue 2/9/16,WVDE Twitbot,12,10,2016-02-09 10:02:03,Lewis County School District,2016-02-09
440438619480678400,UPDATE: All schools in #Cabell Co now closed Mon 3/3/14 due to inclement weather code blue,WVDE Twitbot,4,6,2014-03-03 10:48:44,Cabell County School District,2014-03-03
418938738836652032,All schools in #Nicholas Co closed Fri 1/3/14,WVDE Twitbot,15,22,2014-01-03 02:55:53,Nicholas County School District,2014-01-03
297289214607912960,All schools in #Doddridge Co closed Fri 2/1/13 due to Snow &amp; Frigid Conditons,WVDE Twitbot,0,1,2013-02-01 10:24:06,Doddridge County School District,2013-02-01
573424199118823425,All schools in #Hampshire Co closed Thu 3/5/15 due to winter storm warning,WVDE Twitbot,13,10,2015-03-05 10:05:57,Hampshire County School District,2015-03-05
420159805387309056,UPDATE: All schools in #Hancock Co now closed Mon 1/6/14,WVDE Twitbot,3,6,2014-01-06 11:47:58,Hancock County School District,2014-01-06
691398172715962368,All schools in #Wyoming Co closed Mon 1/25/16,WVDE Twitbot,19,29,2016-01-24 23:12:24,Wyoming County School District,2016-01-25
775447434310942720,All schools in #Calhoun Co closed Tue 9/13/16 due to Mandatory EPA testing Due to Mandatory EPA Testing,WVDE Twitbot,12,13,2016-09-12 21:34:10,Calhoun County School District,2016-09-13
309469654777217025,All schools in #Hardy Co closed Thu 3/7/13,WVDE Twitbot,4,11,2013-03-07 01:04:50,Hardy County School District,2013-03-07
567422618002030592,All schools in #Upshur Co closed Tue 2/17/15,WVDE Twitbot,19,26,2015-02-16 20:37:48,Upshur County School District,2015-02-17
410391465941282816,UPDATE: All schools in #Calhoun Co now closed Tue 12/10/13 due to Inclement Weather,WVDE Twitbot,5,7,2013-12-10 12:52:04,Calhoun County School District,2013-12-10
426712271772209152,All schools in #Mercer Co closed Fri 1/24/14 due to inclement weather,WVDE Twitbot,2,1,2014-01-24 13:45:08,Mercer County School District,2014-01-24
295863030854586370,UPDATE: All schools in #Mineral Co now closed Mon 1/28/13 due to Freezing rain code A,WVDE Twitbot,5,17,2013-01-28 11:56:58,Mineral County School District,2013-01-28
420658261503647744,All schools in #Fayette Co closed Wed 1/8/14 due to inclement weather,WVDE Twitbot,18,61,2014-01-07 20:48:39,Fayette County School District,2014-01-08
691389772460335104,All schools in #Hardy Co closed Mon 1/25/16,WVDE Twitbot,24,30,2016-01-24 22:39:01,Hardy County School District,2016-01-25
297274943295594496,All schools in #Wood Co closed Fri 2/1/13 due to inclement weather code A,WVDE Twitbot,16,62,2013-02-01 09:27:24,Wood County School District,2013-02-01
691387371049336832,All schools in #Cabell Co closed Mon 1/25/16 due to Inclement weather code red All custodians report at 7:00 AM.,WVDE Twitbot,61,58,2016-01-24 22:29:29,Cabell County School District,2016-01-25
949037729295355905,All schools in #Lincoln Co closed Fri 1/5/18,WVDE Twitbot,5,5,2018-01-04 22:00:01,Lincoln County School District,2018-01-05
438639307109060610,UPDATE: All schools in #Tucker Co now closed Wed 2/26/14,WVDE Twitbot,10,3,2014-02-26 11:38:54,Tucker County School District,2014-02-26
963014280554668032,UPDATE: All schools in #Tyler Co now closed Mon 2/12/18,WVDE Twitbot,9,5,2018-02-12 11:37:51,Tyler County School District,2018-02-12
298235784031518720,All schools in #Mercer Co closed Mon 2/4/13 due to inclement weather,WVDE Twitbot,2,6,2013-02-04 01:05:26,Mercer County School District,2013-02-04
553135996037246976,UPDATE: All schools in #Ohio Co now closed Thu 1/8/15,WVDE Twitbot,25,48,2015-01-08 10:27:52,Ohio County School District,2015-01-08
568143336176893952,All schools in #Summers Co closed Thu 2/19/15,WVDE Twitbot,7,8,2015-02-18 20:21:41,Summers County School District,2015-02-19
561134916822642688,UPDATE: All schools in #Marshall Co now closed Fri 1/30/15,WVDE Twitbot,10,36,2015-01-30 12:12:44,Marshall County School District,2015-01-30
690325673664237568,All schools in #Hardy Co closed Fri 1/22/16,WVDE Twitbot,27,43,2016-01-22 00:10:40,Hardy County School District,2016-01-22
699556977484009473,UPDATE: All schools in #Preston Co now closed Tue 2/16/16 due to winter weather conditions,WVDE Twitbot,8,7,2016-02-16 11:32:35,Preston County School District,2016-02-16
431011117754638337,UPDATE: All schools in #Jefferson Co now closed Wed 2/5/14 due to weather,WVDE Twitbot,7,17,2014-02-05 10:27:12,Jefferson County School District,2014-02-05
566171483240955904,UPDATE: All schools in #Barbour Co now closed Fri 2/13/15,WVDE Twitbot,6,4,2015-02-13 09:46:15,Barbour County School District,2015-02-13
428314461074501632,All schools in #Nicholas Co closed Wed 1/29/14,WVDE Twitbot,13,26,2014-01-28 23:51:39,Nicholas County School District,2014-01-29
841961672516472833,UPDATE: All schools in #Barbour Co now closed Wed 3/15/17 due to weather conditions,WVDE Twitbot,12,11,2017-03-15 10:38:00,Barbour County School District,2017-03-15
410355154488020992,All schools in #Wyoming Co closed Tue 12/10/13 due to inclement weather,WVDE Twitbot,7,18,2013-12-10 10:27:47,Wyoming County School District,2013-12-10
420759586346643456,UPDATE: All schools in #Marshall Co now closed Wed 1/8/14,WVDE Twitbot,4,14,2014-01-08 03:31:17,Marshall County School District,2014-01-08
263058124905263104,All schools in #Upshur Co closed Tue 10/30/12 due to inclement weather  #WVSandy,WVDE Twitbot,3,17,2012-10-29 23:21:59,Upshur County School District,2012-10-30
294380964216459265,All schools in #Webster Co closed Thu 1/24/13 due to Weather Conditions,WVDE Twitbot,2,7,2013-01-24 09:47:45,Webster County School District,2013-01-24
950320276889391105,UPDATE: All schools in #Pendleton Co now closed Mon 1/8/18,WVDE Twitbot,4,2,2018-01-08 10:56:24,Pendleton County School District,2018-01-08
691713105915674627,All schools in #Mineral Co closed Tue 1/26/16 due to inclement weather,WVDE Twitbot,37,62,2016-01-25 20:03:50,Mineral County School District,2016-01-26
298376573122408448,UPDATE: All schools in #Pocahontas Co now closed Mon 2/4/13 due to snow,WVDE Twitbot,4,4,2013-02-04 10:24:53,Pocahontas County School District,2013-02-04
569627022076596224,All schools in #Fayette Co closed Mon 2/23/15 due to inclement weather,WVDE Twitbot,28,65,2015-02-22 22:37:19,Fayette County School District,2015-02-23
426479049318219776,UPDATE: All schools in #Wirt Co now closed Fri 1/24/14 due to Wind Chill advisory issued by Homeland Security Emergency Management.,WVDE Twitbot,11,26,2014-01-23 22:18:23,Wirt County School District,2014-01-24
568555039071080448,All schools in #Hampshire Co closed Fri 2/20/15,WVDE Twitbot,17,29,2015-02-19 23:37:39,Hampshire County School District,2015-02-20
427608950695936002,All schools in #Ritchie Co closed Mon 1/27/14,WVDE Twitbot,10,16,2014-01-27 01:08:13,Ritchie County School District,2014-01-27
693043653959352320,UPDATE: All schools in #Greenbrier Co now closed Fri 1/29/16 due to Weather conditions,WVDE Twitbot,20,27,2016-01-29 12:10:57,Greenbrier County School District,2016-01-29
425579016712507392,UPDATE: All schools in #Tucker Co now closed Tue 1/21/14,WVDE Twitbot,6,6,2014-01-21 10:41:59,Tucker County School District,2014-01-21
826056016475353088,UPDATE: All schools in #Wood Co now closed Mon 1/30/17 This is a STATUS UPDATE.,WVDE Twitbot,157,241,2017-01-30 13:14:36,Wood County School District,2017-01-30
567113223938519040,All schools in #Roane Co closed Mon 2/16/15 due to extreme temperatures and expected snow,WVDE Twitbot,13,20,2015-02-16 00:08:23,Roane County School District,2015-02-16
950163491394064397,All schools in #Clay Co closed Mon 1/8/18,WVDE Twitbot,11,8,2018-01-08 00:33:24,Clay County School District,2018-01-08
428323812573081600,All schools in #Mason Co closed Wed 1/29/14 due to Inclement Weather code A Regular staff to report observing 2 hour delay.,WVDE Twitbot,6,23,2014-01-29 00:28:49,Mason County School District,2014-01-29
568102710089814017,All schools in #Putnam Co closed Thu 2/19/15 due to Weather conditions,WVDE Twitbot,68,105,2015-02-18 17:40:15,Putnam County School District,2015-02-19
573575545293770752,All schools in #Marion Co closed Fri 3/6/15 due to INCLEMENT WEATHER,WVDE Twitbot,20,36,2015-03-05 20:07:21,Marion County School District,2015-03-06
412561319640825857,UPDATE: All schools in #Doddridge Co now closed Mon 12/16/13 due to Inclement weather,WVDE Twitbot,3,12,2013-12-16 12:34:18,Doddridge County School District,2013-12-16
294399818573422595,UPDATE: All schools in #Clay Co now closed Thu 1/24/13 due to Weather conditions,WVDE Twitbot,3,6,2013-01-24 11:02:41,Clay County School District,2013-01-24
568567248610316288,All schools in #Tyler Co closed Fri 2/20/15 All 240 and 261 day employees should report on a two-hour delay.,WVDE Twitbot,14,11,2015-02-20 00:26:10,Tyler County School District,2015-02-20
690128389588520960,UPDATE: All schools in #Monongalia Co now closed Thu 1/21/16,WVDE Twitbot,64,71,2016-01-21 11:06:44,Monongalia County School District,2016-01-21
563305182860439553,UPDATE: All schools in #Preston Co now closed Thu 2/5/15 due to winter weather conditions,WVDE Twitbot,9,6,2015-02-05 11:56:35,Preston County School District,2015-02-05
949033502695141376,All schools in #Webster Co closed Fri 1/5/18 due to weather conditions,WVDE Twitbot,16,5,2018-01-04 21:43:13,Webster County School District,2018-01-05
567451271284920321,All schools in #Gilmer Co closed Tue 2/17/15,WVDE Twitbot,11,7,2015-02-16 22:31:40,Gilmer County School District,2015-02-17
428315320818737152,All schools in #Boone Co closed Wed 1/29/14 due to inclement winter weather,WVDE Twitbot,13,52,2014-01-28 23:55:04,Boone County School District,2014-01-29
553151585141157889,UPDATE: All schools in #Monongalia Co now closed Thu 1/8/15,WVDE Twitbot,45,81,2015-01-08 11:29:49,Monongalia County School District,2015-01-08
421455027291422720,UPDATE: All schools in #Boone Co now closed Fri 1/10/14 due to the announced water emergency,WVDE Twitbot,5,22,2014-01-10 01:34:43,Boone County School District,2014-01-10
263194406302126080,All schools in #Braxton Co closed Tue 10/30/12 due to inclement weather  #WVSandy,WVDE Twitbot,3,5,2012-10-30 08:23:31,Braxton County School District,2012-10-30
304926946402381824,UPDATE: All schools in #Greenbrier Co now closed Fri 2/22/13 due to Weather conditions,WVDE Twitbot,4,14,2013-02-22 12:13:43,Greenbrier County School District,2013-02-22
961063204637036545,All schools in #Wetzel Co closed Wed 2/7/18 due to the fact that I lost a foul shooting contest with my daughter ( https://t.co/snz3VMCIal,WVDE Twitbot,822,232,2018-02-07 02:24:58,Wetzel County School District,2018-02-07
949030671615447040,All schools in #McDowell Co closed Fri 1/5/18,WVDE Twitbot,4,3,2018-01-04 21:31:58,McDowell County School District,2018-01-05
294753034016284672,"All schools in #Wirt Co on a 1-hr delay Fri 1/25/13 Wirt County schools will be closed today Friday, January 25, 2013",WVDE Twitbot,1,2,2013-01-25 10:26:14,Wirt County School District,2013-01-25
418901926214762496,All schools in #Pocahontas Co closed Fri 1/3/14,WVDE Twitbot,8,18,2014-01-03 00:29:36,Pocahontas County School District,2014-01-03
568181538162139136,All schools in #Pocahontas Co closed Thu 2/19/15,WVDE Twitbot,6,5,2015-02-18 22:53:29,Pocahontas County School District,2015-02-19
440307715437383680,All schools in #Upshur Co closed Mon 3/3/14,WVDE Twitbot,15,33,2014-03-03 02:08:34,Upshur County School District,2014-03-03
568223889026887680,All schools in #Hampshire Co closed Thu 2/19/15,WVDE Twitbot,22,32,2015-02-19 01:41:46,Hampshire County School District,2015-02-19
567810848803262464,All schools in #Summers Co closed Wed 2/18/15,WVDE Twitbot,12,11,2015-02-17 22:20:30,Summers County School District,2015-02-18
686878294860509185,UPDATE: All schools in #Marshall Co now closed Tue 1/12/16,WVDE Twitbot,25,35,2016-01-12 11:52:01,Marshall County School District,2016-01-12
826032086683353088,UPDATE: All schools in #Calhoun Co now closed Mon 1/30/17 due to Weather Conditions code blue,WVDE Twitbot,3,3,2017-01-30 11:39:31,Calhoun County School District,2017-01-30
263061438736773120,UPDATE: All schools in #Hardy Co now closed Tue 10/30/12  #WVSandy,WVDE Twitbot,0,0,2012-10-29 23:35:09,Hardy County School District,2012-10-30
573580677020581889,All schools in #Taylor Co closed Fri 3/6/15,WVDE Twitbot,16,16,2015-03-05 20:27:44,Taylor County School District,2015-03-06
953595825069883393,UPDATE: All schools in #Grant Co now closed Wed 1/17/18 due to inclement weather,WVDE Twitbot,16,8,2018-01-17 11:52:16,Grant County School District,2018-01-17
559668749750788097,UPDATE: All schools in #Marshall Co now closed Mon 1/26/15,WVDE Twitbot,14,26,2015-01-26 11:06:42,Marshall County School District,2015-01-26
826039526028107777,UPDATE: All schools in #Wirt Co now closed Mon 1/30/17 due to hazardous conditions,WVDE Twitbot,2,3,2017-01-30 12:09:04,Wirt County School District,2017-01-30
697743525409071104,UPDATE: All schools in #Raleigh Co now closed Thu 2/11/16,WVDE Twitbot,40,54,2016-02-11 11:26:34,Raleigh County School District,2016-02-11
573653341504430080,All schools in #Webster Co closed Fri 3/6/15 due to Weather Conditions,WVDE Twitbot,13,12,2015-03-06 01:16:29,Webster County School District,2015-03-06
950321913016004608,UPDATE: All schools in #Raleigh Co now closed Mon 1/8/18,WVDE Twitbot,45,32,2018-01-08 11:02:54,Raleigh County School District,2018-01-08
699557875849564160,UPDATE: All schools in #Brooke Co now closed Tue 2/16/16,WVDE Twitbot,14,14,2016-02-16 11:36:09,Brooke County School District,2016-02-16
420720890578763776,UPDATE: All schools in #Randolph Co now closed Wed 1/8/14 due to inclement weather,WVDE Twitbot,12,34,2014-01-08 00:57:31,Randolph County School District,2014-01-08
420287639749922816,All schools in #Lewis Co closed Tue 1/7/14,WVDE Twitbot,13,25,2014-01-06 20:15:56,Lewis County School District,2014-01-07
440808036152524800,UPDATE: All schools in #Randolph Co now closed Tue 3/4/14,WVDE Twitbot,17,25,2014-03-04 11:16:40,Randolph County School District,2014-03-04
420148584382623744,All schools in #Wayne Co closed Mon 1/6/14 due to Inclement Weather,WVDE Twitbot,4,10,2014-01-06 11:03:23,Wayne County School District,2014-01-06
573577499373867008,All schools in #Calhoun Co closed Fri 3/6/15 code red,WVDE Twitbot,3,6,2015-03-05 20:15:07,Calhoun County School District,2015-03-06
432875829203189760,UPDATE: All schools in #Logan Co now closed Mon 2/10/14,WVDE Twitbot,7,13,2014-02-10 13:56:54,Logan County School District,2014-02-10
427777927007051778,UPDATE: All schools in #Braxton Co now closed Mon 1/27/14 due to weather Staff report on 2-hour delay.,WVDE Twitbot,6,4,2014-01-27 12:19:40,Braxton County School District,2014-01-27
573589222831034370,All schools in #Roane Co closed Fri 3/6/15 due to snow,WVDE Twitbot,5,6,2015-03-05 21:01:42,Roane County School District,2015-03-06
219627768395202560,All schools in #Clay Co closed Mon 7/2/12,WVDE Twitbot,1,0,2012-07-02 03:05:15,Clay County School District,2012-07-02
569632097444499456,All schools in #Pocahontas Co closed Mon 2/23/15,WVDE Twitbot,9,6,2015-02-22 22:57:29,Pocahontas County School District,2015-02-23
573590307192860673,All schools in #Mingo Co closed Fri 3/6/15 Code Orange.,WVDE Twitbot,12,22,2015-03-05 21:06:00,Mingo County School District,2015-03-06
420329586849611776,All schools in #Marshall Co closed Tue 1/7/14,WVDE Twitbot,2,16,2014-01-06 23:02:37,Marshall County School District,2014-01-07
420725771049521152,All schools in #Wood Co closed Wed 1/8/14 due to heating and weather related issues code A THIS IS A STATUS UPDATE.,WVDE Twitbot,27,66,2014-01-08 01:16:55,Wood County School District,2014-01-08
440625486750699520,All schools in #Jackson Co closed Tue 3/4/14 code A,WVDE Twitbot,31,50,2014-03-03 23:11:17,Jackson County School District,2014-03-04
689232767624843265,All schools in #McDowell Co closed Tue 1/19/16,WVDE Twitbot,13,5,2016-01-18 23:47:51,McDowell County School District,2016-01-19
294412347202748416,UPDATE: All schools in #Hampshire Co now closed Thu 1/24/13 due to Inclement Weather/Snow Covered Roads,WVDE Twitbot,2,9,2013-01-24 11:52:28,Hampshire County School District,2013-01-24
961045097784729601,All schools in #Ohio Co closed Wed 2/7/18,WVDE Twitbot,27,17,2018-02-07 01:13:01,Ohio County School District,2018-02-07
571098036123922433,All schools in #Wyoming Co closed Fri 2/27/15 due to inclement weather,WVDE Twitbot,7,9,2015-02-27 00:02:36,Wyoming County School District,2015-02-27
573592868679516160,All schools in #Tyler Co closed Fri 3/6/15 Schools are closed for all staff and students.,WVDE Twitbot,6,15,2015-03-05 21:16:11,Tyler County School District,2015-03-06
691742126720315395,All schools in #Mercer Co closed Tue 1/26/16 due to inclement weather conditions,WVDE Twitbot,28,28,2016-01-25 21:59:09,Mercer County School District,2016-01-26
950334866557689856,UPDATE: All schools in #Randolph Co now closed Mon 1/8/18,WVDE Twitbot,12,5,2018-01-08 11:54:23,Randolph County School District,2018-01-08
297273704294010881,All schools in #Jackson Co closed Fri 2/1/13 due to snow code A,WVDE Twitbot,3,9,2013-02-01 09:22:28,Jackson County School District,2013-02-01
430189974441320448,All schools in #Calhoun Co closed Mon 2/3/14 due to Heavy Snow and Hazardous Road Conditions,WVDE Twitbot,2,12,2014-02-03 04:04:17,Calhoun County School District,2014-02-03
425575465877635072,All schools in #Wirt Co closed Tue 1/21/14,WVDE Twitbot,5,6,2014-01-21 10:27:52,Wirt County School District,2014-01-21
953384551258230784,All schools in #Lincoln Co closed Wed 1/17/18,WVDE Twitbot,19,12,2018-01-16 21:52:44,Lincoln County School District,2018-01-17
841961304516624385,UPDATE: All schools in #Pendleton Co now closed Wed 3/15/17 due to Icy conditions,WVDE Twitbot,10,3,2017-03-15 10:36:32,Pendleton County School District,2017-03-15
433944186539106304,1/2 UPDATE: All schools in #Kanawha Co now closed Thu 2/13/14 due to Inclement Weather Conditions code B,WVDE Twitbot,16,22,2014-02-13 12:42:11,Kanawha County School District,2014-02-13
571077208552443905,All schools in #McDowell Co closed Fri 2/27/15,WVDE Twitbot,8,7,2015-02-26 22:39:51,McDowell County School District,2015-02-27
953053740252221440,UPDATE: All schools in #Ohio Co now closed Tue 1/16/18,WVDE Twitbot,25,20,2018-01-15 23:58:13,Ohio County School District,2018-01-16
699022309697396736,All schools in #Mercer Co closed Mon 2/15/16 due to Inclement weather conditions,WVDE Twitbot,21,14,2016-02-15 00:08:00,Mercer County School District,2016-02-15
263230159996452864,UPDATE: All schools in #Mingo Co now closed Tue 10/30/12  #WVSandy,WVDE Twitbot,1,5,2012-10-30 10:45:35,Mingo County School District,2012-10-30
262998940163641345,All schools in #Hampshire Co closed Tue 10/30/12  #WVSandy,WVDE Twitbot,1,5,2012-10-29 19:26:48,Hampshire County School District,2012-10-30
427776209460944896,UPDATE: All schools in #Clay Co now closed Mon 1/27/14 due to Weather,WVDE Twitbot,8,12,2014-01-27 12:12:50,Clay County School District,2014-01-27
282052976430960640,All schools in #Taylor Co closed Fri 12/21/12,WVDE Twitbot,0,1,2012-12-21 09:20:44,Taylor County School District,2012-12-21
565845523136253952,UPDATE: All schools in #Boone Co now closed Thu 2/12/15,WVDE Twitbot,23,32,2015-02-12 12:11:00,Boone County School District,2015-02-12
428499667609870338,UPDATE: All schools in #Hardy Co now closed Wed 1/29/14,WVDE Twitbot,7,15,2014-01-29 12:07:36,Hardy County School District,2014-01-29
826033255929503744,UPDATE: All schools in #Lewis Co now closed Mon 1/30/17,WVDE Twitbot,8,5,2017-01-30 11:44:09,Lewis County School District,2017-01-30
573594540143177729,All schools in #WVSDB closed Fri 3/6/15,WVDE Twitbot,5,0,2015-03-05 21:22:49,,2015-03-06
552609129089728512,All schools in #Tucker Co closed Wed 1/7/15,WVDE Twitbot,10,20,2015-01-06 23:34:18,Tucker County School District,2015-01-07
696992675929657344,All schools in #Harrison Co closed Tue 2/9/16,WVDE Twitbot,45,85,2016-02-09 09:42:58,Harrison County School District,2016-02-09
566198080853512192,UPDATE: All schools in #Gilmer Co now closed Fri 2/13/15,WVDE Twitbot,5,4,2015-02-13 11:31:56,Gilmer County School District,2015-02-13
430666256451395584,UPDATE: All schools in #Mason Co now closed Tue 2/4/14 due to Inclement Weather code A All staff are to report observing a 2 hour delay,WVDE Twitbot,7,14,2014-02-04 11:36:51,Mason County School District,2014-02-04
426137769207799808,All schools in #Pocahontas Co closed Thu 1/23/14,WVDE Twitbot,2,3,2014-01-22 23:42:16,Pocahontas County School District,2014-01-23
420163563768930304,UPDATE: All schools in #Mingo Co now closed Mon 1/6/14 code A,WVDE Twitbot,5,2,2014-01-06 12:02:54,Mingo County School District,2014-01-06
573264587866427392,All schools in #McDowell Co closed Thu 3/5/15,WVDE Twitbot,8,6,2015-03-04 23:31:43,McDowell County School District,2015-03-05
689398817880309760,UPDATE: All schools in #Fayette Co now closed Tue 1/19/16 due to inclement weather,WVDE Twitbot,24,56,2016-01-19 10:47:41,Fayette County School District,2016-01-19
958294536463310848,UPDATE: All schools in #Preston Co now closed Tue 1/30/18 due to winter weather conditions 240-day employees &amp; cent https://t.co/U1VUy2hEpk,WVDE Twitbot,6,0,2018-01-30 11:03:16,Preston County School District,2018-01-30
263432081005228032,All schools in #Braxton Co closed Wed 10/31/12 due to inclement weather  #WVSandy,WVDE Twitbot,1,9,2012-10-31 00:07:57,Braxton County School District,2012-10-31
690338610890031104,All schools in #Pendleton Co closed Fri 1/22/16,WVDE Twitbot,19,15,2016-01-22 01:02:05,Pendleton County School District,2016-01-22
420690215234064384,All schools in #Jackson Co closed Wed 1/8/14 code A,WVDE Twitbot,24,51,2014-01-07 22:55:38,Jackson County School District,2014-01-08
420725148556070912,All schools in #Calhoun Co closed Wed 1/8/14 due to Fridgid Temperatures and Slick Secondary Roads,WVDE Twitbot,5,5,2014-01-08 01:14:26,Calhoun County School District,2014-01-08
692080594646388737,All schools in #Mineral Co closed Wed 1/27/16 due to poor secondary road conditions,WVDE Twitbot,39,72,2016-01-26 20:24:06,Mineral County School District,2016-01-27
171375412272836608,All schools in #Summers Co closed Mon 2/20/12,WVDE Twitbot,0,0,2012-02-19 23:27:36,Summers County School District,2012-02-20
434146545890373633,All schools in #Calhoun Co closed Fri 2/14/14 due to Slick Conditions on Secondary Roads,WVDE Twitbot,8,11,2014-02-14 02:06:17,Calhoun County School District,2014-02-14
440289824889516032,All schools in #Jackson Co closed Mon 3/3/14 code A,WVDE Twitbot,24,56,2014-03-03 00:57:29,Jackson County School District,2014-03-03
566191626729840640,UPDATE: All schools in #Fayette Co now closed Fri 2/13/15 due to inclement weather,WVDE Twitbot,10,26,2015-02-13 11:06:17,Fayette County School District,2015-02-13
690300123935547394,All schools in #Pleasants Co closed Fri 1/22/16,WVDE Twitbot,35,37,2016-01-21 22:29:09,Pleasants County School District,2016-01-22
568539959549960192,All schools in #Doddridge Co closed Fri 2/20/15 due to winter weather,WVDE Twitbot,8,10,2015-02-19 22:37:43,Doddridge County School District,2015-02-20
697228147620769792,All schools in #Pleasants Co closed Wed 2/10/16,WVDE Twitbot,36,34,2016-02-10 01:18:38,Pleasants County School District,2016-02-10
841442878547214342,All schools in #Jefferson Co closed Tue 3/14/17 due to snow,WVDE Twitbot,72,68,2017-03-14 00:16:30,Jefferson County School District,2017-03-14
440256229441404928,All schools in #Marion Co closed Mon 3/3/14 due to Inclement Weather,WVDE Twitbot,15,49,2014-03-02 22:43:59,Marion County School District,2014-03-03
573635774949752832,All schools in #Wyoming Co closed Fri 3/6/15 due to inclement weather,WVDE Twitbot,6,5,2015-03-06 00:06:41,Wyoming County School District,2015-03-06
444038544273600512,All schools in #Randolph Co closed Thu 3/13/14,WVDE Twitbot,14,25,2014-03-13 09:13:33,Randolph County School District,2014-03-13
412552910543659009,UPDATE: All schools in #Taylor Co now closed Mon 12/16/13,WVDE Twitbot,6,9,2013-12-16 12:00:53,Taylor County School District,2013-12-16
697021034113929216,UPDATE: All schools in #Fayette Co now closed Tue 2/9/16 due to inclement weather,WVDE Twitbot,23,37,2016-02-09 11:35:39,Fayette County School District,2016-02-09
567451724492062720,All schools in #Mingo Co closed Tue 2/17/15 Code Blue.,WVDE Twitbot,24,44,2015-02-16 22:33:28,Mingo County School District,2015-02-17
440300671430955008,2/2 All schools and work sites will be closed for March 3rd with no employees reporting to work.,WVDE Twitbot,6,7,2014-03-03 01:40:35,,
699050832520704000,All schools in #Upshur Co closed Mon 2/15/16,WVDE Twitbot,26,30,2016-02-15 02:01:20,Upshur County School District,2016-02-15
841595347046678528,UPDATE: All schools in #Grant Co now closed Tue 3/14/17,WVDE Twitbot,7,7,2017-03-14 10:22:21,Grant County School District,2017-03-14
692121032996589568,All schools in #Lewis Co closed Wed 1/27/16,WVDE Twitbot,19,20,2016-01-26 23:04:47,Lewis County School District,2016-01-27
419053602137579521,UPDATE: All schools in #Jackson Co now closed Fri 1/3/14 code A,WVDE Twitbot,15,22,2014-01-03 10:32:19,Jackson County School District,2014-01-03
552636119079477248,UPDATE: All schools in #Upshur Co now closed Wed 1/7/15,WVDE Twitbot,17,35,2015-01-07 01:21:32,Upshur County School District,2015-01-07
430494134437048320,All schools in #Ritchie Co closed Tue 2/4/14,WVDE Twitbot,11,19,2014-02-04 00:12:54,Ritchie County School District,2014-02-04
431028012940017664,All schools in #Lincoln Co closed Wed 2/5/14,WVDE Twitbot,13,44,2014-02-05 11:34:21,Lincoln County School District,2014-02-05
567163912249163778,UPDATE: All schools in #Logan Co now closed Mon 2/16/15,WVDE Twitbot,32,61,2015-02-16 03:29:48,Logan County School District,2015-02-16
427938896479936512,All schools in #Clay Co closed Tue 1/28/14 due to Weather,WVDE Twitbot,9,14,2014-01-27 22:59:18,Clay County School District,2014-01-28
294422707846672384,UPDATE: All schools in #Jackson Co now closed Thu 1/24/13 code A,WVDE Twitbot,4,19,2013-01-24 12:33:38,Jackson County School District,2013-01-24
433731286117519360,All schools in #Berkeley Co closed Thu 2/13/14 due to weather Evening activities for 2/13 are cancelled.,WVDE Twitbot,35,98,2014-02-12 22:36:11,Berkeley County School District,2014-02-13
552589091960029185,All schools in #Preston Co closed Wed 1/7/15 due to winter weather conditions,WVDE Twitbot,24,23,2015-01-06 22:14:40,Preston County School District,2015-01-07
568154346623520768,All schools in #Wirt Co closed Thu 2/19/15,WVDE Twitbot,15,18,2015-02-18 21:05:26,Wirt County School District,2015-02-19
691754739164385284,All schools in #Wetzel Co closed Tue 1/26/16 due to Road Conditions,WVDE Twitbot,39,55,2016-01-25 22:49:16,Wetzel County School District,2016-01-26
567110130798706688,All schools in #Gilmer Co closed Mon 2/16/15,WVDE Twitbot,9,16,2015-02-15 23:56:06,Gilmer County School District,2015-02-16
697355668127420416,All schools in #Barbour Co closed Wed 2/10/16 due to unsafe road conditions,WVDE Twitbot,7,12,2016-02-10 09:45:22,Barbour County School District,2016-02-10
959364465513979904,All schools in #Barbour Co closed Fri 2/2/18,WVDE Twitbot,5,4,2018-02-02 09:54:47,Barbour County School District,2018-02-02
421448411838050304,All schools in #Lincoln Co closed Fri 1/10/14,WVDE Twitbot,6,30,2014-01-10 01:08:26,Lincoln County School District,2014-01-10
427937275448545280,All schools in #Upshur Co closed Tue 1/28/14,WVDE Twitbot,12,22,2014-01-27 22:52:51,Upshur County School District,2014-01-28
559643938307715072,All schools in #Berkeley Co closed Mon 1/26/15 due to weather,WVDE Twitbot,53,80,2015-01-26 09:28:07,Berkeley County School District,2015-01-26
297311403151351808,UPDATE: All schools in #Pleasants Co now closed Fri 2/1/13,WVDE Twitbot,5,6,2013-02-01 11:52:16,Pleasants County School District,2013-02-01
552792511308390400,UPDATE: All schools in #Raleigh Co now closed Wed 1/7/15 due to weather conditions,WVDE Twitbot,22,48,2015-01-07 11:42:59,Raleigh County School District,2015-01-07
948311826210713600,All schools in #Summers Co closed Wed 1/3/18,WVDE Twitbot,4,4,2018-01-02 21:55:32,Summers County School District,2018-01-03
420287607000801280,All schools in #Preston Co closed Tue 1/7/14,WVDE Twitbot,7,18,2014-01-06 20:15:48,Preston County School District,2014-01-07
433778292861042688,All schools in #Tucker Co closed Thu 2/13/14,WVDE Twitbot,10,6,2014-02-13 01:42:58,Tucker County School District,2014-02-13
552437761874350082,UPDATE: All schools in #Hardy Co now closed Tue 1/6/15,WVDE Twitbot,10,15,2015-01-06 12:13:20,Hardy County School District,2015-01-06
953208195362775040,UPDATE: All schools in #Wood Co now closed Tue 1/16/18 due to inclement weather Employees will operate on a CDOE A,WVDE Twitbot,153,69,2018-01-16 10:11:58,Wood County School District,2018-01-16
420311876061257728,All schools in #Calhoun Co closed Tue 1/7/14 due to Frigid Temperatures,WVDE Twitbot,3,10,2014-01-06 21:52:14,Calhoun County School District,2014-01-07
697245711767879680,All schools in #Wood Co closed Wed 2/10/16 Only 261 day employees report to work.,WVDE Twitbot,151,269,2016-02-10 02:28:26,Wood County School District,2016-02-10
298204034161070081,All schools in #Raleigh Co closed Mon 2/4/13 due to road conditions,WVDE Twitbot,5,27,2013-02-03 22:59:16,Raleigh County School District,2013-02-04
567085646188400640,All schools in #Mercer Co closed Mon 2/16/15 due to inclement weather,WVDE Twitbot,8,12,2015-02-15 22:18:48,Mercer County School District,2015-02-16
294415002729852928,UPDATE: All schools in #Wetzel Co now closed Thu 1/24/13,WVDE Twitbot,1,2,2013-01-24 12:03:01,Wetzel County School District,2013-01-24
569625970791092224,All schools in #Lincoln Co closed Mon 2/23/15,WVDE Twitbot,21,54,2015-02-22 22:33:09,Lincoln County School District,2015-02-23
568578673156218880,All schools in #Berkeley Co closed Fri 2/20/15 due to weather All evening activities are canceled.,WVDE Twitbot,76,171,2015-02-20 01:11:34,Berkeley County School District,2015-02-20
420133903920136192,All schools in #Raleigh Co closed Mon 1/6/14 due to weather conditions,WVDE Twitbot,17,42,2014-01-06 10:05:03,Raleigh County School District,2014-01-06
841576502676332544,All schools in #Greenbrier Co closed Tue 3/14/17 due to Weather conditions,WVDE Twitbot,18,23,2017-03-14 09:07:28,Greenbrier County School District,2017-03-14
568515610474196993,All schools in #Raleigh Co closed Fri 2/20/15,WVDE Twitbot,32,78,2015-02-19 21:00:58,Raleigh County School District,2015-02-20
426312828211851264,UPDATE: All schools in #Clay Co now closed Thu 1/23/14 due to weather,WVDE Twitbot,5,12,2014-01-23 11:17:53,Clay County School District,2014-01-23
699014488637501440,All schools in #Raleigh Co closed Mon 2/15/16,WVDE Twitbot,68,137,2016-02-14 23:36:55,Raleigh County School District,2016-02-15
950143747353972736,All schools in #Pleasants Co closed Mon 1/8/18,WVDE Twitbot,26,12,2018-01-07 23:14:56,Pleasants County School District,2018-01-08
440296092656074753,All schools in #Putnam Co closed Mon 3/3/14 due to weather conditions,WVDE Twitbot,87,230,2014-03-03 01:22:23,Putnam County School District,2014-03-03
953409079065628673,All schools in #Lewis Co closed Wed 1/17/18 Please complete snow packet #3.,WVDE Twitbot,14,2,2018-01-16 23:30:12,Lewis County School District,2018-01-17
309280032604438528,1/2 UPDATE: All schools in #Raleigh Co now closed Wed 3/6/13 due to weather conditions code A,WVDE Twitbot,1,11,2013-03-06 12:31:20,Raleigh County School District,2013-03-06
703186424795770882,UPDATE: All schools in #Randolph Co now closed Fri 2/26/16,WVDE Twitbot,20,12,2016-02-26 11:54:42,Randolph County School District,2016-02-26
430276073637433345,All schools in #Jackson Co closed Mon 2/3/14 code A,WVDE Twitbot,12,21,2014-02-03 09:46:24,Jackson County School District,2014-02-03
697381502473125888,UPDATE: All schools in #McDowell Co now closed Wed 2/10/16,WVDE Twitbot,6,1,2016-02-10 11:28:01,McDowell County School District,2016-02-10
425752190154584064,All schools in #Preston Co closed Wed 1/22/14,WVDE Twitbot,11,15,2014-01-21 22:10:06,Preston County School District,2014-01-22
692035360084336640,"All schools in #Jefferson Co closed Wed 1/27/16 due to road conditions Schools closed till Monday, February 1, 2016",WVDE Twitbot,101,103,2016-01-26 17:24:21,Jefferson County School District,2016-01-27
297311463561912321,UPDATE: All schools in #Tyler Co now closed Fri 2/1/13 due to dangerous road conditions,WVDE Twitbot,1,6,2013-02-01 11:52:31,Tyler County School District,2013-02-01
445484308157853698,All schools in #Pleasants Co closed Mon 3/17/14,WVDE Twitbot,11,17,2014-03-17 08:58:30,Pleasants County School District,2014-03-17
953446106003894274,All schools in #Nicholas Co closed Wed 1/17/18,WVDE Twitbot,37,22,2018-01-17 01:57:20,Nicholas County School District,2018-01-17
422467693933895680,"All schools in #Kanawha Co closed Mon 1/13/14 due to water crisis Cooks,Cust.,Maint.,Mech.&amp; Central Ofc. are to work.",WVDE Twitbot,53,211,2014-01-12 20:38:41,Kanawha County School District,2014-01-13
428308448179011584,All schools in #Marshall Co closed Wed 1/29/14,WVDE Twitbot,7,20,2014-01-28 23:27:46,Marshall County School District,2014-01-29
408985108415148032,UPDATE: All schools in #Lincoln Co now closed Fri 12/6/13 due to Flooding All schools closing 5 hours early,WVDE Twitbot,2,2,2013-12-06 15:43:43,Lincoln County School District,2013-12-06
841594841935020033,UPDATE: All schools in #Pocahontas Co now closed Tue 3/14/17 due to impending severe weather,WVDE Twitbot,6,4,2017-03-14 10:20:21,Pocahontas County School District,2017-03-14
573269494614921216,All schools in #Mason Co closed Thu 3/5/15 due to Inclement Weather code red,WVDE Twitbot,25,42,2015-03-04 23:51:13,Mason County School District,2015-03-05
420673148527185920,UPDATE: All schools in #Mingo Co now closed Wed 1/8/14 code A,WVDE Twitbot,8,12,2014-01-07 21:47:49,Mingo County School District,2014-01-08
567117743993135105,All schools in #Tucker Co closed Mon 2/16/15,WVDE Twitbot,13,12,2015-02-16 00:26:21,Tucker County School District,2015-02-16
699170501080584192,UPDATE: All schools in #Roane Co now closed Mon 2/15/16 due to snow,WVDE Twitbot,13,5,2016-02-15 09:56:52,Roane County School District,2016-02-15
690269142834872321,All schools in #Pocahontas Co closed Fri 1/22/16 due to inclement weather,WVDE Twitbot,9,7,2016-01-21 20:26:02,Pocahontas County School District,2016-01-22
948694314204450819,All schools in #Webster Co closed Thu 1/4/18 due to Weather conditions,WVDE Twitbot,15,10,2018-01-03 23:15:25,Webster County School District,2018-01-04
438299010399367168,UPDATE: All schools in #Gilmer Co now closed Tue 2/25/14,WVDE Twitbot,13,11,2014-02-25 13:06:41,Gilmer County School District,2014-02-25
568564932956053504,All schools in #Hancock Co closed Fri 2/20/15,WVDE Twitbot,8,5,2015-02-20 00:16:58,Hancock County School District,2015-02-20
690312059129614336,All schools in #Nicholas Co closed Fri 1/22/16 due to weather conditions,WVDE Twitbot,31,33,2016-01-21 23:16:34,Nicholas County School District,2016-01-22
552797602866290688,UPDATE: All schools in #Greenbrier Co now closed Wed 1/7/15,WVDE Twitbot,18,23,2015-01-07 12:03:13,Greenbrier County School District,2015-01-07
561149972364918784,UPDATE: All schools in #Lewis Co now closed Fri 1/30/15,WVDE Twitbot,11,14,2015-01-30 13:12:33,Lewis County School District,2015-01-30
687239986928812032,UPDATE: All schools in #Pocahontas Co now closed Wed 1/13/16 due to inclement weather,WVDE Twitbot,8,7,2016-01-13 11:49:15,Pocahontas County School District,2016-01-13
433919985123999744,UPDATE: All schools in #Logan Co now closed Thu 2/13/14,WVDE Twitbot,11,27,2014-02-13 11:06:00,Logan County School District,2014-02-13
430276442962665472,All schools in #Barbour Co closed Mon 2/3/14 due to icy road conditions,WVDE Twitbot,3,4,2014-02-03 09:47:52,Barbour County School District,2014-02-03
440803496896380928,UPDATE: All schools in #Lewis Co now closed Tue 3/4/14,WVDE Twitbot,6,14,2014-03-04 10:58:38,Lewis County School District,2014-03-04
426301488143417344,1/2 UPDATE: All schools in #Preston Co now closed Thu 1/23/14,WVDE Twitbot,2,9,2014-01-23 10:32:49,Preston County School District,2014-01-23
699555053141626880,UPDATE: All schools in #Pendleton Co now closed Tue 2/16/16,WVDE Twitbot,10,8,2016-02-16 11:24:56,Pendleton County School District,2016-02-16
423796700184969217,UPDATE: All schools in #Monroe Co now closed Thu 1/16/14,WVDE Twitbot,3,12,2014-01-16 12:39:41,Monroe County School District,2014-01-16
690229053547216896,All schools in #Wayne Co closed Fri 1/22/16 due to Inclement Weather,WVDE Twitbot,45,75,2016-01-21 17:46:44,Wayne County School District,2016-01-22
696894291654897664,All schools in #Upshur Co closed Tue 2/9/16,WVDE Twitbot,50,32,2016-02-09 03:12:01,Upshur County School District,2016-02-09
697378042763743232,UPDATE: All schools in #Fayette Co now closed Wed 2/10/16 due to inclement weather,WVDE Twitbot,16,37,2016-02-10 11:14:16,Fayette County School District,2016-02-10
425734037806661632,All schools in #Berkeley Co closed Wed 1/22/14 All evening activities scheduled for Jan 22nd are cancelled as well.,WVDE Twitbot,36,111,2014-01-21 20:57:59,Berkeley County School District,2014-01-22
297315823444451328,UPDATE: All schools in #Brooke Co now closed Fri 2/1/13,WVDE Twitbot,1,2,2013-02-01 12:09:50,Brooke County School District,2013-02-01
568213831232716800,All schools in #Grant Co closed Thu 2/19/15,WVDE Twitbot,8,21,2015-02-19 01:01:48,Grant County School District,2015-02-19
961054906495963137,All schools in #Brooke Co closed Wed 2/7/18 due to Weather,WVDE Twitbot,10,2,2018-02-07 01:51:59,Brooke County School District,2018-02-07
699064734734274561,UPDATE: All schools in #Mason Co now closed Mon 2/15/16 due to Inclement weather code red,WVDE Twitbot,38,44,2016-02-15 02:56:35,Mason County School District,2016-02-15
841956898958123008,UPDATE: All schools in #Summers Co now closed Wed 3/15/17,WVDE Twitbot,5,3,2017-03-15 10:19:02,Summers County School District,2017-03-15
561091296585334785,UPDATE: All schools in #Nicholas Co now closed Fri 1/30/15 due to weather conditions,WVDE Twitbot,9,12,2015-01-30 09:19:24,Nicholas County School District,2015-01-30
841954460029075457,1/2 UPDATE: All schools in #Mercer Co now closed Wed 3/15/17 due to inclement weather conditions,WVDE Twitbot,13,17,2017-03-15 10:09:20,Mercer County School District,2017-03-15
570918630982086657,UPDATE: All schools in #McDowell Co now closed Thu 2/26/15,WVDE Twitbot,3,2,2015-02-26 12:09:43,McDowell County School District,2015-02-26
953417676466130944,UPDATE: All schools in #Doddridge Co now closed Wed 1/17/18 due to inclement weather and frigid temperatures code C,WVDE Twitbot,10,5,2018-01-17 00:04:22,Doddridge County School District,2018-01-17
703175371751985152,UPDATE: All schools in #Pocahontas Co now closed Fri 2/26/16 due to inclement weather,WVDE Twitbot,6,2,2016-02-26 11:10:47,Pocahontas County School District,2016-02-26
696993435593662464,All schools in #Wirt Co closed Tue 2/9/16 due to winter weather advisory,WVDE Twitbot,9,8,2016-02-09 09:45:59,Wirt County School District,2016-02-09
440424772707446785,All schools in #Hampshire Co closed Mon 3/3/14,WVDE Twitbot,9,10,2014-03-03 09:53:43,Hampshire County School District,2014-03-03
445492231403999232,UPDATE: All schools in #Wood Co now closed Mon 3/17/14 code B OPERATING STATUS UPDATE.,WVDE Twitbot,47,109,2014-03-17 09:29:59,Wood County School District,2014-03-17
567470233833992192,All schools in #Wetzel Co closed Tue 2/17/15,WVDE Twitbot,27,55,2015-02-16 23:47:01,Wetzel County School District,2015-02-17
434043289025916928,All schools in #Mercer Co closed Fri 2/14/14 due to inclement weather,WVDE Twitbot,4,9,2014-02-13 19:15:58,Mercer County School District,2014-02-14
410381930090090497,UPDATE: All schools in #Summers Co now closed Tue 12/10/13,WVDE Twitbot,5,15,2013-12-10 12:14:11,Summers County School District,2013-12-10
298207685118160897,All schools in #Tucker Co closed Mon 2/4/13,WVDE Twitbot,2,8,2013-02-03 23:13:47,Tucker County School District,2013-02-04
573302958961659904,All schools in #Doddridge Co closed Thu 3/5/15 due to Inclement Weather,WVDE Twitbot,12,17,2015-03-05 02:04:11,Doddridge County School District,2015-03-05
841550100321177600,UPDATE: All schools in #Hardy Co now closed Tue 3/14/17 due to Winter Storm,WVDE Twitbot,10,13,2017-03-14 07:22:33,Hardy County School District,2017-03-14
691679612045279232,All schools in #Barbour Co closed Tue 1/26/16 due to continued poor road conditions,WVDE Twitbot,23,15,2016-01-25 17:50:44,Barbour County School District,2016-01-26
567277708447846400,UPDATE: All schools in #Doddridge Co now closed Mon 2/16/15 due to frigid temperatures and inclement weather conditions,WVDE Twitbot,8,8,2015-02-16 11:01:59,Doddridge County School District,2015-02-16
426507471499186176,All schools in #Pleasants Co closed Fri 1/24/14,WVDE Twitbot,12,19,2014-01-24 00:11:19,Pleasants County School District,2014-01-24
949008622536810496,All schools in #Doddridge Co closed Fri 1/5/18 due to frigid wind chills and temperatures code C,WVDE Twitbot,4,8,2018-01-04 20:04:21,Doddridge County School District,2018-01-05
567445298898026497,All schools in #Cabell Co closed Tue 2/17/15 due to inclement weather code red,WVDE Twitbot,63,70,2015-02-16 22:07:56,Cabell County School District,2015-02-17
420298471631900672,All schools in #Fayette Co closed Tue 1/7/14 due to inclement weather,WVDE Twitbot,6,16,2014-01-06 20:58:59,Fayette County School District,2014-01-07
420671595674222593,All schools in #Monroe Co closed Wed 1/8/14,WVDE Twitbot,7,20,2014-01-07 21:41:38,Monroe County School District,2014-01-08
690244977067180033,All schools in #Mercer Co closed Fri 1/22/16 due to the impending weather forecast,WVDE Twitbot,24,45,2016-01-21 18:50:01,Mercer County School District,2016-01-22
699022845016408065,All schools in #Kanawha Co closed Mon 2/15/16 due to Inclement Weather code B,WVDE Twitbot,236,416,2016-02-15 00:10:08,Kanawha County School District,2016-02-15
262740478053724161,All schools in #Mineral Co closed Mon 10/29/12 due to pending inclement weather code A,WVDE Twitbot,2,8,2012-10-29 02:19:46,Mineral County School District,2012-10-29
567452130601349120,All schools in #Raleigh Co closed Tue 2/17/15 due to weather conditions,WVDE Twitbot,26,70,2015-02-16 22:35:05,Raleigh County School District,2015-02-17
567123869627334656,All schools in #Ohio Co closed Mon 2/16/15,WVDE Twitbot,41,92,2015-02-16 00:50:41,Ohio County School District,2015-02-16
430487466546835456,All schools in #Taylor Co closed Tue 2/4/14,WVDE Twitbot,8,14,2014-02-03 23:46:24,Taylor County School District,2014-02-04
297324256935673856,UPDATE: All schools in #Berkeley Co now closed Fri 2/1/13,WVDE Twitbot,8,40,2013-02-01 12:43:21,Berkeley County School District,2013-02-01
419062742230646785,UPDATE: All schools in #Boone Co now closed Fri 1/3/14,WVDE Twitbot,11,22,2014-01-03 11:08:38,Boone County School District,2014-01-03
430281977443254272,All schools in #Wood Co closed Mon 2/3/14 code A Employees who work on Code A days are not to report until 10 AM.,WVDE Twitbot,33,71,2014-02-03 10:09:52,Wood County School District,2014-02-03
940936389373329409,UPDATE: All schools in #Summers Co now closed Wed 12/13/17,WVDE Twitbot,7,1,2017-12-13 13:28:11,Summers County School District,2017-12-13
427963677455552513,All schools in #Jefferson Co closed Tue 1/28/14 due to weather,WVDE Twitbot,11,20,2014-01-28 00:37:46,Jefferson County School District,2014-01-28
160299359840378881,All schools in #Taylor Co closed Fri 1/20/12,WVDE Twitbot,0,2,2012-01-20 09:55:20,Taylor County School District,2012-01-20
569674828556460033,All schools in #Tyler Co closed Mon 2/23/15 All 240 and 261 day employees should report by 10:00 a.m.,WVDE Twitbot,10,13,2015-02-23 01:47:17,Tyler County School District,2015-02-23
959386234559844352,UPDATE: All schools in #Harrison Co now closed Fri 2/2/18 due to inclement weather,WVDE Twitbot,27,19,2018-02-02 11:21:17,Harrison County School District,2018-02-02
554608196846108672,UPDATE: All schools in #Morgan Co now closed Mon 1/12/15 code A,WVDE Twitbot,9,19,2015-01-12 11:57:52,Morgan County School District,2015-01-12
444080066759118848,UPDATE: All schools in #Mingo Co now closed Thu 3/13/14 due to Code W,WVDE Twitbot,12,22,2014-03-13 11:58:33,Mingo County School District,2014-03-13
262946027252891648,All schools in #Berkeley Co closed Tue 10/30/12 All evening activities are cancelled.,WVDE Twitbot,0,7,2012-10-29 15:56:32,Berkeley County School District,2012-10-30
425567928096796672,All schools in #Harrison Co closed Tue 1/21/14,WVDE Twitbot,19,68,2014-01-21 09:57:55,Harrison County School District,2014-01-21
294750132354830336,All schools in #Wood Co closed Fri 1/25/13 due to inclement weather code A,WVDE Twitbot,30,74,2013-01-25 10:14:42,Wood County School District,2013-01-25
176619489201360896,All schools in #Cabell Co closed Mon 3/5/12 code red Administrative meeting moved to 10:00 AM.,WVDE Twitbot,0,5,2012-03-05 10:45:42,Cabell County School District,2012-03-05
824921913050984448,All schools in #Tucker Co closed Fri 1/27/17,WVDE Twitbot,12,6,2017-01-27 10:08:05,Tucker County School District,2017-01-27
428873920414904320,"UPDATE: All schools in #Webster Co now closed Thu 1/30/14 due to Weather, Water &amp; Bus",WVDE Twitbot,4,14,2014-01-30 12:54:45,Webster County School District,2014-01-30
552976754307268609,All schools in #Calhoun Co closed Thu 1/8/15 due to Extreme Wind Chills code blue,WVDE Twitbot,9,2,2015-01-07 23:55:06,Calhoun County School District,2015-01-08
420295994400460800,All schools in #Wirt Co closed Tue 1/7/14,WVDE Twitbot,9,19,2014-01-06 20:49:08,Wirt County School District,2014-01-07
949020961369657349,All schools in #Calhoun Co closed Fri 1/5/18,WVDE Twitbot,4,6,2018-01-04 20:53:23,Calhoun County School District,2018-01-05
567468856202260480,All schools in #Tucker Co closed Tue 2/17/15,WVDE Twitbot,18,12,2015-02-16 23:41:33,Tucker County School District,2015-02-17
412562333928411136,UPDATE: All schools in #Harrison Co now closed Mon 12/16/13,WVDE Twitbot,20,64,2013-12-16 12:38:20,Harrison County School District,2013-12-16
699536599361724416,All schools in #Hardy Co closed Tue 2/16/16,WVDE Twitbot,17,18,2016-02-16 10:11:36,Hardy County School District,2016-02-16
157798201494224896,All schools in #Gilmer Co closed Fri 1/13/12,WVDE Twitbot,0,1,2012-01-13 12:16:37,Gilmer County School District,2012-01-13
176651225771675648,UPDATE: All schools in #Clay Co now closed Mon 3/5/12 due to Weather Conditions,WVDE Twitbot,0,1,2012-03-05 12:51:48,Clay County School District,2012-03-05
421614041404948480,UPDATE: All schools in #Hampshire Co now closed Fri 1/10/14 due to Freezing Rain,WVDE Twitbot,3,9,2014-01-10 12:06:35,Hampshire County School District,2014-01-10
554610854646542336,UPDATE: All schools in #Gilmer Co now closed Mon 1/12/15,WVDE Twitbot,5,9,2015-01-12 12:08:26,Gilmer County School District,2015-01-12
697597632517160960,All schools in #Pleasants Co closed Thu 2/11/16,WVDE Twitbot,30,27,2016-02-11 01:46:50,Pleasants County School District,2016-02-11
568145810409562112,All schools in #Wayne Co closed Thu 2/19/15 due to Inclement Weather,WVDE Twitbot,17,23,2015-02-18 20:31:31,Wayne County School District,2015-02-19
567282673056763905,UPDATE: All schools in #Monongalia Co now closed Mon 2/16/15,WVDE Twitbot,35,77,2015-02-16 11:21:43,Monongalia County School District,2015-02-16
697368332580818948,UPDATE: All schools in #Doddridge Co now closed Wed 2/10/16 due to Inclement Weather,WVDE Twitbot,6,3,2016-02-10 10:35:41,Doddridge County School District,2016-02-10
686873627057324032,UPDATE: All schools in #Brooke Co now closed Tue 1/12/16,WVDE Twitbot,12,8,2016-01-12 11:33:28,Brooke County School District,2016-01-12
430277673706086400,All schools in #Mason Co closed Mon 2/3/14 due to Inclement weather code A staff are to report after observing a 2 hour delay,WVDE Twitbot,3,9,2014-02-03 09:52:46,Mason County School District,2014-02-03
428262252567740416,All schools in #Calhoun Co closed Wed 1/29/14 due to Frigid Temperatures and Wind Chills,WVDE Twitbot,6,7,2014-01-28 20:24:12,Calhoun County School District,2014-01-29
960495018485190656,UPDATE: All schools in #Randolph Co now closed Mon 2/5/18 Snow packet day #3. Staff report on 2 hour delay.,WVDE Twitbot,14,11,2018-02-05 12:47:12,Randolph County School District,2018-02-05
294780752841814016,UPDATE: All schools in #Tucker Co now closed Fri 1/25/13,WVDE Twitbot,2,9,2013-01-25 12:16:22,Tucker County School District,2013-01-25
420277742467182592,All schools in #McDowell Co closed Tue 1/7/14 due to inclement weather,WVDE Twitbot,5,9,2014-01-06 19:36:36,McDowell County School District,2014-01-07
425565992895668224,All schools in #Morgan Co closed Tue 1/21/14 code A,WVDE Twitbot,6,10,2014-01-21 09:50:14,Morgan County School District,2014-01-21
440649696738955264,All schools in #Calhoun Co closed Tue 3/4/14 due to Slick Road Conditions,WVDE Twitbot,6,13,2014-03-04 00:47:29,Calhoun County School District,2014-03-04
566181433061179392,UPDATE: All schools in #Lewis Co now closed Fri 2/13/15,WVDE Twitbot,5,4,2015-02-13 10:25:47,Lewis County School District,2015-02-13
409882881423458304,All schools in #McDowell Co on a 2-hr delay Mon 12/9/13 with the exception of Iaeger Elementary and they will be closed.,WVDE Twitbot,1,8,2013-12-09 03:11:08,McDowell County School District,2013-12-09
569639219368468480,All schools in #Ritchie Co closed Mon 2/23/15,WVDE Twitbot,22,20,2015-02-22 23:25:47,Ritchie County School District,2015-02-23
263093637406150656,All schools in #Monroe Co closed Tue 10/30/12 due to weather  #WVSandy,WVDE Twitbot,2,7,2012-10-30 01:43:05,Monroe County School District,2012-10-30
953586452469878784,UPDATE: All schools in #Wyoming Co now closed Wed 1/17/18 due to inclement weather,WVDE Twitbot,5,2,2018-01-17 11:15:01,Wyoming County School District,2018-01-17
948709422007767041,All schools in #Raleigh Co closed Thu 1/4/18 Re-imagined Education Day.,WVDE Twitbot,50,40,2018-01-04 00:15:27,Raleigh County School District,2018-01-04
573294241633443841,All schools in #Wirt Co closed Thu 3/5/15,WVDE Twitbot,6,15,2015-03-05 01:29:33,Wirt County School District,2015-03-05
313599393372712960,UPDATE: All schools in #Grant Co now closed Mon 3/18/13 due to inclement weather,WVDE Twitbot,3,1,2013-03-18 10:34:56,Grant County School District,2013-03-18
297284899633774592,All schools in #Gilmer Co closed Fri 2/1/13,WVDE Twitbot,4,4,2013-02-01 10:06:58,Gilmer County School District,2013-02-01
297285267235160064,All schools in #Lewis Co closed Fri 2/1/13,WVDE Twitbot,4,10,2013-02-01 10:08:25,Lewis County School District,2013-02-01
298243400170360832,UPDATE: All schools in #Randolph Co now closed Mon 2/4/13,WVDE Twitbot,4,24,2013-02-04 01:35:42,Randolph County School District,2013-02-04
428290623775322112,1/2 All schools in #Marion Co closed Wed 1/29/14 due to Inclement Weather,WVDE Twitbot,9,42,2014-01-28 22:16:56,Marion County School District,2014-01-29
573424277581656064,All schools in #Hardy Co closed Thu 3/5/15,WVDE Twitbot,11,16,2015-03-05 10:06:16,Hardy County School District,2015-03-05
826015023600398337,UPDATE: All schools in #Nicholas Co now closed Mon 1/30/17,WVDE Twitbot,20,24,2017-01-30 10:31:42,Nicholas County School District,2017-01-30
568535803246174208,All schools in #Pleasants Co closed Fri 2/20/15,WVDE Twitbot,24,19,2015-02-19 22:21:13,Pleasants County School District,2015-02-20
265245695072673792,UPDATE: All schools in #Nicholas Co now closed Mon 11/5/12 due to Power and Bad Weather,WVDE Twitbot,0,2,2012-11-05 00:14:36,Nicholas County School District,2012-11-05
561132758391853057,UPDATE: All schools in #Monroe Co now closed Fri 1/30/15,WVDE Twitbot,11,14,2015-01-30 12:04:09,Monroe County School District,2015-01-30
573312485215879168,All schools in #Lewis Co closed Thu 3/5/15,WVDE Twitbot,18,15,2015-03-05 02:42:02,Lewis County School District,2015-03-05
445484735515480064,All schools in #Webster Co closed Mon 3/17/14 due to Weather and Road Conditions Staff report on a 2 hour delay.,WVDE Twitbot,6,10,2014-03-17 09:00:12,Webster County School District,2014-03-17
434073693560381440,All schools in #Taylor Co closed Fri 2/14/14,WVDE Twitbot,6,21,2014-02-13 21:16:47,Taylor County School District,2014-02-14
431387558912614400,UPDATE: All schools in #Fayette Co now closed Thu 2/6/14 due to inclement weather code A,WVDE Twitbot,12,37,2014-02-06 11:23:03,Fayette County School District,2014-02-06
409813932874801152,All schools in #Jefferson Co closed Mon 12/9/13 due to Inclimate Weather,WVDE Twitbot,5,9,2013-12-08 22:37:10,Jefferson County School District,2013-12-09
567452563285749760,All schools in #Lewis Co closed Tue 2/17/15,WVDE Twitbot,10,17,2015-02-16 22:36:48,Lewis County School District,2015-02-17
304938334109720577,UPDATE: All schools in #Pleasants Co now closed Fri 2/22/13,WVDE Twitbot,3,7,2013-02-22 12:58:58,Pleasants County School District,2013-02-22
552406676146757632,All schools in #Lewis Co closed Tue 1/6/15,WVDE Twitbot,14,13,2015-01-06 10:09:49,Lewis County School District,2015-01-06
427946648426119168,All schools in #Taylor Co closed Tue 1/28/14,WVDE Twitbot,1,11,2014-01-27 23:30:06,Taylor County School District,2014-01-28
298210973083389952,All schools in #Summers Co closed Mon 2/4/13,WVDE Twitbot,1,8,2013-02-03 23:26:51,Summers County School District,2013-02-04
567101660141727745,All schools in #Raleigh Co closed Mon 2/16/15 due to weather conditions,WVDE Twitbot,35,99,2015-02-15 23:22:26,Raleigh County School District,2015-02-16
552965451492655105,All schools in #Greenbrier Co closed Thu 1/8/15,WVDE Twitbot,31,51,2015-01-07 23:10:11,Greenbrier County School District,2015-01-08
534674958887428097,UPDATE: All schools in #Randolph Co now closed Tue 11/18/14,WVDE Twitbot,18,32,2014-11-18 11:50:18,Randolph County School District,2014-11-18
570895771396128768,UPDATE: All schools in #Summers Co now closed Thu 2/26/15,WVDE Twitbot,6,7,2015-02-26 10:38:53,Summers County School District,2015-02-26
767644094420115456,All schools in #Calhoun Co closed Mon 8/22/16 due to Water Main Break code blue,WVDE Twitbot,7,0,2016-08-22 08:46:28,Calhoun County School District,2016-08-22
690266135355379712,All schools in #Monroe Co closed Fri 1/22/16,WVDE Twitbot,17,15,2016-01-21 20:14:05,Monroe County School District,2016-01-22
422479442284249088,All schools in #Boone Co closed Mon 1/13/14 due to the water crisis,WVDE Twitbot,21,77,2014-01-12 21:25:22,Boone County School District,2014-01-13
567102652497264642,UPDATE: All schools in #Barbour Co now closed Mon 2/16/15,WVDE Twitbot,38,16,2015-02-15 23:26:23,Barbour County School District,2015-02-16
428286364971307008,All schools in #Harrison Co closed Wed 1/29/14,WVDE Twitbot,32,114,2014-01-28 22:00:01,Harrison County School District,2014-01-29
568472437488259072,All schools in #Putnam Co closed Fri 2/20/15 due to Weather conditions,WVDE Twitbot,58,125,2015-02-19 18:09:25,Putnam County School District,2015-02-20
620547532893081600,All schools in #Webster Co closed Mon 7/13/15 due to High Water This message is for Summer School and Energy Express staff and students.,WVDE Twitbot,6,5,2015-07-13 10:57:15,Webster County School District,2015-07-13
567156370605346816,UPDATE: All schools in #Mingo Co now closed Mon 2/16/15 Code Orange.,WVDE Twitbot,23,39,2015-02-16 02:59:50,Mingo County School District,2015-02-16
425575052445093888,All schools in #Cabell Co closed Tue 1/21/14 due to snow code red,WVDE Twitbot,22,53,2014-01-21 10:26:13,Cabell County School District,2014-01-21
420332717956272128,All schools in #Mason Co closed Tue 1/7/14 due to Inclement Weather,WVDE Twitbot,13,22,2014-01-06 23:15:04,Mason County School District,2014-01-07
420865839256965120,UPDATE: All schools in #Doddridge Co now closed Wed 1/8/14 due to Inclement Weather,WVDE Twitbot,6,9,2014-01-08 10:33:30,Doddridge County School District,2014-01-08
445531082234945536,UPDATE: All schools in #Monroe Co now closed Mon 3/17/14,WVDE Twitbot,11,9,2014-03-17 12:04:22,Monroe County School District,2014-03-17
699041209084416000,UPDATE: All schools in #Cabell Co now closed Mon 2/15/16 due to inclement weather code red,WVDE Twitbot,75,60,2016-02-15 01:23:06,Cabell County School District,2016-02-15
573607828121862144,All schools in #Monroe Co closed Fri 3/6/15,WVDE Twitbot,8,18,2015-03-05 22:15:37,Monroe County School District,2015-03-06
691373567464841217,All schools in #Raleigh Co closed Mon 1/25/16,WVDE Twitbot,55,103,2016-01-24 21:34:38,Raleigh County School District,2016-01-25
841573952598265856,All schools in #Mineral Co closed Tue 3/14/17 due to inclement weather,WVDE Twitbot,19,28,2017-03-14 08:57:20,Mineral County School District,2017-03-14
433939281909153792,UPDATE: All schools in #Pleasants Co now closed Thu 2/13/14,WVDE Twitbot,12,15,2014-02-13 12:22:41,Pleasants County School District,2014-02-13
573285730375639041,All schools in #Nicholas Co closed Thu 3/5/15,WVDE Twitbot,5,12,2015-03-05 00:55:43,Nicholas County School District,2015-03-05
427930056359690240,All schools in #Mason Co closed Tue 1/28/14 due to Inclement Weather code A All employees are to report recognizing the 2 hour delay.,WVDE Twitbot,19,52,2014-01-27 22:24:10,Mason County School District,2014-01-28
316110391237283840,All schools in #Taylor Co closed Mon 3/25/13,WVDE Twitbot,1,4,2013-03-25 08:52:44,Taylor County School District,2013-03-25
950313379037671424,UPDATE: All schools in #Barbour Co now closed Mon 1/8/18,WVDE Twitbot,8,8,2018-01-08 10:29:00,Barbour County School District,2018-01-08
420156149699063810,UPDATE: All schools in #Ohio Co now closed Mon 1/6/14,WVDE Twitbot,17,37,2014-01-06 11:33:26,Ohio County School District,2014-01-06
420294157736108032,All schools in #Jackson Co closed Tue 1/7/14 code A,WVDE Twitbot,31,67,2014-01-06 20:41:50,Jackson County School District,2014-01-07
157758210890149888,All schools in #Pocahontas Co closed Fri 1/13/12,WVDE Twitbot,0,0,2012-01-13 09:37:43,Pocahontas County School District,2012-01-13
567291391517421568,UPDATE: All schools in #Mineral Co now closed Mon 2/16/15 due to inclement weather,WVDE Twitbot,14,42,2015-02-16 11:56:22,Mineral County School District,2015-02-16
440672238597992448,"All schools in #Tyler Co closed Tue 3/4/14 Employees, Code C.",WVDE Twitbot,12,6,2014-03-04 02:17:03,Tyler County School District,2014-03-04
309243430641483776,All schools in #Summers Co closed Wed 3/6/13,WVDE Twitbot,0,9,2013-03-06 10:05:53,Summers County School District,2013-03-06
427900376184918016,All schools in #Nicholas Co closed Tue 1/28/14,WVDE Twitbot,11,21,2014-01-27 20:26:14,Nicholas County School District,2014-01-28
433742756465238016,All schools in #Monroe Co closed Thu 2/13/14,WVDE Twitbot,8,15,2014-02-12 23:21:46,Monroe County School District,2014-02-13
818420540092403716,UPDATE: All schools in #Barbour Co now closed Mon 1/9/17 due to excessive cold and slick secondary roads,WVDE Twitbot,8,5,2017-01-09 11:33:56,Barbour County School District,2017-01-09
292074745447456768,All schools in #Mercer Co closed Fri 1/18/13 due to inclement weather,WVDE Twitbot,1,16,2013-01-18 01:03:40,Mercer County School District,2013-01-18
423565662779609088,All schools in #Boone Co closed Thu 1/16/14 due to the continued water crisis,WVDE Twitbot,20,47,2014-01-15 21:21:38,Boone County School District,2014-01-16
420146600812376065,UPDATE: All schools in #Wetzel Co now closed Mon 1/6/14 due to weather and road conditions,WVDE Twitbot,11,27,2014-01-06 10:55:30,Wetzel County School District,2014-01-06
425565787110137856,UPDATE: All schools in #McDowell Co now closed Tue 1/21/14 due to inclement weather,WVDE Twitbot,4,3,2014-01-21 09:49:24,McDowell County School District,2014-01-21
826012259856027648,UPDATE: All schools in #Randolph Co now closed Mon 1/30/17,WVDE Twitbot,19,14,2017-01-30 10:20:43,Randolph County School District,2017-01-30
425570780466782208,All schools in #Wood Co closed Tue 1/21/14 due to inclement weather code A,WVDE Twitbot,52,92,2014-01-21 10:09:15,Wood County School District,2014-01-21
419999934054539264,All schools in #Ritchie Co closed Mon 1/6/14,WVDE Twitbot,13,18,2014-01-06 01:12:42,Ritchie County School District,2014-01-06
425743328429096960,All schools in #Ritchie Co closed Wed 1/22/14,WVDE Twitbot,10,19,2014-01-21 21:34:54,Ritchie County School District,2014-01-22
309264011881484288,UPDATE: All schools in #Braxton Co now closed Wed 3/6/13 due to inclement weather Staff is to report on a two-hour delay.,WVDE Twitbot,1,7,2013-03-06 11:27:40,Braxton County School District,2013-03-06
154521333861060609,UPDATE: All schools in #Nicholas Co now closed Wed 1/4/12 due to Bad Weather!,WVDE Twitbot,0,1,2012-01-04 11:15:31,Nicholas County School District,2012-01-04
949023506116808704,All schools in #Taylor Co closed Fri 1/5/18,WVDE Twitbot,14,25,2018-01-04 21:03:30,Taylor County School District,2018-01-05
573579288617877504,All schools in #Upshur Co closed Fri 3/6/15,WVDE Twitbot,18,21,2015-03-05 20:22:13,Upshur County School District,2015-03-06
420290821997338624,All schools in #Wetzel Co closed Tue 1/7/14,WVDE Twitbot,29,67,2014-01-06 20:28:35,Wetzel County School District,2014-01-07
949014697331904512,All schools in #Upshur Co closed Fri 1/5/18,WVDE Twitbot,13,8,2018-01-04 20:28:30,Upshur County School District,2018-01-05
298742583960678402,UPDATE: All schools in #Barbour Co now closed Tue 2/5/13 due to inclement weather and road conditions,WVDE Twitbot,1,3,2013-02-05 10:39:17,Barbour County School District,2013-02-05
312155620432289792,UPDATE: All schools in #Nicholas Co now closed Thu 3/14/13 due to Bad Weather,WVDE Twitbot,1,11,2013-03-14 10:57:54,Nicholas County School District,2013-03-14
573288301697871874,All schools in #Braxton Co closed Thu 3/5/15,WVDE Twitbot,9,12,2015-03-05 01:05:56,Braxton County School District,2015-03-05
573603303717801984,All schools in #Boone Co closed Fri 3/6/15 Employees are not to report to work. All facilities will be closed.,WVDE Twitbot,22,22,2015-03-05 21:57:39,Boone County School District,2015-03-06
425566134335578112,All schools in #Jefferson Co closed Tue 1/21/14 due to weather,WVDE Twitbot,16,21,2014-01-21 09:50:47,Jefferson County School District,2014-01-21
568347445379387392,All schools in #Mineral Co closed Thu 2/19/15 due to inclement weather,WVDE Twitbot,5,6,2015-02-19 09:52:45,Mineral County School District,2015-02-19
573300022168702976,All schools in #WVSDB closed Thu 3/5/15 due to Inclement weather,WVDE Twitbot,2,5,2015-03-05 01:52:31,,2015-03-05
420281371161296896,All schools in #Wood Co closed Tue 1/7/14 due to frigid temperatures code A,WVDE Twitbot,74,170,2014-01-06 19:51:01,Wood County School District,2014-01-07
430892271165140992,All schools in #Ritchie Co closed Wed 2/5/14,WVDE Twitbot,13,15,2014-02-05 02:34:57,Ritchie County School District,2014-02-05
953417167982268416,All schools in #Taylor Co closed Wed 1/17/18,WVDE Twitbot,24,12,2018-01-17 00:02:21,Taylor County School District,2018-01-17
691715111103401984,All schools in #Monroe Co closed Tue 1/26/16,WVDE Twitbot,19,19,2016-01-25 20:11:48,Monroe County School District,2016-01-26
728370550368800768,All schools in #Clay Co closed Fri 5/6/16 due to school threat situation,WVDE Twitbot,39,11,2016-05-05 23:47:26,Clay County School District,2016-05-06
567463772940685313,All schools in #Hampshire Co closed Tue 2/17/15,WVDE Twitbot,29,32,2015-02-16 23:21:21,Hampshire County School District,2015-02-17
427954422405017600,All schools in #Lewis Co closed Tue 1/28/14,WVDE Twitbot,7,19,2014-01-28 00:00:59,Lewis County School District,2014-01-28
690276494770335744,All schools in #Roane Co closed Fri 1/22/16,WVDE Twitbot,10,8,2016-01-21 20:55:15,Roane County School District,2016-01-22
948684313750630401,All schools in #Nicholas Co closed Thu 1/4/18,WVDE Twitbot,16,14,2018-01-03 22:35:40,Nicholas County School District,2018-01-04
427906914626703360,All schools in #Roane Co closed Tue 1/28/14 due to extreme cold,WVDE Twitbot,4,14,2014-01-27 20:52:13,Roane County School District,2014-01-28
949007119659028480,All schools in #Gilmer Co closed Fri 1/5/18,WVDE Twitbot,5,2,2018-01-04 19:58:23,Gilmer County School District,2018-01-05
963008311321874432,UPDATE: All schools in #Wetzel Co now closed Mon 2/12/18 due to the fact that the ruling on the field has been changed,WVDE Twitbot,74,26,2018-02-12 11:14:07,Wetzel County School District,2018-02-12
298361577613189120,UPDATE: All schools in #Webster Co now closed Mon 2/4/13 due to Weather Conditions,WVDE Twitbot,2,4,2013-02-04 09:25:18,Webster County School District,2013-02-04
298397096476807168,UPDATE: All schools in #Monroe Co now closed Mon 2/4/13,WVDE Twitbot,2,6,2013-02-04 11:46:26,Monroe County School District,2013-02-04
419072012468748288,UPDATE: All schools in #Pendleton Co now closed Fri 1/3/14 due to Inclement weather,WVDE Twitbot,6,9,2014-01-03 11:45:28,Pendleton County School District,2014-01-03
263228262912770048,UPDATE: All schools in #Roane Co now closed Tue 10/30/12 due to Inclement Weather  #WVSandy,WVDE Twitbot,1,2,2012-10-30 10:38:03,Roane County School District,2012-10-30
553528679037669376,UPDATE: All schools in #Brooke Co now closed Fri 1/9/15,WVDE Twitbot,9,4,2015-01-09 12:28:15,Brooke County School District,2015-01-09
690270371405303810,All schools in #Marion Co closed Fri 1/22/16 due to Inclement Weather,WVDE Twitbot,48,138,2016-01-21 20:30:55,Marion County School District,2016-01-22
419064406392074240,UPDATE: All schools in #Wayne Co now closed Fri 1/3/14 due to Inclement Weather,WVDE Twitbot,6,8,2014-01-03 11:15:14,Wayne County School District,2014-01-03
154162986045554689,UPDATE: All schools in #Tucker Co now closed Tue 1/3/12,WVDE Twitbot,0,2,2012-01-03 11:31:34,Tucker County School District,2012-01-03
430285186983403520,All schools in #Berkeley Co closed Mon 2/3/14 All evening activities are cancelled.,WVDE Twitbot,17,48,2014-02-03 10:22:37,Berkeley County School District,2014-02-03
298402083814653954,UPDATE: All schools in #Brooke Co now closed Mon 2/4/13,WVDE Twitbot,2,4,2013-02-04 12:06:15,Brooke County School District,2013-02-04
425763520601288706,All schools in #Pocahontas Co closed Wed 1/22/14,WVDE Twitbot,3,6,2014-01-21 22:55:08,Pocahontas County School District,2014-01-22
567111667579125761,All schools in #Putnam Co closed Mon 2/16/15 due to Weather conditions,WVDE Twitbot,111,281,2015-02-16 00:02:12,Putnam County School District,2015-02-16
567987665439739904,All schools in #Preston Co closed Wed 2/18/15 due to anticipated winter weather conditions,WVDE Twitbot,6,5,2015-02-18 10:03:06,Preston County School District,2015-02-18
697387640786706432,UPDATE: All schools in #Putnam Co now closed Wed 2/10/16 due to Weather conditions,WVDE Twitbot,70,173,2016-02-10 11:52:25,Putnam County School District,2016-02-10
699541849967620096,UPDATE: All schools in #Grant Co now closed Tue 2/16/16,WVDE Twitbot,10,7,2016-02-16 10:32:28,Grant County School District,2016-02-16
699170405890813952,All schools in #Hardy Co closed Mon 2/15/16,WVDE Twitbot,16,17,2016-02-15 09:56:29,Hardy County School District,2016-02-15
440284692181704704,All schools in #Cabell Co closed Mon 3/3/14 due to inclement weather code red,WVDE Twitbot,42,70,2014-03-03 00:37:05,Cabell County School District,2014-03-03
427939534639083520,All schools in #Doddridge Co closed Tue 1/28/14 due to inclement weather &amp; frigid temperatures Staff is to report.,WVDE Twitbot,3,6,2014-01-27 23:01:50,Doddridge County School District,2014-01-28
953408408820043786,All schools in #Logan Co closed Wed 1/17/18,WVDE Twitbot,56,41,2018-01-16 23:27:32,Logan County School District,2018-01-17
294409262136967168,UPDATE: All schools in #Tyler Co now closed Thu 1/24/13 due to hazardous road conditions,WVDE Twitbot,2,2,2013-01-24 11:40:12,Tyler County School District,2013-01-24
313603425394913280,UPDATE: All schools in #Pendleton Co now closed Mon 3/18/13,WVDE Twitbot,0,2,2013-03-18 10:50:57,Pendleton County School District,2013-03-18
435205749329756160,All schools in #Barbour Co closed Mon 2/17/14,WVDE Twitbot,16,19,2014-02-17 00:15:11,Barbour County School District,2014-02-17
419043604565614592,UPDATE: All schools in #Monongalia Co now closed Fri 1/3/14,WVDE Twitbot,29,50,2014-01-03 09:52:35,Monongalia County School District,2014-01-03
427791871813763072,UPDATE: All schools in #Logan Co now closed Mon 1/27/14,WVDE Twitbot,16,31,2014-01-27 13:15:04,Logan County School District,2014-01-27
430310521963687936,UPDATE: All schools in #Randolph Co now closed Mon 2/3/14,WVDE Twitbot,10,23,2014-02-03 12:03:17,Randolph County School District,2014-02-03
958280839279804417,All schools in #Barbour Co closed Tue 1/30/18 Snow Pack Day #5. Staff will report on a two hour delay.,WVDE Twitbot,7,3,2018-01-30 10:08:50,Barbour County School District,2018-01-30
552406875669790721,All schools in #Mineral Co closed Tue 1/6/15 due to inclement weather,WVDE Twitbot,12,31,2015-01-06 10:10:37,Mineral County School District,2015-01-06
567412183982956544,All schools in #Barbour Co closed Tue 2/17/15,WVDE Twitbot,21,8,2015-02-16 19:56:21,Barbour County School District,2015-02-17
953431812457619456,All schools in #Raleigh Co closed Wed 1/17/18,WVDE Twitbot,71,43,2018-01-17 01:00:32,Raleigh County School District,2018-01-17
435604549370273792,UPDATE: All schools in #Hancock Co now closed Tue 2/18/14 due to weather,WVDE Twitbot,4,4,2014-02-18 02:39:52,Hancock County School District,2014-02-18
445367049410195456,All schools in #Calhoun Co closed Mon 3/17/14,WVDE Twitbot,13,10,2014-03-17 01:12:33,Calhoun County School District,2014-03-17
410350974448857088,All schools in #Webster Co closed Tue 12/10/13 due to the weather,WVDE Twitbot,5,11,2013-12-10 10:11:10,Webster County School District,2013-12-10
697212371522232320,All schools in #Greenbrier Co closed Wed 2/10/16 due to Weather conditions,WVDE Twitbot,21,41,2016-02-10 00:15:57,Greenbrier County School District,2016-02-10
428354707640164352,All schools in #Wyoming Co closed Wed 1/29/14 due to inclement weather,WVDE Twitbot,6,10,2014-01-29 02:31:35,Wyoming County School District,2014-01-29
696891453826588672,All schools in #Wood Co closed Tue 2/9/16 Only 261 day employees report to work.,WVDE Twitbot,156,290,2016-02-09 03:00:44,Wood County School District,2016-02-09
703193460539527168,UPDATE: All schools in #Mineral Co now closed Fri 2/26/16 due to inclement weather,WVDE Twitbot,25,28,2016-02-26 12:22:40,Mineral County School District,2016-02-26
444034619319787520,All schools in #Webster Co closed Thu 3/13/14 due to Weather and Road Conditions Staff report on a 2 hour delay.,WVDE Twitbot,0,10,2014-03-13 08:57:57,Webster County School District,2014-03-13
426133260305850368,All schools in #Hampshire Co closed Thu 1/23/14,WVDE Twitbot,14,22,2014-01-22 23:24:21,Hampshire County School District,2014-01-23
430316880281100288,1/2 UPDATE: All schools in #Mason Co now closed Mon 2/3/14 due to Inclement weather,WVDE Twitbot,3,4,2014-02-03 12:28:33,Mason County School District,2014-02-03
568219877393227776,UPDATE: All schools in #Wetzel Co now closed Thu 2/19/15,WVDE Twitbot,10,26,2015-02-19 01:25:50,Wetzel County School District,2015-02-19
440642517416304640,All schools in #Pocahontas Co closed Tue 3/4/14,WVDE Twitbot,3,7,2014-03-04 00:18:57,Pocahontas County School District,2014-03-04
419040966604251136,All schools in #Braxton Co closed Fri 1/3/14,WVDE Twitbot,8,10,2014-01-03 09:42:06,Braxton County School District,2014-01-03
427773285313425408,UPDATE: All schools in #Roane Co now closed Mon 1/27/14 due to snow &amp; ice,WVDE Twitbot,5,6,2014-01-27 12:01:13,Roane County School District,2014-01-27
440441713803268096,UPDATE: All schools in #Grant Co now closed Mon 3/3/14 due to inclement weather,WVDE Twitbot,2,7,2014-03-03 11:01:02,Grant County School District,2014-03-03
840169060809748481,UPDATE: All schools in #Monongalia Co now closed Fri 3/10/17,WVDE Twitbot,42,42,2017-03-10 11:54:48,Monongalia County School District,2017-03-10
699015290101899264,All schools in #Fayette Co closed Mon 2/15/16 due to inclement weather,WVDE Twitbot,51,81,2016-02-14 23:40:06,Fayette County School District,2016-02-15
565841741652430848,UPDATE: All schools in #Webster Co now closed Thu 2/12/15 due to Weather Conditions,WVDE Twitbot,8,8,2015-02-12 11:55:58,Webster County School District,2015-02-12
560371514697351168,All schools in #Randolph Co on a 2-hr delay Wed 1/28/15 with Harman school closed,WVDE Twitbot,7,14,2015-01-28 09:39:14,Randolph County School District,2015-01-28
567485215556509696,All schools in #Jefferson Co closed Tue 2/17/15 due to snow,WVDE Twitbot,39,65,2015-02-17 00:46:33,Jefferson County School District,2015-02-17
690110011838742530,All schools in #Tucker Co closed Thu 1/21/16,WVDE Twitbot,14,16,2016-01-21 09:53:43,Tucker County School District,2016-01-21
953349907880046593,All schools in #Hancock Co closed Wed 1/17/18 due to Road Conditions and Sub Zero Windchills,WVDE Twitbot,18,15,2018-01-16 19:35:05,Hancock County School District,2018-01-17
444059518784131072,UPDATE: All schools in #McDowell Co now closed Thu 3/13/14 due to Inclement weather,WVDE Twitbot,1,6,2014-03-13 10:36:54,McDowell County School District,2014-03-13
294629728462200832,All schools in #Ritchie Co closed Fri 1/25/13,WVDE Twitbot,3,12,2013-01-25 02:16:15,Ritchie County School District,2013-01-25
563302271367528448,UPDATE: All schools in #Clay Co now closed Thu 2/5/15 due to weather conditions,WVDE Twitbot,10,14,2015-02-05 11:45:01,Clay County School District,2015-02-05
420144496458727424,UPDATE: All schools in #Lincoln Co now closed Mon 1/6/14,WVDE Twitbot,18,43,2014-01-06 10:47:08,Lincoln County School District,2014-01-06
420302079094448128,All schools in #Wayne Co closed Tue 1/7/14 due to Inclement Weather,WVDE Twitbot,4,15,2014-01-06 21:13:19,Wayne County School District,2014-01-07
573304668329271296,All schools in #Tyler Co closed Thu 3/5/15 School will be closed for all staff and students.,WVDE Twitbot,11,8,2015-03-05 02:10:59,Tyler County School District,2015-03-05
262719592743460864,All schools in #Pendleton Co closed Mon 10/29/12,WVDE Twitbot,1,7,2012-10-29 00:56:46,Pendleton County School District,2012-10-29
568168769325039616,All schools in #Greenbrier Co closed Thu 2/19/15,WVDE Twitbot,15,27,2015-02-18 22:02:45,Greenbrier County School District,2015-02-19
428316473841680384,All schools in #Grant Co closed Wed 1/29/14 due to extreme cold temperatures. All staff are to report on a two hour delay,WVDE Twitbot,5,7,2014-01-28 23:59:39,Grant County School District,2014-01-29
428337615474290688,All schools in #Mineral Co closed Wed 1/29/14,WVDE Twitbot,8,43,2014-01-29 01:23:40,Mineral County School District,2014-01-29
950164863279599618,All schools in #Gilmer Co closed Mon 1/8/18,WVDE Twitbot,9,4,2018-01-08 00:38:51,Gilmer County School District,2018-01-08
953209468044632064,All schools in #Cabell Co closed Tue 1/16/18 due to inclement weather code red,WVDE Twitbot,26,15,2018-01-16 10:17:01,Cabell County School District,2018-01-16
696885549756506112,All schools in #Greenbrier Co closed Tue 2/9/16 due to Weather conditions,WVDE Twitbot,26,33,2016-02-09 02:37:17,Greenbrier County School District,2016-02-09
697704836033355776,UPDATE: All schools in #Upshur Co now closed Thu 2/11/16,WVDE Twitbot,20,9,2016-02-11 08:52:50,Upshur County School District,2016-02-11
697389797682364418,UPDATE: All schools in #Mason Co now closed Wed 2/10/16 due to Inclement weather code red,WVDE Twitbot,17,25,2016-02-10 12:00:59,Mason County School District,2016-02-10
433769938931556352,All schools in #Mercer Co closed Thu 2/13/14 due to inclement weather,WVDE Twitbot,1,6,2014-02-13 01:09:47,Mercer County School District,2014-02-13
423823160765464577,All schools in #Kanawha Co closed Fri 1/17/14 due to water crisis code B,WVDE Twitbot,20,60,2014-01-16 14:24:50,Kanawha County School District,2014-01-17
567295665223786496,1/2 All schools in #Kanawha Co closed Mon 2/16/15 due to Inclement Weather code B,WVDE Twitbot,17,14,2015-02-16 12:13:21,Kanawha County School District,2015-02-16
567455294968856577,UPDATE: All schools in #Nicholas Co now closed Tue 2/17/15 due to the winter storm,WVDE Twitbot,16,11,2015-02-16 22:47:39,Nicholas County School District,2015-02-17
568571189125365762,All schools in #Morgan Co closed Fri 2/20/15 code A,WVDE Twitbot,15,29,2015-02-20 00:41:49,Morgan County School District,2015-02-20
428882608345202688,UPDATE: All schools in #McDowell Co now closed Thu 1/30/14 due to inclement weather,WVDE Twitbot,3,7,2014-01-30 13:29:16,McDowell County School District,2014-01-30
309245835961569280,All schools in #Mineral Co closed Wed 3/6/13 due to snow code C,WVDE Twitbot,3,13,2013-03-06 10:15:27,Mineral County School District,2013-03-06
297315144197869568,UPDATE: All schools in #Hampshire Co now closed Fri 2/1/13 due to snow/ice covered roads,WVDE Twitbot,3,11,2013-02-01 12:07:08,Hampshire County School District,2013-02-01
430282176723419136,All schools in #Morgan Co closed Mon 2/3/14 code A,WVDE Twitbot,2,12,2014-02-03 10:10:39,Morgan County School District,2014-02-03
309234831395524608,All schools in #Fayette Co closed Wed 3/6/13,WVDE Twitbot,3,18,2013-03-06 09:31:43,Fayette County School District,2013-03-06
568531224613879809,All schools in #Ohio Co closed Fri 2/20/15,WVDE Twitbot,25,51,2015-02-19 22:03:01,Ohio County School District,2015-02-20
960467969691308033,UPDATE: All schools in #Berkeley Co now closed Mon 2/5/18 due to weather This includes Pre-K.Evening activities are cancelled.,WVDE Twitbot,42,23,2018-02-05 10:59:43,Berkeley County School District,2018-02-05
953072471888072704,All schools in #Wetzel Co closed Tue 1/16/18 due to Old Man Winter,WVDE Twitbot,68,26,2018-01-16 01:12:39,Wetzel County School District,2018-01-16
690266063490146304,All schools in #Jackson Co closed Fri 1/22/16 code B,WVDE Twitbot,31,48,2016-01-21 20:13:48,Jackson County School District,2016-01-22
697001457606856704,All schools in #Pleasants Co closed Tue 2/9/16,WVDE Twitbot,16,14,2016-02-09 10:17:51,Pleasants County School District,2016-02-09
699038135653527552,UPDATE: All schools in #Wayne Co now closed Mon 2/15/16 due to Inclement Weather,WVDE Twitbot,27,44,2016-02-15 01:10:53,Wayne County School District,2016-02-15
445379410149920768,All schools in #Pocahontas Co closed Mon 3/17/14,WVDE Twitbot,9,9,2014-03-17 02:01:40,Pocahontas County School District,2014-03-17
552768195900473345,UPDATE: All schools in #Lewis Co now closed Wed 1/7/15,WVDE Twitbot,7,12,2015-01-07 10:06:22,Lewis County School District,2015-01-07
298385920602808321,UPDATE: All schools in #Harrison Co now closed Mon 2/4/13,WVDE Twitbot,9,34,2013-02-04 11:02:01,Harrison County School District,2013-02-04
311257659888250881,All schools in #Clay Co closed Tue 3/12/13 due to Water Outage,WVDE Twitbot,3,15,2013-03-11 23:29:43,Clay County School District,2013-03-12
431039640746078208,UPDATE: All schools in #Mason Co now closed Wed 2/5/14 due to High Water/Loss of Power close for students and staff,WVDE Twitbot,12,12,2014-02-05 12:20:33,Mason County School District,2014-02-05
948859100967899137,1/2 UPDATE: All schools in #Braxton Co now closed Thu 1/4/18 due to possible sub-zero wind chill factors,WVDE Twitbot,6,2,2018-01-04 10:10:13,Braxton County School District,2018-01-04
567274241935306752,UPDATE: All schools in #Taylor Co now closed Mon 2/16/15,WVDE Twitbot,12,13,2015-02-16 10:48:13,Taylor County School District,2015-02-16
567419499738333184,All schools in #Calhoun Co closed Tue 2/17/15 due to Inclement Weather code red,WVDE Twitbot,8,5,2015-02-16 20:25:25,Calhoun County School District,2015-02-17
220618862436163585,All schools in #Fayette Co closed Thu 7/5/12,WVDE Twitbot,0,3,2012-07-04 20:43:30,Fayette County School District,2012-07-05
573615289159565312,All schools in #Lewis Co closed Fri 3/6/15,WVDE Twitbot,9,10,2015-03-05 22:45:16,Lewis County School District,2015-03-06
420132011743797248,All schools in #Taylor Co closed Mon 1/6/14,WVDE Twitbot,0,10,2014-01-06 09:57:31,Taylor County School District,2014-01-06
567477655277428736,All schools in #Morgan Co closed Tue 2/17/15 code A,WVDE Twitbot,16,19,2015-02-17 00:16:30,Morgan County School District,2015-02-17
427901009424158721,All schools in #Randolph Co closed Tue 1/28/14,WVDE Twitbot,10,30,2014-01-27 20:28:45,Randolph County School District,2014-01-28
948529946460409857,UPDATE: All schools in #Marion Co now closed Wed 1/3/18 due to Inclement Weather,WVDE Twitbot,72,43,2018-01-03 12:22:16,Marion County School District,2018-01-03
951760610773098496,All schools in #Tyler Co closed Fri 1/12/18,WVDE Twitbot,7,8,2018-01-12 10:19:47,Tyler County School District,2018-01-12
298413260825309185,UPDATE: All schools in #Hancock Co now closed Mon 2/4/13 due to weather,WVDE Twitbot,2,0,2013-02-04 12:50:40,Hancock County School District,2013-02-04
171739546793426945,All schools in #Mercer Co closed Tue 2/21/12 due to widespread power outages,WVDE Twitbot,0,1,2012-02-20 23:34:33,Mercer County School District,2012-02-21
427571954371948544,All schools in #Ohio Co closed Mon 1/27/14,WVDE Twitbot,13,68,2014-01-26 22:41:12,Ohio County School District,2014-01-27
960481235897409536,UPDATE: All schools in #Raleigh Co now closed Mon 2/5/18,WVDE Twitbot,47,29,2018-02-05 11:52:26,Raleigh County School District,2018-02-05
426107412844523521,All schools in #Greenbrier Co closed Thu 1/23/14 due to Weather conditions and Temperatures,WVDE Twitbot,16,43,2014-01-22 21:41:38,Greenbrier County School District,2014-01-23
440661587792101376,All schools in #Pendleton Co closed Tue 3/4/14,WVDE Twitbot,8,12,2014-03-04 01:34:44,Pendleton County School District,2014-03-04
438634937810300928,UPDATE: All schools in #Preston Co now closed Wed 2/26/14,WVDE Twitbot,2,10,2014-02-26 11:21:33,Preston County School District,2014-02-26
568547215783936000,All schools in #Pocahontas Co closed Fri 2/20/15,WVDE Twitbot,2,2,2015-02-19 23:06:33,Pocahontas County School District,2015-02-20
430282521754861568,All schools in #Hampshire Co closed Mon 2/3/14,WVDE Twitbot,5,10,2014-02-03 10:12:02,Hampshire County School District,2014-02-03
263391208842330112,All schools in #Pendleton Co closed Wed 10/31/12 due to power outage  #WVSandy,WVDE Twitbot,0,3,2012-10-30 21:25:32,Pendleton County School District,2012-10-31
426314060531904512,UPDATE: All schools in #Wood Co now closed Thu 1/23/14 code B This is a STATUS UPDATE.,WVDE Twitbot,46,100,2014-01-23 11:22:47,Wood County School District,2014-01-23
950308688379764741,All schools in #Hampshire Co closed Mon 1/8/18,WVDE Twitbot,9,6,2018-01-08 10:10:21,Hampshire County School District,2018-01-08
157785646923132928,UPDATE: All schools in #Mingo Co now closed Fri 1/13/12 code H,WVDE Twitbot,0,0,2012-01-13 11:26:44,Mingo County School District,2012-01-13
691379453897883648,All schools in #Lewis Co closed Mon 1/25/16,WVDE Twitbot,17,26,2016-01-24 21:58:01,Lewis County School District,2016-01-25
922474753377669120,UPDATE: All schools in #Wood Co now closed Mon 10/23/17 Wood County is now on a Code C,WVDE Twitbot,35,12,2017-10-23 14:48:14,Wood County School District,2017-10-23
420688699131559936,All schools in #Harrison Co closed Wed 1/8/14,WVDE Twitbot,14,78,2014-01-07 22:49:36,Harrison County School District,2014-01-08
691941531511582720,UPDATE: All schools in #Randolph Co now closed Tue 1/26/16,WVDE Twitbot,19,24,2016-01-26 11:11:31,Randolph County School District,2016-01-26
263792144240750592,All schools in #Greenbrier Co closed Thu 11/1/12 due to conditions from the storm  #WVSandy,WVDE Twitbot,3,21,2012-10-31 23:58:42,Greenbrier County School District,2012-11-01
949033740302512128,All schools in #Braxton Co closed Fri 1/5/18 due to NWS issuing wind chill advisory of -10 to -20 degrees for the area,WVDE Twitbot,9,10,2018-01-04 21:44:10,Braxton County School District,2018-01-05
263931569553690624,UPDATE: All schools in #Taylor Co now closed Thu 11/1/12  #WVSandy,WVDE Twitbot,0,2,2012-11-01 09:12:44,Taylor County School District,2012-11-01
430280945875570688,All schools in #Mineral Co closed Mon 2/3/14,WVDE Twitbot,5,19,2014-02-03 10:05:46,Mineral County School District,2014-02-03
959390427668500480,UPDATE: All schools in #Marion Co now closed Fri 2/2/18 due to Inclement Weather,WVDE Twitbot,29,11,2018-02-02 11:37:57,Marion County School District,2018-02-02
412576470708797440,UPDATE: All schools in #Monongalia Co now closed Mon 12/16/13,WVDE Twitbot,20,57,2013-12-16 13:34:30,Monongalia County School District,2013-12-16
433791615065272320,All schools in #Clay Co closed Thu 2/13/14 due to weather conditions,WVDE Twitbot,11,42,2014-02-13 02:35:55,Clay County School District,2014-02-13
573604095845613568,All schools in #Berkeley Co closed Fri 3/6/15 due to weather All evening activities for March 6th canceled also.,WVDE Twitbot,55,125,2015-03-05 22:00:48,Berkeley County School District,2015-03-06
294634724444475392,All schools in #Tyler Co closed Fri 1/25/13,WVDE Twitbot,3,1,2013-01-25 02:36:07,Tyler County School District,2013-01-25
554611646665334784,UPDATE: All schools in #Pleasants Co now closed Mon 1/12/15,WVDE Twitbot,15,15,2015-01-12 12:11:35,Pleasants County School District,2015-01-12
567448027078868993,All schools in #Nicholas Co closed Tue 2/17/15,WVDE Twitbot,20,17,2015-02-16 22:18:46,Nicholas County School District,2015-02-17
699381262851645442,All schools in #Summers Co closed Tue 2/16/16,WVDE Twitbot,10,6,2016-02-15 23:54:21,Summers County School District,2016-02-16
553135711072034817,UPDATE: All schools in #Mingo Co now closed Thu 1/8/15 Employees Code Orange.,WVDE Twitbot,11,14,2015-01-08 10:26:44,Mingo County School District,2015-01-08
410357080864739328,UPDATE: All schools in #Pocahontas Co now closed Tue 12/10/13,WVDE Twitbot,3,9,2013-12-10 10:35:26,Pocahontas County School District,2013-12-10
421620106846683138,UPDATE: All schools in #Morgan Co now closed Fri 1/10/14 code A,WVDE Twitbot,2,19,2014-01-10 12:30:41,Morgan County School District,2014-01-10
427958065858502656,All schools in #Mingo Co closed Tue 1/28/14 Code W.  School employees report on a 2 hour delay.,WVDE Twitbot,7,15,2014-01-28 00:15:28,Mingo County School District,2014-01-28
292119699947413505,All schools in #McDowell Co closed Fri 1/18/13 due to inclement weather,WVDE Twitbot,1,2,2013-01-18 04:02:18,McDowell County School District,2013-01-18
568501335823388673,All schools in #Tucker Co closed Fri 2/20/15 The Central Office will also be closed.,WVDE Twitbot,11,7,2015-02-19 20:04:15,Tucker County School District,2015-02-20
426138184339030016,All schools in #Morgan Co closed Thu 1/23/14 code A,WVDE Twitbot,5,17,2014-01-22 23:43:55,Morgan County School District,2014-01-23
568501419130662912,All schools in #Fayette Co closed Fri 2/20/15 due to inclement weather,WVDE Twitbot,25,58,2015-02-19 20:04:35,Fayette County School District,2015-02-20
561132412063977473,All schools in #McDowell Co closed Fri 1/30/15,WVDE Twitbot,5,4,2015-01-30 12:02:47,McDowell County School District,2015-01-30
950171789468069888,All schools in #Webster Co closed Mon 1/8/18 due to weather conditions,WVDE Twitbot,15,8,2018-01-08 01:06:22,Webster County School District,2018-01-08
309253575601700864,All schools in #Wood Co closed Wed 3/6/13 due to inclement weather code A,WVDE Twitbot,14,48,2013-03-06 10:46:12,Wood County School District,2013-03-06
440639322715222016,All schools in #Berkeley Co closed Tue 3/4/14 due to weather All evening activities cancelled for March 4th.,WVDE Twitbot,37,98,2014-03-04 00:06:15,Berkeley County School District,2014-03-04
959385275368640512,UPDATE: All schools in #Monongalia Co now closed Fri 2/2/18,WVDE Twitbot,25,10,2018-02-02 11:17:28,Monongalia County School District,2018-02-02
426482893301374976,All schools in #Mingo Co closed Fri 1/24/14 Code W.  School Employees report on a 2 hour delay.,WVDE Twitbot,12,33,2014-01-23 22:33:40,Mingo County School District,2014-01-24
263337361461628929,All schools in #Upshur Co closed Wed 10/31/12 due to inclement weather  #WVSandy,WVDE Twitbot,0,17,2012-10-30 17:51:34,Upshur County School District,2012-10-31
428857113507794944,UPDATE: All schools in #Pendleton Co now closed Thu 1/30/14,WVDE Twitbot,7,10,2014-01-30 11:47:58,Pendleton County School District,2014-01-30
699379376035667973,All schools in #Monroe Co closed Tue 2/16/16,WVDE Twitbot,13,13,2016-02-15 23:46:51,Monroe County School District,2016-02-16
426474679335784448,All schools in #Nicholas Co closed Fri 1/24/14,WVDE Twitbot,8,10,2014-01-23 22:01:01,Nicholas County School District,2014-01-24
440627106238578689,1/2 All schools in #Roane Co closed Tue 3/4/14 due to snow on roads,WVDE Twitbot,7,8,2014-03-03 23:17:43,Roane County School District,2014-03-04
697000233243385856,All schools in #Preston Co closed Tue 2/9/16 due to winter weather conditions,WVDE Twitbot,8,10,2016-02-09 10:12:59,Preston County School District,2016-02-09
430307846270771201,UPDATE: All schools in #Gilmer Co now closed Mon 2/3/14 due to Poor Weather Conditions,WVDE Twitbot,3,7,2014-02-03 11:52:39,Gilmer County School District,2014-02-03
953578303457198080,UPDATE: All schools in #Hampshire Co now closed Wed 1/17/18,WVDE Twitbot,7,3,2018-01-17 10:42:38,Hampshire County School District,2018-01-17
568531073988034561,All schools in #Roane Co closed Fri 2/20/15 due to extreme cold,WVDE Twitbot,11,10,2015-02-19 22:02:25,Roane County School District,2015-02-20
423165541587509248,All schools in #Kanawha Co closed Wed 1/15/14 due to water crisis code A employees report at regular time.,WVDE Twitbot,49,116,2014-01-14 18:51:41,Kanawha County School District,2014-01-15
560011061064392704,All schools in #Morgan Co closed Tue 1/27/15 code A,WVDE Twitbot,6,16,2015-01-27 09:46:56,Morgan County School District,2015-01-27
958280728407695361,All schools in #McDowell Co closed Tue 1/30/18,WVDE Twitbot,5,0,2018-01-30 10:08:24,McDowell County School District,2018-01-30
313605482327707648,"UPDATE: All schools in #Hampshire Co now closed Mon 3/18/13 due to Weather, Snow Covered &amp; Icy Roads",WVDE Twitbot,2,12,2013-03-18 10:59:08,Hampshire County School District,2013-03-18
829626392597975040,All schools in #Wetzel Co closed Thu 2/9/17 due to Weather,WVDE Twitbot,20,18,2017-02-09 09:42:00,Wetzel County School District,2017-02-09
568019348134232064,UPDATE: All schools in #Tyler Co now closed Wed 2/18/15 All 240 and 261 day employees should report by 10:00 a.m.,WVDE Twitbot,12,14,2015-02-18 12:09:00,Tyler County School District,2015-02-18
567825424883060736,All schools in #Gilmer Co closed Wed 2/18/15,WVDE Twitbot,10,10,2015-02-17 23:18:25,Gilmer County School District,2015-02-18
263234605342158850,UPDATE: All schools in #Wayne Co now closed Tue 10/30/12 due to Inclement Weather  #WVSandy,WVDE Twitbot,3,5,2012-10-30 11:03:15,Wayne County School District,2012-10-30
953369431538839557,All schools in #Brooke Co closed Wed 1/17/18 due to weather,WVDE Twitbot,10,11,2018-01-16 20:52:39,Brooke County School District,2018-01-17
263458080858198016,All schools in #Barbour Co closed Wed 10/31/12 due to inclement weather  #WVSandy,WVDE Twitbot,0,1,2012-10-31 01:51:15,Barbour County School District,2012-10-31
427581432723042304,All schools in #Pleasants Co closed Mon 1/27/14,WVDE Twitbot,7,16,2014-01-26 23:18:52,Pleasants County School District,2014-01-27
690253923899305989,All schools in #Kanawha Co closed Fri 1/22/16 due to Inclement Weather No Employees including 261 Day Employees are to report tomorrow!,WVDE Twitbot,264,446,2016-01-21 19:25:34,Kanawha County School District,2016-01-22
294389788604248065,All schools in #Harrison Co closed Thu 1/24/13,WVDE Twitbot,7,36,2013-01-24 10:22:49,Harrison County School District,2013-01-24
425573750080147456,1/2 All schools in #Putnam Co closed Tue 1/21/14 due to Weather Conditions,WVDE Twitbot,28,98,2014-01-21 10:21:03,Putnam County School District,2014-01-21
432708185309609984,All schools in #Pleasants Co closed Mon 2/10/14,WVDE Twitbot,17,22,2014-02-10 02:50:45,Pleasants County School District,2014-02-10
440620286866493441,All schools in #Lincoln Co closed Tue 3/4/14,WVDE Twitbot,19,53,2014-03-03 22:50:37,Lincoln County School District,2014-03-04
573653125468438529,All schools in #Ohio Co closed Fri 3/6/15,WVDE Twitbot,14,49,2015-03-06 01:15:37,Ohio County School District,2015-03-06
553555042297724928,All schools in #Hancock Co closed Fri 1/9/15,WVDE Twitbot,10,3,2015-01-09 14:13:01,Hancock County School District,2015-01-09
953412473712971776,All schools in #Braxton Co closed Wed 1/17/18 All extracurricular activities including practices and games are cancelled.,WVDE Twitbot,9,6,2018-01-16 23:43:41,Braxton County School District,2018-01-17
568211403804413952,All schools in #Marshall Co closed Thu 2/19/15,WVDE Twitbot,17,45,2015-02-19 00:52:10,Marshall County School District,2015-02-19
428338768098390016,All schools in #Wood Co closed Wed 1/29/14 due to frigid conditions code B,WVDE Twitbot,83,194,2014-01-29 01:28:15,Wood County School District,2014-01-29
949026254707154944,All schools in #Wirt Co closed Fri 1/5/18 code A Snow Day Learning Packets,WVDE Twitbot,7,9,2018-01-04 21:14:25,Wirt County School District,2018-01-05
691395356735717376,All schools in #Tyler Co closed Mon 1/25/16,WVDE Twitbot,23,18,2016-01-24 23:01:13,Tyler County School District,2016-01-25
689994945952899076,All schools in #Summers Co closed Thu 1/21/16,WVDE Twitbot,20,20,2016-01-21 02:16:29,Summers County School District,2016-01-21
419057338004156416,UPDATE: All schools in #Preston Co now closed Fri 1/3/14 All staff not required to report.,WVDE Twitbot,2,4,2014-01-03 10:47:09,Preston County School District,2014-01-03
420286338768703488,All schools in #Summers Co closed Tue 1/7/14,WVDE Twitbot,8,33,2014-01-06 20:10:46,Summers County School District,2014-01-07
552964279478263808,All schools in #Upshur Co closed Thu 1/8/15,WVDE Twitbot,21,32,2015-01-07 23:05:32,Upshur County School District,2015-01-08
568454663135215616,All schools in #Barbour Co closed Fri 2/20/15,WVDE Twitbot,17,14,2015-02-19 16:58:47,Barbour County School District,2015-02-20
160303164422234112,All schools in #Harrison Co closed Fri 1/20/12,WVDE Twitbot,0,1,2012-01-20 10:10:27,Harrison County School District,2012-01-20
568532758651277313,All schools in #Monongalia Co closed Fri 2/20/15,WVDE Twitbot,53,120,2015-02-19 22:09:07,Monongalia County School District,2015-02-20
440656709481033728,All schools in #Hardy Co closed Tue 3/4/14,WVDE Twitbot,10,30,2014-03-04 01:15:21,Hardy County School District,2014-03-04
826019034164580355,UPDATE: All schools in #Mercer Co now closed Mon 1/30/17 due to inclement weather conditions,WVDE Twitbot,13,8,2017-01-30 10:47:39,Mercer County School District,2017-01-30
297313302701281280,UPDATE: All schools in #Grant Co now closed Fri 2/1/13 due to inclement weather,WVDE Twitbot,1,4,2013-02-01 11:59:49,Grant County School District,2013-02-01
553153714127904768,All schools in #Grant Co closed Thu 1/8/15,WVDE Twitbot,4,2,2015-01-08 11:38:17,Grant County School District,2015-01-08
425731108496355328,All schools in #Tucker Co closed Wed 1/22/14,WVDE Twitbot,7,8,2014-01-21 20:46:20,Tucker County School District,2014-01-22
691326249327788032,All schools in #Harrison Co closed Mon 1/25/16,WVDE Twitbot,73,148,2016-01-24 18:26:36,Harrison County School District,2016-01-25
157792759284117505,UPDATE: All schools in #Marshall Co now closed Fri 1/13/12,WVDE Twitbot,0,1,2012-01-13 11:55:00,Marshall County School District,2012-01-13
438636051041902593,UPDATE: All schools in #Roane Co now closed Wed 2/26/14 due to snow,WVDE Twitbot,5,7,2014-02-26 11:25:58,Roane County School District,2014-02-26
425577381173395457,All schools in #Wayne Co closed Tue 1/21/14 due to Inclement Weather,WVDE Twitbot,3,10,2014-01-21 10:35:29,Wayne County School District,2014-01-21
552912427588014080,All schools in #Barbour Co closed Thu 1/8/15 due to frigid temperatures,WVDE Twitbot,11,19,2015-01-07 19:39:30,Barbour County School District,2015-01-08
567099415757062144,All schools in #Upshur Co closed Mon 2/16/15,WVDE Twitbot,26,38,2015-02-15 23:13:31,Upshur County School District,2015-02-16
298196151067357184,All schools in #Preston Co closed Mon 2/4/13,WVDE Twitbot,2,13,2013-02-03 22:27:57,Preston County School District,2013-02-04
434102700356026370,All schools in #Webster Co closed Fri 2/14/14 due to Weather Conditions,WVDE Twitbot,9,24,2014-02-13 23:12:03,Webster County School District,2014-02-14
690488870840958976,All schools in #Jefferson Co closed Fri 1/22/16,WVDE Twitbot,36,14,2016-01-22 10:59:10,Jefferson County School District,2016-01-22
297273624992296960,All schools in #Kanawha Co closed Fri 2/1/13 due to winter road conditions code B,WVDE Twitbot,44,145,2013-02-01 09:22:09,Kanawha County School District,2013-02-01
440690562341928960,All schools in #Mercer Co closed Tue 3/4/14 due to inclement weather,WVDE Twitbot,8,4,2014-03-04 03:29:52,Mercer County School District,2014-03-04
433915346232147969,All schools in #Wayne Co closed Thu 2/13/14 due to Inclement Weather,WVDE Twitbot,3,1,2014-02-13 10:47:34,Wayne County School District,2014-02-13
434023222820868096,All schools in #Fayette Co closed Fri 2/14/14 due to inclement weather code B,WVDE Twitbot,13,21,2014-02-13 17:56:14,Fayette County School District,2014-02-14
567285051105480705,UPDATE: All schools in #Grant Co now closed Mon 2/16/15,WVDE Twitbot,3,6,2015-02-16 11:31:10,Grant County School District,2015-02-16
950155407649071104,All schools in #Doddridge Co closed Mon 1/8/18 due to inclement weather code C,WVDE Twitbot,12,12,2018-01-08 00:01:16,Doddridge County School District,2018-01-08
567833827130937344,All schools in #Fayette Co closed Wed 2/18/15 due to incoming inclement weather,WVDE Twitbot,36,59,2015-02-17 23:51:48,Fayette County School District,2015-02-18
426685651161870336,UPDATE: All schools in #Hardy Co now closed Fri 1/24/14,WVDE Twitbot,7,17,2014-01-24 11:59:21,Hardy County School District,2014-01-24
566200125119549442,UPDATE: All schools in #Webster Co now closed Fri 2/13/15 due to Weather Conditions,WVDE Twitbot,4,7,2015-02-13 11:40:03,Webster County School District,2015-02-13
420659206027354112,All schools in #Summers Co closed Wed 1/8/14,WVDE Twitbot,9,20,2014-01-07 20:52:24,Summers County School District,2014-01-08
420288083490533377,All schools in #Tucker Co closed Tue 1/7/14,WVDE Twitbot,11,20,2014-01-06 20:17:42,Tucker County School District,2014-01-07
961196380860674048,"UPDATE: All schools in #Preston Co now closed Wed 2/7/18 due to winter weather conditions, and it is not a ""Brain F https://t.co/Z3Dangxn02",WVDE Twitbot,14,5,2018-02-07 11:14:10,Preston County School District,2018-02-07
690128410522357761,UPDATE: All schools in #Taylor Co now closed Thu 1/21/16,WVDE Twitbot,16,11,2016-01-21 11:06:49,Taylor County School District,2016-01-21
953763788720885761,All schools in #Raleigh Co closed Thu 1/18/18 This is a Reimagined Time Day.,WVDE Twitbot,56,25,2018-01-17 22:59:41,Raleigh County School District,2018-01-18
573065798417321984,All schools in #Ritchie Co closed Wed 3/4/15,WVDE Twitbot,4,12,2015-03-04 10:21:48,Ritchie County School District,2015-03-04
552431926674722819,UPDATE: All schools in #Grant Co now closed Tue 1/6/15,WVDE Twitbot,9,8,2015-01-06 11:50:09,Grant County School District,2015-01-06
697366648890720257,"UPDATE: All schools in #Braxton Co now closed Wed 2/10/16 BOE, principals, maintenance, and custodians over 200 days, please report.",WVDE Twitbot,5,4,2016-02-10 10:29:00,Braxton County School District,2016-02-10
569983102799519745,All schools in #Raleigh Co closed Tue 2/24/15,WVDE Twitbot,22,66,2015-02-23 22:12:16,Raleigh County School District,2015-02-24
434084997947867136,UPDATE: All schools in #Morgan Co now closed Fri 2/14/14 code A,WVDE Twitbot,1,9,2014-02-13 22:01:43,Morgan County School District,2014-02-14
444046504789938177,All schools in #Pocahontas Co closed Thu 3/13/14,WVDE Twitbot,1,5,2014-03-13 09:45:11,Pocahontas County School District,2014-03-13
950522627612987392,All schools in #Greenbrier Co on a 3-hr delay Tue 1/9/18 Western Gbr Middle will be closed NO WATER,WVDE Twitbot,7,5,2018-01-09 00:20:28,Greenbrier County School District,2018-01-09
440294904841777152,All schools in #Doddridge Co closed Mon 3/3/14 due to inclement weather Staff does not have to report.,WVDE Twitbot,14,18,2014-03-03 01:17:40,Doddridge County School District,2014-03-03
419059151013040128,UPDATE: All schools in #Putnam Co now closed Fri 1/3/14 due to the weather conditions,WVDE Twitbot,26,90,2014-01-03 10:54:22,Putnam County School District,2014-01-03
296917476925661185,All schools in #Webster Co closed Thu 1/31/13 due to Weather Conditions,WVDE Twitbot,0,7,2013-01-31 09:46:57,Webster County School District,2013-01-31
552403139492872196,All schools in #Calhoun Co closed Tue 1/6/15 due to Inclement Weather code blue,WVDE Twitbot,3,9,2015-01-06 09:55:46,Calhoun County School District,2015-01-06
690276408648691713,All schools in #Mineral Co closed Fri 1/22/16 due to pending severe weather,WVDE Twitbot,51,79,2016-01-21 20:54:55,Mineral County School District,2016-01-22
433931042815111168,UPDATE: All schools in #Wetzel Co now closed Thu 2/13/14,WVDE Twitbot,23,36,2014-02-13 11:49:57,Wetzel County School District,2014-02-13
953375058113826816,All schools in #Mason Co closed Wed 1/17/18 due to Inclement Weather code red,WVDE Twitbot,19,12,2018-01-16 21:15:01,Mason County School District,2018-01-17
425590199230283776,UPDATE: All schools in #Mason Co now closed Tue 1/21/14 due to Inclement Weather,WVDE Twitbot,7,13,2014-01-21 11:26:25,Mason County School District,2014-01-21
534686787126722560,UPDATE: All schools in #Tucker Co now closed Tue 11/18/14,WVDE Twitbot,15,17,2014-11-18 12:37:18,Tucker County School District,2014-11-18
316119199808368640,All schools in #Jefferson Co closed Mon 3/25/13 due to Snow,WVDE Twitbot,0,15,2013-03-25 09:27:45,Jefferson County School District,2013-03-25
420131718377385984,All schools in #Marion Co closed Mon 1/6/14 due to Inclement Weather,WVDE Twitbot,10,40,2014-01-06 09:56:21,Marion County School District,2014-01-06
445516571788578816,"UPDATE: All schools in #Tyler Co now closed Mon 3/17/14 Employees, Code C.",WVDE Twitbot,14,8,2014-03-17 11:06:42,Tyler County School District,2014-03-17
953385029232623616,All schools in #Roane Co closed Wed 1/17/18 due to inclement weather,WVDE Twitbot,7,5,2018-01-16 21:54:38,Roane County School District,2018-01-17
697000878096715776,All schools in #Tyler Co closed Tue 2/9/16,WVDE Twitbot,17,11,2016-02-09 10:15:33,Tyler County School District,2016-02-09
440492146055864320,UPDATE: All schools in #Fayette Co now closed Mon 3/3/14 due to inclement weather code B,WVDE Twitbot,9,9,2014-03-03 14:21:26,Fayette County School District,2014-03-03
767644151311659008,UPDATE: All schools in #Calhoun Co now closed Mon 8/22/16 due to Water Main Break code blue,WVDE Twitbot,1,5,2016-08-22 08:46:42,Calhoun County School District,2016-08-22
298607678828187648,All schools in #Pleasants Co closed Tue 2/5/13,WVDE Twitbot,9,15,2013-02-05 01:43:13,Pleasants County School District,2013-02-05
691371687510585344,All schools in #Calhoun Co closed Mon 1/25/16 due to Weather Conditions code blue,WVDE Twitbot,12,9,2016-01-24 21:27:10,Calhoun County School District,2016-01-25
567281171936321537,1/2 UPDATE: All schools in #Jefferson Co now closed Mon 2/16/15 due to extreme cold temperatures,WVDE Twitbot,20,32,2015-02-16 11:15:45,Jefferson County School District,2015-02-16
552800904223924224,UPDATE: All schools in #Webster Co now closed Wed 1/7/15 due to Weather Conditions,WVDE Twitbot,12,11,2015-01-07 12:16:20,Webster County School District,2015-01-07
563288910240169984,UPDATE: All schools in #Ohio Co now closed Thu 2/5/15,WVDE Twitbot,13,48,2015-02-05 10:51:56,Ohio County School District,2015-02-05
953236406087946240,UPDATE: All schools in #Lewis Co now closed Tue 1/16/18 Please complete snow packet #2.,WVDE Twitbot,10,4,2018-01-16 12:04:04,Lewis County School District,2018-01-16
428115154408976384,UPDATE: All schools in #Berkeley Co now closed Tue 1/28/14 All evening activities are cancelled.,WVDE Twitbot,14,43,2014-01-28 10:39:41,Berkeley County School District,2014-01-28
689939092101009409,All schools in #Logan Co closed Thu 1/21/16,WVDE Twitbot,40,67,2016-01-20 22:34:32,Logan County School District,2016-01-21
691748577220136961,All schools in #Hardy Co closed Tue 1/26/16,WVDE Twitbot,25,21,2016-01-25 22:24:47,Hardy County School District,2016-01-26
948697675007975425,All schools in #Fayette Co closed Thu 1/4/18,WVDE Twitbot,22,31,2018-01-03 23:28:46,Fayette County School District,2018-01-04
567425663318364160,All schools in #Taylor Co closed Tue 2/17/15,WVDE Twitbot,11,18,2015-02-16 20:49:55,Taylor County School District,2015-02-17
953593026030587904,UPDATE: All schools in #Summers Co now closed Wed 1/17/18 due to Inclement weather,WVDE Twitbot,6,1,2018-01-17 11:41:08,Summers County School District,2018-01-17
569608653243875329,All schools in #Roane Co closed Mon 2/23/15 due to snow and ice,WVDE Twitbot,10,13,2015-02-22 21:24:20,Roane County School District,2015-02-23
171392086782902273,All schools in #Greenbrier Co closed Mon 2/20/12 ISE Day no students all employees report at 10am.,WVDE Twitbot,0,1,2012-02-20 00:33:52,Greenbrier County School District,2012-02-20
699531192023060480,All schools in #Jefferson Co closed Tue 2/16/16,WVDE Twitbot,43,37,2016-02-16 09:50:07,Jefferson County School District,2016-02-16
568186586040557568,All schools in #Monongalia Co closed Thu 2/19/15,WVDE Twitbot,61,122,2015-02-18 23:13:33,Monongalia County School District,2015-02-19
309304732625801216,UPDATE: All schools in #Marshall Co now closed Wed 3/6/13,WVDE Twitbot,0,3,2013-03-06 14:09:29,Marshall County School District,2013-03-06
569955929392877568,All schools in #Summers Co closed Tue 2/24/15,WVDE Twitbot,12,6,2015-02-23 20:24:17,Summers County School District,2015-02-24
433892038606483458,All schools in #Webster Co closed Thu 2/13/14 due to Weather Conditions,WVDE Twitbot,2,6,2014-02-13 09:14:57,Webster County School District,2014-02-13
263083018212757506,UPDATE: All schools in #Nicholas Co now closed Tue 10/30/12 due to Bad Weather  #WVSandy,WVDE Twitbot,0,7,2012-10-30 01:00:54,Nicholas County School District,2012-10-30
157776175341641728,"All schools in #Pleasants Co closed Fri 1/13/12 Pleasants County Scools will be closed on Friday January 13, 2012.",WVDE Twitbot,0,0,2012-01-13 10:49:06,Pleasants County School District,2012-01-13
420009114564325376,All schools in #Monroe Co closed Mon 1/6/14,WVDE Twitbot,12,26,2014-01-06 01:49:10,Monroe County School District,2014-01-06
959213523179130880,All schools in #Fayette Co closed Fri 2/2/18 All activities have been cancelled.,WVDE Twitbot,50,42,2018-02-01 23:54:59,Fayette County School District,2018-02-02
703186262249893889,UPDATE: All schools in #Preston Co now closed Fri 2/26/16 due to winter weather conditions,WVDE Twitbot,8,1,2016-02-26 11:54:04,Preston County School District,2016-02-26
697378236758626305,UPDATE: All schools in #Gilmer Co now closed Wed 2/10/16,WVDE Twitbot,5,4,2016-02-10 11:15:02,Gilmer County School District,2016-02-10
567330759498006528,All schools in #Wetzel Co closed Mon 2/16/15,WVDE Twitbot,17,16,2015-02-16 14:32:48,Wetzel County School District,2015-02-16
568219206929522688,All schools in #Wetzel Co closed Thu 2/19/15,WVDE Twitbot,17,46,2015-02-19 01:23:10,Wetzel County School District,2015-02-19
567443335691141120,All schools in #Mercer Co closed Tue 2/17/15 due to inclement weather,WVDE Twitbot,11,8,2015-02-16 22:00:08,Mercer County School District,2015-02-17
309232686743044096,All schools in #Upshur Co closed Wed 3/6/13 due to inclement weather,WVDE Twitbot,2,9,2013-03-06 09:23:12,Upshur County School District,2013-03-06
425584997894852609,UPDATE: All schools in #Grant Co now closed Tue 1/21/14 due to inclement weather,WVDE Twitbot,6,4,2014-01-21 11:05:45,Grant County School District,2014-01-21
697039940958449664,UPDATE: All schools in #Mingo Co now closed Tue 2/9/16 due to inclement weather code orange,WVDE Twitbot,33,46,2016-02-09 12:50:46,Mingo County School District,2016-02-09
948319268487221248,All schools in #Monongalia Co closed Wed 1/3/18 It's an Arctic Academy Day!,WVDE Twitbot,37,20,2018-01-02 22:25:07,Monongalia County School District,2018-01-03
699582956478791680,UPDATE: All schools in #Pleasants Co now closed Tue 2/16/16,WVDE Twitbot,25,19,2016-02-16 13:15:49,Pleasants County School District,2016-02-16
948693262675730432,All schools in #Summers Co closed Thu 1/4/18,WVDE Twitbot,10,3,2018-01-03 23:11:14,Summers County School District,2018-01-04
568499581018906625,All schools in #Cabell Co closed Fri 2/20/15 due to inclement weather code red,WVDE Twitbot,16,16,2015-02-19 19:57:16,Cabell County School District,2015-02-20
697028682767081472,UPDATE: All schools in #Boone Co now closed Tue 2/9/16,WVDE Twitbot,19,23,2016-02-09 12:06:02,Boone County School District,2016-02-09
297313594561937408,UPDATE: All schools in #Wetzel Co now closed Fri 2/1/13,WVDE Twitbot,2,8,2013-02-01 12:00:59,Wetzel County School District,2013-02-01
570186967721254915,UPDATE: All schools in #Calhoun Co now closed Tue 2/24/15 due to Dangerous Temperatures code blue,WVDE Twitbot,4,3,2015-02-24 11:42:21,Calhoun County School District,2015-02-24
697588922646450176,All schools in #Ritchie Co closed Thu 2/11/16,WVDE Twitbot,21,14,2016-02-11 01:12:14,Ritchie County School District,2016-02-11
420124885411586049,All schools in #Upshur Co closed Mon 1/6/14,WVDE Twitbot,7,18,2014-01-06 09:29:12,Upshur County School District,2014-01-06
157785233498968064,UPDATE: All schools in #Fayette Co now closed Fri 1/13/12,WVDE Twitbot,1,8,2012-01-13 11:25:05,Fayette County School District,2012-01-13
297313281473933312,UPDATE: All schools in #Randolph Co now closed Fri 2/1/13,WVDE Twitbot,5,11,2013-02-01 11:59:44,Randolph County School District,2013-02-01
570188574370484224,UPDATE: All schools in #Hancock Co now closed Tue 2/24/15,WVDE Twitbot,6,4,2015-02-24 11:48:44,Hancock County School District,2015-02-24
950707136044130305,UPDATE: All schools in #Monongalia Co now closed Tue 1/9/18,WVDE Twitbot,49,16,2018-01-09 12:33:39,Monongalia County School District,2018-01-09
419060353012469760,UPDATE: All schools in #Wetzel Co now closed Fri 1/3/14 due to inclement weather and road conditions,WVDE Twitbot,4,17,2014-01-03 10:59:08,Wetzel County School District,2014-01-03
573085836801134592,UPDATE: All schools in #Taylor Co now closed Wed 3/4/15,WVDE Twitbot,12,11,2015-03-04 11:41:25,Taylor County School District,2015-03-04
420671505869987840,All schools in #Logan Co closed Wed 1/8/14,WVDE Twitbot,14,32,2014-01-07 21:41:17,Logan County School District,2014-01-08
294413942149758976,UPDATE: All schools in #Greenbrier Co now closed Thu 1/24/13 due to Weather conditions,WVDE Twitbot,2,17,2013-01-24 11:58:48,Greenbrier County School District,2013-01-24
690291285085786112,All schools in #Hampshire Co closed Fri 1/22/16 due to impending Inclement weather,WVDE Twitbot,23,31,2016-01-21 21:54:02,Hampshire County School District,2016-01-22
950326717956096000,UPDATE: All schools in #Marshall Co now closed Mon 1/8/18,WVDE Twitbot,6,11,2018-01-08 11:22:00,Marshall County School District,2018-01-08
947951077638492160,All schools in #Tucker Co closed Tue 1/2/18,WVDE Twitbot,7,2,2018-01-01 22:02:03,Tucker County School District,2018-01-02
826029641693536260,UPDATE: All schools in #Greenbrier Co now closed Mon 1/30/17 due to Weather conditions,WVDE Twitbot,14,23,2017-01-30 11:29:48,Greenbrier County School District,2017-01-30
569656541957255169,All schools in #Calhoun Co closed Mon 2/23/15 due to Hazardous Roads code red,WVDE Twitbot,11,4,2015-02-23 00:34:37,Calhoun County School District,2015-02-23
542300988401790976,UPDATE: All schools in #Hardy Co now closed Tue 12/9/14,WVDE Twitbot,9,16,2014-12-09 12:53:25,Hardy County School District,2014-12-09
420002971175235584,"All schools in #Tyler Co closed Mon 1/6/14 due to the threat of freezing rain, snow, and extremely cold temperatures",WVDE Twitbot,11,9,2014-01-06 01:24:46,Tyler County School District,2014-01-06
572365635784708096,UPDATE: All schools in #Marshall Co now closed Mon 3/2/15,WVDE Twitbot,7,24,2015-03-02 11:59:36,Marshall County School District,2015-03-02
953587974171709440,UPDATE: All schools in #Greenbrier Co now closed Wed 1/17/18 due to Weather conditions,WVDE Twitbot,7,1,2018-01-17 11:21:04,Greenbrier County School District,2018-01-17
433737551652716544,All schools in #Jefferson Co closed Thu 2/13/14 due to snow,WVDE Twitbot,20,36,2014-02-12 23:01:05,Jefferson County School District,2014-02-13
426104426776907776,All schools in #Tucker Co closed Thu 1/23/14,WVDE Twitbot,8,5,2014-01-22 21:29:46,Tucker County School District,2014-01-23
689965471861477376,All schools in #Wyoming Co closed Thu 1/21/16 due to Weather,WVDE Twitbot,27,43,2016-01-21 00:19:22,Wyoming County School District,2016-01-21
948892930231668736,UPDATE: All schools in #Marshall Co now closed Thu 1/4/18,WVDE Twitbot,15,19,2018-01-04 12:24:38,Marshall County School District,2018-01-04
573598754332393472,All schools in #Gilmer Co closed Fri 3/6/15,WVDE Twitbot,12,7,2015-03-05 21:39:34,Gilmer County School District,2015-03-06
438641668783226881,UPDATE: All schools in #Lincoln Co now closed Wed 2/26/14,WVDE Twitbot,17,38,2014-02-26 11:48:18,Lincoln County School District,2014-02-26
427934395094142976,All schools in #Marion Co closed Tue 1/28/14 due to Inclement Weather,WVDE Twitbot,11,68,2014-01-27 22:41:25,Marion County School District,2014-01-28
567281244199989249,UPDATE: All schools in #Marion Co now closed Mon 2/16/15 due to Extremely cold temperatures,WVDE Twitbot,24,59,2015-02-16 11:16:02,Marion County School District,2015-02-16
420018820984483840,All schools in #Summers Co closed Mon 1/6/14,WVDE Twitbot,4,18,2014-01-06 02:27:45,Summers County School District,2014-01-06
434054785340542977,All schools in #Hampshire Co closed Fri 2/14/14,WVDE Twitbot,13,20,2014-02-13 20:01:39,Hampshire County School District,2014-02-14
567150753819942912,UPDATE: All schools in #Wood Co now closed Mon 2/16/15 Only 261 day employees report to work.,WVDE Twitbot,119,200,2015-02-16 02:37:31,Wood County School District,2015-02-16
568496361534070784,All schools in #Lewis Co closed Fri 2/20/15,WVDE Twitbot,9,14,2015-02-19 19:44:29,Lewis County School District,2015-02-20
552425758543839232,UPDATE: All schools in #Randolph Co now closed Tue 1/6/15,WVDE Twitbot,15,18,2015-01-06 11:25:39,Randolph County School District,2015-01-06
296942249760157696,UPDATE: All schools in #McDowell Co now closed Thu 1/31/13,WVDE Twitbot,0,3,2013-01-31 11:25:23,McDowell County School District,2013-01-31
692067792313520129,All schools in #Barbour Co closed Wed 1/27/16 due to continued poor road conditions,WVDE Twitbot,19,13,2016-01-26 19:33:14,Barbour County School District,2016-01-27
691663857207607296,All schools in #Harrison Co closed Tue 1/26/16,WVDE Twitbot,86,175,2016-01-25 16:48:08,Harrison County School District,2016-01-26
691369215719260161,All schools in #Barbour Co closed Mon 1/25/16 due to Road Conditions,WVDE Twitbot,15,16,2016-01-24 21:17:20,Barbour County School District,2016-01-25
567109845737029632,UPDATE: All schools in #Nicholas Co now closed Mon 2/16/15 due to a Winter Storm Warning,WVDE Twitbot,14,7,2015-02-15 23:54:58,Nicholas County School District,2015-02-16
951766772138631169,All schools in #Pleasants Co closed Fri 1/12/18 due to High water,WVDE Twitbot,18,6,2018-01-12 10:44:16,Pleasants County School District,2018-01-12
953413135435751424,UPDATE: All schools in #Ritchie Co now closed Wed 1/17/18,WVDE Twitbot,18,8,2018-01-16 23:46:19,Ritchie County School District,2018-01-17
953234854992318464,UPDATE: All schools in #Monongalia Co now closed Tue 1/16/18,WVDE Twitbot,32,20,2018-01-16 11:57:54,Monongalia County School District,2018-01-16
949049720214781954,All schools in #Monroe Co closed Fri 1/5/18,WVDE Twitbot,10,12,2018-01-04 22:47:40,Monroe County School District,2018-01-05
691705032530640896,All schools in #Hampshire Co closed Tue 1/26/16,WVDE Twitbot,31,23,2016-01-25 19:31:45,Hampshire County School District,2016-01-26
689220417379262466,All schools in #Mercer Co closed Tue 1/19/16 due to inclement weather conditions,WVDE Twitbot,33,40,2016-01-18 22:58:47,Mercer County School District,2016-01-19
568020804711161856,UPDATE: All schools in #Pocahontas Co now closed Wed 2/18/15,WVDE Twitbot,5,8,2015-02-18 12:14:47,Pocahontas County School District,2015-02-18
294383456211849216,"All schools in #Wirt Co closed Thu 1/24/13 All Wirt County Schools will be closed today Thursday Jan. 24, 2013",WVDE Twitbot,4,6,2013-01-24 09:57:39,Wirt County School District,2013-01-24
440297605336006656,All schools in #Ritchie Co closed Mon 3/3/14,WVDE Twitbot,11,6,2014-03-03 01:28:24,Ritchie County School District,2014-03-03
295885961668214784,UPDATE: All schools in #Jefferson Co now closed Mon 1/28/13 due to Freezing Rain,WVDE Twitbot,5,11,2013-01-28 13:28:05,Jefferson County School District,2013-01-28
294637151432368128,All schools in #Marshall Co closed Fri 1/25/13,WVDE Twitbot,4,19,2013-01-25 02:45:45,Marshall County School District,2013-01-25
950712310833844224,UPDATE: All schools in #McDowell Co now closed Tue 1/9/18,WVDE Twitbot,4,0,2018-01-09 12:54:12,McDowell County School District,2018-01-09
426151312938373120,All schools in #Boone Co closed Thu 1/23/14 due to the condition of various roadways,WVDE Twitbot,5,23,2014-01-23 00:36:05,Boone County School District,2014-01-23
953232078140829696,UPDATE: All schools in #Pleasants Co now closed Tue 1/16/18,WVDE Twitbot,22,10,2018-01-16 11:46:52,Pleasants County School District,2018-01-16
428259031656845313,All schools in #Gilmer Co closed Wed 1/29/14 due to Extreme Cold Weather,WVDE Twitbot,6,14,2014-01-28 20:11:24,Gilmer County School District,2014-01-29
568585228878532608,All schools in #Pendleton Co closed Fri 2/20/15,WVDE Twitbot,9,6,2015-02-20 01:37:37,Pendleton County School District,2015-02-20
425752389702795264,All schools in #Boone Co closed Wed 1/22/14 due to the winter weather,WVDE Twitbot,21,70,2014-01-21 22:10:54,Boone County School District,2014-01-22
552408443915882496,All schools in #Tyler Co closed Tue 1/6/15 due to dangerous road conditions throughout the county,WVDE Twitbot,16,17,2015-01-06 10:16:50,Tyler County School District,2015-01-06
702794958168788992,All schools in #Raleigh Co closed Thu 2/25/16,WVDE Twitbot,62,59,2016-02-25 09:59:09,Raleigh County School District,2016-02-25
316495852791296000,UPDATE: All schools in #Nicholas Co now closed Tue 3/26/13 due to Bad Weather,WVDE Twitbot,4,17,2013-03-26 10:24:26,Nicholas County School District,2013-03-26
422824035043389440,All schools in #Kanawha Co closed Tue 1/14/14 due to water crisis code A employees report at regular time.,WVDE Twitbot,68,260,2014-01-13 20:14:40,Kanawha County School District,2014-01-14
420647341746438144,All schools in #Preston Co closed Wed 1/8/14,WVDE Twitbot,10,15,2014-01-07 20:05:16,Preston County School District,2014-01-08
568546436801032193,All schools in #Marshall Co closed Fri 2/20/15,WVDE Twitbot,19,22,2015-02-19 23:03:28,Marshall County School District,2015-02-20
431404092275974144,"UPDATE: All schools in #Tyler Co now closed Thu 2/6/14 Employees, Code C.",WVDE Twitbot,10,7,2014-02-06 12:28:45,Tyler County School District,2014-02-06
826006262747975680,UPDATE: All schools in #Upshur Co now closed Mon 1/30/17,WVDE Twitbot,12,11,2017-01-30 09:56:54,Upshur County School District,2017-01-30
554607809510539264,UPDATE: All schools in #WVSDB now closed Mon 1/12/15,WVDE Twitbot,3,2,2015-01-12 11:56:20,,2015-01-12
567431904056844288,All schools in #Greenbrier Co closed Tue 2/17/15,WVDE Twitbot,20,32,2015-02-16 21:14:42,Greenbrier County School District,2015-02-17
699168826173345792,All schools in #Pendleton Co closed Mon 2/15/16,WVDE Twitbot,7,6,2016-02-15 09:50:12,Pendleton County School District,2016-02-15
430280449630294017,All schools in #Roane Co closed Mon 2/3/14 due to icy road conditions,WVDE Twitbot,7,6,2014-02-03 10:03:48,Roane County School District,2014-02-03
445500313022132226,UPDATE: All schools in #Randolph Co now closed Mon 3/17/14,WVDE Twitbot,15,19,2014-03-17 10:02:06,Randolph County School District,2014-03-17
297283733877301248,"All schools in #Wirt Co closed Fri 2/1/13 All Wirt county schools will be closed today Friday, Feb. 1, 2013.",WVDE Twitbot,0,2,2013-02-01 10:02:20,Wirt County School District,2013-02-01
425572716217782272,UPDATE: All schools in #Barbour Co now closed Tue 1/21/14,WVDE Twitbot,8,13,2014-01-21 10:16:56,Barbour County School District,2014-01-21
831829149148917760,UPDATE: All schools in #Mercer Co now closed Wed 2/15/17 due to inclement weather conditions,WVDE Twitbot,21,23,2017-02-15 11:34:58,Mercer County School District,2017-02-15
440630352374431744,All schools in #Webster Co closed Tue 3/4/14 due to Weather &amp; Road Conditions Staff report on a 2 hour delay.,WVDE Twitbot,7,14,2014-03-03 23:30:37,Webster County School District,2014-03-04
568144718435127296,All schools in #Clay Co closed Thu 2/19/15 due to weather conditions,WVDE Twitbot,12,24,2015-02-18 20:27:11,Clay County School District,2015-02-19
448772853094051840,UPDATE: All schools in #Fayette Co now closed Wed 3/26/14 due to inclement weather code A,WVDE Twitbot,15,28,2014-03-26 10:46:00,Fayette County School District,2014-03-26
304922611987673089,UPDATE: All schools in #Monroe Co now closed Fri 2/22/13,WVDE Twitbot,2,3,2013-02-22 11:56:30,Monroe County School District,2013-02-22
420309192180629504,All schools in #Tyler Co closed Tue 1/7/14,WVDE Twitbot,5,3,2014-01-06 21:41:35,Tyler County School District,2014-01-07
434079554471088128,All schools in #Randolph Co closed Fri 2/14/14,WVDE Twitbot,7,26,2014-02-13 21:40:05,Randolph County School District,2014-02-14
427933883774955520,All schools in #Webster Co closed Tue 1/28/14 due to Weather Conditions,WVDE Twitbot,6,20,2014-01-27 22:39:23,Webster County School District,2014-01-28
603486926386110464,"All schools in #Calhoun Co closed Wed 5/27/15 due to Power Outages, Down Power  Lines code red School Without Power",WVDE Twitbot,3,3,2015-05-27 09:04:30,Calhoun County School District,2015-05-27
552435031764123650,UPDATE: All schools in #Berkeley Co now closed Tue 1/6/15 due to Inclement weather All evening activities are canceled.,WVDE Twitbot,32,83,2015-01-06 12:02:29,Berkeley County School District,2015-01-06
563311182778744833,UPDATE: All schools in #Wirt Co now closed Thu 2/5/15,WVDE Twitbot,10,8,2015-02-05 12:20:26,Wirt County School District,2015-02-05
420286195227041792,All schools in #Monongalia Co closed Tue 1/7/14,WVDE Twitbot,36,106,2014-01-06 20:10:12,Monongalia County School District,2014-01-07
949041882658635786,All schools in #Greenbrier Co closed Fri 1/5/18 due to Weather conditions,WVDE Twitbot,15,17,2018-01-04 22:16:31,Greenbrier County School District,2018-01-05
425567333831045120,All schools in #Monroe Co closed Tue 1/21/14,WVDE Twitbot,8,13,2014-01-21 09:55:33,Monroe County School District,2014-01-21
953710940071096321,All schools in #Wayne Co closed Thu 1/18/18 due to poor road conditions,WVDE Twitbot,24,9,2018-01-17 19:29:41,Wayne County School District,2018-01-18
689407683682668544,UPDATE: All schools in #Monroe Co now closed Tue 1/19/16,WVDE Twitbot,9,12,2016-01-19 11:22:55,Monroe County School District,2016-01-19
427595713464135680,"All schools in #Tyler Co closed Mon 1/27/14 Employees, Code C.",WVDE Twitbot,8,6,2014-01-27 00:15:37,Tyler County School District,2014-01-27
309274861497368576,UPDATE: All schools in #Ohio Co now closed Wed 3/6/13,WVDE Twitbot,6,22,2013-03-06 12:10:47,Ohio County School District,2013-03-06
950166324231266305,All schools in #Jefferson Co closed Mon 1/8/18 due to weather,WVDE Twitbot,51,30,2018-01-08 00:44:39,Jefferson County School District,2018-01-08
313605452384579586,UPDATE: All schools in #Hardy Co now closed Mon 3/18/13 Central office staff on two hour delay or when safe to travel.,WVDE Twitbot,0,4,2013-03-18 10:59:01,Hardy County School District,2013-03-18
953277400003108864,UPDATE: All schools in #Wayne Co now closed Tue 1/16/18 due to Inclement weather Tonight's BOE meeting has also been cancelled.,WVDE Twitbot,8,2,2018-01-16 14:46:57,Wayne County School District,2018-01-16
420003440173924353,All schools in #Wirt Co closed Mon 1/6/14,WVDE Twitbot,16,23,2014-01-06 01:26:38,Wirt County School District,2014-01-06
420744267384901632,UPDATE: All schools in #Tyler Co now closed Wed 1/8/14 due to extremely cold teperatures and icy roads throughout the county,WVDE Twitbot,7,6,2014-01-08 02:30:25,Tyler County School District,2014-01-08
691363169391022081,1/2 UPDATE: All schools in #Kanawha Co now closed Mon 1/25/16 due to Inclement Weather Conditions code B,WVDE Twitbot,29,33,2016-01-24 20:53:19,Kanawha County School District,2016-01-25
567091605258399744,All schools in #Monroe Co closed Mon 2/16/15,WVDE Twitbot,15,19,2015-02-15 22:42:29,Monroe County School District,2015-02-16
950730344914964481,UPDATE: All schools in #Calhoun Co now closed Tue 1/9/18,WVDE Twitbot,2,6,2018-01-09 14:05:52,Calhoun County School District,2018-01-09
568506980328980481,All schools in #Wirt Co closed Fri 2/20/15,WVDE Twitbot,14,13,2015-02-19 20:26:41,Wirt County School District,2015-02-20
295864973362606080,UPDATE: All schools in #Morgan Co now closed Mon 1/28/13 code A The Central Office will open at 10:00am.,WVDE Twitbot,0,8,2013-01-28 12:04:41,Morgan County School District,2013-01-28
690303917800951808,All schools in #McDowell Co closed Fri 1/22/16,WVDE Twitbot,11,6,2016-01-21 22:44:13,McDowell County School District,2016-01-22
262853322749399040,All schools in #Mercer Co closed Mon 10/29/12 due to the impending storm,WVDE Twitbot,0,3,2012-10-29 09:48:10,Mercer County School District,2012-10-29
697721933861908482,"UPDATE: All schools in #Barbour Co now closed Thu 2/11/16 due to road conditions As always, the BOE office is open regular hours.",WVDE Twitbot,10,9,2016-02-11 10:00:46,Barbour County School District,2016-02-11
427572669647958016,All schools in #Marion Co closed Mon 1/27/14 due to Inclement Weather,WVDE Twitbot,13,63,2014-01-26 22:44:03,Marion County School District,2014-01-27
542284924741758978,UPDATE: All schools in #Grant Co now closed Tue 12/9/14,WVDE Twitbot,3,4,2014-12-09 11:49:35,Grant County School District,2014-12-09
568020557284950016,UPDATE: All schools in #Doddridge Co now closed Wed 2/18/15 due to inclement weather,WVDE Twitbot,7,7,2015-02-18 12:13:48,Doddridge County School District,2015-02-18
940907850049744896,UPDATE: All schools in #Pocahontas Co now closed Wed 12/13/17 due to power outages in various parts of the county,WVDE Twitbot,9,4,2017-12-13 11:34:47,Pocahontas County School District,2017-12-13
316110051041484800,All schools in #Tucker Co closed Mon 3/25/13,WVDE Twitbot,0,4,2013-03-25 08:51:23,Tucker County School District,2013-03-25
436115870503284736,UPDATE: All schools in #Hampshire Co now closed Wed 2/19/14 due to freezing rain,WVDE Twitbot,16,18,2014-02-19 12:31:40,Hampshire County School District,2014-02-19
950158510242844678,All schools in #Kanawha Co closed Mon 1/8/18 due to Inclement Weather code B All 261 Day Employees Report at Regular Time,WVDE Twitbot,200,178,2018-01-08 00:13:36,Kanawha County School District,2018-01-08
440636754815483904,All schools in #Jefferson Co closed Tue 3/4/14,WVDE Twitbot,19,33,2014-03-03 23:56:03,Jefferson County School District,2014-03-04
438293846964072448,UPDATE: All schools in #Wirt Co now closed Tue 2/25/14,WVDE Twitbot,4,5,2014-02-25 12:46:10,Wirt County School District,2014-02-25
961177259288612865,All schools in #Morgan Co closed Wed 2/7/18 code H,WVDE Twitbot,9,6,2018-02-07 09:58:11,Morgan County School District,2018-02-07
428007990633836544,All schools in #Mercer Co closed Tue 1/28/14 due to inclement weather,WVDE Twitbot,3,1,2014-01-28 03:33:51,Mercer County School District,2014-01-28
420148297416724480,UPDATE: All schools in #Logan Co now closed Mon 1/6/14,WVDE Twitbot,9,17,2014-01-06 11:02:14,Logan County School District,2014-01-06
949004021498548225,All schools in #Hancock Co closed Fri 1/5/18 due to Extreme Cold All school board offices will be closed.,WVDE Twitbot,12,15,2018-01-04 19:46:05,Hancock County School District,2018-01-05
426461113182478336,All schools in #Fayette Co closed Fri 1/24/14 due to inclement weather code A,WVDE Twitbot,18,51,2014-01-23 21:07:07,Fayette County School District,2014-01-24
438650329492516864,UPDATE: All schools in #Lewis Co now closed Wed 2/26/14,WVDE Twitbot,6,14,2014-02-26 12:22:42,Lewis County School District,2014-02-26
553161620579704832,UPDATE: All schools in #Hardy Co now closed Thu 1/8/15,WVDE Twitbot,11,18,2015-01-08 12:09:42,Hardy County School District,2015-01-08
573578520745611267,All schools in #Preston Co closed Fri 3/6/15 due to winter weather conditions,WVDE Twitbot,13,8,2015-03-05 20:19:10,Preston County School District,2015-03-06
428313380621791232,All schools in #Fayette Co closed Wed 1/29/14 due to inclement weather code A,WVDE Twitbot,22,60,2014-01-28 23:47:22,Fayette County School District,2014-01-29
297282595945852928,All schools in #Cabell Co closed Fri 2/1/13 due to inclement weather code blue,WVDE Twitbot,14,27,2013-02-01 09:57:48,Cabell County School District,2013-02-01
953590690675679237,UPDATE: All schools in #Preston Co now closed Wed 1/17/18 due to winter weather conditions,WVDE Twitbot,7,1,2018-01-17 11:31:52,Preston County School District,2018-01-17
298613605400723457,All schools in #Brooke Co closed Tue 2/5/13,WVDE Twitbot,2,8,2013-02-05 02:06:46,Brooke County School District,2013-02-05
428304638077456384,All schools in #Mingo Co closed Wed 1/29/14 Code W.  School Employees report on a 2 hour delay.,WVDE Twitbot,5,24,2014-01-28 23:12:37,Mingo County School District,2014-01-29
419054948655955968,UPDATE: All schools in #Fayette Co now closed Fri 1/3/14 due to inclement weather,WVDE Twitbot,10,22,2014-01-03 10:37:40,Fayette County School District,2014-01-03
176662277884354561,All schools in #Logan Co closed Mon 3/5/12,WVDE Twitbot,0,0,2012-03-05 13:35:43,Logan County School District,2012-03-05
565804200953929728,UPDATE: All schools in #Nicholas Co now closed Thu 2/12/15 due to a winter weather advisory,WVDE Twitbot,9,27,2015-02-12 09:26:48,Nicholas County School District,2015-02-12
699567160788676608,UPDATE: All schools in #Tyler Co now closed Tue 2/16/16,WVDE Twitbot,12,18,2016-02-16 12:13:03,Tyler County School District,2016-02-16
297282383865069569,All schools in #Harrison Co closed Fri 2/1/13,WVDE Twitbot,7,29,2013-02-01 09:56:58,Harrison County School District,2013-02-01
566202240135102464,UPDATE: All schools in #Calhoun Co now closed Fri 2/13/15 due to Dangerous Temperatures code blue,WVDE Twitbot,2,4,2015-02-13 11:48:28,Calhoun County School District,2015-02-13
420283772618014720,"All schools in #Barbour Co closed Tue 1/7/14 due to impending frigid temperatures, weather, and road conditions",WVDE Twitbot,15,26,2014-01-06 20:00:34,Barbour County School District,2014-01-07
949032923738583041,All schools in #Logan Co closed Fri 1/5/18,WVDE Twitbot,68,55,2018-01-04 21:40:55,Logan County School District,2018-01-05
923608567600635904,All schools in #Wood Co closed Fri 10/27/17 Employees will operate on a Code C,WVDE Twitbot,41,21,2017-10-26 17:53:36,Wood County School District,2017-10-27
420144148998414336,UPDATE: All schools in #Preston Co now closed Mon 1/6/14,WVDE Twitbot,5,5,2014-01-06 10:45:45,Preston County School District,2014-01-06
953441917303508993,All schools in #Monongalia Co closed Wed 1/17/18 Arctic Academy Day!,WVDE Twitbot,37,22,2018-01-17 01:40:41,Monongalia County School District,2018-01-17
418930706275131392,UPDATE: All schools in #Doddridge Co now closed Fri 1/3/14 due to Inclement Weather,WVDE Twitbot,9,17,2014-01-03 02:23:58,Doddridge County School District,2014-01-03
426476212039323648,All schools in #Marion Co closed Fri 1/24/14 due to Inclement Weather,WVDE Twitbot,20,82,2014-01-23 22:07:07,Marion County School District,2014-01-24
419055183075606529,All schools in #Mercer Co closed Fri 1/3/14 due to inclement weather,WVDE Twitbot,1,4,2014-01-03 10:38:35,Mercer County School District,2014-01-03
573612157599936512,All schools in #Hardy Co closed Fri 3/6/15,WVDE Twitbot,14,25,2015-03-05 22:32:50,Hardy County School District,2015-03-06
567826903021924352,All schools in #Raleigh Co closed Wed 2/18/15,WVDE Twitbot,36,98,2015-02-17 23:24:18,Raleigh County School District,2015-02-18
445504916878938112,UPDATE: All schools in #Lincoln Co now closed Mon 3/17/14,WVDE Twitbot,14,33,2014-03-17 10:20:23,Lincoln County School District,2014-03-17
699046805523275776,All schools in #Wood Co closed Mon 2/15/16 Only 261 day employees report to work.,WVDE Twitbot,129,271,2016-02-15 01:45:20,Wood County School District,2016-02-15
947968623565508610,All schools in #Lewis Co closed Tue 1/2/18 due to inclement weather,WVDE Twitbot,15,15,2018-01-01 23:11:46,Lewis County School District,2018-01-02
154171002601996289,UPDATE: All schools in #Kanawha Co now closed Tue 1/3/12 code B,WVDE Twitbot,3,28,2012-01-03 12:03:26,Kanawha County School District,2012-01-03
567454843984683008,All schools in #Randolph Co closed Tue 2/17/15,WVDE Twitbot,25,31,2015-02-16 22:45:52,Randolph County School District,2015-02-17
294634329366212610,All schools in #Pleasants Co closed Fri 1/25/13,WVDE Twitbot,5,8,2013-01-25 02:34:32,Pleasants County School District,2013-01-25
697736940175683584,UPDATE: All schools in #Grant Co now closed Thu 2/11/16 due to extreme cold temperatures,WVDE Twitbot,17,14,2016-02-11 11:00:24,Grant County School District,2016-02-11
420296247803527168,1/2 UPDATE: All schools in #Clay Co now closed Tue 1/7/14 due to current weather conditions,WVDE Twitbot,5,2,2014-01-06 20:50:08,Clay County School District,2014-01-07
408960363623747584,1/2 UPDATE: All schools in #Tyler Co now closed Fri 12/6/13 due to rising water throughout the county,WVDE Twitbot,1,4,2013-12-06 14:05:23,Tyler County School District,2013-12-06
426164772115980288,UPDATE: All schools in #Mason Co now closed Thu 1/23/14 due to Inclement Weather,WVDE Twitbot,5,18,2014-01-23 01:29:34,Mason County School District,2014-01-23
157782202548105216,UPDATE: All schools in #Braxton Co now closed Fri 1/13/12,WVDE Twitbot,0,2,2012-01-13 11:13:03,Braxton County School District,2012-01-13
570879434510766080,All schools in #Fayette Co closed Thu 2/26/15 due to inclement weather,WVDE Twitbot,14,32,2015-02-26 09:33:58,Fayette County School District,2015-02-26
431000556656529408,All schools in #Hampshire Co closed Wed 2/5/14,WVDE Twitbot,6,11,2014-02-05 09:45:14,Hampshire County School District,2014-02-05
568009132776808448,UPDATE: All schools in #Barbour Co now closed Wed 2/18/15,WVDE Twitbot,11,9,2015-02-18 11:28:25,Barbour County School District,2015-02-18
567132456302960640,UPDATE: All schools in #Wayne Co now closed Mon 2/16/15 due to Inclement Weather,WVDE Twitbot,16,37,2015-02-16 01:24:49,Wayne County School District,2015-02-16
425776676468166656,All schools in #Pleasants Co closed Wed 1/22/14,WVDE Twitbot,10,20,2014-01-21 23:47:24,Pleasants County School District,2014-01-22
568520175013638144,1/2 All schools in #Mason Co closed Fri 2/20/15 due to Inclement Weather code red,WVDE Twitbot,34,37,2015-02-19 21:19:06,Mason County School District,2015-02-20
176633082420535296,UPDATE: All schools in #Greenbrier Co now closed Mon 3/5/12 All Schools Closed,WVDE Twitbot,0,1,2012-03-05 11:39:43,Greenbrier County School District,2012-03-05
552618020120854529,UPDATE: All schools in #Barbour Co now closed Wed 1/7/15 due to fridgid temperatures,WVDE Twitbot,13,15,2015-01-07 00:09:37,Barbour County School District,2015-01-07
410388544075472896,UPDATE: All schools in #Lincoln Co now closed Tue 12/10/13,WVDE Twitbot,10,27,2013-12-10 12:40:28,Lincoln County School District,2013-12-10
950694210591739904,UPDATE: All schools in #Tyler Co now closed Tue 1/9/18,WVDE Twitbot,6,10,2018-01-09 11:42:17,Tyler County School District,2018-01-09
445485972801609728,All schools in #Mineral Co closed Mon 3/17/14,WVDE Twitbot,20,26,2014-03-17 09:05:07,Mineral County School District,2014-03-17
425776101655183361,"All schools in #Tyler Co closed Wed 1/22/14 Employees, Code C.",WVDE Twitbot,11,7,2014-01-21 23:45:07,Tyler County School District,2014-01-22
570911525336170496,UPDATE: All schools in #Nicholas Co now closed Thu 2/26/15 due to road conditions,WVDE Twitbot,11,14,2015-02-26 11:41:29,Nicholas County School District,2015-02-26
697227249720893441,All schools in #Tyler Co closed Wed 2/10/16,WVDE Twitbot,27,24,2016-02-10 01:15:04,Tyler County School District,2016-02-10
953388780840419330,All schools in #Jackson Co closed Wed 1/17/18 code A,WVDE Twitbot,20,18,2018-01-16 22:09:33,Jackson County School District,2018-01-17
427910740226220032,All schools in #Ritchie Co closed Tue 1/28/14 Staff is to report on a 2 hour delay schedule,WVDE Twitbot,13,15,2014-01-27 21:07:25,Ritchie County School District,2014-01-28
697027588611563520,UPDATE: All schools in #Calhoun Co now closed Tue 2/9/16 due to Weather Conditions code blue,WVDE Twitbot,8,5,2016-02-09 12:01:41,Calhoun County School District,2016-02-09
425591695879585792,UPDATE: All schools in #Logan Co now closed Tue 1/21/14,WVDE Twitbot,17,18,2014-01-21 11:32:22,Logan County School District,2014-01-21
420861115061374976,UPDATE: All schools in #Hancock Co now closed Wed 1/8/14,WVDE Twitbot,4,2,2014-01-08 10:14:43,Hancock County School District,2014-01-08
438639518611030017,UPDATE: All schools in #Logan Co now closed Wed 2/26/14,WVDE Twitbot,16,29,2014-02-26 11:39:45,Logan County School District,2014-02-26
426122530319892480,All schools in #Lewis Co closed Thu 1/23/14,WVDE Twitbot,7,10,2014-01-22 22:41:42,Lewis County School District,2014-01-23
958281775842721793,All schools in #Mercer Co closed Tue 1/30/18 due to inclement weather conditions,WVDE Twitbot,7,3,2018-01-30 10:12:34,Mercer County School District,2018-01-30
961172791272902656,All schools in #Berkeley Co closed Wed 2/7/18 due to weathr Pre-K included.  Evening activities cancelled.,WVDE Twitbot,36,12,2018-02-07 09:40:25,Berkeley County School District,2018-02-07
440621021440135168,All schools in #Raleigh Co closed Tue 3/4/14 due to weather conditions,WVDE Twitbot,21,56,2014-03-03 22:53:32,Raleigh County School District,2014-03-04
561129490383134721,UPDATE: All schools in #Pendleton Co now closed Fri 1/30/15,WVDE Twitbot,4,3,2015-01-30 11:51:10,Pendleton County School District,2015-01-30
294758917345533952,UPDATE: All schools in #Webster Co now closed Fri 1/25/13 due to Pending Weather Conditions,WVDE Twitbot,2,8,2013-01-25 10:49:36,Webster County School District,2013-01-25
264050559835848705,1/2 All schools in #Preston Co closed Fri 11/2/12,WVDE Twitbot,0,6,2012-11-01 17:05:33,Preston County School District,2012-11-02
567787410889904130,All schools in #Clay Co closed Wed 2/18/15 due to Weather conditions,WVDE Twitbot,25,30,2015-02-17 20:47:22,Clay County School District,2015-02-18
428883954586750976,1/2 UPDATE: All schools in #Braxton Co now closed Thu 1/30/14 due to weather and bus issues,WVDE Twitbot,6,7,2014-01-30 13:34:37,Braxton County School District,2014-01-30
428864059471970304,UPDATE: All schools in #Pocahontas Co now closed Thu 1/30/14,WVDE Twitbot,4,6,2014-01-30 12:15:34,Pocahontas County School District,2014-01-30
420675730280689665,All schools in #Marion Co closed Wed 1/8/14 due to Inclement Weather,WVDE Twitbot,8,56,2014-01-07 21:58:04,Marion County School District,2014-01-08
949009710673465346,All schools in #Tucker Co closed Fri 1/5/18,WVDE Twitbot,5,3,2018-01-04 20:08:41,Tucker County School District,2018-01-05
419059532099100672,UPDATE: All schools in #Tucker Co now closed Fri 1/3/14,WVDE Twitbot,9,6,2014-01-03 10:55:52,Tucker County School District,2014-01-03
568173465234219008,All schools in #Mingo Co closed Thu 2/19/15 Code Orange.,WVDE Twitbot,22,37,2015-02-18 22:21:24,Mingo County School District,2015-02-19
445515765706276864,UPDATE: All schools in #Jackson Co now closed Mon 3/17/14 code A,WVDE Twitbot,17,23,2014-03-17 11:03:30,Jackson County School District,2014-03-17
433915593272459264,UPDATE: All schools in #Wayne Co now closed Thu 2/13/14 due to Inclement Weather,WVDE Twitbot,11,10,2014-02-13 10:48:33,Wayne County School District,2014-02-13
425560466006368256,All schools in #Fayette Co closed Tue 1/21/14 due to inclement weather,WVDE Twitbot,10,30,2014-01-21 09:28:16,Fayette County School District,2014-01-21
568145557082001409,All schools in #Barbour Co closed Thu 2/19/15,WVDE Twitbot,29,15,2015-02-18 20:30:31,Barbour County School District,2015-02-19
566062574240681984,All schools in #Greenbrier Co closed Fri 2/13/15,WVDE Twitbot,23,42,2015-02-13 02:33:29,Greenbrier County School District,2015-02-13
440280234307227649,All schools in #Ohio Co closed Mon 3/3/14,WVDE Twitbot,31,70,2014-03-03 00:19:22,Ohio County School District,2014-03-03
426173905305227265,UPDATE: All schools in #Ritchie Co now closed Thu 1/23/14,WVDE Twitbot,9,17,2014-01-23 02:05:51,Ritchie County School District,2014-01-23
297292212272762880,UPDATE: All schools in #Greenbrier Co now closed Fri 2/1/13 due to weather and temperature conditions,WVDE Twitbot,2,11,2013-02-01 10:36:01,Greenbrier County School District,2013-02-01
567128417494372352,"All schools in #Jackson Co closed Mon 2/16/15 code B Code B - 260 day employees, principals and assistant principals report to work.",WVDE Twitbot,25,36,2015-02-16 01:08:46,Jackson County School District,2015-02-16
420710594971316224,All schools in #Lincoln Co closed Wed 1/8/14,WVDE Twitbot,13,25,2014-01-08 00:16:36,Lincoln County School District,2014-01-08
265179839437365249,All schools in #Upshur Co closed Mon 11/5/12,WVDE Twitbot,2,13,2012-11-04 19:52:55,Upshur County School District,2012-11-05
419039312311619584,All schools in #Webster Co closed Fri 1/3/14 due to Weather Conditions,WVDE Twitbot,6,7,2014-01-03 09:35:32,Webster County School District,2014-01-03
160308676366827520,All schools in #Marion Co closed Fri 1/20/12 due to ROAD CONDITIONS,WVDE Twitbot,0,2,2012-01-20 10:32:21,Marion County School District,2012-01-20
689958142722072576,All schools in #Mercer Co closed Thu 1/21/16 due to inclement weather conditions,WVDE Twitbot,24,35,2016-01-20 23:50:14,Mercer County School District,2016-01-21
426124480746758144,All schools in #McDowell Co closed Thu 1/23/14 due to inclement weather,WVDE Twitbot,3,5,2014-01-22 22:49:27,McDowell County School District,2014-01-23
426099816624443392,All schools in #Doddridge Co closed Thu 1/23/14 due to Inclement Weather &amp; Frigid Temperatures,WVDE Twitbot,7,16,2014-01-22 21:11:27,Doddridge County School District,2014-01-23
930032173771567104,"UPDATE: All schools in #Braxton Co now closed Mon 11/13/17 due to gas issues Board office employees, please report.",WVDE Twitbot,8,5,2017-11-13 11:18:44,Braxton County School District,2017-11-13
426489044017496064,All schools in #Hampshire Co closed Fri 1/24/14,WVDE Twitbot,7,21,2014-01-23 22:58:06,Hampshire County School District,2014-01-24
264066233752768513,All schools in #Upshur Co closed Fri 11/2/12 due to Major power outages and road conditions  #WVSandy,WVDE Twitbot,1,14,2012-11-01 18:07:50,Upshur County School District,2012-11-02
573596146834235393,All schools in #Braxton Co closed Fri 3/6/15,WVDE Twitbot,11,14,2015-03-05 21:29:12,Braxton County School District,2015-03-06
420295400457637888,All schools in #Raleigh Co closed Tue 1/7/14 due to weather conditions,WVDE Twitbot,9,40,2014-01-06 20:46:46,Raleigh County School District,2014-01-07
426103148315291648,All schools in #Barbour Co closed Thu 1/23/14 due to temperature related concerns.,WVDE Twitbot,7,19,2014-01-22 21:24:41,Barbour County School District,2014-01-23
573085158548635649,UPDATE: All schools in #Barbour Co now closed Wed 3/4/15,WVDE Twitbot,5,3,2015-03-04 11:38:43,Barbour County School District,2015-03-04
426485083717906432,All schools in #Summers Co closed Fri 1/24/14,WVDE Twitbot,13,16,2014-01-23 22:42:22,Summers County School District,2014-01-24
298596241984585728,All schools in #Harrison Co closed Tue 2/5/13,WVDE Twitbot,13,67,2013-02-05 00:57:46,Harrison County School District,2013-02-05
691708935326285824,UPDATE: All schools in #Preston Co now closed Tue 1/26/16 due to winter weather conditions,WVDE Twitbot,21,8,2016-01-25 19:47:16,Preston County School District,2016-01-26
948525814668300288,UPDATE: All schools in #Upshur Co now closed Wed 1/3/18,WVDE Twitbot,5,2,2018-01-03 12:05:51,Upshur County School District,2018-01-03
699555500610973696,UPDATE: All schools in #Hancock Co now closed Tue 2/16/16,WVDE Twitbot,17,16,2016-02-16 11:26:43,Hancock County School District,2016-02-16
923280766183858176,All schools in #Wood Co closed Thu 10/26/17 Employees will operate on a Code C,WVDE Twitbot,35,14,2017-10-25 20:11:03,Wood County School District,2017-10-26
948681488131903491,All schools in #Greenbrier Co closed Thu 1/4/18 due to Weather conditions,WVDE Twitbot,29,18,2018-01-03 22:24:27,Greenbrier County School District,2018-01-04
587935220147560448,UPDATE: All schools in #Roane Co now closed Tue 4/14/15,WVDE Twitbot,4,6,2015-04-14 11:07:34,Roane County School District,2015-04-14
565817898170851328,All schools in #Greenbrier Co closed Thu 2/12/15,WVDE Twitbot,8,21,2015-02-12 10:21:13,Greenbrier County School District,2015-02-12
691417414886674432,All schools in #Mason Co closed Mon 1/25/16 due to Inclement weather code red,WVDE Twitbot,38,36,2016-01-25 00:28:52,Mason County School District,2016-01-25
691285825238208513,All schools in #Morgan Co closed Mon 1/25/16 code H,WVDE Twitbot,28,17,2016-01-24 15:45:58,Morgan County School District,2016-01-25
296960022427095041,UPDATE: All schools in #Randolph Co now closed Thu 1/31/13,WVDE Twitbot,6,16,2013-01-31 12:36:01,Randolph County School District,2013-01-31
692082360712564736,All schools in #Hampshire Co closed Wed 1/27/16,WVDE Twitbot,40,25,2016-01-26 20:31:07,Hampshire County School District,2016-01-27
425566573223354368,All schools in #Roane Co closed Tue 1/21/14 due to anticipated snowfall,WVDE Twitbot,6,9,2014-01-21 09:52:32,Roane County School District,2014-01-21
567433123441672192,All schools in #Webster Co closed Tue 2/17/15 due to Weather Conditions,WVDE Twitbot,13,16,2015-02-16 21:19:33,Webster County School District,2015-02-17
697623038968385537,UPDATE: All schools in #Wood Co now closed Thu 2/11/16 Only 261 employees report for work.,WVDE Twitbot,160,288,2016-02-11 03:27:48,Wood County School District,2016-02-11
699369904156368896,All schools in #Greenbrier Co closed Tue 2/16/16 due to Weather conditions,WVDE Twitbot,20,22,2016-02-15 23:09:13,Greenbrier County School District,2016-02-16
426489887806590976,All schools in #Greenbrier Co closed Fri 1/24/14 due to Weather conditions &amp; Temperatures,WVDE Twitbot,15,46,2014-01-23 23:01:27,Greenbrier County School District,2014-01-24
419058259241091073,UPDATE: All schools in #Cabell Co now closed Fri 1/3/14 due to inclement weather code blue,WVDE Twitbot,12,18,2014-01-03 10:50:49,Cabell County School District,2014-01-03
568434140091187200,All schools in #Kanawha Co closed Fri 2/20/15 due to Inclement Weather code B,WVDE Twitbot,127,298,2015-02-19 15:37:14,Kanawha County School District,2015-02-20
573064880078659584,All schools in #Logan Co closed Wed 3/4/15,WVDE Twitbot,12,20,2015-03-04 10:18:09,Logan County School District,2015-03-04
426487570843701248,"UPDATE: All schools in #Berkeley Co now closed Fri 1/24/14 All evening activities are cancelled, as well.",WVDE Twitbot,15,57,2014-01-23 22:52:15,Berkeley County School District,2014-01-24
573294275343077376,All schools in #Pocahontas Co closed Thu 3/5/15,WVDE Twitbot,9,7,2015-03-05 01:29:41,Pocahontas County School District,2015-03-05
699021430810406912,All schools in #Lincoln Co closed Mon 2/15/16,WVDE Twitbot,28,40,2016-02-15 00:04:30,Lincoln County School District,2016-02-15
440663741546659841,UPDATE: All schools in #Wetzel Co now closed Tue 3/4/14 School staff to report on a two hour delay.,WVDE Twitbot,20,44,2014-03-04 01:43:17,Wetzel County School District,2014-03-04
435380536953942016,UPDATE: All schools in #Pleasants Co now closed Mon 2/17/14,WVDE Twitbot,12,5,2014-02-17 11:49:43,Pleasants County School District,2014-02-17
568216897814208513,All schools in #Hardy Co closed Thu 2/19/15,WVDE Twitbot,18,32,2015-02-19 01:14:00,Hardy County School District,2015-02-19
157798463013261312,UPDATE: All schools in #Wetzel Co now closed Fri 1/13/12,WVDE Twitbot,0,1,2012-01-13 12:17:39,Wetzel County School District,2012-01-13
568530005078056960,All schools in #Harrison Co closed Fri 2/20/15,WVDE Twitbot,38,156,2015-02-19 21:58:10,Harrison County School District,2015-02-20
570177064235610112,UPDATE: All schools in #Randolph Co now closed Tue 2/24/15,WVDE Twitbot,14,20,2015-02-24 11:03:00,Randolph County School District,2015-02-24
425952113726726146,All schools in #Mercer Co closed Wed 1/22/14 due to inclement weather,WVDE Twitbot,3,1,2014-01-22 11:24:32,Mercer County School District,2014-01-22
294754648127045632,All schools in #McDowell Co closed Fri 1/25/13 due to inclement,WVDE Twitbot,1,1,2013-01-25 10:32:39,McDowell County School District,2013-01-25
960477922883723264,UPDATE: All schools in #Ritchie Co now closed Mon 2/5/18,WVDE Twitbot,9,6,2018-02-05 11:39:16,Ritchie County School District,2018-02-05
421616961861087233,UPDATE: All schools in #Mineral Co now closed Fri 1/10/14 due to weather,WVDE Twitbot,5,18,2014-01-10 12:18:11,Mineral County School District,2014-01-10
263082896611495936,"All schools in #Nicholas Co closed Tue 10/30/12 due to Bad Weather on Tuesday, Oct. 30, 2012 #WVSandy",WVDE Twitbot,0,4,2012-10-30 01:00:25,Nicholas County School District,2012-10-30
263397117362589696,All schools in #Clay Co closed Wed 10/31/12 due to weather  #WVSandy,WVDE Twitbot,0,5,2012-10-30 21:49:01,Clay County School District,2012-10-31
963003281143451648,All schools in #Wood Co closed Mon 2/12/18 due to inclement weather Employees will operate on a Code A.,WVDE Twitbot,98,54,2018-02-12 10:54:08,Wood County School District,2018-02-12
297293254125289472,All schools in #Putnam Co closed Fri 2/1/13 due to Weather Conditions,WVDE Twitbot,15,39,2013-02-01 10:40:09,Putnam County School District,2013-02-01
572369495576199169,UPDATE: All schools in #Hancock Co now closed Mon 3/2/15,WVDE Twitbot,6,9,2015-03-02 12:14:56,Hancock County School District,2015-03-02
567627623040565248,All schools in #Hancock Co closed Tue 2/17/15,WVDE Twitbot,9,6,2015-02-17 10:12:26,Hancock County School District,2015-02-17
781805102445330432,UPDATE: All schools in #Pocahontas Co now closed Fri 9/30/16 a significant rain event in the central portion of Pocahontas County,WVDE Twitbot,7,14,2016-09-30 10:37:16,Pocahontas County School District,2016-09-30
438643291400060928,UPDATE: All schools in #Mingo Co now closed Wed 2/26/14 Employees Code W.,WVDE Twitbot,2,10,2014-02-26 11:54:44,Mingo County School District,2014-02-26
699177897626628096,UPDATE: All schools in #Barbour Co now closed Mon 2/15/16 due to weather cinditions,WVDE Twitbot,10,4,2016-02-15 10:26:15,Barbour County School District,2016-02-15
562224235910008832,UPDATE: All schools in #Barbour Co now closed Mon 2/2/15,WVDE Twitbot,11,9,2015-02-02 12:21:18,Barbour County School District,2015-02-02
420232917365714945,All schools in #Nicholas Co closed Tue 1/7/14,WVDE Twitbot,14,13,2014-01-06 16:38:29,Nicholas County School District,2014-01-07
958313410202128390,UPDATE: All schools in #Greenbrier Co now closed Tue 1/30/18 due to Weather conditions Reimagine day one,WVDE Twitbot,9,6,2018-01-30 12:18:16,Greenbrier County School District,2018-01-30
573291103077732352,All schools in #Monongalia Co closed Thu 3/5/15,WVDE Twitbot,74,128,2015-03-05 01:17:04,Monongalia County School District,2015-03-05
309273535258447872,UPDATE: All schools in #Pleasants Co now closed Wed 3/6/13,WVDE Twitbot,0,7,2013-03-06 12:05:31,Pleasants County School District,2013-03-06
691319562931933185,All schools in #Lincoln Co closed Mon 1/25/16,WVDE Twitbot,17,13,2016-01-24 18:00:02,Lincoln County School District,2016-01-25
697370073439301632,UPDATE: All schools in #Lewis Co now closed Wed 2/10/16,WVDE Twitbot,14,8,2016-02-10 10:42:36,Lewis County School District,2016-02-10
948159996327530496,UPDATE: All schools in #Greenbrier Co now closed Tue 1/2/18 due to Weather conditions,WVDE Twitbot,9,7,2018-01-02 11:52:13,Greenbrier County School District,2018-01-02
428872176586870784,UPDATE: All schools in #Upshur Co now closed Thu 1/30/14 due to Bus issues Staff is to report,WVDE Twitbot,4,9,2014-01-30 12:47:49,Upshur County School District,2014-01-30
691721704058535938,All schools in #Taylor Co closed Tue 1/26/16,WVDE Twitbot,27,14,2016-01-25 20:38:00,Taylor County School District,2016-01-26
699195731505242113,UPDATE: All schools in #Gilmer Co now closed Mon 2/15/16,WVDE Twitbot,15,4,2016-02-15 11:37:07,Gilmer County School District,2016-02-15
948902254282727425,UPDATE: All schools in #Ritchie Co now closed Thu 1/4/18,WVDE Twitbot,17,19,2018-01-04 13:01:41,Ritchie County School District,2018-01-04
948157204120694784,UPDATE: All schools in #Fayette Co now closed Tue 1/2/18 due to low temperatures This is a reimagined time day.,WVDE Twitbot,25,31,2018-01-02 11:41:08,Fayette County School District,2018-01-02
949040347237232640,All schools in #Mineral Co closed Fri 1/5/18 due to cold temperatures,WVDE Twitbot,36,34,2018-01-04 22:10:25,Mineral County School District,2018-01-05
427963110637326336,"All schools in #Braxton Co closed Tue 1/28/14 Staff, please report on a 2-hour delay.",WVDE Twitbot,7,15,2014-01-28 00:35:31,Braxton County School District,2014-01-28
430275044296503297,All schools in #Doddridge Co closed Mon 2/3/14 due to snow and hazardous road condtions Staff is not required to report.,WVDE Twitbot,4,7,2014-02-03 09:42:19,Doddridge County School District,2014-02-03
420332801884303360,All schools in #Webster Co closed Tue 1/7/14 due to Weather Conditions,WVDE Twitbot,3,18,2014-01-06 23:15:24,Webster County School District,2014-01-07
960490756959096833,UPDATE: All schools in #Mercer Co now closed Mon 2/5/18 due to inclement weather conditions,WVDE Twitbot,9,5,2018-02-05 12:30:16,Mercer County School District,2018-02-05
297270685036851201,All schools in #Roane Co closed Fri 2/1/13 due to the recent snow,WVDE Twitbot,1,2,2013-02-01 09:10:28,Roane County School District,2013-02-01
566197730419433472,UPDATE: All schools in #Grant Co now closed Fri 2/13/15,WVDE Twitbot,5,6,2015-02-13 11:30:33,Grant County School District,2015-02-13
425728496355139585,All schools in #Webster Co closed Wed 1/22/14 due to Weather Conditions,WVDE Twitbot,5,14,2014-01-21 20:35:57,Webster County School District,2014-01-22
298223058236358657,All schools in #Upshur Co closed Mon 2/4/13 due to inclement weather,WVDE Twitbot,3,18,2013-02-04 00:14:52,Upshur County School District,2013-02-04
950691214998765568,UPDATE: All schools in #Clay Co now closed Tue 1/9/18,WVDE Twitbot,9,6,2018-01-09 11:30:23,Clay County School District,2018-01-09
961057358372884480,UPDATE: All schools in #Hancock Co now closed Wed 2/7/18 due to Inclement Weather Tomorrow Will NOT be a snow sack https://t.co/LX5rFgaTes,WVDE Twitbot,13,8,2018-02-07 02:01:44,Hancock County School District,2018-02-07
263029880998989825,All schools in #Monongalia Co closed Tue 10/30/12 due to inclement weather  #WVSandy,WVDE Twitbot,13,41,2012-10-29 21:29:45,Monongalia County School District,2012-10-30
691269345771704320,All schools in #Berkeley Co closed Mon 1/25/16 due to significant snowfall All evening activities for 1/25 are canceled as well.,WVDE Twitbot,87,137,2016-01-24 14:40:29,Berkeley County School District,2016-01-25
573419680049827840,All schools in #Berkeley Co closed Thu 3/5/15 due to weather Evening activities canceled.,WVDE Twitbot,39,65,2015-03-05 09:48:00,Berkeley County School District,2015-03-05
842302610589769728,UPDATE: All schools in #Berkeley Co now closed Thu 3/16/17 due to weather All evening activities for March 16th are cancelled,WVDE Twitbot,49,47,2017-03-16 09:12:46,Berkeley County School District,2017-03-16
690303469064949762,All schools in #Wood Co closed Fri 1/22/16 Only 261 day employees report for work.,WVDE Twitbot,229,393,2016-01-21 22:42:26,Wood County School District,2016-01-22
818428433999032320,UPDATE: All schools in #Monroe Co now closed Mon 1/9/17,WVDE Twitbot,10,14,2017-01-09 12:05:18,Monroe County School District,2017-01-09
316138608241278976,UPDATE: All schools in #Brooke Co now closed Mon 3/25/13,WVDE Twitbot,2,8,2013-03-25 10:44:52,Brooke County School District,2013-03-25
441019549324828672,All schools in #Logan Co closed Wed 3/5/14,WVDE Twitbot,17,25,2014-03-05 01:17:08,Logan County School District,2014-03-05
420638098423177216,All schools in #Webster Co closed Wed 1/8/14 due to Road and Weather Conditions,WVDE Twitbot,8,10,2014-01-07 19:28:32,Webster County School District,2014-01-08
568548440768155648,UPDATE: All schools in #Pocahontas Co now closed Fri 2/20/15,WVDE Twitbot,7,2,2015-02-19 23:11:26,Pocahontas County School District,2015-02-20
420143945717256192,UPDATE: All schools in #Lewis Co now closed Mon 1/6/14,WVDE Twitbot,11,11,2014-01-06 10:44:57,Lewis County School District,2014-01-06
431020111281917952,All schools in #Marshall Co closed Wed 2/5/14,WVDE Twitbot,5,7,2014-02-05 11:02:57,Marshall County School District,2014-02-05
560041510205263873,UPDATE: All schools in #Brooke Co now closed Tue 1/27/15,WVDE Twitbot,11,10,2015-01-27 11:47:55,Brooke County School District,2015-01-27
561144188646211584,UPDATE: All schools in #Jackson Co now closed Fri 1/30/15,WVDE Twitbot,19,41,2015-01-30 12:49:34,Jackson County School District,2015-01-30
552406062721425408,All schools in #Hampshire Co closed Tue 1/6/15 due to weather,WVDE Twitbot,21,14,2015-01-06 10:07:23,Hampshire County School District,2015-01-06
297308535199522816,UPDATE: All schools in #Pendleton Co now closed Fri 2/1/13,WVDE Twitbot,0,1,2013-02-01 11:40:53,Pendleton County School District,2013-02-01
420294915541585921,All schools in #Randolph Co closed Tue 1/7/14,WVDE Twitbot,18,36,2014-01-06 20:44:51,Randolph County School District,2014-01-07
438272997057896448,UPDATE: All schools in #Barbour Co now closed Tue 2/25/14,WVDE Twitbot,1,4,2014-02-25 11:23:19,Barbour County School District,2014-02-25
573290092015591424,All schools in #Monroe Co closed Thu 3/5/15,WVDE Twitbot,11,18,2015-03-05 01:13:03,Monroe County School District,2015-03-05
567475620096270337,All schools in #Hardy Co closed Tue 2/17/15,WVDE Twitbot,16,29,2015-02-17 00:08:25,Hardy County School District,2015-02-17
959389836208730112,"UPDATE: All schools in #Tucker Co now closed Fri 2/2/18 This will be a Polar School Day, and staff will report 2 hours late.",WVDE Twitbot,5,1,2018-02-02 11:35:36,Tucker County School District,2018-02-02
699026194428268549,All schools in #Mingo Co closed Mon 2/15/16 due to yet another February 15 snow code orange,WVDE Twitbot,32,58,2016-02-15 00:23:26,Mingo County School District,2016-02-15
428886094843621376,UPDATE: All schools in #Monroe Co now closed Thu 1/30/14,WVDE Twitbot,4,17,2014-01-30 13:43:07,Monroe County School District,2014-01-30
552401718487810048,All schools in #Wetzel Co closed Tue 1/6/15,WVDE Twitbot,15,34,2015-01-06 09:50:07,Wetzel County School District,2015-01-06
557894538241794048,1/2 UPDATE: All schools in #Tyler Co now closed Wed 1/21/15 due to icy road conditions,WVDE Twitbot,8,4,2015-01-21 13:36:37,Tyler County School District,2015-01-21
296906546414243840,UPDATE: All schools in #Pocahontas Co now closed Thu 1/31/13 due to flooding,WVDE Twitbot,1,2,2013-01-31 09:03:31,Pocahontas County School District,2013-01-31
552971361980018689,All schools in #Webster Co closed Thu 1/8/15 due to Weather Conditions,WVDE Twitbot,34,19,2015-01-07 23:33:41,Webster County School District,2015-01-08
568517069009846273,All schools in #Summers Co closed Fri 2/20/15,WVDE Twitbot,9,11,2015-02-19 21:06:46,Summers County School District,2015-02-20
690141621363544065,UPDATE: All schools in #Tyler Co now closed Thu 1/21/16,WVDE Twitbot,18,22,2016-01-21 11:59:19,Tyler County School District,2016-01-21
420271058399137792,All schools in #Ritchie Co closed Tue 1/7/14,WVDE Twitbot,11,20,2014-01-06 19:10:03,Ritchie County School District,2014-01-07
552430590981836800,UPDATE: All schools in #Marion Co now closed Tue 1/6/15 due to INCLEMENT WEATHER,WVDE Twitbot,23,51,2015-01-06 11:44:51,Marion County School District,2015-01-06
568199936082350080,All schools in #Braxton Co closed Thu 2/19/15,WVDE Twitbot,13,13,2015-02-19 00:06:36,Braxton County School District,2015-02-19
410370354209497090,UPDATE: All schools in #Morgan Co now closed Tue 12/10/13 code A,WVDE Twitbot,3,14,2013-12-10 11:28:11,Morgan County School District,2013-12-10
699559196560261120,UPDATE: All schools in #Ohio Co now closed Tue 2/16/16,WVDE Twitbot,35,67,2016-02-16 11:41:24,Ohio County School District,2016-02-16
154160722002198528,UPDATE: All schools in #Summers Co now closed Tue 1/3/12,WVDE Twitbot,0,0,2012-01-03 11:22:34,Summers County School District,2012-01-03
559674148595978241,UPDATE: All schools in #Grant Co now closed Mon 1/26/15,WVDE Twitbot,5,7,2015-01-26 11:28:09,Grant County School District,2015-01-26
309469776034537472,UPDATE: All schools in #Pendleton Co now closed Thu 3/7/13,WVDE Twitbot,2,6,2013-03-07 01:05:18,Pendleton County School District,2013-03-07
425591863299428352,UPDATE: All schools in #Lewis Co now closed Tue 1/21/14,WVDE Twitbot,5,14,2014-01-21 11:33:01,Lewis County School District,2014-01-21
430301123665092608,UPDATE: All schools in #Grant Co now closed Mon 2/3/14 due to inclement weather,WVDE Twitbot,4,4,2014-02-03 11:25:57,Grant County School District,2014-02-03
263399400829747200,All schools in #Greenbrier Co closed Wed 10/31/12 due to Weather  #WVSandy,WVDE Twitbot,1,28,2012-10-30 21:58:05,Greenbrier County School District,2012-10-31
154163811228729344,UPDATE: All schools in #Randolph Co now closed Tue 1/3/12 due to Weather,WVDE Twitbot,0,2,2012-01-03 11:34:51,Randolph County School District,2012-01-03
697361886808031232,All schools in #Marshall Co closed Wed 2/10/16,WVDE Twitbot,17,37,2016-02-10 10:10:04,Marshall County School District,2016-02-10
157782526004432896,UPDATE: All schools in #Clay Co now closed Fri 1/13/12,WVDE Twitbot,0,0,2012-01-13 11:14:20,Clay County School District,2012-01-13
567789327909130241,All schools in #Lincoln Co closed Wed 2/18/15,WVDE Twitbot,20,49,2015-02-17 20:54:59,Lincoln County School District,2015-02-18
563305370563903488,UPDATE: All schools in #Calhoun Co now closed Thu 2/5/15 due to Inclement Weather code blue Code Blue,WVDE Twitbot,4,4,2015-02-05 11:57:20,Calhoun County School District,2015-02-05
425568514330476544,All schools in #Monongalia Co closed Tue 1/21/14,WVDE Twitbot,37,72,2014-01-21 10:00:15,Monongalia County School District,2014-01-21
703192006542151680,UPDATE: All schools in #Raleigh Co now closed Fri 2/26/16,WVDE Twitbot,44,54,2016-02-26 12:16:53,Raleigh County School District,2016-02-26
219967761659600896,UPDATE: All schools in #Clay Co now closed Tue 7/3/12,WVDE Twitbot,1,0,2012-07-03 01:36:15,Clay County School District,2012-07-03
568148583763058688,All schools in #Logan Co closed Thu 2/19/15,WVDE Twitbot,13,17,2015-02-18 20:42:32,Logan County School District,2015-02-19
953234374991974403,UPDATE: All schools in #Clay Co now closed Tue 1/16/18,WVDE Twitbot,11,9,2018-01-16 11:55:59,Clay County School District,2018-01-16
425565606574714880,All schools in #McDowell Co closed Tue 1/21/14 due to inclement weather,WVDE Twitbot,2,2,2014-01-21 09:48:41,McDowell County School District,2014-01-21
425763461801725953,All schools in #Jackson Co closed Wed 1/22/14 code A,WVDE Twitbot,19,54,2014-01-21 22:54:54,Jackson County School District,2014-01-22
297287782609600512,UPDATE: All schools in #Summers Co now closed Fri 2/1/13,WVDE Twitbot,0,6,2013-02-01 10:18:25,Summers County School District,2013-02-01
440316427229097984,All schools in #Summers Co closed Mon 3/3/14,WVDE Twitbot,11,11,2014-03-03 02:43:11,Summers County School District,2014-03-03
570214225303490560,All schools in #McDowell Co closed Tue 2/24/15,WVDE Twitbot,7,0,2015-02-24 13:30:40,McDowell County School District,2015-02-24
691375760716763136,All schools in #Gilmer Co closed Mon 1/25/16,WVDE Twitbot,7,11,2016-01-24 21:43:21,Gilmer County School District,2016-01-25
573285645298364416,All schools in #Jackson Co closed Thu 3/5/15 code B,WVDE Twitbot,23,26,2015-03-05 00:55:23,Jackson County School District,2015-03-05
697243342330003457,All schools in #Wirt Co closed Wed 2/10/16,WVDE Twitbot,23,24,2016-02-10 02:19:01,Wirt County School District,2016-02-10
445516706861948929,UPDATE: All schools in #Boone Co now closed Mon 3/17/14 due to inclement weather,WVDE Twitbot,13,28,2014-03-17 11:07:14,Boone County School District,2014-03-17
410365021659865088,UPDATE: All schools in #Berkeley Co now closed Tue 12/10/13 All evening activities cancelled.,WVDE Twitbot,16,57,2013-12-10 11:07:00,Berkeley County School District,2013-12-10
298404893608275968,UPDATE: All schools in #Pleasants Co now closed Mon 2/4/13,WVDE Twitbot,5,10,2013-02-04 12:17:25,Pleasants County School District,2013-02-04
313607538341978112,UPDATE: All schools in #Mineral Co now closed Mon 3/18/13 due to the weather code A,WVDE Twitbot,2,11,2013-03-18 11:07:18,Mineral County School District,2013-03-18
157787229081698304,UPDATE: All schools in #Tucker Co now closed Fri 1/13/12,WVDE Twitbot,0,1,2012-01-13 11:33:01,Tucker County School District,2012-01-13
428284100525301762,All schools in #Lewis Co closed Wed 1/29/14,WVDE Twitbot,10,14,2014-01-28 21:51:01,Lewis County School District,2014-01-29
426689897978531842,UPDATE: All schools in #Pendleton Co now closed Fri 1/24/14,WVDE Twitbot,8,8,2014-01-24 12:16:13,Pendleton County School District,2014-01-24
568189811749748736,All schools in #Brooke Co closed Thu 2/19/15,WVDE Twitbot,23,18,2015-02-18 23:26:22,Brooke County School District,2015-02-19
568140281775845376,All schools in #Kanawha Co closed Thu 2/19/15 due to Inclement Weather code B,WVDE Twitbot,77,103,2015-02-18 20:09:33,Kanawha County School District,2015-02-19
265245558308999168,"All schools in #Nicholas Co closed Mon 11/5/12 due to Power and Bad Weather on Monday, Nov. 5, 2012",WVDE Twitbot,0,1,2012-11-05 00:14:03,Nicholas County School District,2012-11-05
573590217015300097,All schools in #Randolph Co closed Fri 3/6/15,WVDE Twitbot,29,19,2015-03-05 21:05:39,Randolph County School District,2015-03-06
291865484960358400,All schools in #Monroe Co closed Thu 1/17/13,WVDE Twitbot,0,2,2013-01-17 11:12:08,Monroe County School District,2013-01-17
